consent_response.keys,consent_response.rt,key_resp_2.keys,key_resp_2.rt,user_resp.keys,user_resp.rt,trials.thisRepN,trials.thisTrialN,trials.thisN,trials.thisIndex,trials.ran,image_1_text,image_2_text,database,image,number,age,worker_ID,date,expName,psychopyVersion,OS,frameRate,hitId,workerId,assignmentId,a,tp_a,b,tp_b,c,tp_c,catch_same_resp.keys,catch_same_resp.rt,image_1_text_catch_same,image_2_text_catch_same,image_catch_same,catch_different_resp.keys,catch_different_resp.rt,image_1_text_catch_different,image_2_text_catch_different,image_catch_different
space,19.385,space,5.059,5,2.885,0,0,0,41,1,"a modern bathroom with twin rectangular sinks, a glass shower and shelving. the shelf above the left sink has two red glasses","a modern bathroom with twin rectangular sinks, a glass shower and shelving.  the shelf above the left sink has three glasses.",wolfe2,029_L_glass,3,35,A13QVB627KKIPT,2021-01-26_08h58.35.876,MetaAwareness,2020.1.2,Win32,60,33TGB4G0LQK9FDSB50H28AI9YEKTXR,A13QVB627KKIPT,3HWRJOOET652GXM9BXRMYZW466QESB,EJWH8,EJWH8,3HWRJOOET652GXM9BXRMYZW466QESB,3HWRJOOET652GXM9BXRMYZW466QESB,271388,271388,,,,,,,,,,
,,,,6,1.672,0,1,1,33,1,a white and chrome kitchen with two hanging lights,a white and chrome kitchen with three hanging lights,wolfe2,022_L_lamp,3,35,A13QVB627KKIPT,2021-01-26_08h58.35.876,MetaAwareness,2020.1.2,Win32,60,33TGB4G0LQK9FDSB50H28AI9YEKTXR,A13QVB627KKIPT,3HWRJOOET652GXM9BXRMYZW466QESB,EJWH8,EJWH8,3HWRJOOET652GXM9BXRMYZW466QESB,3HWRJOOET652GXM9BXRMYZW466QESB,271388,271388,,,,,,,,,,
,,,,4,1.261,0,2,2,121,1,a maroon bedroom with hardwood floors and a tiny lamp on the floor,a maroon bedroom with hardwood floors,wolfe2,090_R_lamp,3,35,A13QVB627KKIPT,2021-01-26_08h58.35.876,MetaAwareness,2020.1.2,Win32,60,33TGB4G0LQK9FDSB50H28AI9YEKTXR,A13QVB627KKIPT,3HWRJOOET652GXM9BXRMYZW466QESB,EJWH8,EJWH8,3HWRJOOET652GXM9BXRMYZW466QESB,3HWRJOOET652GXM9BXRMYZW466QESB,271388,271388,,,,,,,,,,
,,,,5,1.796,0,3,3,138,1,two coat-suit are in the hanker,there is only one coat-suit in the hanker,wolfe2,107_R_shirts,1,35,A13QVB627KKIPT,2021-01-26_08h58.35.876,MetaAwareness,2020.1.2,Win32,60,33TGB4G0LQK9FDSB50H28AI9YEKTXR,A13QVB627KKIPT,3HWRJOOET652GXM9BXRMYZW466QESB,EJWH8,EJWH8,3HWRJOOET652GXM9BXRMYZW466QESB,3HWRJOOET652GXM9BXRMYZW466QESB,271388,271388,,,,,,,,,,
,,,,6,1.733,0,4,4,98,1,spacious and bright kitchen with several windows and a flower vase on the countertop.,spacious and bright kitchen with several windows and a multiple flower vases on the countertop.,wolfe2,073_R_coffeemug,3,35,A13QVB627KKIPT,2021-01-26_08h58.35.876,MetaAwareness,2020.1.2,Win32,60,33TGB4G0LQK9FDSB50H28AI9YEKTXR,A13QVB627KKIPT,3HWRJOOET652GXM9BXRMYZW466QESB,EJWH8,EJWH8,3HWRJOOET652GXM9BXRMYZW466QESB,3HWRJOOET652GXM9BXRMYZW466QESB,271388,271388,,,,,,,,,,
,,,,5,1.495,0,5,5,60,1,"a bedroom with a bed, tv on a dresser, a large mirror, and a desk and chair.","a bedroom that contains a bed, a tv on a dresser, a large mirror, a desk with four knobs, and a chair.",wolfe2,047_L_handle,3,35,A13QVB627KKIPT,2021-01-26_08h58.35.876,MetaAwareness,2020.1.2,Win32,60,33TGB4G0LQK9FDSB50H28AI9YEKTXR,A13QVB627KKIPT,3HWRJOOET652GXM9BXRMYZW466QESB,EJWH8,EJWH8,3HWRJOOET652GXM9BXRMYZW466QESB,3HWRJOOET652GXM9BXRMYZW466QESB,271388,271388,,,,,,,,,,
,,,,3,1.436,0,6,6,145,1,a lounge area with a plant,a lounge area that doesn't have a plant,wolfe2,112_R_basket,1,35,A13QVB627KKIPT,2021-01-26_08h58.35.876,MetaAwareness,2020.1.2,Win32,60,33TGB4G0LQK9FDSB50H28AI9YEKTXR,A13QVB627KKIPT,3HWRJOOET652GXM9BXRMYZW466QESB,EJWH8,EJWH8,3HWRJOOET652GXM9BXRMYZW466QESB,3HWRJOOET652GXM9BXRMYZW466QESB,271388,271388,,,,,,,,,,
,,,,4,2.105,0,7,7,161,1,"a public dining area with multiple tables and chairs, with a chair sitting next to a table near the back window","a public dining area with multiple tables and chairs, with no chair sitting next to a table near the back window",wolfe2,122_R_chair,3,35,A13QVB627KKIPT,2021-01-26_08h58.35.876,MetaAwareness,2020.1.2,Win32,60,33TGB4G0LQK9FDSB50H28AI9YEKTXR,A13QVB627KKIPT,3HWRJOOET652GXM9BXRMYZW466QESB,EJWH8,EJWH8,3HWRJOOET652GXM9BXRMYZW466QESB,3HWRJOOET652GXM9BXRMYZW466QESB,271388,271388,,,,,,,,,,
,,,,5,1.302,0,8,8,77,1,a modern living room,a modern living room with something missing from the desk.,wolfe2,063_R_laptop,1,35,A13QVB627KKIPT,2021-01-26_08h58.35.876,MetaAwareness,2020.1.2,Win32,60,33TGB4G0LQK9FDSB50H28AI9YEKTXR,A13QVB627KKIPT,3HWRJOOET652GXM9BXRMYZW466QESB,EJWH8,EJWH8,3HWRJOOET652GXM9BXRMYZW466QESB,3HWRJOOET652GXM9BXRMYZW466QESB,271388,271388,,,,,,,,,,
,,,,6,1.421,0,9,9,157,1,"a living room with cream-color furnature, a white fireplace, large windows, and a decorative item on the fireplace mantle","a living room with cream color furnature, a white fireplace with a white mantle, large windows, and tan walls",wolfe2,120_R_art,1,35,A13QVB627KKIPT,2021-01-26_08h58.35.876,MetaAwareness,2020.1.2,Win32,60,33TGB4G0LQK9FDSB50H28AI9YEKTXR,A13QVB627KKIPT,3HWRJOOET652GXM9BXRMYZW466QESB,EJWH8,EJWH8,3HWRJOOET652GXM9BXRMYZW466QESB,3HWRJOOET652GXM9BXRMYZW466QESB,271388,271388,,,,,,,,,,
,,,,5,1.243,0,10,10,116,1,an outlet attached to the wall,a part of the wall next to mirror,wolfe2,085_R_switchboard,7,35,A13QVB627KKIPT,2021-01-26_08h58.35.876,MetaAwareness,2020.1.2,Win32,60,33TGB4G0LQK9FDSB50H28AI9YEKTXR,A13QVB627KKIPT,3HWRJOOET652GXM9BXRMYZW466QESB,EJWH8,EJWH8,3HWRJOOET652GXM9BXRMYZW466QESB,3HWRJOOET652GXM9BXRMYZW466QESB,271388,271388,,,,,,,,,,
,,,,6,1.668,0,11,11,92,1,living room with a large mirror on the middle of the wall with only one lamp mount on the wall on the right hand side,living room with a large mirror o the middle of the wall with two lamps mount on the wall on the both sides,wolfe2,070_L_lamp,4,35,A13QVB627KKIPT,2021-01-26_08h58.35.876,MetaAwareness,2020.1.2,Win32,60,33TGB4G0LQK9FDSB50H28AI9YEKTXR,A13QVB627KKIPT,3HWRJOOET652GXM9BXRMYZW466QESB,EJWH8,EJWH8,3HWRJOOET652GXM9BXRMYZW466QESB,3HWRJOOET652GXM9BXRMYZW466QESB,271388,271388,,,,,,,,,,
,,,,5,1.575,0,12,12,111,1,a grand style master bedroom with a white nightstand to the right,a granddstyle master bedroom with a object on the nightstand to the right,wolfe2,082_R_bowl,3,35,A13QVB627KKIPT,2021-01-26_08h58.35.876,MetaAwareness,2020.1.2,Win32,60,33TGB4G0LQK9FDSB50H28AI9YEKTXR,A13QVB627KKIPT,3HWRJOOET652GXM9BXRMYZW466QESB,EJWH8,EJWH8,3HWRJOOET652GXM9BXRMYZW466QESB,3HWRJOOET652GXM9BXRMYZW466QESB,271388,271388,,,,,,,,,,
,,,,4,1.371,0,13,13,66,1,"a room that looks like a study with lots of books on shelves, brown coloring, and an empty fireplace","a room that looks like a study with lots of books on shelves, brown coloring, and a fireplace with wood in it",wolfe2,054_R_firewood,5,35,A13QVB627KKIPT,2021-01-26_08h58.35.876,MetaAwareness,2020.1.2,Win32,60,33TGB4G0LQK9FDSB50H28AI9YEKTXR,A13QVB627KKIPT,3HWRJOOET652GXM9BXRMYZW466QESB,EJWH8,EJWH8,3HWRJOOET652GXM9BXRMYZW466QESB,3HWRJOOET652GXM9BXRMYZW466QESB,271388,271388,,,,,,,,,,
,,,,5,1.297,0,14,14,141,1,a living room with an orange pillow on the couch.,a living room with no pillow on the couch.,wolfe2,109_R_pillow,1,35,A13QVB627KKIPT,2021-01-26_08h58.35.876,MetaAwareness,2020.1.2,Win32,60,33TGB4G0LQK9FDSB50H28AI9YEKTXR,A13QVB627KKIPT,3HWRJOOET652GXM9BXRMYZW466QESB,EJWH8,EJWH8,3HWRJOOET652GXM9BXRMYZW466QESB,3HWRJOOET652GXM9BXRMYZW466QESB,271388,271388,,,,,,,,,,
,,,,5,1.51,0,15,15,51,1,a bedroom with 2 decorations on the side table,a bedroom with 3 decorations on the side table,wolfe2,035_L_fruit,6,35,A13QVB627KKIPT,2021-01-26_08h58.35.876,MetaAwareness,2020.1.2,Win32,60,33TGB4G0LQK9FDSB50H28AI9YEKTXR,A13QVB627KKIPT,3HWRJOOET652GXM9BXRMYZW466QESB,EJWH8,EJWH8,3HWRJOOET652GXM9BXRMYZW466QESB,3HWRJOOET652GXM9BXRMYZW466QESB,271388,271388,,,,,,,,,,
,,,,6,1.454,0,16,16,0,1,there is nothing but green wallpaper on the bedroom wall.,there is a small mirror hanging on the green wallpaper next to the wall.,wolfe2,001_R_mirror,1,35,A13QVB627KKIPT,2021-01-26_08h58.35.876,MetaAwareness,2020.1.2,Win32,60,33TGB4G0LQK9FDSB50H28AI9YEKTXR,A13QVB627KKIPT,3HWRJOOET652GXM9BXRMYZW466QESB,EJWH8,EJWH8,3HWRJOOET652GXM9BXRMYZW466QESB,3HWRJOOET652GXM9BXRMYZW466QESB,271388,271388,,,,,,,,,,
,,,,6,1.268,0,17,17,49,1,a bedroom  with a bed and a table without fruits on top of the table,a bedroom with a bed and a table with fruits placed on top of the table,wolfe2,035_L_fruit,2,35,A13QVB627KKIPT,2021-01-26_08h58.35.876,MetaAwareness,2020.1.2,Win32,60,33TGB4G0LQK9FDSB50H28AI9YEKTXR,A13QVB627KKIPT,3HWRJOOET652GXM9BXRMYZW466QESB,EJWH8,EJWH8,3HWRJOOET652GXM9BXRMYZW466QESB,3HWRJOOET652GXM9BXRMYZW466QESB,271388,271388,,,,,,,,,,
,,,,5,1.135,0,18,18,71,1,a colorful bedroom with pink and purple fluffy objects around,a colorful bedroom with a purple diary on the fluffy tablet,wolfe2,058_L_clutch,2,35,A13QVB627KKIPT,2021-01-26_08h58.35.876,MetaAwareness,2020.1.2,Win32,60,33TGB4G0LQK9FDSB50H28AI9YEKTXR,A13QVB627KKIPT,3HWRJOOET652GXM9BXRMYZW466QESB,EJWH8,EJWH8,3HWRJOOET652GXM9BXRMYZW466QESB,3HWRJOOET652GXM9BXRMYZW466QESB,271388,271388,,,,,,,,,,
,,,,4,1.449,0,19,19,15,1,this bathtub is missing an overflow drain,this bathtub has all the necessary pieces,wolfe2,012_R_tubaccesory,2,35,A13QVB627KKIPT,2021-01-26_08h58.35.876,MetaAwareness,2020.1.2,Win32,60,33TGB4G0LQK9FDSB50H28AI9YEKTXR,A13QVB627KKIPT,3HWRJOOET652GXM9BXRMYZW466QESB,EJWH8,EJWH8,3HWRJOOET652GXM9BXRMYZW466QESB,3HWRJOOET652GXM9BXRMYZW466QESB,271388,271388,,,,,,,,,,
,,,,5,1.357,0,20,20,37,1,an open wooden bathroom with two stacks of towels under the sink.,an open wooden bathroom with one stack of towels under the sink,wolfe2,024_L_towels,6,35,A13QVB627KKIPT,2021-01-26_08h58.35.876,MetaAwareness,2020.1.2,Win32,60,33TGB4G0LQK9FDSB50H28AI9YEKTXR,A13QVB627KKIPT,3HWRJOOET652GXM9BXRMYZW466QESB,EJWH8,EJWH8,3HWRJOOET652GXM9BXRMYZW466QESB,3HWRJOOET652GXM9BXRMYZW466QESB,271388,271388,,,,,,,,,,
,,,,6,1.77,0,21,21,89,1,a classic style living room with fireplace and a shelf to the righta,a classic style living room with fireplace and a object on the shelf to the right,wolfe2,069_R_things,2,35,A13QVB627KKIPT,2021-01-26_08h58.35.876,MetaAwareness,2020.1.2,Win32,60,33TGB4G0LQK9FDSB50H28AI9YEKTXR,A13QVB627KKIPT,3HWRJOOET652GXM9BXRMYZW466QESB,EJWH8,EJWH8,3HWRJOOET652GXM9BXRMYZW466QESB,3HWRJOOET652GXM9BXRMYZW466QESB,271388,271388,,,,,,,,,,
,,,,5,1.36,0,22,22,126,1,a modern looking girls office with something on the counter   num_enter,a modern looking girls room with nothing on the counter,wolfe2,096_L_painting,3,35,A13QVB627KKIPT,2021-01-26_08h58.35.876,MetaAwareness,2020.1.2,Win32,60,33TGB4G0LQK9FDSB50H28AI9YEKTXR,A13QVB627KKIPT,3HWRJOOET652GXM9BXRMYZW466QESB,EJWH8,EJWH8,3HWRJOOET652GXM9BXRMYZW466QESB,3HWRJOOET652GXM9BXRMYZW466QESB,271388,271388,,,,,,,,,,
,,,,4,1.449,0,23,23,96,1,"it's an old styled living room with some light and dark colors, plus floral.","it's an old styled living room with some light and dark colors, plus floral and some extra flowers on the table top in the back right.",wolfe2,071_R_art,2,35,A13QVB627KKIPT,2021-01-26_08h58.35.876,MetaAwareness,2020.1.2,Win32,60,33TGB4G0LQK9FDSB50H28AI9YEKTXR,A13QVB627KKIPT,3HWRJOOET652GXM9BXRMYZW466QESB,EJWH8,EJWH8,3HWRJOOET652GXM9BXRMYZW466QESB,3HWRJOOET652GXM9BXRMYZW466QESB,271388,271388,,,,,,,,,,
,,,,5,1.142,0,24,24,50,1,a bedroom with one wall covered in blue-flowered brown wallpaper with a narrow wood table topped with two vases over a radiator,a bedroom with one wall covered in blue-flowered brown wallpaper with a narrow wood table topped with two vases and a fruit bowl over a radiator,wolfe2,035_L_fruit,4,35,A13QVB627KKIPT,2021-01-26_08h58.35.876,MetaAwareness,2020.1.2,Win32,60,33TGB4G0LQK9FDSB50H28AI9YEKTXR,A13QVB627KKIPT,3HWRJOOET652GXM9BXRMYZW466QESB,EJWH8,EJWH8,3HWRJOOET652GXM9BXRMYZW466QESB,3HWRJOOET652GXM9BXRMYZW466QESB,271388,271388,,,,,,,,,,
,,,,6,1.293,0,25,25,3,1,a table in an upscale dining room with 7 place settings,a table in an upscale dining room with 8 place settings.,wolfe2,002_R_napkin,2,35,A13QVB627KKIPT,2021-01-26_08h58.35.876,MetaAwareness,2020.1.2,Win32,60,33TGB4G0LQK9FDSB50H28AI9YEKTXR,A13QVB627KKIPT,3HWRJOOET652GXM9BXRMYZW466QESB,EJWH8,EJWH8,3HWRJOOET652GXM9BXRMYZW466QESB,3HWRJOOET652GXM9BXRMYZW466QESB,271388,271388,,,,,,,,,,
,,,,6,1.319,0,26,26,35,1,it's a pretty modern hangout area that appears to be in the patio or backyard.,"modern hangout area in the patio or backyard, but there is now a remote control on the table for the tv.",wolfe2,023_R_remote,3,35,A13QVB627KKIPT,2021-01-26_08h58.35.876,MetaAwareness,2020.1.2,Win32,60,33TGB4G0LQK9FDSB50H28AI9YEKTXR,A13QVB627KKIPT,3HWRJOOET652GXM9BXRMYZW466QESB,EJWH8,EJWH8,3HWRJOOET652GXM9BXRMYZW466QESB,3HWRJOOET652GXM9BXRMYZW466QESB,271388,271388,,,,,,,,,,
,,,,5,1.166,0,27,27,86,1,an office meeting room with a large tv,an office meeting room with a large tv and a small picture,wolfe2,067_R_painting,3,35,A13QVB627KKIPT,2021-01-26_08h58.35.876,MetaAwareness,2020.1.2,Win32,60,33TGB4G0LQK9FDSB50H28AI9YEKTXR,A13QVB627KKIPT,3HWRJOOET652GXM9BXRMYZW466QESB,EJWH8,EJWH8,3HWRJOOET652GXM9BXRMYZW466QESB,3HWRJOOET652GXM9BXRMYZW466QESB,271388,271388,,,,,,,,,,
,,,,6,1.177,0,28,28,8,1,a white and red living area with a blank wall above the futon,a white and red living area with a mirror above the futon,wolfe2,005_L_mirror,6,35,A13QVB627KKIPT,2021-01-26_08h58.35.876,MetaAwareness,2020.1.2,Win32,60,33TGB4G0LQK9FDSB50H28AI9YEKTXR,A13QVB627KKIPT,3HWRJOOET652GXM9BXRMYZW466QESB,EJWH8,EJWH8,3HWRJOOET652GXM9BXRMYZW466QESB,3HWRJOOET652GXM9BXRMYZW466QESB,271388,271388,,,,,,,,,,
,,,,5,1.704,0,29,29,53,1,a cream colored couch being lit up by several can lights in a living room,"a cream colored couch being lit up by several can lights in a living room, there is a ceiling fan installed to help with air movement.",wolfe2,039_L_ventilator,1,35,A13QVB627KKIPT,2021-01-26_08h58.35.876,MetaAwareness,2020.1.2,Win32,60,33TGB4G0LQK9FDSB50H28AI9YEKTXR,A13QVB627KKIPT,3HWRJOOET652GXM9BXRMYZW466QESB,EJWH8,EJWH8,3HWRJOOET652GXM9BXRMYZW466QESB,3HWRJOOET652GXM9BXRMYZW466QESB,271388,271388,,,,,,,,,,
,,,,,,,,,,,,,,,,35,A13QVB627KKIPT,2021-01-26_08h58.35.876,MetaAwareness,2020.1.2,Win32,60,33TGB4G0LQK9FDSB50H28AI9YEKTXR,A13QVB627KKIPT,3HWRJOOET652GXM9BXRMYZW466QESB,EJWH8,EJWH8,3HWRJOOET652GXM9BXRMYZW466QESB,3HWRJOOET652GXM9BXRMYZW466QESB,271388,271388,5,1.789,someone laying underneath a blue beach umbrella on a crowded beach,someone laying underneath a blue beach umbrella on a crowded beach,same,6,1.54,members of a marching band crossing a track that all have feather plumes at the front of their hats,a cluttered and rustic looking cafe with 10 hanging lights,different
