consent_response.keys,consent_response.rt,key_resp_2.keys,key_resp_2.rt,user_resp.keys,user_resp.rt,trials.thisRepN,trials.thisTrialN,trials.thisN,trials.thisIndex,trials.ran,image_1_text,image_2_text,database,image,number,age,worker_ID,date,expName,psychopyVersion,OS,frameRate,hitId,workerId,assignmentId,a,tp_a,b,tp_b,c,tp_c,catch_same_resp.keys,catch_same_resp.rt,image_1_text_catch_same,image_2_text_catch_same,image_catch_same,catch_different_resp.keys,catch_different_resp.rt,image_1_text_catch_different,image_2_text_catch_different,image_catch_different
space,5.24786,space,11.437825,4,16.96355,0,0,0,148,1,a rustic cabin setting with lots of nice plants and a small tree in the corner.,a rutic cabin setting with lots of nice plants but no small tree like plant in the corder,wolfe2,113_L_plant,2,37,A3HHDPKL3O3O7Y,2021-01-26_09h19.22.320,MetaAwareness,2020.1.2,MacIntel,60,3E22YV8GG296BRL0MDL95YQE7XQNPX,A3HHDPKL3O3O7Y,3AMW0RGHOE59XBJUCFQBTHL2XEPPN0,H0MA8,H0MA8,3AMW0RGHOE59XBJUCFQBTHL2XEPPN0,3AMW0RGHOE59XBJUCFQBTHL2XEPPN0,271388,271388,,,,,,,,,,
,,,,2,9.6312,0,1,1,0,1,there is nothing but green wallpaper on the bedroom wall.,there is a small mirror hanging on the green wallpaper next to the wall.,wolfe2,001_R_mirror,1,37,A3HHDPKL3O3O7Y,2021-01-26_09h19.22.320,MetaAwareness,2020.1.2,MacIntel,60,3E22YV8GG296BRL0MDL95YQE7XQNPX,A3HHDPKL3O3O7Y,3AMW0RGHOE59XBJUCFQBTHL2XEPPN0,H0MA8,H0MA8,3AMW0RGHOE59XBJUCFQBTHL2XEPPN0,3AMW0RGHOE59XBJUCFQBTHL2XEPPN0,271388,271388,,,,,,,,,,
,,,,2,8.012705,0,2,2,113,1,the room is so beatiful and there is no lamp,the room is so beatiful and there is very beatiful lamp is there,wolfe2,084_L_light,1,37,A3HHDPKL3O3O7Y,2021-01-26_09h19.22.320,MetaAwareness,2020.1.2,MacIntel,60,3E22YV8GG296BRL0MDL95YQE7XQNPX,A3HHDPKL3O3O7Y,3AMW0RGHOE59XBJUCFQBTHL2XEPPN0,H0MA8,H0MA8,3AMW0RGHOE59XBJUCFQBTHL2XEPPN0,3AMW0RGHOE59XBJUCFQBTHL2XEPPN0,271388,271388,,,,,,,,,,
,,,,3,8.77673,0,3,3,107,1,a modern looking kitchen with a black shelf in its background,a modern looking kitchen with a plant on the counter,wolfe2,080_R_plant,3,37,A3HHDPKL3O3O7Y,2021-01-26_09h19.22.320,MetaAwareness,2020.1.2,MacIntel,60,3E22YV8GG296BRL0MDL95YQE7XQNPX,A3HHDPKL3O3O7Y,3AMW0RGHOE59XBJUCFQBTHL2XEPPN0,H0MA8,H0MA8,3AMW0RGHOE59XBJUCFQBTHL2XEPPN0,3AMW0RGHOE59XBJUCFQBTHL2XEPPN0,271388,271388,,,,,,,,,,
,,,,5,12.11892,0,4,4,5,1,"a living room with wood paneled windows that look out on a quiet, serene mountain lake",a living room with wood paneled windows that look out onto a mountain lake that appears to have three ducks or swans swimming in it,wolfe2,003_L_ducks,3,37,A3HHDPKL3O3O7Y,2021-01-26_09h19.22.320,MetaAwareness,2020.1.2,MacIntel,60,3E22YV8GG296BRL0MDL95YQE7XQNPX,A3HHDPKL3O3O7Y,3AMW0RGHOE59XBJUCFQBTHL2XEPPN0,H0MA8,H0MA8,3AMW0RGHOE59XBJUCFQBTHL2XEPPN0,3AMW0RGHOE59XBJUCFQBTHL2XEPPN0,271388,271388,,,,,,,,,,
,,,,2,5.268815,0,5,5,101,1,a kitchen with three ceiling lights,a kitchen with,wolfe2,075_R_light,3,37,A3HHDPKL3O3O7Y,2021-01-26_09h19.22.320,MetaAwareness,2020.1.2,MacIntel,60,3E22YV8GG296BRL0MDL95YQE7XQNPX,A3HHDPKL3O3O7Y,3AMW0RGHOE59XBJUCFQBTHL2XEPPN0,H0MA8,H0MA8,3AMW0RGHOE59XBJUCFQBTHL2XEPPN0,3AMW0RGHOE59XBJUCFQBTHL2XEPPN0,271388,271388,,,,,,,,,,
,,,,2,5.786855,0,6,6,95,1,a nice living room without a flower vessel on top of the cupboards,a nice living room with a flower vessel on top of the cupboard,wolfe2,071_L_art,4,37,A3HHDPKL3O3O7Y,2021-01-26_09h19.22.320,MetaAwareness,2020.1.2,MacIntel,60,3E22YV8GG296BRL0MDL95YQE7XQNPX,A3HHDPKL3O3O7Y,3AMW0RGHOE59XBJUCFQBTHL2XEPPN0,H0MA8,H0MA8,3AMW0RGHOE59XBJUCFQBTHL2XEPPN0,3AMW0RGHOE59XBJUCFQBTHL2XEPPN0,271388,271388,,,,,,,,,,
,,,,2,9.129975,0,7,7,112,1,this is a bedroom. a night stand on the right has empty shelves.,this is a bedroom. a night stand on the right has shelves with a bowl on it.,wolfe2,082_R_bowl,9,37,A3HHDPKL3O3O7Y,2021-01-26_09h19.22.320,MetaAwareness,2020.1.2,MacIntel,60,3E22YV8GG296BRL0MDL95YQE7XQNPX,A3HHDPKL3O3O7Y,3AMW0RGHOE59XBJUCFQBTHL2XEPPN0,H0MA8,H0MA8,3AMW0RGHOE59XBJUCFQBTHL2XEPPN0,3AMW0RGHOE59XBJUCFQBTHL2XEPPN0,271388,271388,,,,,,,,,,
,,,,5,8.978995,0,8,8,99,1,a pristine sitting room with a coffee table that holds multiple plants,a pristine sitting room with a coffee table that holds multiple plants and a book,wolfe2,074_R_book,1,37,A3HHDPKL3O3O7Y,2021-01-26_09h19.22.320,MetaAwareness,2020.1.2,MacIntel,60,3E22YV8GG296BRL0MDL95YQE7XQNPX,A3HHDPKL3O3O7Y,3AMW0RGHOE59XBJUCFQBTHL2XEPPN0,H0MA8,H0MA8,3AMW0RGHOE59XBJUCFQBTHL2XEPPN0,3AMW0RGHOE59XBJUCFQBTHL2XEPPN0,271388,271388,,,,,,,,,,
,,,,2,12.5589,0,9,9,120,1,a bedroom with a red and white theme. there are several doors with mirrors on them. in the corner of the room near on of the doors with a mirror on it is a little lamp.,a bedroom with a red and white theme. there are several doors with mirrors on them. there is nothing in the corner of the room near the door with a mirror.,wolfe2,090_L_lamp,1,37,A3HHDPKL3O3O7Y,2021-01-26_09h19.22.320,MetaAwareness,2020.1.2,MacIntel,60,3E22YV8GG296BRL0MDL95YQE7XQNPX,A3HHDPKL3O3O7Y,3AMW0RGHOE59XBJUCFQBTHL2XEPPN0,H0MA8,H0MA8,3AMW0RGHOE59XBJUCFQBTHL2XEPPN0,3AMW0RGHOE59XBJUCFQBTHL2XEPPN0,271388,271388,,,,,,,,,,
,,,,5,8.34216,0,10,10,27,1,a very contemporary living room with a flat screen tv against the wall.,a very contmporary living room with a flat screen tv against the wall that is a newer movel.,wolfe2,017_L_wood,1,37,A3HHDPKL3O3O7Y,2021-01-26_09h19.22.320,MetaAwareness,2020.1.2,MacIntel,60,3E22YV8GG296BRL0MDL95YQE7XQNPX,A3HHDPKL3O3O7Y,3AMW0RGHOE59XBJUCFQBTHL2XEPPN0,H0MA8,H0MA8,3AMW0RGHOE59XBJUCFQBTHL2XEPPN0,3AMW0RGHOE59XBJUCFQBTHL2XEPPN0,271388,271388,,,,,,,,,,
,,,,5,15.48593,0,11,11,151,1,"a spacious living room with hardwood floors, a leather coach and a plant on a table that is next to glass doors and windows looking out to the patio.","a spacious living room with hardwood floors, a leather couch and a table that is next to glass doors and windows looking out to the patio.",wolfe2,117_R_plant_sized,3,37,A3HHDPKL3O3O7Y,2021-01-26_09h19.22.320,MetaAwareness,2020.1.2,MacIntel,60,3E22YV8GG296BRL0MDL95YQE7XQNPX,A3HHDPKL3O3O7Y,3AMW0RGHOE59XBJUCFQBTHL2XEPPN0,H0MA8,H0MA8,3AMW0RGHOE59XBJUCFQBTHL2XEPPN0,3AMW0RGHOE59XBJUCFQBTHL2XEPPN0,271388,271388,,,,,,,,,,
,,,,4,17.51816,0,12,12,90,1,a living room with a lot of wood detailing and a built in bookshelf with an empty space on the top,a living room with a lot of wood detailing and a built in bookshelf with a set of candles on the top shelf,wolfe2,069_R_things,4,37,A3HHDPKL3O3O7Y,2021-01-26_09h19.22.320,MetaAwareness,2020.1.2,MacIntel,60,3E22YV8GG296BRL0MDL95YQE7XQNPX,A3HHDPKL3O3O7Y,3AMW0RGHOE59XBJUCFQBTHL2XEPPN0,H0MA8,H0MA8,3AMW0RGHOE59XBJUCFQBTHL2XEPPN0,3AMW0RGHOE59XBJUCFQBTHL2XEPPN0,271388,271388,,,,,,,,,,
,,,,3,10.831055,0,13,13,161,1,"a public dining area with multiple tables and chairs, with a chair sitting next to a table near the back window","a public dining area with multiple tables and chairs, with no chair sitting next to a table near the back window",wolfe2,122_R_chair,3,37,A3HHDPKL3O3O7Y,2021-01-26_09h19.22.320,MetaAwareness,2020.1.2,MacIntel,60,3E22YV8GG296BRL0MDL95YQE7XQNPX,A3HHDPKL3O3O7Y,3AMW0RGHOE59XBJUCFQBTHL2XEPPN0,H0MA8,H0MA8,3AMW0RGHOE59XBJUCFQBTHL2XEPPN0,3AMW0RGHOE59XBJUCFQBTHL2XEPPN0,271388,271388,,,,,,,,,,
,,,,1,8.966245,0,14,14,168,1,the studying room is good  thereis a flower to simle and good enegry to the room,there is no flower in my room are a planted,wolfe2,128_L_pot,1,37,A3HHDPKL3O3O7Y,2021-01-26_09h19.22.320,MetaAwareness,2020.1.2,MacIntel,60,3E22YV8GG296BRL0MDL95YQE7XQNPX,A3HHDPKL3O3O7Y,3AMW0RGHOE59XBJUCFQBTHL2XEPPN0,H0MA8,H0MA8,3AMW0RGHOE59XBJUCFQBTHL2XEPPN0,3AMW0RGHOE59XBJUCFQBTHL2XEPPN0,271388,271388,,,,,,,,,,
,,,,5,12.99039,0,15,15,43,1,"a modern-looking bathroom with two shelves, one of which is empty and the other of which has one white bottle","a modern-looking bathroom with two shelves, one of which is empty and the other of which has two white bottles",wolfe2,032_R_bottle,1,37,A3HHDPKL3O3O7Y,2021-01-26_09h19.22.320,MetaAwareness,2020.1.2,MacIntel,60,3E22YV8GG296BRL0MDL95YQE7XQNPX,A3HHDPKL3O3O7Y,3AMW0RGHOE59XBJUCFQBTHL2XEPPN0,H0MA8,H0MA8,3AMW0RGHOE59XBJUCFQBTHL2XEPPN0,3AMW0RGHOE59XBJUCFQBTHL2XEPPN0,271388,271388,,,,,,,,,,
,,,,5,9.246315,0,16,16,16,1,"a large, open bathroom overlooking a beautiful yard. the bathroom includes a soaking tub that has no drain","a large, open bathroom overlooking a beautiful yard. the bathroom includes a soaking tub with a drain at the top",wolfe2,012_R_tubaccesory,4,37,A3HHDPKL3O3O7Y,2021-01-26_09h19.22.320,MetaAwareness,2020.1.2,MacIntel,60,3E22YV8GG296BRL0MDL95YQE7XQNPX,A3HHDPKL3O3O7Y,3AMW0RGHOE59XBJUCFQBTHL2XEPPN0,H0MA8,H0MA8,3AMW0RGHOE59XBJUCFQBTHL2XEPPN0,3AMW0RGHOE59XBJUCFQBTHL2XEPPN0,271388,271388,,,,,,,,,,
,,,,5,11.26746,0,17,17,63,1,"a very large bathroom that has a double sinks, a shower, a tub, and a wooden closet with a bottom drawer.","a very large bathroom that has double sinks, a shower, a tub, and a wooden closet with two bottom drawers.",wolfe2,053_R_handle,2,37,A3HHDPKL3O3O7Y,2021-01-26_09h19.22.320,MetaAwareness,2020.1.2,MacIntel,60,3E22YV8GG296BRL0MDL95YQE7XQNPX,A3HHDPKL3O3O7Y,3AMW0RGHOE59XBJUCFQBTHL2XEPPN0,H0MA8,H0MA8,3AMW0RGHOE59XBJUCFQBTHL2XEPPN0,3AMW0RGHOE59XBJUCFQBTHL2XEPPN0,271388,271388,,,,,,,,,,
,,,,2,8.191565,0,18,18,103,1,the beige wall is waiting for the right decor to liven the bathroom up abit.,"the decor that is in this image, seems to promote a healthy body image.  the space is nice and roomy.",wolfe2,076_R_hook,1,37,A3HHDPKL3O3O7Y,2021-01-26_09h19.22.320,MetaAwareness,2020.1.2,MacIntel,60,3E22YV8GG296BRL0MDL95YQE7XQNPX,A3HHDPKL3O3O7Y,3AMW0RGHOE59XBJUCFQBTHL2XEPPN0,H0MA8,H0MA8,3AMW0RGHOE59XBJUCFQBTHL2XEPPN0,3AMW0RGHOE59XBJUCFQBTHL2XEPPN0,271388,271388,,,,,,,,,,
,,,,5,4.671205,0,19,19,55,1,"a nice, clean dining room with two paintings hanging above a china cabinet.","a nice, clean dining room with three paintings hanging above a china cabinet.",wolfe2,040_R_painting,4,37,A3HHDPKL3O3O7Y,2021-01-26_09h19.22.320,MetaAwareness,2020.1.2,MacIntel,60,3E22YV8GG296BRL0MDL95YQE7XQNPX,A3HHDPKL3O3O7Y,3AMW0RGHOE59XBJUCFQBTHL2XEPPN0,H0MA8,H0MA8,3AMW0RGHOE59XBJUCFQBTHL2XEPPN0,3AMW0RGHOE59XBJUCFQBTHL2XEPPN0,271388,271388,,,,,,,,,,
,,,,3,11.203935,0,20,20,130,1,a bathroom with two towels displayed which also has a smaller mirror on the wall.,a bathroom with two towels displayed and no extra mirrors on the side wall.,wolfe2,100_R_mirror,5,37,A3HHDPKL3O3O7Y,2021-01-26_09h19.22.320,MetaAwareness,2020.1.2,MacIntel,60,3E22YV8GG296BRL0MDL95YQE7XQNPX,A3HHDPKL3O3O7Y,3AMW0RGHOE59XBJUCFQBTHL2XEPPN0,H0MA8,H0MA8,3AMW0RGHOE59XBJUCFQBTHL2XEPPN0,3AMW0RGHOE59XBJUCFQBTHL2XEPPN0,271388,271388,,,,,,,,,,
,,,,5,13.42174,0,21,21,47,1,"a gray colored bedroom with white contrasting appliance such as the bed, rug and the side drawer with a missing lower handle","a gray colored bedroom with white contrasting appliance such as the bed, rug and the side drawer",wolfe2,034_L_handle,5,37,A3HHDPKL3O3O7Y,2021-01-26_09h19.22.320,MetaAwareness,2020.1.2,MacIntel,60,3E22YV8GG296BRL0MDL95YQE7XQNPX,A3HHDPKL3O3O7Y,3AMW0RGHOE59XBJUCFQBTHL2XEPPN0,H0MA8,H0MA8,3AMW0RGHOE59XBJUCFQBTHL2XEPPN0,3AMW0RGHOE59XBJUCFQBTHL2XEPPN0,271388,271388,,,,,,,,,,
,,,,4,9.524715,0,22,22,9,1,a living room area with a painting and tv on a wall,a living room area with a painting and tv on one wall and a mirror art on the other wall,wolfe2,005_R_mirror,1,37,A3HHDPKL3O3O7Y,2021-01-26_09h19.22.320,MetaAwareness,2020.1.2,MacIntel,60,3E22YV8GG296BRL0MDL95YQE7XQNPX,A3HHDPKL3O3O7Y,3AMW0RGHOE59XBJUCFQBTHL2XEPPN0,H0MA8,H0MA8,3AMW0RGHOE59XBJUCFQBTHL2XEPPN0,3AMW0RGHOE59XBJUCFQBTHL2XEPPN0,271388,271388,,,,,,,,,,
,,,,5,10.830735,0,23,23,76,1,"a dining room with four chairs, a table and five wine glasses","a dining room with four chairs, a table, and six wine glasses.",wolfe2,061_R_glass,2,37,A3HHDPKL3O3O7Y,2021-01-26_09h19.22.320,MetaAwareness,2020.1.2,MacIntel,60,3E22YV8GG296BRL0MDL95YQE7XQNPX,A3HHDPKL3O3O7Y,3AMW0RGHOE59XBJUCFQBTHL2XEPPN0,H0MA8,H0MA8,3AMW0RGHOE59XBJUCFQBTHL2XEPPN0,3AMW0RGHOE59XBJUCFQBTHL2XEPPN0,271388,271388,,,,,,,,,,
,,,,4,8.262915,0,24,24,125,1,two beds next to each other with a golden tag in between.,two beds next to each other.,wolfe2,093_L_switch,8,37,A3HHDPKL3O3O7Y,2021-01-26_09h19.22.320,MetaAwareness,2020.1.2,MacIntel,60,3E22YV8GG296BRL0MDL95YQE7XQNPX,A3HHDPKL3O3O7Y,3AMW0RGHOE59XBJUCFQBTHL2XEPPN0,H0MA8,H0MA8,3AMW0RGHOE59XBJUCFQBTHL2XEPPN0,3AMW0RGHOE59XBJUCFQBTHL2XEPPN0,271388,271388,,,,,,,,,,
,,,,5,6.125565,0,25,25,61,1,a very nice bedroom with a glass vase off to one end.,a very nice bedroom with a glass vase off to one end that has another glass vase on top of it.,wolfe2,048_L_art,1,37,A3HHDPKL3O3O7Y,2021-01-26_09h19.22.320,MetaAwareness,2020.1.2,MacIntel,60,3E22YV8GG296BRL0MDL95YQE7XQNPX,A3HHDPKL3O3O7Y,3AMW0RGHOE59XBJUCFQBTHL2XEPPN0,H0MA8,H0MA8,3AMW0RGHOE59XBJUCFQBTHL2XEPPN0,3AMW0RGHOE59XBJUCFQBTHL2XEPPN0,271388,271388,,,,,,,,,,
,,,,4,13.196695,0,26,26,118,1,a barber shop with a picture of woman with red hair between station that has a picture of a woman with black hair on the other side of station,a barber shop with a picture of a woman with black hair between the stations,wolfe2,089_R_poster,3,37,A3HHDPKL3O3O7Y,2021-01-26_09h19.22.320,MetaAwareness,2020.1.2,MacIntel,60,3E22YV8GG296BRL0MDL95YQE7XQNPX,A3HHDPKL3O3O7Y,3AMW0RGHOE59XBJUCFQBTHL2XEPPN0,H0MA8,H0MA8,3AMW0RGHOE59XBJUCFQBTHL2XEPPN0,3AMW0RGHOE59XBJUCFQBTHL2XEPPN0,271388,271388,,,,,,,,,,
,,,,5,9.61847,0,27,27,152,1,a room with furniture looking out at table on patio and shoes next to plant,a room with furniture looking out at table on patio with a plant,wolfe2,118_L_shoes,1,37,A3HHDPKL3O3O7Y,2021-01-26_09h19.22.320,MetaAwareness,2020.1.2,MacIntel,60,3E22YV8GG296BRL0MDL95YQE7XQNPX,A3HHDPKL3O3O7Y,3AMW0RGHOE59XBJUCFQBTHL2XEPPN0,H0MA8,H0MA8,3AMW0RGHOE59XBJUCFQBTHL2XEPPN0,3AMW0RGHOE59XBJUCFQBTHL2XEPPN0,271388,271388,,,,,,,,,,
,,,,3,7.79251,0,28,28,127,1,"a feminine bedroom with a large mirror, and a picture frame sitting on top of the vanity table",a feminine bedroom with a large mirror and nothing sitting on top of the vanity table,wolfe2,096_R_painting,1,37,A3HHDPKL3O3O7Y,2021-01-26_09h19.22.320,MetaAwareness,2020.1.2,MacIntel,60,3E22YV8GG296BRL0MDL95YQE7XQNPX,A3HHDPKL3O3O7Y,3AMW0RGHOE59XBJUCFQBTHL2XEPPN0,H0MA8,H0MA8,3AMW0RGHOE59XBJUCFQBTHL2XEPPN0,3AMW0RGHOE59XBJUCFQBTHL2XEPPN0,271388,271388,,,,,,,,,,
,,,,2,8.622435,0,29,29,62,1,a bedroom with no pictures near the mirror.,a bedroom with a picture hanging near the mirror.,wolfe2,049_R_painting,2,37,A3HHDPKL3O3O7Y,2021-01-26_09h19.22.320,MetaAwareness,2020.1.2,MacIntel,60,3E22YV8GG296BRL0MDL95YQE7XQNPX,A3HHDPKL3O3O7Y,3AMW0RGHOE59XBJUCFQBTHL2XEPPN0,H0MA8,H0MA8,3AMW0RGHOE59XBJUCFQBTHL2XEPPN0,3AMW0RGHOE59XBJUCFQBTHL2XEPPN0,271388,271388,,,,,,,,,,
,,,,,,,,,,,,,,,,37,A3HHDPKL3O3O7Y,2021-01-26_09h19.22.320,MetaAwareness,2020.1.2,MacIntel,60,3E22YV8GG296BRL0MDL95YQE7XQNPX,A3HHDPKL3O3O7Y,3AMW0RGHOE59XBJUCFQBTHL2XEPPN0,H0MA8,H0MA8,3AMW0RGHOE59XBJUCFQBTHL2XEPPN0,3AMW0RGHOE59XBJUCFQBTHL2XEPPN0,271388,271388,6,9.3835,someone laying underneath a blue beach umbrella on a crowded beach,someone laying underneath a blue beach umbrella on a crowded beach,same,1,7.09906,members of a marching band crossing a track that all have feather plumes at the front of their hats,a cluttered and rustic looking cafe with 10 hanging lights,different
