consent_response.keys,consent_response.rt,key_resp_2.keys,key_resp_2.rt,user_resp.keys,user_resp.rt,trials.thisRepN,trials.thisTrialN,trials.thisN,trials.thisIndex,trials.ran,image_1_text,image_2_text,database,image,number,age,worker_ID,date,expName,psychopyVersion,OS,frameRate,hitId,workerId,assignmentId,a,tp_a,b,tp_b,c,tp_c,catch_same_resp.keys,catch_same_resp.rt,image_1_text_catch_same,image_2_text_catch_same,image_catch_same,catch_different_resp.keys,catch_different_resp.rt,image_1_text_catch_different,image_2_text_catch_different,image_catch_different
space,2.458175,space,26.0041,5,17.17799,0,0,0,14,1,a group of young men playing basketball in front of garage doors that have overhanging lights,"a group of young men playing basketball in front of garage doors, of which one has an overhanging light",wolfe1,image-040,4,30,A3EWR58W0SA885,2021-02-18_11h24.21.974,MetaAwareness,2020.1.2,Win32,60,3Y7LTZE0YUPDKL7F6NVXARKMQTOUZI,A3EWR58W0SA885,3GD6L00D3T00Y1FSFC0LF6E4SFDM1E,DLDG3,DLDG3,3GD6L00D3T00Y1FSFC0LF6E4SFDM1E,3GD6L00D3T00Y1FSFC0LF6E4SFDM1E,276373,276373,,,,,,,,,,
,,,,4,9.59166,0,1,1,1,1,"a band plaing music outdoors on a sidewalk, there is a small sign on the wall behind them.","a band playing music outdoors on a sidewalk, there is no sign on the wall behind them.",wolfe1,image-013,3,30,A3EWR58W0SA885,2021-02-18_11h24.21.974,MetaAwareness,2020.1.2,Win32,60,3Y7LTZE0YUPDKL7F6NVXARKMQTOUZI,A3EWR58W0SA885,3GD6L00D3T00Y1FSFC0LF6E4SFDM1E,DLDG3,DLDG3,3GD6L00D3T00Y1FSFC0LF6E4SFDM1E,3GD6L00D3T00Y1FSFC0LF6E4SFDM1E,276373,276373,,,,,,,,,,
,,,,5,14.95431,0,2,2,26,1,"a group of people hang around some playground equipment, including someone with a red backpack","a group of people hang around some playground equipment, including someone wwith an orange backpack.",wolfe1,image-118,2,30,A3EWR58W0SA885,2021-02-18_11h24.21.974,MetaAwareness,2020.1.2,Win32,60,3Y7LTZE0YUPDKL7F6NVXARKMQTOUZI,A3EWR58W0SA885,3GD6L00D3T00Y1FSFC0LF6E4SFDM1E,DLDG3,DLDG3,3GD6L00D3T00Y1FSFC0LF6E4SFDM1E,3GD6L00D3T00Y1FSFC0LF6E4SFDM1E,276373,276373,,,,,,,,,,
,,,,5,4.81809,0,3,3,30,1,living room with red pillows,living room with green pillows,wolfe1,image-132,3,30,A3EWR58W0SA885,2021-02-18_11h24.21.974,MetaAwareness,2020.1.2,Win32,60,3Y7LTZE0YUPDKL7F6NVXARKMQTOUZI,A3EWR58W0SA885,3GD6L00D3T00Y1FSFC0LF6E4SFDM1E,DLDG3,DLDG3,3GD6L00D3T00Y1FSFC0LF6E4SFDM1E,3GD6L00D3T00Y1FSFC0LF6E4SFDM1E,276373,276373,,,,,,,,,,
,,,,5,6.00654,0,4,4,22,1,there is some red color flowers,there is some yellow color flowers,wolfe1,image-095,3,30,A3EWR58W0SA885,2021-02-18_11h24.21.974,MetaAwareness,2020.1.2,Win32,60,3Y7LTZE0YUPDKL7F6NVXARKMQTOUZI,A3EWR58W0SA885,3GD6L00D3T00Y1FSFC0LF6E4SFDM1E,DLDG3,DLDG3,3GD6L00D3T00Y1FSFC0LF6E4SFDM1E,3GD6L00D3T00Y1FSFC0LF6E4SFDM1E,276373,276373,,,,,,,,,,
,,,,5,9.15239,0,5,5,19,1,a group of young black children pose for a group photo. behind them is a river that leads to a lake.,a group of you black children pose for a group photo. behind them is a lake,wolfe1,image-048,1,30,A3EWR58W0SA885,2021-02-18_11h24.21.974,MetaAwareness,2020.1.2,Win32,60,3Y7LTZE0YUPDKL7F6NVXARKMQTOUZI,A3EWR58W0SA885,3GD6L00D3T00Y1FSFC0LF6E4SFDM1E,DLDG3,DLDG3,3GD6L00D3T00Y1FSFC0LF6E4SFDM1E,3GD6L00D3T00Y1FSFC0LF6E4SFDM1E,276373,276373,,,,,,,,,,
,,,,4,21.23539,0,6,6,31,1,"a group of five people walking together, one of the people in front have a red shirt on","a group of five people walking together, one of the people in front have a blue shirt on",wolfe1,image-134,4,30,A3EWR58W0SA885,2021-02-18_11h24.21.974,MetaAwareness,2020.1.2,Win32,60,3Y7LTZE0YUPDKL7F6NVXARKMQTOUZI,A3EWR58W0SA885,3GD6L00D3T00Y1FSFC0LF6E4SFDM1E,DLDG3,DLDG3,3GD6L00D3T00Y1FSFC0LF6E4SFDM1E,3GD6L00D3T00Y1FSFC0LF6E4SFDM1E,276373,276373,,,,,,,,,,
,,,,3,13.79557,0,7,7,12,1,a man in a yellow sportscoat and two women and a child feeding pigeons infront of a castle. there are birds to the right of the boys feet,"a man , two women and a child feeding pigeons in front of a castle, there are no birds to the right of the boys feet.",wolfe1,image-032,2,30,A3EWR58W0SA885,2021-02-18_11h24.21.974,MetaAwareness,2020.1.2,Win32,60,3Y7LTZE0YUPDKL7F6NVXARKMQTOUZI,A3EWR58W0SA885,3GD6L00D3T00Y1FSFC0LF6E4SFDM1E,DLDG3,DLDG3,3GD6L00D3T00Y1FSFC0LF6E4SFDM1E,3GD6L00D3T00Y1FSFC0LF6E4SFDM1E,276373,276373,,,,,,,,,,
,,,,5,29.91809,0,8,8,6,1,a mother and child walking in to a glass building thats a clinic with two bushes outside,a mother and child walking in to a glass building thats a clinic that has only 1 bush,wolfe1,image-023,1,30,A3EWR58W0SA885,2021-02-18_11h24.21.974,MetaAwareness,2020.1.2,Win32,60,3Y7LTZE0YUPDKL7F6NVXARKMQTOUZI,A3EWR58W0SA885,3GD6L00D3T00Y1FSFC0LF6E4SFDM1E,DLDG3,DLDG3,3GD6L00D3T00Y1FSFC0LF6E4SFDM1E,3GD6L00D3T00Y1FSFC0LF6E4SFDM1E,276373,276373,,,,,,,,,,
,,,,4,28.750415,0,9,9,3,1,a man in a blue shirt sits next to a pink and white striped sack at an outdoor festival with many other people.,a  man in a blue shirt sits at an outdoor festival with many other people.,wolfe1,image-020,3,30,A3EWR58W0SA885,2021-02-18_11h24.21.974,MetaAwareness,2020.1.2,Win32,60,3Y7LTZE0YUPDKL7F6NVXARKMQTOUZI,A3EWR58W0SA885,3GD6L00D3T00Y1FSFC0LF6E4SFDM1E,DLDG3,DLDG3,3GD6L00D3T00Y1FSFC0LF6E4SFDM1E,3GD6L00D3T00Y1FSFC0LF6E4SFDM1E,276373,276373,,,,,,,,,,
,,,,5,33.76595,0,10,10,7,1,large car festival with multiple cars on display. the cars have their hoods and trucks open. one red car in particular has a red and white barrol in front of it.,large car festival with mulitple cars on display. the cars have their hoods and trucks open.,wolfe1,image-024,3,30,A3EWR58W0SA885,2021-02-18_11h24.21.974,MetaAwareness,2020.1.2,Win32,60,3Y7LTZE0YUPDKL7F6NVXARKMQTOUZI,A3EWR58W0SA885,3GD6L00D3T00Y1FSFC0LF6E4SFDM1E,DLDG3,DLDG3,3GD6L00D3T00Y1FSFC0LF6E4SFDM1E,3GD6L00D3T00Y1FSFC0LF6E4SFDM1E,276373,276373,,,,,,,,,,
,,,,5,11.76821,0,11,11,8,1,"an outdoor festival with various tents, two trees can be seen in the background","an outdoor festival with various tents, a tree can be seen in  the background",wolfe1,image-025,1,30,A3EWR58W0SA885,2021-02-18_11h24.21.974,MetaAwareness,2020.1.2,Win32,60,3Y7LTZE0YUPDKL7F6NVXARKMQTOUZI,A3EWR58W0SA885,3GD6L00D3T00Y1FSFC0LF6E4SFDM1E,DLDG3,DLDG3,3GD6L00D3T00Y1FSFC0LF6E4SFDM1E,3GD6L00D3T00Y1FSFC0LF6E4SFDM1E,276373,276373,,,,,,,,,,
,,,,3,8.840055,0,12,12,25,1,airplanes next to yellow truck,airplanes next to red truck,wolfe1,image-111,3,30,A3EWR58W0SA885,2021-02-18_11h24.21.974,MetaAwareness,2020.1.2,Win32,60,3Y7LTZE0YUPDKL7F6NVXARKMQTOUZI,A3EWR58W0SA885,3GD6L00D3T00Y1FSFC0LF6E4SFDM1E,DLDG3,DLDG3,3GD6L00D3T00Y1FSFC0LF6E4SFDM1E,3GD6L00D3T00Y1FSFC0LF6E4SFDM1E,276373,276373,,,,,,,,,,
,,,,4,22.536905,0,13,13,4,1,an outdoor event with many people and a white tent. there is a pink and white striped bag on the grass,"an outdoor event with many people and a whitee tent, there is no pink and white striped bag on the grass in this image",wolfe1,image-020,6,30,A3EWR58W0SA885,2021-02-18_11h24.21.974,MetaAwareness,2020.1.2,Win32,60,3Y7LTZE0YUPDKL7F6NVXARKMQTOUZI,A3EWR58W0SA885,3GD6L00D3T00Y1FSFC0LF6E4SFDM1E,DLDG3,DLDG3,3GD6L00D3T00Y1FSFC0LF6E4SFDM1E,3GD6L00D3T00Y1FSFC0LF6E4SFDM1E,276373,276373,,,,,,,,,,
,,,,3,11.26142,0,14,14,17,1,a crowd is in front of an ornate church with statues at the top of each arch on its facade,a crowd is in front of an ornate church with statues at the top of each arch on its facade except for the leftmost arch,wolfe1,image-042,6,30,A3EWR58W0SA885,2021-02-18_11h24.21.974,MetaAwareness,2020.1.2,Win32,60,3Y7LTZE0YUPDKL7F6NVXARKMQTOUZI,A3EWR58W0SA885,3GD6L00D3T00Y1FSFC0LF6E4SFDM1E,DLDG3,DLDG3,3GD6L00D3T00Y1FSFC0LF6E4SFDM1E,3GD6L00D3T00Y1FSFC0LF6E4SFDM1E,276373,276373,,,,,,,,,,
,,,,3,17.836395,0,15,15,33,1,"there are two women walking on a beach and there are several umbrellas, there is a blue umbrella and a yellow umbrella behind them.","there are two women walking on a beach, and there are several umbrellas. there are two yellow umbrellas behind them.",wolfe1,image-137,1,30,A3EWR58W0SA885,2021-02-18_11h24.21.974,MetaAwareness,2020.1.2,Win32,60,3Y7LTZE0YUPDKL7F6NVXARKMQTOUZI,A3EWR58W0SA885,3GD6L00D3T00Y1FSFC0LF6E4SFDM1E,DLDG3,DLDG3,3GD6L00D3T00Y1FSFC0LF6E4SFDM1E,3GD6L00D3T00Y1FSFC0LF6E4SFDM1E,276373,276373,,,,,,,,,,
,,,,3,22.064895,0,16,16,28,1,a volley ball game in a wooded park setting with a group of three people watching a ball about to be volleyed back,a volleyball game with a group of three players watching on the right watching one person about to hit the ball across in a park setting,wolfe1,image-126,1,30,A3EWR58W0SA885,2021-02-18_11h24.21.974,MetaAwareness,2020.1.2,Win32,60,3Y7LTZE0YUPDKL7F6NVXARKMQTOUZI,A3EWR58W0SA885,3GD6L00D3T00Y1FSFC0LF6E4SFDM1E,DLDG3,DLDG3,3GD6L00D3T00Y1FSFC0LF6E4SFDM1E,3GD6L00D3T00Y1FSFC0LF6E4SFDM1E,276373,276373,,,,,,,,,,
,,,,5,8.653045,0,17,17,11,1,a scout troop marches in a parade. one of the scouts in front has badges on both sides of her uniform.,a scout troop marches in a parade. one of the scouts in front has badges on one side of her uniform.,wolfe1,image-031,7,30,A3EWR58W0SA885,2021-02-18_11h24.21.974,MetaAwareness,2020.1.2,Win32,60,3Y7LTZE0YUPDKL7F6NVXARKMQTOUZI,A3EWR58W0SA885,3GD6L00D3T00Y1FSFC0LF6E4SFDM1E,DLDG3,DLDG3,3GD6L00D3T00Y1FSFC0LF6E4SFDM1E,3GD6L00D3T00Y1FSFC0LF6E4SFDM1E,276373,276373,,,,,,,,,,
,,,,3,11.827935,0,18,18,5,1,"a group of archers practices their shots, with every archer having a quiver and arrows at their feet.","a group of archers practices their shots, with the last archer's quiver and arrows being missing.",wolfe1,image-021,4,30,A3EWR58W0SA885,2021-02-18_11h24.21.974,MetaAwareness,2020.1.2,Win32,60,3Y7LTZE0YUPDKL7F6NVXARKMQTOUZI,A3EWR58W0SA885,3GD6L00D3T00Y1FSFC0LF6E4SFDM1E,DLDG3,DLDG3,3GD6L00D3T00Y1FSFC0LF6E4SFDM1E,3GD6L00D3T00Y1FSFC0LF6E4SFDM1E,276373,276373,,,,,,,,,,
,,,,3,21.56162,0,19,19,9,1,a large building with many windows with people sittin infront of it and there is an object behind them in the grass,a large building ith many widowd with people sitting in the grass with no object behind them,wolfe1,image-028,1,30,A3EWR58W0SA885,2021-02-18_11h24.21.974,MetaAwareness,2020.1.2,Win32,60,3Y7LTZE0YUPDKL7F6NVXARKMQTOUZI,A3EWR58W0SA885,3GD6L00D3T00Y1FSFC0LF6E4SFDM1E,DLDG3,DLDG3,3GD6L00D3T00Y1FSFC0LF6E4SFDM1E,3GD6L00D3T00Y1FSFC0LF6E4SFDM1E,276373,276373,,,,,,,,,,
,,,,2,6.6185,0,20,20,15,1,a factory near a lake with rocks,a factory near a lake with no rocks in it,wolfe1,image-041,7,30,A3EWR58W0SA885,2021-02-18_11h24.21.974,MetaAwareness,2020.1.2,Win32,60,3Y7LTZE0YUPDKL7F6NVXARKMQTOUZI,A3EWR58W0SA885,3GD6L00D3T00Y1FSFC0LF6E4SFDM1E,DLDG3,DLDG3,3GD6L00D3T00Y1FSFC0LF6E4SFDM1E,3GD6L00D3T00Y1FSFC0LF6E4SFDM1E,276373,276373,,,,,,,,,,
,,,,2,12.442205,0,21,21,10,1,a parade of people are on the stree and the girl has a badge on her right chest,a parade of people are on the street and the girl has no badge on her right chest,wolfe1,image-031,4,30,A3EWR58W0SA885,2021-02-18_11h24.21.974,MetaAwareness,2020.1.2,Win32,60,3Y7LTZE0YUPDKL7F6NVXARKMQTOUZI,A3EWR58W0SA885,3GD6L00D3T00Y1FSFC0LF6E4SFDM1E,DLDG3,DLDG3,3GD6L00D3T00Y1FSFC0LF6E4SFDM1E,3GD6L00D3T00Y1FSFC0LF6E4SFDM1E,276373,276373,,,,,,,,,,
,,,,3,10.40859,0,22,22,18,1,a decorated room with a vase on the right side on the floor,a decorated room with no small vase on the right side on the floor.,wolfe1,image-043,4,30,A3EWR58W0SA885,2021-02-18_11h24.21.974,MetaAwareness,2020.1.2,Win32,60,3Y7LTZE0YUPDKL7F6NVXARKMQTOUZI,A3EWR58W0SA885,3GD6L00D3T00Y1FSFC0LF6E4SFDM1E,DLDG3,DLDG3,3GD6L00D3T00Y1FSFC0LF6E4SFDM1E,3GD6L00D3T00Y1FSFC0LF6E4SFDM1E,276373,276373,,,,,,,,,,
,,,,4,10.79349,0,23,23,13,1,a collection of boats and ten people on jet skis in an open body of water,a collection of boats and nine people on jet skis in an open body of water,wolfe1,image-035,4,30,A3EWR58W0SA885,2021-02-18_11h24.21.974,MetaAwareness,2020.1.2,Win32,60,3Y7LTZE0YUPDKL7F6NVXARKMQTOUZI,A3EWR58W0SA885,3GD6L00D3T00Y1FSFC0LF6E4SFDM1E,DLDG3,DLDG3,3GD6L00D3T00Y1FSFC0LF6E4SFDM1E,3GD6L00D3T00Y1FSFC0LF6E4SFDM1E,276373,276373,,,,,,,,,,
,,,,3,18.39825,0,24,24,29,1,dance instructor teaches a group of young children how to dance. one child wearing a red plaid skirt seems to have mastered the form better than the rest of her class,dance instructor teaches a group of young children how to dance. one child wearing a purple plaid skirt seems to have mastered the form better than the rest of her class,wolfe1,image-131,4,30,A3EWR58W0SA885,2021-02-18_11h24.21.974,MetaAwareness,2020.1.2,Win32,60,3Y7LTZE0YUPDKL7F6NVXARKMQTOUZI,A3EWR58W0SA885,3GD6L00D3T00Y1FSFC0LF6E4SFDM1E,DLDG3,DLDG3,3GD6L00D3T00Y1FSFC0LF6E4SFDM1E,3GD6L00D3T00Y1FSFC0LF6E4SFDM1E,276373,276373,,,,,,,,,,
,,,,3,7.852235,0,25,25,23,1,a hiker on a dusty mountain trail passes red wildflowers on his left,a hiker on a dusty mauntain trail passes yellow wildflowers on his left.,wolfe1,image-095,4,30,A3EWR58W0SA885,2021-02-18_11h24.21.974,MetaAwareness,2020.1.2,Win32,60,3Y7LTZE0YUPDKL7F6NVXARKMQTOUZI,A3EWR58W0SA885,3GD6L00D3T00Y1FSFC0LF6E4SFDM1E,DLDG3,DLDG3,3GD6L00D3T00Y1FSFC0LF6E4SFDM1E,3GD6L00D3T00Y1FSFC0LF6E4SFDM1E,276373,276373,,,,,,,,,,
,,,,3,15.432325,0,26,26,24,1,people walking to a  catheral with one person wearing green shorts.,people walking to a  catheral with one person wearing brown shorts.,wolfe1,image-098,2,30,A3EWR58W0SA885,2021-02-18_11h24.21.974,MetaAwareness,2020.1.2,Win32,60,3Y7LTZE0YUPDKL7F6NVXARKMQTOUZI,A3EWR58W0SA885,3GD6L00D3T00Y1FSFC0LF6E4SFDM1E,DLDG3,DLDG3,3GD6L00D3T00Y1FSFC0LF6E4SFDM1E,3GD6L00D3T00Y1FSFC0LF6E4SFDM1E,276373,276373,,,,,,,,,,
,,,,2,9.56727,0,27,27,32,1,a rooftop lounge area overlooking a light blue building,a rooftop lounge area overlooking a pink building,wolfe1,image-136,4,30,A3EWR58W0SA885,2021-02-18_11h24.21.974,MetaAwareness,2020.1.2,Win32,60,3Y7LTZE0YUPDKL7F6NVXARKMQTOUZI,A3EWR58W0SA885,3GD6L00D3T00Y1FSFC0LF6E4SFDM1E,DLDG3,DLDG3,3GD6L00D3T00Y1FSFC0LF6E4SFDM1E,3GD6L00D3T00Y1FSFC0LF6E4SFDM1E,276373,276373,,,,,,,,,,
,,,,5,10.618015,0,28,28,2,1,"a group of four men stand on a golf course, and one of them is getting ready to swing, and there is a peg in the ground behind him","a group of four men stand on a gold course, and one of them is getting ready to swing",wolfe1,image-017,4,30,A3EWR58W0SA885,2021-02-18_11h24.21.974,MetaAwareness,2020.1.2,Win32,60,3Y7LTZE0YUPDKL7F6NVXARKMQTOUZI,A3EWR58W0SA885,3GD6L00D3T00Y1FSFC0LF6E4SFDM1E,DLDG3,DLDG3,3GD6L00D3T00Y1FSFC0LF6E4SFDM1E,3GD6L00D3T00Y1FSFC0LF6E4SFDM1E,276373,276373,,,,,,,,,,
,,,,5,6.557205,0,29,29,20,1,two men one in yellow shirt watch motorcross biking,two men one in a green shirt watch motorcross biking,wolfe1,image-076,7,30,A3EWR58W0SA885,2021-02-18_11h24.21.974,MetaAwareness,2020.1.2,Win32,60,3Y7LTZE0YUPDKL7F6NVXARKMQTOUZI,A3EWR58W0SA885,3GD6L00D3T00Y1FSFC0LF6E4SFDM1E,DLDG3,DLDG3,3GD6L00D3T00Y1FSFC0LF6E4SFDM1E,3GD6L00D3T00Y1FSFC0LF6E4SFDM1E,276373,276373,,,,,,,,,,
,,,,,,,,,,,,,,,,30,A3EWR58W0SA885,2021-02-18_11h24.21.974,MetaAwareness,2020.1.2,Win32,60,3Y7LTZE0YUPDKL7F6NVXARKMQTOUZI,A3EWR58W0SA885,3GD6L00D3T00Y1FSFC0LF6E4SFDM1E,DLDG3,DLDG3,3GD6L00D3T00Y1FSFC0LF6E4SFDM1E,3GD6L00D3T00Y1FSFC0LF6E4SFDM1E,276373,276373,6,11.705795,someone laying underneath a blue beach umbrella on a crowded beach,someone laying underneath a blue beach umbrella on a crowded beach,same,1,10.775025,members of a marching band crossing a track that all have feather plumes at the front of their hats,a cluttered and rustic looking cafe with 10 hanging lights,different
