consent_response.keys,consent_response.rt,key_resp_2.keys,key_resp_2.rt,user_resp.keys,user_resp.rt,trials.thisRepN,trials.thisTrialN,trials.thisN,trials.thisIndex,trials.ran,image_1_text,image_2_text,database,image,number,age,worker_ID,date,expName,psychopyVersion,OS,frameRate,hitId,workerId,assignmentId,a,tp_a,b,tp_b,c,tp_c,catch_same_resp.keys,catch_same_resp.rt,image_1_text_catch_same,image_2_text_catch_same,image_catch_same,catch_different_resp.keys,catch_different_resp.rt,image_1_text_catch_different,image_2_text_catch_different,image_catch_different
space,4.637115,space,2.15655,4,17.200635,0,0,0,148,1,a man wearing a blue shirt has a discussion with his co-workers,a man wearing a green shirt has a discussion with his co-workers,wolfe1,image-104,2,33,A20C38AB8D6Z2L,2021-02-17_15h38.11.982,MetaAwareness,2020.1.2,Win32,60,388FBO7JZSW0K5D1D0HSIPJQC30YNC,A20C38AB8D6Z2L,30H4UDGLT3L3FTYU0EBBG2W2VSSPMO,LUH06,LUH06,30H4UDGLT3L3FTYU0EBBG2W2VSSPMO,30H4UDGLT3L3FTYU0EBBG2W2VSSPMO,276286,276286,,,,,,,,,,
,,,,5,5.094505,0,1,1,43,1,"a group of people are sitting on towels and blankets in the grass, waiting for something, with a pink and white striped blanket in the center of the image.","a group of people are sitting on towels and blankets in the grass, waiting for something, with there being no blanket in the center of the image.",wolfe1,image-020,4,33,A20C38AB8D6Z2L,2021-02-17_15h38.11.982,MetaAwareness,2020.1.2,Win32,60,388FBO7JZSW0K5D1D0HSIPJQC30YNC,A20C38AB8D6Z2L,30H4UDGLT3L3FTYU0EBBG2W2VSSPMO,LUH06,LUH06,30H4UDGLT3L3FTYU0EBBG2W2VSSPMO,30H4UDGLT3L3FTYU0EBBG2W2VSSPMO,276286,276286,,,,,,,,,,
,,,,5,3.80333,0,2,2,89,1,a crowd is in front of an ornate church with statues at the top of each arch on its facade,a crowd is in front of an ornate church with statues at the top of each arch on its facade except for the leftmost arch,wolfe1,image-042,6,33,A20C38AB8D6Z2L,2021-02-17_15h38.11.982,MetaAwareness,2020.1.2,Win32,60,388FBO7JZSW0K5D1D0HSIPJQC30YNC,A20C38AB8D6Z2L,30H4UDGLT3L3FTYU0EBBG2W2VSSPMO,LUH06,LUH06,30H4UDGLT3L3FTYU0EBBG2W2VSSPMO,30H4UDGLT3L3FTYU0EBBG2W2VSSPMO,276286,276286,,,,,,,,,,
,,,,5,6.091865,0,3,3,110,1,"there are a group of people, including police officers, standing in front of a large brick mansion. a woman is holding a blue child's jacket.",there is a group of people standing in front of a large brick mansion. some  of the people are police officers. there is a woman holding a child' yellow jacket.,wolfe1,image-077,2,33,A20C38AB8D6Z2L,2021-02-17_15h38.11.982,MetaAwareness,2020.1.2,Win32,60,388FBO7JZSW0K5D1D0HSIPJQC30YNC,A20C38AB8D6Z2L,30H4UDGLT3L3FTYU0EBBG2W2VSSPMO,LUH06,LUH06,30H4UDGLT3L3FTYU0EBBG2W2VSSPMO,30H4UDGLT3L3FTYU0EBBG2W2VSSPMO,276286,276286,,,,,,,,,,
,,,,5,11.12221,0,4,4,54,1,a crowd forms in front of benches with placards on them,"a crowd forms in front of benches, some of which have placards",wolfe1,image-027,5,33,A20C38AB8D6Z2L,2021-02-17_15h38.11.982,MetaAwareness,2020.1.2,Win32,60,388FBO7JZSW0K5D1D0HSIPJQC30YNC,A20C38AB8D6Z2L,30H4UDGLT3L3FTYU0EBBG2W2VSSPMO,LUH06,LUH06,30H4UDGLT3L3FTYU0EBBG2W2VSSPMO,30H4UDGLT3L3FTYU0EBBG2W2VSSPMO,276286,276286,,,,,,,,,,
,,,,4,8.044495,0,5,5,153,1,a crowd is sitting in the sun while a man in a green shirt is turned the opposite way,a crowd is sitting in the sun while a man in a pink shirt is turned the opposite way,wolfe1,image-105,1,33,A20C38AB8D6Z2L,2021-02-17_15h38.11.982,MetaAwareness,2020.1.2,Win32,60,388FBO7JZSW0K5D1D0HSIPJQC30YNC,A20C38AB8D6Z2L,30H4UDGLT3L3FTYU0EBBG2W2VSSPMO,LUH06,LUH06,30H4UDGLT3L3FTYU0EBBG2W2VSSPMO,30H4UDGLT3L3FTYU0EBBG2W2VSSPMO,276286,276286,,,,,,,,,,
,,,,4,3.264315,0,6,6,118,1,a group of young hikers in which one hiker is checking out something in his red backpack,a group of young ikers in whic one hiker is checking out something in his green backpack,wolfe1,image-084,4,33,A20C38AB8D6Z2L,2021-02-17_15h38.11.982,MetaAwareness,2020.1.2,Win32,60,388FBO7JZSW0K5D1D0HSIPJQC30YNC,A20C38AB8D6Z2L,30H4UDGLT3L3FTYU0EBBG2W2VSSPMO,LUH06,LUH06,30H4UDGLT3L3FTYU0EBBG2W2VSSPMO,30H4UDGLT3L3FTYU0EBBG2W2VSSPMO,276286,276286,,,,,,,,,,
,,,,4,2.773395,0,7,7,115,1,students using computers with a red object in the background,students using computers with a yellow object in the nbackground,wolfe1,image-083,2,33,A20C38AB8D6Z2L,2021-02-17_15h38.11.982,MetaAwareness,2020.1.2,Win32,60,388FBO7JZSW0K5D1D0HSIPJQC30YNC,A20C38AB8D6Z2L,30H4UDGLT3L3FTYU0EBBG2W2VSSPMO,LUH06,LUH06,30H4UDGLT3L3FTYU0EBBG2W2VSSPMO,30H4UDGLT3L3FTYU0EBBG2W2VSSPMO,276286,276286,,,,,,,,,,
,,,,4,2.57647,0,8,8,18,1,a street in milwaukee close to se water with a solar panel nearby,a street in milwaukee close to se water,wolfe1,image-007,5,33,A20C38AB8D6Z2L,2021-02-17_15h38.11.982,MetaAwareness,2020.1.2,Win32,60,388FBO7JZSW0K5D1D0HSIPJQC30YNC,A20C38AB8D6Z2L,30H4UDGLT3L3FTYU0EBBG2W2VSSPMO,LUH06,LUH06,30H4UDGLT3L3FTYU0EBBG2W2VSSPMO,30H4UDGLT3L3FTYU0EBBG2W2VSSPMO,276286,276286,,,,,,,,,,
,,,,5,2.97365,0,9,9,195,1,woman in blue jeans walking,woman in gray jeans walking,wolfe1,image-129,1,33,A20C38AB8D6Z2L,2021-02-17_15h38.11.982,MetaAwareness,2020.1.2,Win32,60,388FBO7JZSW0K5D1D0HSIPJQC30YNC,A20C38AB8D6Z2L,30H4UDGLT3L3FTYU0EBBG2W2VSSPMO,LUH06,LUH06,30H4UDGLT3L3FTYU0EBBG2W2VSSPMO,30H4UDGLT3L3FTYU0EBBG2W2VSSPMO,276286,276286,,,,,,,,,,
,,,,5,1.608515,0,10,10,82,1,a group of young men playing basketball in front of garage doors that have overhanging lights,"a group of young men playing basketball in front of garage doors, of which one has an overhanging light",wolfe1,image-040,4,33,A20C38AB8D6Z2L,2021-02-17_15h38.11.982,MetaAwareness,2020.1.2,Win32,60,388FBO7JZSW0K5D1D0HSIPJQC30YNC,A20C38AB8D6Z2L,30H4UDGLT3L3FTYU0EBBG2W2VSSPMO,LUH06,LUH06,30H4UDGLT3L3FTYU0EBBG2W2VSSPMO,30H4UDGLT3L3FTYU0EBBG2W2VSSPMO,276286,276286,,,,,,,,,,
,,,,5,4.00208,0,11,11,96,1,diggers with white box,diggers discussing dig site,wolfe1,image-046,2,33,A20C38AB8D6Z2L,2021-02-17_15h38.11.982,MetaAwareness,2020.1.2,Win32,60,388FBO7JZSW0K5D1D0HSIPJQC30YNC,A20C38AB8D6Z2L,30H4UDGLT3L3FTYU0EBBG2W2VSSPMO,LUH06,LUH06,30H4UDGLT3L3FTYU0EBBG2W2VSSPMO,30H4UDGLT3L3FTYU0EBBG2W2VSSPMO,276286,276286,,,,,,,,,,
,,,,4,3.970535,0,12,12,23,1,someone sets up camp in the snow and a yellow piece of plastic is by their equipment,someone sets up camp in the snow and their equipment is all around them,wolfe1,image-010,5,33,A20C38AB8D6Z2L,2021-02-17_15h38.11.982,MetaAwareness,2020.1.2,Win32,60,388FBO7JZSW0K5D1D0HSIPJQC30YNC,A20C38AB8D6Z2L,30H4UDGLT3L3FTYU0EBBG2W2VSSPMO,LUH06,LUH06,30H4UDGLT3L3FTYU0EBBG2W2VSSPMO,30H4UDGLT3L3FTYU0EBBG2W2VSSPMO,276286,276286,,,,,,,,,,
,,,,5,1.67522,0,13,13,28,1,"many people are enjoying an outdoor concert in the grass, there is a blanket with no one on it",many people are enjoying an outdoor concert in the grass,wolfe1,image-014,1,33,A20C38AB8D6Z2L,2021-02-17_15h38.11.982,MetaAwareness,2020.1.2,Win32,60,388FBO7JZSW0K5D1D0HSIPJQC30YNC,A20C38AB8D6Z2L,30H4UDGLT3L3FTYU0EBBG2W2VSSPMO,LUH06,LUH06,30H4UDGLT3L3FTYU0EBBG2W2VSSPMO,30H4UDGLT3L3FTYU0EBBG2W2VSSPMO,276286,276286,,,,,,,,,,
,,,,5,3.48484,0,14,14,113,1,people walking in mall with a red store sign upstairs,people walking in mall with a pink store sign upstairs,wolfe1,image-079,1,33,A20C38AB8D6Z2L,2021-02-17_15h38.11.982,MetaAwareness,2020.1.2,Win32,60,388FBO7JZSW0K5D1D0HSIPJQC30YNC,A20C38AB8D6Z2L,30H4UDGLT3L3FTYU0EBBG2W2VSSPMO,LUH06,LUH06,30H4UDGLT3L3FTYU0EBBG2W2VSSPMO,30H4UDGLT3L3FTYU0EBBG2W2VSSPMO,276286,276286,,,,,,,,,,
,,,,4,4.111445,0,15,15,205,1,living room with red pillows,living room with green pillows,wolfe1,image-132,3,33,A20C38AB8D6Z2L,2021-02-17_15h38.11.982,MetaAwareness,2020.1.2,Win32,60,388FBO7JZSW0K5D1D0HSIPJQC30YNC,A20C38AB8D6Z2L,30H4UDGLT3L3FTYU0EBBG2W2VSSPMO,LUH06,LUH06,30H4UDGLT3L3FTYU0EBBG2W2VSSPMO,30H4UDGLT3L3FTYU0EBBG2W2VSSPMO,276286,276286,,,,,,,,,,
,,,,5,113.52103,0,16,16,60,1,adult boy scouts marching in a parade with one girl scout accompanying them and wearing a badge on the right side of her chest.,adult boy scouts marching in a parade with one girl scout accompanying them.,wolfe1,image-031,2,33,A20C38AB8D6Z2L,2021-02-17_15h38.11.982,MetaAwareness,2020.1.2,Win32,60,388FBO7JZSW0K5D1D0HSIPJQC30YNC,A20C38AB8D6Z2L,30H4UDGLT3L3FTYU0EBBG2W2VSSPMO,LUH06,LUH06,30H4UDGLT3L3FTYU0EBBG2W2VSSPMO,30H4UDGLT3L3FTYU0EBBG2W2VSSPMO,276286,276286,,,,,,,,,,
,,,,5,4.005795,0,17,17,188,1,a walk in the park on a gated path along the water with green posts sticking out of the water,a walk in the park on a gated path along the water with green and brown posts sticking out of the water,wolfe1,image-124,6,33,A20C38AB8D6Z2L,2021-02-17_15h38.11.982,MetaAwareness,2020.1.2,Win32,60,388FBO7JZSW0K5D1D0HSIPJQC30YNC,A20C38AB8D6Z2L,30H4UDGLT3L3FTYU0EBBG2W2VSSPMO,LUH06,LUH06,30H4UDGLT3L3FTYU0EBBG2W2VSSPMO,30H4UDGLT3L3FTYU0EBBG2W2VSSPMO,276286,276286,,,,,,,,,,
,,,,4,3.12748,0,18,18,180,1,a pond with a yellow sign.,a pond with a dark orange sign.,wolfe1,image-119,5,33,A20C38AB8D6Z2L,2021-02-17_15h38.11.982,MetaAwareness,2020.1.2,Win32,60,388FBO7JZSW0K5D1D0HSIPJQC30YNC,A20C38AB8D6Z2L,30H4UDGLT3L3FTYU0EBBG2W2VSSPMO,LUH06,LUH06,30H4UDGLT3L3FTYU0EBBG2W2VSSPMO,30H4UDGLT3L3FTYU0EBBG2W2VSSPMO,276286,276286,,,,,,,,,,
,,,,5,1.43744,0,19,19,30,1,a large concert in an outdoor tent with a lot of people sitting on the ground and a baby in the grass alone,a large concert in an outdoor tent with a lot people sitting on the ground. there is no baby in the grass in this image,wolfe1,image-014,7,33,A20C38AB8D6Z2L,2021-02-17_15h38.11.982,MetaAwareness,2020.1.2,Win32,60,388FBO7JZSW0K5D1D0HSIPJQC30YNC,A20C38AB8D6Z2L,30H4UDGLT3L3FTYU0EBBG2W2VSSPMO,LUH06,LUH06,30H4UDGLT3L3FTYU0EBBG2W2VSSPMO,30H4UDGLT3L3FTYU0EBBG2W2VSSPMO,276286,276286,,,,,,,,,,
,,,,4,6.84106,0,20,20,64,1,a scout troop marches in a parade. one of the scouts in front has badges on both sides of her uniform.,a scout troop marches in a parade. one of the scouts in front has badges on one side of her uniform.,wolfe1,image-031,7,33,A20C38AB8D6Z2L,2021-02-17_15h38.11.982,MetaAwareness,2020.1.2,Win32,60,388FBO7JZSW0K5D1D0HSIPJQC30YNC,A20C38AB8D6Z2L,30H4UDGLT3L3FTYU0EBBG2W2VSSPMO,LUH06,LUH06,30H4UDGLT3L3FTYU0EBBG2W2VSSPMO,30H4UDGLT3L3FTYU0EBBG2W2VSSPMO,276286,276286,,,,,,,,,,
,,,,4,5.5193,0,21,21,183,1,"an outside concert with a stage and one central performer in orange, some people with umbreallas and a person on the ground with an umbrella",an outdoor concert with a central performer with a guitar and one person with an umbrella on the ground while others stand around,wolfe1,image-122,1,33,A20C38AB8D6Z2L,2021-02-17_15h38.11.982,MetaAwareness,2020.1.2,Win32,60,388FBO7JZSW0K5D1D0HSIPJQC30YNC,A20C38AB8D6Z2L,30H4UDGLT3L3FTYU0EBBG2W2VSSPMO,LUH06,LUH06,30H4UDGLT3L3FTYU0EBBG2W2VSSPMO,30H4UDGLT3L3FTYU0EBBG2W2VSSPMO,276286,276286,,,,,,,,,,
,,,,5,4.02328,0,22,22,88,1,many people crowd a street in front of a huge catherdral with 5 front points on the top.,many people crowd a street in front of a huge catherdral with 4 front points on the top.,wolfe1,image-042,2,33,A20C38AB8D6Z2L,2021-02-17_15h38.11.982,MetaAwareness,2020.1.2,Win32,60,388FBO7JZSW0K5D1D0HSIPJQC30YNC,A20C38AB8D6Z2L,30H4UDGLT3L3FTYU0EBBG2W2VSSPMO,LUH06,LUH06,30H4UDGLT3L3FTYU0EBBG2W2VSSPMO,30H4UDGLT3L3FTYU0EBBG2W2VSSPMO,276286,276286,,,,,,,,,,
,,,,5,14.244575,0,23,23,185,1,three buildings on a street with a shop that has a green window above a sign,three buildings on a street with a shop that has a red window above a sign,wolfe1,image-123,4,33,A20C38AB8D6Z2L,2021-02-17_15h38.11.982,MetaAwareness,2020.1.2,Win32,60,388FBO7JZSW0K5D1D0HSIPJQC30YNC,A20C38AB8D6Z2L,30H4UDGLT3L3FTYU0EBBG2W2VSSPMO,LUH06,LUH06,30H4UDGLT3L3FTYU0EBBG2W2VSSPMO,30H4UDGLT3L3FTYU0EBBG2W2VSSPMO,276286,276286,,,,,,,,,,
,,,,5,2.86704,0,24,24,144,1,a tent set up in the woods with several red striped towels and one blue stripped towel hanging up.,a tent set up in the woods with red striped towels hanging up.,wolfe1,image-100,3,33,A20C38AB8D6Z2L,2021-02-17_15h38.11.982,MetaAwareness,2020.1.2,Win32,60,388FBO7JZSW0K5D1D0HSIPJQC30YNC,A20C38AB8D6Z2L,30H4UDGLT3L3FTYU0EBBG2W2VSSPMO,LUH06,LUH06,30H4UDGLT3L3FTYU0EBBG2W2VSSPMO,30H4UDGLT3L3FTYU0EBBG2W2VSSPMO,276286,276286,,,,,,,,,,
,,,,4,1.567635,0,25,25,41,1,people climbing the face of a short cliff with bags and gear on the ground and one man in a red shirt almost reaching the top.,people climbing the face of a short cliff with bags and gear on the ground.,wolfe1,image-019,4,33,A20C38AB8D6Z2L,2021-02-17_15h38.11.982,MetaAwareness,2020.1.2,Win32,60,388FBO7JZSW0K5D1D0HSIPJQC30YNC,A20C38AB8D6Z2L,30H4UDGLT3L3FTYU0EBBG2W2VSSPMO,LUH06,LUH06,30H4UDGLT3L3FTYU0EBBG2W2VSSPMO,30H4UDGLT3L3FTYU0EBBG2W2VSSPMO,276286,276286,,,,,,,,,,
,,,,4,5.446945,0,26,26,65,1,a man in a yellow sportscoat and two women and a child feeding pigeons infront of a castle. there are birds to the right of the boys feet,"a man , two women and a child feeding pigeons in front of a castle, there are no birds to the right of the boys feet.",wolfe1,image-032,2,33,A20C38AB8D6Z2L,2021-02-17_15h38.11.982,MetaAwareness,2020.1.2,Win32,60,388FBO7JZSW0K5D1D0HSIPJQC30YNC,A20C38AB8D6Z2L,30H4UDGLT3L3FTYU0EBBG2W2VSSPMO,LUH06,LUH06,30H4UDGLT3L3FTYU0EBBG2W2VSSPMO,30H4UDGLT3L3FTYU0EBBG2W2VSSPMO,276286,276286,,,,,,,,,,
,,,,5,1.534325,0,27,27,159,1,a group of men playing golf with a view of a grayish buliding roof visible in the break of the tree line.,a group of men playing golf with a view of a reddish building roof visible in the break of the tree line.,wolfe1,image-108,2,33,A20C38AB8D6Z2L,2021-02-17_15h38.11.982,MetaAwareness,2020.1.2,Win32,60,388FBO7JZSW0K5D1D0HSIPJQC30YNC,A20C38AB8D6Z2L,30H4UDGLT3L3FTYU0EBBG2W2VSSPMO,LUH06,LUH06,30H4UDGLT3L3FTYU0EBBG2W2VSSPMO,30H4UDGLT3L3FTYU0EBBG2W2VSSPMO,276286,276286,,,,,,,,,,
,,,,4,3.021635,0,28,28,201,1,the instructor shows the children dance moves. one of the children wears a pink skirt.,the instructor shows the children dance moves. one of the children wears a purple skirt.,wolfe1,image-131,1,33,A20C38AB8D6Z2L,2021-02-17_15h38.11.982,MetaAwareness,2020.1.2,Win32,60,388FBO7JZSW0K5D1D0HSIPJQC30YNC,A20C38AB8D6Z2L,30H4UDGLT3L3FTYU0EBBG2W2VSSPMO,LUH06,LUH06,30H4UDGLT3L3FTYU0EBBG2W2VSSPMO,30H4UDGLT3L3FTYU0EBBG2W2VSSPMO,276286,276286,,,,,,,,,,
,,,,5,0.923,0,29,29,19,1,"a woman pettin a deer at what appears to be a petting zoo, there is a person in all black behind her to the right.","a woman petting a deer at a zoo, there is no person dressed in all black behind her",wolfe1,image-008,5,33,A20C38AB8D6Z2L,2021-02-17_15h38.11.982,MetaAwareness,2020.1.2,Win32,60,388FBO7JZSW0K5D1D0HSIPJQC30YNC,A20C38AB8D6Z2L,30H4UDGLT3L3FTYU0EBBG2W2VSSPMO,LUH06,LUH06,30H4UDGLT3L3FTYU0EBBG2W2VSSPMO,30H4UDGLT3L3FTYU0EBBG2W2VSSPMO,276286,276286,,,,,,,,,,
,,,,,,,,,,,,,,,,33,A20C38AB8D6Z2L,2021-02-17_15h38.11.982,MetaAwareness,2020.1.2,Win32,60,388FBO7JZSW0K5D1D0HSIPJQC30YNC,A20C38AB8D6Z2L,30H4UDGLT3L3FTYU0EBBG2W2VSSPMO,LUH06,LUH06,30H4UDGLT3L3FTYU0EBBG2W2VSSPMO,30H4UDGLT3L3FTYU0EBBG2W2VSSPMO,276286,276286,4,0.86035,someone laying underneath a blue beach umbrella on a crowded beach,someone laying underneath a blue beach umbrella on a crowded beach,same,3,1.213635,members of a marching band crossing a track that all have feather plumes at the front of their hats,a cluttered and rustic looking cafe with 10 hanging lights,different
