start_time,opening_start_time,opening_end_time,consent_start_time,consent_response_keys,consent_response_rt,consent_end_time,instructions_1_start_time,key_resp_2_keys,key_resp_2_rt,instructions_1_end_time,Example_1_start_time,Example_1_resp_keys,Example_1_response_keys,Example_1_response_rt,Example_1_end_time,Example_1_a_text,Example_1_b_text,Example_1_mouse_x,Example_1_mouse_y,Example_1_mouse_leftButton,Example_1_mouse_midButton,Example_1_mouse_rightButton,Example_2_start_time,Example_2_resp_keys,Example_2_response_keys,Example_2_response_rt,Example_2_end_time,Example_2_a_text,Example_2_b_text,Example_2_mouse_x,Example_2_mouse_y,Example_2_mouse_leftButton,Example_2_mouse_midButton,Example_2_mouse_rightButton,Example_3_start_time,Example_3_resp_keys,Example_3_response_keys,Example_3_response_rt,Example_3_end_time,Example_3_a_text,Example_3_b_text,Example_3_mouse_x,Example_3_mouse_y,Example_3_mouse_leftButton,Example_3_mouse_midButton,Example_3_mouse_rightButton,instructions_2_start_time,Start_resp_2_keys,Start_resp_2_rt,instructions_2_end_time,trial_start_time,user_resp_keys,trial_response_keys,trial_response_rt,trial_end_time,image_1_text,image_2_text,trial_mouse_x,trial_mouse_y,trial_mouse_leftButton,trial_mouse_midButton,trial_mouse_rightButton,trials.thisRepN,trials.thisTrialN,trials.thisN,trials.thisIndex,trials.ran,workerId,trial_num,image_a,image_b,age,worker_ID,date,expName,psychopyVersion,OS,frameRate,hitId,assignmentId,a,tp_a,b,tp_b,c,tp_c,Cow_start_time,Cow_resp_keys,Cow_response_keys,Cow_response_rt,Cow_end_time,Cow_a_text,Cow_b_text,Cow_mouse_x,Cow_mouse_y,Cow_mouse_leftButton,Cow_mouse_midButton,Cow_mouse_rightButton,Airplane_start_time,Airplane_resp_keys,Airplane_response_keys,Airplane_response_rt,Airplane_end_time,Airplane_a_text,Airplane_b_text,Airplane_mouse_x,Airplane_mouse_y,Airplane_mouse_leftButton,Airplane_mouse_midButton,Airplane_mouse_rightButton
0:18:32:470,0:18:43:261,0:18:58:227,0:18:58:234,space,21.134,0:19:19:417,0:19:19:424,space,14.613,0:19:34:60,0:19:35:75,,space,26.333,0:20:1:447,members of a marching band crossing a track that all have feather plumes at the front of their hats,members of a marching band crossing a track with one player who has their feather plume at the back of their hat,-0.103009259,-0.09837963,0,0,0,0:20:2:462,,space,19.325,0:20:21:820,a cluttered and rustic looking cafe with 10 hanging lights,a cluttered and rustic looking cafe with 9 hanging lights,-0.103009259,-0.09837963,0,0,0,0:20:22:835,,space,16.441,0:20:39:311,someone laying underneath a blue beach umbrella on a crowded beach,someone laying underneath a purple beach umbrella on a crowded beach,-0.103009259,-0.09837963,0,0,0,0:20:40:331,return,7.396,0:20:47:740,0:20:48:756,,return,78.51,0:22:7:304,"a living room containing a sofa, book shelves, and an empty fireplace ","a living room containing a sofa, book shelves, and logs in a fireplace",0.168981481,-0.290509259,0,0,0,0,0,0,6,1,A21QSJIMHCW3N8,108,wolfe_054_R_firewood-a_w_outline.jpg,wolfe_054_R_firewood-b_w_outline.jpg,38,A21QSJIMHCW3N8,2021-01-13_00h18.43.166,MetaAwareness,2020.1.2,Win32,60,3MDKGGG61RQWWY8F4D8C8X5P0UFT6U,3EQHHY4HQTVZU9KP5W425R7O4TAG5M,HHQE6,HHQE6,3EQHHY4HQTVZU9KP5W425R7O4TAG5M,3EQHHY4HQTVZU9KP5W425R7O4TAG5M,268696,268696,,,,,,,,,,,,,,,,,,,,,,,,
,,,,,,,,,,,,,,,,,,,,,,,,,,,,,,,,,,,,,,,,,,,,,,,,,,,0:22:8:317,,return,80.78,0:23:29:128,"a large sitting room in a house with two sofas, a dog, and two lights on the wall","a large sitting room in a  house with two sofas, a dog in a dog bed, and one light on the wall",0.248842593,-0.247685185,0,0,0,0,1,1,10,1,A21QSJIMHCW3N8,254,wolfe_127_R_light-a_w_outline.jpg,wolfe_127_R_light-b_w_outline.jpg,38,A21QSJIMHCW3N8,2021-01-13_00h18.43.166,MetaAwareness,2020.1.2,Win32,60,3MDKGGG61RQWWY8F4D8C8X5P0UFT6U,3EQHHY4HQTVZU9KP5W425R7O4TAG5M,HHQE6,HHQE6,3EQHHY4HQTVZU9KP5W425R7O4TAG5M,3EQHHY4HQTVZU9KP5W425R7O4TAG5M,268696,268696,,,,,,,,,,,,,,,,,,,,,,,,
,,,,,,,,,,,,,,,,,,,,,,,,,,,,,,,,,,,,,,,,,,,,,,,,,,,0:23:30:142,,return,133.753,0:25:43:927,"a room in a house with two sofas, a table, and a shelving unit that has one long, pale art object","a room in a house with two sofas, a table, and a shelving unit that has two long, pale art objects",0.103009259,-0.275462963,0,0,0,0,2,2,3,1,A21QSJIMHCW3N8,50,wolfe_025_R_vase-a_w_outline.jpg,wolfe_025_R_vase-b_w_outline.jpg,38,A21QSJIMHCW3N8,2021-01-13_00h18.43.166,MetaAwareness,2020.1.2,Win32,60,3MDKGGG61RQWWY8F4D8C8X5P0UFT6U,3EQHHY4HQTVZU9KP5W425R7O4TAG5M,HHQE6,HHQE6,3EQHHY4HQTVZU9KP5W425R7O4TAG5M,3EQHHY4HQTVZU9KP5W425R7O4TAG5M,268696,268696,,,,,,,,,,,,,,,,,,,,,,,,
,,,,,,,,,,,,,,,,,,,,,,,,,,,,,,,,,,,,,,,,,,,,,,,,,,,0:25:44:942,,return,107.983,0:27:32:957,a clean and orderly blue bathroom with a large mirror and one bottle on the window sill,a clean and orderly blue bathroom with a large mirror and two bottles on the window sill,0.18287037,-0.27662037,0,0,0,0,3,3,1,1,A21QSJIMHCW3N8,16,wolfe_008_R_bottle-a_w_outline.jpg,wolfe_008_R_bottle-b_w_outline.jpg,38,A21QSJIMHCW3N8,2021-01-13_00h18.43.166,MetaAwareness,2020.1.2,Win32,60,3MDKGGG61RQWWY8F4D8C8X5P0UFT6U,3EQHHY4HQTVZU9KP5W425R7O4TAG5M,HHQE6,HHQE6,3EQHHY4HQTVZU9KP5W425R7O4TAG5M,3EQHHY4HQTVZU9KP5W425R7O4TAG5M,268696,268696,,,,,,,,,,,,,,,,,,,,,,,,
,,,,,,,,,,,,,,,,,,,,,,,,,,,,,,,,,,,,,,,,,,,,,,,,,,,0:27:33:972,,return,128.486,0:29:42:493,"a large white bathroom that has both a tub and a shower as well as a toilet and a bidet, and two brown towels on a shelf","a large white bathroom that has both a tub and a shower as well as a toilet and a bidet, and three brown towels on a shelf",0.131944444,-0.260416667,0,0,0,0,4,4,5,1,A21QSJIMHCW3N8,74,wolfe_037_R_towel-a_w_outline.jpg,wolfe_037_R_towel-b_w_outline.jpg,38,A21QSJIMHCW3N8,2021-01-13_00h18.43.166,MetaAwareness,2020.1.2,Win32,60,3MDKGGG61RQWWY8F4D8C8X5P0UFT6U,3EQHHY4HQTVZU9KP5W425R7O4TAG5M,HHQE6,HHQE6,3EQHHY4HQTVZU9KP5W425R7O4TAG5M,3EQHHY4HQTVZU9KP5W425R7O4TAG5M,268696,268696,,,,,,,,,,,,,,,,,,,,,,,,
,,,,,,,,,,,,,,,,,,,,,,,,,,,,,,,,,,,,,,,,,,,,,,,,,,,0:29:43:508,,return,120.441,0:31:43:983,"a home office with built in desk and book shelves, the desk has computer equipment and a plant on it","a home office with built in desk and book shelves, the desk has computer equipment on it",0.136574074,-0.282407407,0,0,0,0,5,5,11,1,A21QSJIMHCW3N8,256,wolfe_128_R_pot-a_w_outline.jpg,wolfe_128_R_pot-b_w_outline.jpg,38,A21QSJIMHCW3N8,2021-01-13_00h18.43.166,MetaAwareness,2020.1.2,Win32,60,3MDKGGG61RQWWY8F4D8C8X5P0UFT6U,3EQHHY4HQTVZU9KP5W425R7O4TAG5M,HHQE6,HHQE6,3EQHHY4HQTVZU9KP5W425R7O4TAG5M,3EQHHY4HQTVZU9KP5W425R7O4TAG5M,268696,268696,,,,,,,,,,,,,,,,,,,,,,,,
,,,,,,,,,,,,,,,,,,,,,,,,,,,,,,,,,,,,,,,,,,,,,,,,,,,0:31:44:998,,return,167.769,0:34:32:799,"a bathroom with beige colored walls, with a mirror, a towel holder, a towel hook, and electrical fixtures on the wall","a bathroom with beige colored walls, with a mirror, a towel holder, and electrical fixtures on the wall",0.083333333,-0.280092593,0,0,0,0,6,6,9,1,A21QSJIMHCW3N8,206,wolfe_103_R_hook-a_w_outline.jpg,wolfe_103_R_hook-b_w_outline.jpg,38,A21QSJIMHCW3N8,2021-01-13_00h18.43.166,MetaAwareness,2020.1.2,Win32,60,3MDKGGG61RQWWY8F4D8C8X5P0UFT6U,3EQHHY4HQTVZU9KP5W425R7O4TAG5M,HHQE6,HHQE6,3EQHHY4HQTVZU9KP5W425R7O4TAG5M,3EQHHY4HQTVZU9KP5W425R7O4TAG5M,268696,268696,,,,,,,,,,,,,,,,,,,,,,,,
,,,,,,,,,,,,,,,,,,,,,,,,,,,,,,,,,,,,,,,,,,,,,,,,,,,0:34:33:814,,return,137.102,0:36:50:948,a white bathroom with a black tub and one faucet knob on the wall behind the tub,a white bathroom with a black tub and two faucet knobs on the wall behind the tub,0.113425926,-0.275462963,0,0,0,0,7,7,8,1,A21QSJIMHCW3N8,136,wolfe_068_R_faucet-a_w_outline.jpg,wolfe_068_R_faucet-b_w_outline.jpg,38,A21QSJIMHCW3N8,2021-01-13_00h18.43.166,MetaAwareness,2020.1.2,Win32,60,3MDKGGG61RQWWY8F4D8C8X5P0UFT6U,3EQHHY4HQTVZU9KP5W425R7O4TAG5M,HHQE6,HHQE6,3EQHHY4HQTVZU9KP5W425R7O4TAG5M,3EQHHY4HQTVZU9KP5W425R7O4TAG5M,268696,268696,,,,,,,,,,,,,,,,,,,,,,,,
,,,,,,,,,,,,,,,,,,,,,,,,,,,,,,,,,,,,,,,,,,,,,,,,,,,0:36:51:963,,return,122.43,0:38:54:419,"a bedroom with some tables and a couple of lamps, and a long table with two vases on it","a bedroom with some tables and a couple of lamps, and a long table with two vases and a small art object on it",0.15162037,-0.287037037,0,0,0,0,8,8,4,1,A21QSJIMHCW3N8,70,wolfe_035_R_fruit-a_w_outline.jpg,wolfe_035_R_fruit-b_w_outline.jpg,38,A21QSJIMHCW3N8,2021-01-13_00h18.43.166,MetaAwareness,2020.1.2,Win32,60,3MDKGGG61RQWWY8F4D8C8X5P0UFT6U,3EQHHY4HQTVZU9KP5W425R7O4TAG5M,HHQE6,HHQE6,3EQHHY4HQTVZU9KP5W425R7O4TAG5M,3EQHHY4HQTVZU9KP5W425R7O4TAG5M,268696,268696,,,,,,,,,,,,,,,,,,,,,,,,
,,,,,,,,,,,,,,,,,,,,,,,,,,,,,,,,,,,,,,,,,,,,,,,,,,,0:38:55:435,,return,95.007,0:40:30:472,"a bathroom with two sinks, a mirror, multi-colored towels, and a soap dish on one of the sinks","a bathroom with two sinks, a mirror, multi-colored towels, and a soap dish for each sink",0.111111111,-0.283564815,0,0,0,0,9,9,0,1,A21QSJIMHCW3N8,14,wolfe_007_R_soap-a_w_outline.jpg,wolfe_007_R_soap-b_w_outline.jpg,38,A21QSJIMHCW3N8,2021-01-13_00h18.43.166,MetaAwareness,2020.1.2,Win32,60,3MDKGGG61RQWWY8F4D8C8X5P0UFT6U,3EQHHY4HQTVZU9KP5W425R7O4TAG5M,HHQE6,HHQE6,3EQHHY4HQTVZU9KP5W425R7O4TAG5M,3EQHHY4HQTVZU9KP5W425R7O4TAG5M,268696,268696,,,,,,,,,,,,,,,,,,,,,,,,
,,,,,,,,,,,,,,,,,,,,,,,,,,,,,,,,,,,,,,,,,,,,,,,,,,,0:40:31:488,,return,109.351,0:42:20:867,a dining room with dark brown furniture and a table against the wall with a white bowl on it,a dining room with dark brown furniture and a table against the wall with a white bowl and liquer bottle on it,0.082175926,-0.28587963,0,0,0,0,10,10,7,1,A21QSJIMHCW3N8,128,wolfe_064_R_bottles-a_w_outline.jpg,wolfe_064_R_bottles-b_w_outline.jpg,38,A21QSJIMHCW3N8,2021-01-13_00h18.43.166,MetaAwareness,2020.1.2,Win32,60,3MDKGGG61RQWWY8F4D8C8X5P0UFT6U,3EQHHY4HQTVZU9KP5W425R7O4TAG5M,HHQE6,HHQE6,3EQHHY4HQTVZU9KP5W425R7O4TAG5M,3EQHHY4HQTVZU9KP5W425R7O4TAG5M,268696,268696,,,,,,,,,,,,,,,,,,,,,,,,
,,,,,,,,,,,,,,,,,,,,,,,,,,,,,,,,,,,,,,,,,,,,,,,,,,,0:42:21:883,,return,142.504,0:44:44:413,"a bathroom with a large mirror and two sinks, with a basket and four stacked towels under the sinks",a bathroom with a large mirror and two sinks with a basket and nine stacked towels under the sinks,0.430555556,-0.306712963,0,0,0,0,11,11,2,1,A21QSJIMHCW3N8,48,wolfe_024_R_towels-a_w_outline.jpg,wolfe_024_R_towels-b_w_outline.jpg,38,A21QSJIMHCW3N8,2021-01-13_00h18.43.166,MetaAwareness,2020.1.2,Win32,60,3MDKGGG61RQWWY8F4D8C8X5P0UFT6U,3EQHHY4HQTVZU9KP5W425R7O4TAG5M,HHQE6,HHQE6,3EQHHY4HQTVZU9KP5W425R7O4TAG5M,3EQHHY4HQTVZU9KP5W425R7O4TAG5M,268696,268696,,,,,,,,,,,,,,,,,,,,,,,,
,,,,,,,,,,,,,,,,,,,,,,,,,,,,,,,,,,,,,,,,,,,,,,,,,,,,,,,,,,,,,,,,,,,,A21QSJIMHCW3N8,,,,38,A21QSJIMHCW3N8,2021-01-13_00h18.43.166,MetaAwareness,2020.1.2,Win32,60,3MDKGGG61RQWWY8F4D8C8X5P0UFT6U,3EQHHY4HQTVZU9KP5W425R7O4TAG5M,HHQE6,HHQE6,3EQHHY4HQTVZU9KP5W425R7O4TAG5M,3EQHHY4HQTVZU9KP5W425R7O4TAG5M,268696,268696,0:44:45:429,,return,89.921,0:46:15:385,"a green, grassy field with a black and white cow busy eating it","a green, grassy field",-0.166666667,-0.290509259,0,0,0,0:46:16:401,,return,111.549,0:48:7:979,an orange colored sky at sunset with dark clouds and a plane flying by,an orange colored sky at sunset with dark clouds and a plane flying by,-0.138888889,-0.296296296,0,0,0
