consent_response.keys,consent_response.rt,key_resp_2.keys,key_resp_2.rt,user_resp.keys,user_resp.rt,trials.thisRepN,trials.thisTrialN,trials.thisN,trials.thisIndex,trials.ran,image_1_text,image_2_text,database,image,number,age,worker_ID,date,expName,psychopyVersion,OS,frameRate,hitId,workerId,assignmentId,a,tp_a,b,tp_b,c,tp_c,catch_same_resp.keys,catch_same_resp.rt,image_1_text_catch_same,image_2_text_catch_same,image_catch_same,catch_different_resp.keys,catch_different_resp.rt,image_1_text_catch_different,image_2_text_catch_different,image_catch_different
space,6.559575,space,20.97841,4,17.56388,0,0,0,658,1,a clean and light bathroom with an electrical outlet next to the mirror,a clean and light bathroom without any electrical outlet next to the mirror,wolfe2,085_R_switchboard,3,33,A1YVMDRR9W1LZ1,2021-01-25_07h11.02.367,MetaAwareness,2020.1.2,Win32,60,34R3P23QHT44L4WQV14RS81EEH3HWU,A1YVMDRR9W1LZ1,33M4IA01QH4ZLIDDRDH9WECF06ERXX,1IM30,1IM30,33M4IA01QH4ZLIDDRDH9WECF06ERXX,33M4IA01QH4ZLIDDRDH9WECF06ERXX,271100,271100,,,,,,,,,,
,,,,4,10.052565,0,1,1,485,1,"a dining room with table and chairs, a window view, and one bottle under a mirror","a dining room with table and chairs, a window view, and bottles under a mirror",wolfe2,064_L_bottles,1,33,A1YVMDRR9W1LZ1,2021-01-25_07h11.02.367,MetaAwareness,2020.1.2,Win32,60,34R3P23QHT44L4WQV14RS81EEH3HWU,A1YVMDRR9W1LZ1,33M4IA01QH4ZLIDDRDH9WECF06ERXX,1IM30,1IM30,33M4IA01QH4ZLIDDRDH9WECF06ERXX,33M4IA01QH4ZLIDDRDH9WECF06ERXX,271100,271100,,,,,,,,,,
,,,,3,6.86718,0,2,2,592,1,four stool chairs with a missing label on the bottom.,four stool chairs with all labels.,wolfe2,077_L_footrest,6,33,A1YVMDRR9W1LZ1,2021-01-25_07h11.02.367,MetaAwareness,2020.1.2,Win32,60,34R3P23QHT44L4WQV14RS81EEH3HWU,A1YVMDRR9W1LZ1,33M4IA01QH4ZLIDDRDH9WECF06ERXX,1IM30,1IM30,33M4IA01QH4ZLIDDRDH9WECF06ERXX,33M4IA01QH4ZLIDDRDH9WECF06ERXX,271100,271100,,,,,,,,,,
,,,,4,6.12505,0,3,3,786,1,"a double vanity with a tan countertop, white sinks, cherry cabinets, a wall hook, and a wall sized mirror","a double vanity with a tan countertop, white sinks, cherry cabinets, and a wall sized mirror",wolfe2,103_L_hook,3,33,A1YVMDRR9W1LZ1,2021-01-25_07h11.02.367,MetaAwareness,2020.1.2,Win32,60,34R3P23QHT44L4WQV14RS81EEH3HWU,A1YVMDRR9W1LZ1,33M4IA01QH4ZLIDDRDH9WECF06ERXX,1IM30,1IM30,33M4IA01QH4ZLIDDRDH9WECF06ERXX,33M4IA01QH4ZLIDDRDH9WECF06ERXX,271100,271100,,,,,,,,,,
,,,,2,6.512705,0,4,4,928,1,a picture of a bedroom that has a white night stand with a lamp and car on it,a bedroom that has a white night stand with a lamp on it,wolfe2,121_L_car,2,33,A1YVMDRR9W1LZ1,2021-01-25_07h11.02.367,MetaAwareness,2020.1.2,Win32,60,34R3P23QHT44L4WQV14RS81EEH3HWU,A1YVMDRR9W1LZ1,33M4IA01QH4ZLIDDRDH9WECF06ERXX,1IM30,1IM30,33M4IA01QH4ZLIDDRDH9WECF06ERXX,33M4IA01QH4ZLIDDRDH9WECF06ERXX,271100,271100,,,,,,,,,,
,,,,3,4.32523,0,5,5,724,1,a white living room with a red candle on the fireplace,a whiteliving room without a red candle on the fireplace,wolfe2,095_L_candle,4,33,A1YVMDRR9W1LZ1,2021-01-25_07h11.02.367,MetaAwareness,2020.1.2,Win32,60,34R3P23QHT44L4WQV14RS81EEH3HWU,A1YVMDRR9W1LZ1,33M4IA01QH4ZLIDDRDH9WECF06ERXX,1IM30,1IM30,33M4IA01QH4ZLIDDRDH9WECF06ERXX,33M4IA01QH4ZLIDDRDH9WECF06ERXX,271100,271100,,,,,,,,,,
,,,,4,3.978235,0,6,6,434,1,a library with nothing beside the bookshelf.,a library with a trash can beside the bookshelf.,wolfe2,057_R_bin,3,33,A1YVMDRR9W1LZ1,2021-01-25_07h11.02.367,MetaAwareness,2020.1.2,Win32,60,34R3P23QHT44L4WQV14RS81EEH3HWU,A1YVMDRR9W1LZ1,33M4IA01QH4ZLIDDRDH9WECF06ERXX,1IM30,1IM30,33M4IA01QH4ZLIDDRDH9WECF06ERXX,33M4IA01QH4ZLIDDRDH9WECF06ERXX,271100,271100,,,,,,,,,,
,,,,4,7.87843,0,7,7,413,1,"a studio apartment or dorm room furnished in red, with small rugs in red and black","a studio apartment or dorm room furnished in red, with small rugs in blue, red, and black",wolfe2,055_R_carpet,3,33,A1YVMDRR9W1LZ1,2021-01-25_07h11.02.367,MetaAwareness,2020.1.2,Win32,60,34R3P23QHT44L4WQV14RS81EEH3HWU,A1YVMDRR9W1LZ1,33M4IA01QH4ZLIDDRDH9WECF06ERXX,1IM30,1IM30,33M4IA01QH4ZLIDDRDH9WECF06ERXX,33M4IA01QH4ZLIDDRDH9WECF06ERXX,271100,271100,,,,,,,,,,
,,,,2,6.930115,0,8,8,633,1,a spare couch for sick relatives,a spare couch for a big dog,wolfe2,082_R_bowl,7,33,A1YVMDRR9W1LZ1,2021-01-25_07h11.02.367,MetaAwareness,2020.1.2,Win32,60,34R3P23QHT44L4WQV14RS81EEH3HWU,A1YVMDRR9W1LZ1,33M4IA01QH4ZLIDDRDH9WECF06ERXX,1IM30,1IM30,33M4IA01QH4ZLIDDRDH9WECF06ERXX,33M4IA01QH4ZLIDDRDH9WECF06ERXX,271100,271100,,,,,,,,,,
,,,,4,9.368095,0,9,9,804,1,"small room with clothes on the bed, including a fedora",small room with clothes over the bed and a large mirror,wolfe2,105_L_hat,5,33,A1YVMDRR9W1LZ1,2021-01-25_07h11.02.367,MetaAwareness,2020.1.2,Win32,60,34R3P23QHT44L4WQV14RS81EEH3HWU,A1YVMDRR9W1LZ1,33M4IA01QH4ZLIDDRDH9WECF06ERXX,1IM30,1IM30,33M4IA01QH4ZLIDDRDH9WECF06ERXX,33M4IA01QH4ZLIDDRDH9WECF06ERXX,271100,271100,,,,,,,,,,
,,,,4,8.66679,0,10,10,56,1,a blue bathroom. there is a mirror in the center with a sink below it. there is a window to the left of the mirror with a shade drawn on it with a bottle with a spray bottle with a red cap on it.,a blue bathroom. there is a mirror in the center with a sink below it. there is a window to the left of the mirror with a shade drawn on it with a spray bottle with a red cape with a smaller bottle next to it.,wolfe2,008_L_bottle,2,33,A1YVMDRR9W1LZ1,2021-01-25_07h11.02.367,MetaAwareness,2020.1.2,Win32,60,34R3P23QHT44L4WQV14RS81EEH3HWU,A1YVMDRR9W1LZ1,33M4IA01QH4ZLIDDRDH9WECF06ERXX,1IM30,1IM30,33M4IA01QH4ZLIDDRDH9WECF06ERXX,33M4IA01QH4ZLIDDRDH9WECF06ERXX,271100,271100,,,,,,,,,,
,,,,5,7.38109,0,11,11,839,1,a room with white couches and an orange pillow,a room with white couches and three small pillows,wolfe2,109_R_pillow,2,33,A1YVMDRR9W1LZ1,2021-01-25_07h11.02.367,MetaAwareness,2020.1.2,Win32,60,34R3P23QHT44L4WQV14RS81EEH3HWU,A1YVMDRR9W1LZ1,33M4IA01QH4ZLIDDRDH9WECF06ERXX,1IM30,1IM30,33M4IA01QH4ZLIDDRDH9WECF06ERXX,33M4IA01QH4ZLIDDRDH9WECF06ERXX,271100,271100,,,,,,,,,,
,,,,4,5.664495,0,12,12,317,1,there is an empty bowl atop the countertop in this large kitchen,there is a fruit filled bowl atop the countertop in this large kitchen,wolfe2,041_R_fruit,3,33,A1YVMDRR9W1LZ1,2021-01-25_07h11.02.367,MetaAwareness,2020.1.2,Win32,60,34R3P23QHT44L4WQV14RS81EEH3HWU,A1YVMDRR9W1LZ1,33M4IA01QH4ZLIDDRDH9WECF06ERXX,1IM30,1IM30,33M4IA01QH4ZLIDDRDH9WECF06ERXX,33M4IA01QH4ZLIDDRDH9WECF06ERXX,271100,271100,,,,,,,,,,
,,,,2,6.07715,0,13,13,448,1,an empty wardrobe top in the chilren room,a toy car placed on the wardrobe in te children room.,wolfe2,059_R_car,4,33,A1YVMDRR9W1LZ1,2021-01-25_07h11.02.367,MetaAwareness,2020.1.2,Win32,60,34R3P23QHT44L4WQV14RS81EEH3HWU,A1YVMDRR9W1LZ1,33M4IA01QH4ZLIDDRDH9WECF06ERXX,1IM30,1IM30,33M4IA01QH4ZLIDDRDH9WECF06ERXX,33M4IA01QH4ZLIDDRDH9WECF06ERXX,271100,271100,,,,,,,,,,
,,,,2,4.47545,0,14,14,756,1,a dining area with a candle holder and candle on the wall,a dining area with a picture on the wall,wolfe2,099_L_sconce,3,33,A1YVMDRR9W1LZ1,2021-01-25_07h11.02.367,MetaAwareness,2020.1.2,Win32,60,34R3P23QHT44L4WQV14RS81EEH3HWU,A1YVMDRR9W1LZ1,33M4IA01QH4ZLIDDRDH9WECF06ERXX,1IM30,1IM30,33M4IA01QH4ZLIDDRDH9WECF06ERXX,33M4IA01QH4ZLIDDRDH9WECF06ERXX,271100,271100,,,,,,,,,,
,,,,5,9.43474,0,15,15,225,1,"a bathroom with a shower, two sinks and two mirrors with two red cups on a small shelf","a bathroom with a shower, two sinks and two mirrors with three red cups on a small shelf",wolfe2,029_R_glass,4,33,A1YVMDRR9W1LZ1,2021-01-25_07h11.02.367,MetaAwareness,2020.1.2,Win32,60,34R3P23QHT44L4WQV14RS81EEH3HWU,A1YVMDRR9W1LZ1,33M4IA01QH4ZLIDDRDH9WECF06ERXX,1IM30,1IM30,33M4IA01QH4ZLIDDRDH9WECF06ERXX,33M4IA01QH4ZLIDDRDH9WECF06ERXX,271100,271100,,,,,,,,,,
,,,,1,4.60903,0,16,16,663,1,a living area just off the dining area with a large desk that has a yellow package sitting on the front center of the desk,a living area just off the dining ara with a large desk,wolfe2,086_L_book,1,33,A1YVMDRR9W1LZ1,2021-01-25_07h11.02.367,MetaAwareness,2020.1.2,Win32,60,34R3P23QHT44L4WQV14RS81EEH3HWU,A1YVMDRR9W1LZ1,33M4IA01QH4ZLIDDRDH9WECF06ERXX,1IM30,1IM30,33M4IA01QH4ZLIDDRDH9WECF06ERXX,33M4IA01QH4ZLIDDRDH9WECF06ERXX,271100,271100,,,,,,,,,,
,,,,4,3.22442,0,17,17,639,1,"a bright and sunny children's room with white bunk beds, a colorful carpet, a small white table with a small blue and a small green chair, and a colorful cabinet with white knobs","a bright and sunny children's room with white bunk beds, a colorful carpet, a small white table with a small blue chair and a small green chair, and a colorful cabinet with white knobs on some of the drawers.",wolfe2,083_R_knob,1,33,A1YVMDRR9W1LZ1,2021-01-25_07h11.02.367,MetaAwareness,2020.1.2,Win32,60,34R3P23QHT44L4WQV14RS81EEH3HWU,A1YVMDRR9W1LZ1,33M4IA01QH4ZLIDDRDH9WECF06ERXX,1IM30,1IM30,33M4IA01QH4ZLIDDRDH9WECF06ERXX,33M4IA01QH4ZLIDDRDH9WECF06ERXX,271100,271100,,,,,,,,,,
,,,,4,3.10569,0,18,18,888,1,"a pretty looking dinning area. there is a sliding door with a potted plant in front of it off to the left near the wall, with some metallic object next to it.",a pretty looking dinning area. there is a sliding door with a potted plant in front of the sliding door. the potted plant is close to the wall and has nothing beside it.,wolfe2,116_L_basket,2,33,A1YVMDRR9W1LZ1,2021-01-25_07h11.02.367,MetaAwareness,2020.1.2,Win32,60,34R3P23QHT44L4WQV14RS81EEH3HWU,A1YVMDRR9W1LZ1,33M4IA01QH4ZLIDDRDH9WECF06ERXX,1IM30,1IM30,33M4IA01QH4ZLIDDRDH9WECF06ERXX,33M4IA01QH4ZLIDDRDH9WECF06ERXX,271100,271100,,,,,,,,,,
,,,,5,7.681595,0,19,19,974,1,in a living room there is a light fixture on a wall next to a window,in a living room there is no light fixture on a wall next to a window,wolfe2,127_L_light,1,33,A1YVMDRR9W1LZ1,2021-01-25_07h11.02.367,MetaAwareness,2020.1.2,Win32,60,34R3P23QHT44L4WQV14RS81EEH3HWU,A1YVMDRR9W1LZ1,33M4IA01QH4ZLIDDRDH9WECF06ERXX,1IM30,1IM30,33M4IA01QH4ZLIDDRDH9WECF06ERXX,33M4IA01QH4ZLIDDRDH9WECF06ERXX,271100,271100,,,,,,,,,,
,,,,4,3.156225,0,20,20,400,1,a cabinet in a bathroom with the bottom drawer missing a handle,a cabinet in a bathroom with the bottom dresser having a handle,wolfe2,053_R_handle,3,33,A1YVMDRR9W1LZ1,2021-01-25_07h11.02.367,MetaAwareness,2020.1.2,Win32,60,34R3P23QHT44L4WQV14RS81EEH3HWU,A1YVMDRR9W1LZ1,33M4IA01QH4ZLIDDRDH9WECF06ERXX,1IM30,1IM30,33M4IA01QH4ZLIDDRDH9WECF06ERXX,33M4IA01QH4ZLIDDRDH9WECF06ERXX,271100,271100,,,,,,,,,,
,,,,3,2.907835,0,21,21,261,1,white and gray bedroom with handle missing on the bottom drawer of nightstand,white and gray bedroom with no handle missing on nighstand drawers,wolfe2,034_L_handle,3,33,A1YVMDRR9W1LZ1,2021-01-25_07h11.02.367,MetaAwareness,2020.1.2,Win32,60,34R3P23QHT44L4WQV14RS81EEH3HWU,A1YVMDRR9W1LZ1,33M4IA01QH4ZLIDDRDH9WECF06ERXX,1IM30,1IM30,33M4IA01QH4ZLIDDRDH9WECF06ERXX,33M4IA01QH4ZLIDDRDH9WECF06ERXX,271100,271100,,,,,,,,,,
,,,,4,9.98517,0,22,22,76,1,very nice bedroom with two candle sticks on the night stand next to the bed. one of the candles is missing from the candle sticks,very nice bedroom with two candle sticks on the night stand next to the bed. there are two candles in the two candle sticks,wolfe2,010_R_candle,3,33,A1YVMDRR9W1LZ1,2021-01-25_07h11.02.367,MetaAwareness,2020.1.2,Win32,60,34R3P23QHT44L4WQV14RS81EEH3HWU,A1YVMDRR9W1LZ1,33M4IA01QH4ZLIDDRDH9WECF06ERXX,1IM30,1IM30,33M4IA01QH4ZLIDDRDH9WECF06ERXX,33M4IA01QH4ZLIDDRDH9WECF06ERXX,271100,271100,,,,,,,,,,
,,,,1,4.92522,0,23,23,885,1,open living and kitchen in deep wood tones with a potted plant on the counter,rich wood open concept family and kitchen rooms with a window by the oven.,wolfe2,115_R_pot,4,33,A1YVMDRR9W1LZ1,2021-01-25_07h11.02.367,MetaAwareness,2020.1.2,Win32,60,34R3P23QHT44L4WQV14RS81EEH3HWU,A1YVMDRR9W1LZ1,33M4IA01QH4ZLIDDRDH9WECF06ERXX,1IM30,1IM30,33M4IA01QH4ZLIDDRDH9WECF06ERXX,33M4IA01QH4ZLIDDRDH9WECF06ERXX,271100,271100,,,,,,,,,,
,,,,3,4.244145,0,24,24,28,1,a hotel room with a view of the city and landscape,"a hotel room with a view of the city, landscape and tower in the distance",wolfe2,004_R_electricalgrid,4,33,A1YVMDRR9W1LZ1,2021-01-25_07h11.02.367,MetaAwareness,2020.1.2,Win32,60,34R3P23QHT44L4WQV14RS81EEH3HWU,A1YVMDRR9W1LZ1,33M4IA01QH4ZLIDDRDH9WECF06ERXX,1IM30,1IM30,33M4IA01QH4ZLIDDRDH9WECF06ERXX,33M4IA01QH4ZLIDDRDH9WECF06ERXX,271100,271100,,,,,,,,,,
,,,,3,3.53924,0,25,25,894,1,there is a object behind a potted plant in this rustic room,there is just a wooden floor behind this potted plant in the rustic room,wolfe2,116_R_basket,4,33,A1YVMDRR9W1LZ1,2021-01-25_07h11.02.367,MetaAwareness,2020.1.2,Win32,60,34R3P23QHT44L4WQV14RS81EEH3HWU,A1YVMDRR9W1LZ1,33M4IA01QH4ZLIDDRDH9WECF06ERXX,1IM30,1IM30,33M4IA01QH4ZLIDDRDH9WECF06ERXX,33M4IA01QH4ZLIDDRDH9WECF06ERXX,271100,271100,,,,,,,,,,
,,,,2,3.0768,0,26,26,494,1,an empty slot at the bookshelf,books arranged on a bookshelf,wolfe2,065_L_cd,2,33,A1YVMDRR9W1LZ1,2021-01-25_07h11.02.367,MetaAwareness,2020.1.2,Win32,60,34R3P23QHT44L4WQV14RS81EEH3HWU,A1YVMDRR9W1LZ1,33M4IA01QH4ZLIDDRDH9WECF06ERXX,1IM30,1IM30,33M4IA01QH4ZLIDDRDH9WECF06ERXX,33M4IA01QH4ZLIDDRDH9WECF06ERXX,271100,271100,,,,,,,,,,
,,,,2,2.001625,0,27,27,686,1,this appears to be ready and waiting for clients.  the photo provides some much needed color to the area.,"the bare wall needs a little splash of color.  otherwise, it is ready for clients.",wolfe2,089_R_poster,2,33,A1YVMDRR9W1LZ1,2021-01-25_07h11.02.367,MetaAwareness,2020.1.2,Win32,60,34R3P23QHT44L4WQV14RS81EEH3HWU,A1YVMDRR9W1LZ1,33M4IA01QH4ZLIDDRDH9WECF06ERXX,1IM30,1IM30,33M4IA01QH4ZLIDDRDH9WECF06ERXX,33M4IA01QH4ZLIDDRDH9WECF06ERXX,271100,271100,,,,,,,,,,
,,,,4,4.207185,0,28,28,863,1,"it is a picture of a family room with a couch and chair, and there is a pot on the floor next to the chair.","it is a picture of a family room with a couch and chair, and there is nothing next to the chair.",wolfe2,112_R_basket,3,33,A1YVMDRR9W1LZ1,2021-01-25_07h11.02.367,MetaAwareness,2020.1.2,Win32,60,34R3P23QHT44L4WQV14RS81EEH3HWU,A1YVMDRR9W1LZ1,33M4IA01QH4ZLIDDRDH9WECF06ERXX,1IM30,1IM30,33M4IA01QH4ZLIDDRDH9WECF06ERXX,33M4IA01QH4ZLIDDRDH9WECF06ERXX,271100,271100,,,,,,,,,,
,,,,4,3.072785,0,29,29,770,1,a bathroom with a lighted cabinet next to the sink with soap and three cups in it,a bathroom with a lighted cabinet next to the sink with soap and two cups in it,wolfe2,101_L_cup,2,33,A1YVMDRR9W1LZ1,2021-01-25_07h11.02.367,MetaAwareness,2020.1.2,Win32,60,34R3P23QHT44L4WQV14RS81EEH3HWU,A1YVMDRR9W1LZ1,33M4IA01QH4ZLIDDRDH9WECF06ERXX,1IM30,1IM30,33M4IA01QH4ZLIDDRDH9WECF06ERXX,33M4IA01QH4ZLIDDRDH9WECF06ERXX,271100,271100,,,,,,,,,,
,,,,,,,,,,,,,,,,33,A1YVMDRR9W1LZ1,2021-01-25_07h11.02.367,MetaAwareness,2020.1.2,Win32,60,34R3P23QHT44L4WQV14RS81EEH3HWU,A1YVMDRR9W1LZ1,33M4IA01QH4ZLIDDRDH9WECF06ERXX,1IM30,1IM30,33M4IA01QH4ZLIDDRDH9WECF06ERXX,33M4IA01QH4ZLIDDRDH9WECF06ERXX,271100,271100,6,14.377615,someone laying underneath a blue beach umbrella on a crowded beach,someone laying underneath a blue beach umbrella on a crowded beach,same,1,2.621955,members of a marching band crossing a track that all have feather plumes at the front of their hats,a cluttered and rustic looking cafe with 10 hanging lights,different
