consent_response.keys,consent_response.rt,key_resp_2.keys,key_resp_2.rt,user_resp.keys,user_resp.rt,trials.thisRepN,trials.thisTrialN,trials.thisN,trials.thisIndex,trials.ran,image_1_text,image_2_text,database,image,number,age,worker_ID,date,expName,psychopyVersion,OS,frameRate,hitId,workerId,assignmentId,a,tp_a,b,tp_b,c,tp_c,catch_same_resp.keys,catch_same_resp.rt,image_1_text_catch_same,image_2_text_catch_same,image_catch_same,catch_different_resp.keys,catch_different_resp.rt,image_1_text_catch_different,image_2_text_catch_different,image_catch_different
space,8.359035,space,23.985295,3,20.19559,0,0,0,845,1,a patio with two plants that overlooks a pool outside,a patio with one plant that overlooks a pool outside,wolfe2,110_R_plant,1,57,A244IQQR0CTZ3I,2021-01-25_09h47.06.164,MetaAwareness,2020.1.2,Win32,60,3INZSNUD81TCXSEGGUB9N3E5OOS9DQ,A244IQQR0CTZ3I,3LJ7UR74RIGN8IXBEVYNQJA76ER4NE,4UJL0,4UJL0,3LJ7UR74RIGN8IXBEVYNQJA76ER4NE,3LJ7UR74RIGN8IXBEVYNQJA76ER4NE,271100,271100,,,,,,,,,,
,,,,3,15.809965,0,1,1,104,1,a living space with hardwood floors and one light over a wooden table towards the right.,a living space with hardwood floors and two lights over a wodden table towards the right.,wolfe2,013_R_lamp,2,57,A244IQQR0CTZ3I,2021-01-25_09h47.06.164,MetaAwareness,2020.1.2,Win32,60,3INZSNUD81TCXSEGGUB9N3E5OOS9DQ,A244IQQR0CTZ3I,3LJ7UR74RIGN8IXBEVYNQJA76ER4NE,4UJL0,4UJL0,3LJ7UR74RIGN8IXBEVYNQJA76ER4NE,3LJ7UR74RIGN8IXBEVYNQJA76ER4NE,271100,271100,,,,,,,,,,
,,,,2,17.328635,0,2,2,488,1,the knobbed candle holder sits atop the brown wooden shelf,there is a black vase on top of the wooden shelf that sits in the dining room,wolfe2,064_R_bottles,2,57,A244IQQR0CTZ3I,2021-01-25_09h47.06.164,MetaAwareness,2020.1.2,Win32,60,3INZSNUD81TCXSEGGUB9N3E5OOS9DQ,A244IQQR0CTZ3I,3LJ7UR74RIGN8IXBEVYNQJA76ER4NE,4UJL0,4UJL0,3LJ7UR74RIGN8IXBEVYNQJA76ER4NE,3LJ7UR74RIGN8IXBEVYNQJA76ER4NE,271100,271100,,,,,,,,,,
,,,,3,13.108605,0,3,3,657,1,a dimly lit bathroom with a lightswitch by the mirror.,a dimly lit bathroom without a light switch by the mirror,wolfe2,085_R_switchboard,1,57,A244IQQR0CTZ3I,2021-01-25_09h47.06.164,MetaAwareness,2020.1.2,Win32,60,3INZSNUD81TCXSEGGUB9N3E5OOS9DQ,A244IQQR0CTZ3I,3LJ7UR74RIGN8IXBEVYNQJA76ER4NE,4UJL0,4UJL0,3LJ7UR74RIGN8IXBEVYNQJA76ER4NE,3LJ7UR74RIGN8IXBEVYNQJA76ER4NE,271100,271100,,,,,,,,,,
,,,,3,9.62529,0,4,4,589,1,"a modern kitchen with 4 stools, 3 of which have foot rests",a modern kitchen with 4 stools and all have their foot rest,wolfe2,077_L_footrest,3,57,A244IQQR0CTZ3I,2021-01-25_09h47.06.164,MetaAwareness,2020.1.2,Win32,60,3INZSNUD81TCXSEGGUB9N3E5OOS9DQ,A244IQQR0CTZ3I,3LJ7UR74RIGN8IXBEVYNQJA76ER4NE,4UJL0,4UJL0,3LJ7UR74RIGN8IXBEVYNQJA76ER4NE,3LJ7UR74RIGN8IXBEVYNQJA76ER4NE,271100,271100,,,,,,,,,,
,,,,5,20.683715,0,5,5,454,1,"a modern living room with wood floors and accents, white walls, and a cream colored couch with three cream and two black accent pillows","a modern living room with wood floors and accents, white walls, and a cream colored couch with three cream and three black accent pillows",wolfe2,060_R_pillow,3,57,A244IQQR0CTZ3I,2021-01-25_09h47.06.164,MetaAwareness,2020.1.2,Win32,60,3INZSNUD81TCXSEGGUB9N3E5OOS9DQ,A244IQQR0CTZ3I,3LJ7UR74RIGN8IXBEVYNQJA76ER4NE,4UJL0,4UJL0,3LJ7UR74RIGN8IXBEVYNQJA76ER4NE,3LJ7UR74RIGN8IXBEVYNQJA76ER4NE,271100,271100,,,,,,,,,,
,,,,3,10.18225,0,6,6,959,1,a black and white modern living room with a brown basket on the ground,a black and white modern living room with no baskets on the ground,wolfe2,125_L_sofa,1,57,A244IQQR0CTZ3I,2021-01-25_09h47.06.164,MetaAwareness,2020.1.2,Win32,60,3INZSNUD81TCXSEGGUB9N3E5OOS9DQ,A244IQQR0CTZ3I,3LJ7UR74RIGN8IXBEVYNQJA76ER4NE,4UJL0,4UJL0,3LJ7UR74RIGN8IXBEVYNQJA76ER4NE,3LJ7UR74RIGN8IXBEVYNQJA76ER4NE,271100,271100,,,,,,,,,,
,,,,4,16.99451,0,7,7,649,1,open room with cozy chairs and couch with the door open overlooking the water and a plain wall on the right side,open concept room with cozy furniture overlooking the water and a sconce on the wall.,wolfe2,084_R_light,2,57,A244IQQR0CTZ3I,2021-01-25_09h47.06.164,MetaAwareness,2020.1.2,Win32,60,3INZSNUD81TCXSEGGUB9N3E5OOS9DQ,A244IQQR0CTZ3I,3LJ7UR74RIGN8IXBEVYNQJA76ER4NE,4UJL0,4UJL0,3LJ7UR74RIGN8IXBEVYNQJA76ER4NE,3LJ7UR74RIGN8IXBEVYNQJA76ER4NE,271100,271100,,,,,,,,,,
,,,,3,14.680815,0,8,8,163,1,a dinning table with chair.  fruit and vegetable present on the table only two light is hanging,"a dinninig table with chair,  fruit and vegetables present on the table.  three light are hanging.",wolfe2,022_L_lamp,2,57,A244IQQR0CTZ3I,2021-01-25_09h47.06.164,MetaAwareness,2020.1.2,Win32,60,3INZSNUD81TCXSEGGUB9N3E5OOS9DQ,A244IQQR0CTZ3I,3LJ7UR74RIGN8IXBEVYNQJA76ER4NE,4UJL0,4UJL0,3LJ7UR74RIGN8IXBEVYNQJA76ER4NE,3LJ7UR74RIGN8IXBEVYNQJA76ER4NE,271100,271100,,,,,,,,,,
,,,,3,12.246815,0,9,9,264,1,a bedroom with a white chest of drawers that's missing a handle on the last drawer.,a bedroom with a white chest of drawers and all three drawers have handles.,wolfe2,034_R_handle,1,57,A244IQQR0CTZ3I,2021-01-25_09h47.06.164,MetaAwareness,2020.1.2,Win32,60,3INZSNUD81TCXSEGGUB9N3E5OOS9DQ,A244IQQR0CTZ3I,3LJ7UR74RIGN8IXBEVYNQJA76ER4NE,4UJL0,4UJL0,3LJ7UR74RIGN8IXBEVYNQJA76ER4NE,3LJ7UR74RIGN8IXBEVYNQJA76ER4NE,271100,271100,,,,,,,,,,
,,,,3,13.957735,0,10,10,373,1,"a european contemporary style bedroom that has a wall of closets and shelves. on the left set of shelves, all but one contain books.","a european contemporary style bedroom that has a wall of closets and shelves. on the left set of shelves, all of them are holding books.",wolfe2,050_L_book,3,57,A244IQQR0CTZ3I,2021-01-25_09h47.06.164,MetaAwareness,2020.1.2,Win32,60,3INZSNUD81TCXSEGGUB9N3E5OOS9DQ,A244IQQR0CTZ3I,3LJ7UR74RIGN8IXBEVYNQJA76ER4NE,4UJL0,4UJL0,3LJ7UR74RIGN8IXBEVYNQJA76ER4NE,3LJ7UR74RIGN8IXBEVYNQJA76ER4NE,271100,271100,,,,,,,,,,
,,,,3,25.498705,0,11,11,133,1,a contemporary living room with no objects on top of the fire place,a contemporary living room with a stack of objects on top of the fire place,wolfe2,017_R_wood,2,57,A244IQQR0CTZ3I,2021-01-25_09h47.06.164,MetaAwareness,2020.1.2,Win32,60,3INZSNUD81TCXSEGGUB9N3E5OOS9DQ,A244IQQR0CTZ3I,3LJ7UR74RIGN8IXBEVYNQJA76ER4NE,4UJL0,4UJL0,3LJ7UR74RIGN8IXBEVYNQJA76ER4NE,3LJ7UR74RIGN8IXBEVYNQJA76ER4NE,271100,271100,,,,,,,,,,
,,,,3,3.08648,0,12,12,311,1,a wall with two wall frames,a wall with three wall frames,wolfe2,040_R_painting,3,57,A244IQQR0CTZ3I,2021-01-25_09h47.06.164,MetaAwareness,2020.1.2,Win32,60,3INZSNUD81TCXSEGGUB9N3E5OOS9DQ,A244IQQR0CTZ3I,3LJ7UR74RIGN8IXBEVYNQJA76ER4NE,4UJL0,4UJL0,3LJ7UR74RIGN8IXBEVYNQJA76ER4NE,3LJ7UR74RIGN8IXBEVYNQJA76ER4NE,271100,271100,,,,,,,,,,
,,,,2,14.673875,0,13,13,502,1,this is an interesting bedroom. there is a book shelf with an empty spac ein the middle.,this is an interesting bedroom. there is a completely full book shelf on the wall.,wolfe2,065_R_cd,7,57,A244IQQR0CTZ3I,2021-01-25_09h47.06.164,MetaAwareness,2020.1.2,Win32,60,3INZSNUD81TCXSEGGUB9N3E5OOS9DQ,A244IQQR0CTZ3I,3LJ7UR74RIGN8IXBEVYNQJA76ER4NE,4UJL0,4UJL0,3LJ7UR74RIGN8IXBEVYNQJA76ER4NE,3LJ7UR74RIGN8IXBEVYNQJA76ER4NE,271100,271100,,,,,,,,,,
,,,,5,10.82184,0,14,14,16,1,a desk area inside a home overlooking a lake,a desk area inside a home overlookin a lake with three birds in the water,wolfe2,003_L_ducks,1,57,A244IQQR0CTZ3I,2021-01-25_09h47.06.164,MetaAwareness,2020.1.2,Win32,60,3INZSNUD81TCXSEGGUB9N3E5OOS9DQ,A244IQQR0CTZ3I,3LJ7UR74RIGN8IXBEVYNQJA76ER4NE,4UJL0,4UJL0,3LJ7UR74RIGN8IXBEVYNQJA76ER4NE,3LJ7UR74RIGN8IXBEVYNQJA76ER4NE,271100,271100,,,,,,,,,,
,,,,5,19.667255,0,15,15,86,1,a modern style bathroom with a featureless tub sitting in front of a water faucet.,a modern style bathroom with a tub containing a green circle sitting in front of a water faucet.,wolfe2,012_L_tubaccesory,1,57,A244IQQR0CTZ3I,2021-01-25_09h47.06.164,MetaAwareness,2020.1.2,Win32,60,3INZSNUD81TCXSEGGUB9N3E5OOS9DQ,A244IQQR0CTZ3I,3LJ7UR74RIGN8IXBEVYNQJA76ER4NE,4UJL0,4UJL0,3LJ7UR74RIGN8IXBEVYNQJA76ER4NE,3LJ7UR74RIGN8IXBEVYNQJA76ER4NE,271100,271100,,,,,,,,,,
,,,,5,15.24907,0,16,16,932,1,"an airy bedroom that has a nightstand next to the bed with a lamp and something black on the top shelf, and books on the bottom shelf","an airy beedroom that has a nightstand next to the bed with only a lamp on the top shelf, and books on the bottom shelf",wolfe2,121_R_car,2,57,A244IQQR0CTZ3I,2021-01-25_09h47.06.164,MetaAwareness,2020.1.2,Win32,60,3INZSNUD81TCXSEGGUB9N3E5OOS9DQ,A244IQQR0CTZ3I,3LJ7UR74RIGN8IXBEVYNQJA76ER4NE,4UJL0,4UJL0,3LJ7UR74RIGN8IXBEVYNQJA76ER4NE,3LJ7UR74RIGN8IXBEVYNQJA76ER4NE,271100,271100,,,,,,,,,,
,,,,5,7.73823,0,17,17,572,1,this is a sitting room. the coffee table has plants on it.,this is a sitting room. the coffee table hs plants and a magazine on it.,wolfe2,074_R_book,8,57,A244IQQR0CTZ3I,2021-01-25_09h47.06.164,MetaAwareness,2020.1.2,Win32,60,3INZSNUD81TCXSEGGUB9N3E5OOS9DQ,A244IQQR0CTZ3I,3LJ7UR74RIGN8IXBEVYNQJA76ER4NE,4UJL0,4UJL0,3LJ7UR74RIGN8IXBEVYNQJA76ER4NE,3LJ7UR74RIGN8IXBEVYNQJA76ER4NE,271100,271100,,,,,,,,,,
,,,,5,12.055955,0,18,18,328,1,a living room with sofas and wooden tables next to an entertainment center with a bookcase,a living room with sofas and wooden tables next to an entertainment center with a bookcase holding a clock,wolfe2,043_L_clock,4,57,A244IQQR0CTZ3I,2021-01-25_09h47.06.164,MetaAwareness,2020.1.2,Win32,60,3INZSNUD81TCXSEGGUB9N3E5OOS9DQ,A244IQQR0CTZ3I,3LJ7UR74RIGN8IXBEVYNQJA76ER4NE,4UJL0,4UJL0,3LJ7UR74RIGN8IXBEVYNQJA76ER4NE,3LJ7UR74RIGN8IXBEVYNQJA76ER4NE,271100,271100,,,,,,,,,,
,,,,4,25.211375,0,19,19,858,1,greenroom with plenty of light and a living area with a vace by the sliding door,greenroom area with a living space and a potted plant by the door.,wolfe2,111_R_pot,5,57,A244IQQR0CTZ3I,2021-01-25_09h47.06.164,MetaAwareness,2020.1.2,Win32,60,3INZSNUD81TCXSEGGUB9N3E5OOS9DQ,A244IQQR0CTZ3I,3LJ7UR74RIGN8IXBEVYNQJA76ER4NE,4UJL0,4UJL0,3LJ7UR74RIGN8IXBEVYNQJA76ER4NE,3LJ7UR74RIGN8IXBEVYNQJA76ER4NE,271100,271100,,,,,,,,,,
,,,,3,14.492825,0,20,20,911,1,large living room with high ceilings and two picture frames along the back wall.,large living room with high ceilings and one picture frame along the back wall.,wolfe2,119_L_painting,1,57,A244IQQR0CTZ3I,2021-01-25_09h47.06.164,MetaAwareness,2020.1.2,Win32,60,3INZSNUD81TCXSEGGUB9N3E5OOS9DQ,A244IQQR0CTZ3I,3LJ7UR74RIGN8IXBEVYNQJA76ER4NE,4UJL0,4UJL0,3LJ7UR74RIGN8IXBEVYNQJA76ER4NE,3LJ7UR74RIGN8IXBEVYNQJA76ER4NE,271100,271100,,,,,,,,,,
,,,,5,23.03146,0,21,21,665,1,a small aparmtnet with something on the desk  num_enter,a small apartment with something small on desk,wolfe2,086_L_book,3,57,A244IQQR0CTZ3I,2021-01-25_09h47.06.164,MetaAwareness,2020.1.2,Win32,60,3INZSNUD81TCXSEGGUB9N3E5OOS9DQ,A244IQQR0CTZ3I,3LJ7UR74RIGN8IXBEVYNQJA76ER4NE,4UJL0,4UJL0,3LJ7UR74RIGN8IXBEVYNQJA76ER4NE,3LJ7UR74RIGN8IXBEVYNQJA76ER4NE,271100,271100,,,,,,,,,,
,,,,3,17.424095,0,22,22,44,1,the bed has a palm tree behind it. there is a white rug under the bed. next to the bed on the right is a lamp sitting on a table.,the bed has a palm tree behind it. there is a white rug under the bed. next to the bed on the right side is a lamp and a puple vase.,wolfe2,006_R_vase,2,57,A244IQQR0CTZ3I,2021-01-25_09h47.06.164,MetaAwareness,2020.1.2,Win32,60,3INZSNUD81TCXSEGGUB9N3E5OOS9DQ,A244IQQR0CTZ3I,3LJ7UR74RIGN8IXBEVYNQJA76ER4NE,4UJL0,4UJL0,3LJ7UR74RIGN8IXBEVYNQJA76ER4NE,3LJ7UR74RIGN8IXBEVYNQJA76ER4NE,271100,271100,,,,,,,,,,
,,,,3,13.59527,0,23,23,742,1,a spacious looking hotel room with a big bed and mirror behind the bed. there is a light on the wall near the mirror.,"a spacious looking hotel room, with a big bed, and mirror behind the bed. no light on the wall.",wolfe2,097_L_light,4,57,A244IQQR0CTZ3I,2021-01-25_09h47.06.164,MetaAwareness,2020.1.2,Win32,60,3INZSNUD81TCXSEGGUB9N3E5OOS9DQ,A244IQQR0CTZ3I,3LJ7UR74RIGN8IXBEVYNQJA76ER4NE,4UJL0,4UJL0,3LJ7UR74RIGN8IXBEVYNQJA76ER4NE,3LJ7UR74RIGN8IXBEVYNQJA76ER4NE,271100,271100,,,,,,,,,,
,,,,3,14.88337,0,24,24,877,1,there is a small statue next to the book and vases on the coffee table.,there is nothing but a book and vases on this coffee table.,wolfe2,114_R_bird,2,57,A244IQQR0CTZ3I,2021-01-25_09h47.06.164,MetaAwareness,2020.1.2,Win32,60,3INZSNUD81TCXSEGGUB9N3E5OOS9DQ,A244IQQR0CTZ3I,3LJ7UR74RIGN8IXBEVYNQJA76ER4NE,4UJL0,4UJL0,3LJ7UR74RIGN8IXBEVYNQJA76ER4NE,3LJ7UR74RIGN8IXBEVYNQJA76ER4NE,271100,271100,,,,,,,,,,
,,,,3,10.91403,0,25,25,314,1,room  with chair and table.  two lamp is hang theres is no fruit in the bowl,"room with chair and table. two  lamp is hanging, there is fruit in the bowel",wolfe2,041_L_fruit,1,57,A244IQQR0CTZ3I,2021-01-25_09h47.06.164,MetaAwareness,2020.1.2,Win32,60,3INZSNUD81TCXSEGGUB9N3E5OOS9DQ,A244IQQR0CTZ3I,3LJ7UR74RIGN8IXBEVYNQJA76ER4NE,4UJL0,4UJL0,3LJ7UR74RIGN8IXBEVYNQJA76ER4NE,3LJ7UR74RIGN8IXBEVYNQJA76ER4NE,271100,271100,,,,,,,,,,
,,,,5,12.742525,0,26,26,938,1,"a well-lit room with several empty chairs and tables, with one tablein the corner having two chairs","a well-lit room with several empty chairs and tables, with one chair missing from a table in the corner",wolfe2,122_L_chair,4,57,A244IQQR0CTZ3I,2021-01-25_09h47.06.164,MetaAwareness,2020.1.2,Win32,60,3INZSNUD81TCXSEGGUB9N3E5OOS9DQ,A244IQQR0CTZ3I,3LJ7UR74RIGN8IXBEVYNQJA76ER4NE,4UJL0,4UJL0,3LJ7UR74RIGN8IXBEVYNQJA76ER4NE,3LJ7UR74RIGN8IXBEVYNQJA76ER4NE,271100,271100,,,,,,,,,,
,,,,3,8.044915,0,27,27,193,1,there is one piece of art on the right side of a shelf in the living room,there are two pieces of art on the right side of a shelf in the living room,wolfe2,025_R_vase,2,57,A244IQQR0CTZ3I,2021-01-25_09h47.06.164,MetaAwareness,2020.1.2,Win32,60,3INZSNUD81TCXSEGGUB9N3E5OOS9DQ,A244IQQR0CTZ3I,3LJ7UR74RIGN8IXBEVYNQJA76ER4NE,4UJL0,4UJL0,3LJ7UR74RIGN8IXBEVYNQJA76ER4NE,3LJ7UR74RIGN8IXBEVYNQJA76ER4NE,271100,271100,,,,,,,,,,
,,,,2,23.33323,0,28,28,642,1,"colorful bedroom with bunkbed, table and a row of drawers on the wall with one missing",colorful bedroom with an open window and the matching drawer has a white pull fr it.,wolfe2,083_R_knob,4,57,A244IQQR0CTZ3I,2021-01-25_09h47.06.164,MetaAwareness,2020.1.2,Win32,60,3INZSNUD81TCXSEGGUB9N3E5OOS9DQ,A244IQQR0CTZ3I,3LJ7UR74RIGN8IXBEVYNQJA76ER4NE,4UJL0,4UJL0,3LJ7UR74RIGN8IXBEVYNQJA76ER4NE,3LJ7UR74RIGN8IXBEVYNQJA76ER4NE,271100,271100,,,,,,,,,,
,,,,3,17.25746,0,29,29,609,1,a country kitcjen with many open shelves.one of the shelves has a bowl.,a country kitchen with many open shelves all of which haves bowls and other things.,wolfe2,079_L_bowl,3,57,A244IQQR0CTZ3I,2021-01-25_09h47.06.164,MetaAwareness,2020.1.2,Win32,60,3INZSNUD81TCXSEGGUB9N3E5OOS9DQ,A244IQQR0CTZ3I,3LJ7UR74RIGN8IXBEVYNQJA76ER4NE,4UJL0,4UJL0,3LJ7UR74RIGN8IXBEVYNQJA76ER4NE,3LJ7UR74RIGN8IXBEVYNQJA76ER4NE,271100,271100,,,,,,,,,,
,,,,,,,,,,,,,,,,57,A244IQQR0CTZ3I,2021-01-25_09h47.06.164,MetaAwareness,2020.1.2,Win32,60,3INZSNUD81TCXSEGGUB9N3E5OOS9DQ,A244IQQR0CTZ3I,3LJ7UR74RIGN8IXBEVYNQJA76ER4NE,4UJL0,4UJL0,3LJ7UR74RIGN8IXBEVYNQJA76ER4NE,3LJ7UR74RIGN8IXBEVYNQJA76ER4NE,271100,271100,6,11.032455,someone laying underneath a blue beach umbrella on a crowded beach,someone laying underneath a blue beach umbrella on a crowded beach,same,1,9.429405,members of a marching band crossing a track that all have feather plumes at the front of their hats,a cluttered and rustic looking cafe with 10 hanging lights,different
