consent_response.keys,consent_response.rt,key_resp_2.keys,key_resp_2.rt,user_resp.keys,user_resp.rt,trials.thisRepN,trials.thisTrialN,trials.thisN,trials.thisIndex,trials.ran,image_1_text,image_2_text,database,image,number,age,worker_ID,date,expName,psychopyVersion,OS,frameRate,hitId,workerId,assignmentId,a,tp_a,b,tp_b,c,tp_c,catch_same_resp.keys,catch_same_resp.rt,image_1_text_catch_same,image_2_text_catch_same,image_catch_same,catch_different_resp.keys,catch_different_resp.rt,image_1_text_catch_different,image_2_text_catch_different,image_catch_different
space,3.666475,space,19.462615,5,8.49775,0,0,0,98,1,"a contemporary sitting room with glass walls, sofas, an occupied dog bed, and two light sconces","a contemporary sitting room with glass walls, sofas, an occupied dog bed, and one light sconce",wolfe2,127_L_light,4,36,A2CWJRAEFZ44HU,2021-02-18_10h23.08.683,MetaAwareness,2020.1.2,Win32,60,3Z3R5YC0P4QSFR1Q56BG23I2VAQFTR,A2CWJRAEFZ44HU,31JLPPHS2VXK87EJFWTHV3I6LZIO3Z,SPJ11,SPJ11,31JLPPHS2VXK87EJFWTHV3I6LZIO3Z,31JLPPHS2VXK87EJFWTHV3I6LZIO3Z,276411,276411,,,,,,,,,,
,,,,5,9.478515,0,1,1,69,1,a stylish apartment with a table holding a book.,a stylish apartment with a table without a book.,wolfe2,086_L_book,4,36,A2CWJRAEFZ44HU,2021-02-18_10h23.08.683,MetaAwareness,2020.1.2,Win32,60,3Z3R5YC0P4QSFR1Q56BG23I2VAQFTR,A2CWJRAEFZ44HU,31JLPPHS2VXK87EJFWTHV3I6LZIO3Z,SPJ11,SPJ11,31JLPPHS2VXK87EJFWTHV3I6LZIO3Z,31JLPPHS2VXK87EJFWTHV3I6LZIO3Z,276411,276411,,,,,,,,,,
,,,,5,6.247055,0,2,2,71,1,a large open dining room and living room with a light colored rolled up towel on a table,a large open dining room and living room with a dark colored rolled up towel on a table,wolfe2,086_R_book,5,36,A2CWJRAEFZ44HU,2021-02-18_10h23.08.683,MetaAwareness,2020.1.2,Win32,60,3Z3R5YC0P4QSFR1Q56BG23I2VAQFTR,A2CWJRAEFZ44HU,31JLPPHS2VXK87EJFWTHV3I6LZIO3Z,SPJ11,SPJ11,31JLPPHS2VXK87EJFWTHV3I6LZIO3Z,31JLPPHS2VXK87EJFWTHV3I6LZIO3Z,276411,276411,,,,,,,,,,
,,,,4,4.33305,0,3,3,86,1,a closet with a dresser at the end with a blue thing on top,a closet with a dresser and many clothes,wolfe2,108_L_boa,4,36,A2CWJRAEFZ44HU,2021-02-18_10h23.08.683,MetaAwareness,2020.1.2,Win32,60,3Z3R5YC0P4QSFR1Q56BG23I2VAQFTR,A2CWJRAEFZ44HU,31JLPPHS2VXK87EJFWTHV3I6LZIO3Z,SPJ11,SPJ11,31JLPPHS2VXK87EJFWTHV3I6LZIO3Z,31JLPPHS2VXK87EJFWTHV3I6LZIO3Z,276411,276411,,,,,,,,,,
,,,,5,4.103305,0,4,4,46,1,a dining room with a missing wine glass,a dining room with a wine glass at every setting,wolfe2,061_L_glass,4,36,A2CWJRAEFZ44HU,2021-02-18_10h23.08.683,MetaAwareness,2020.1.2,Win32,60,3Z3R5YC0P4QSFR1Q56BG23I2VAQFTR,A2CWJRAEFZ44HU,31JLPPHS2VXK87EJFWTHV3I6LZIO3Z,SPJ11,SPJ11,31JLPPHS2VXK87EJFWTHV3I6LZIO3Z,31JLPPHS2VXK87EJFWTHV3I6LZIO3Z,276411,276411,,,,,,,,,,
,,,,5,8.670495,0,5,5,13,1,a sink and counter in a room.,a sink and counter in a room with handtowels add the the bottom shelf.num_enter,wolfe2,024_R_towels,1,36,A2CWJRAEFZ44HU,2021-02-18_10h23.08.683,MetaAwareness,2020.1.2,Win32,60,3Z3R5YC0P4QSFR1Q56BG23I2VAQFTR,A2CWJRAEFZ44HU,31JLPPHS2VXK87EJFWTHV3I6LZIO3Z,SPJ11,SPJ11,31JLPPHS2VXK87EJFWTHV3I6LZIO3Z,31JLPPHS2VXK87EJFWTHV3I6LZIO3Z,276411,276411,,,,,,,,,,
,,,,5,3.838385,0,6,6,26,1,a bathroom area with two brown towels,a bathroom area with three brown towels,wolfe2,037_R_towel,2,36,A2CWJRAEFZ44HU,2021-02-18_10h23.08.683,MetaAwareness,2020.1.2,Win32,60,3Z3R5YC0P4QSFR1Q56BG23I2VAQFTR,A2CWJRAEFZ44HU,31JLPPHS2VXK87EJFWTHV3I6LZIO3Z,SPJ11,SPJ11,31JLPPHS2VXK87EJFWTHV3I6LZIO3Z,31JLPPHS2VXK87EJFWTHV3I6LZIO3Z,276411,276411,,,,,,,,,,
,,,,5,4.248675,0,7,7,65,1,a child's bedroom that is very colorful with a knob missing on the blue drawer,a child's bedroom that is very colorful with all the knobs intact on the dresser,wolfe2,083_L_knob,1,36,A2CWJRAEFZ44HU,2021-02-18_10h23.08.683,MetaAwareness,2020.1.2,Win32,60,3Z3R5YC0P4QSFR1Q56BG23I2VAQFTR,A2CWJRAEFZ44HU,31JLPPHS2VXK87EJFWTHV3I6LZIO3Z,SPJ11,SPJ11,31JLPPHS2VXK87EJFWTHV3I6LZIO3Z,31JLPPHS2VXK87EJFWTHV3I6LZIO3Z,276411,276411,,,,,,,,,,
,,,,5,3.93975,0,8,8,63,1,a chiar without leg support,a chair with leg support,wolfe2,077_R_footrest,4,36,A2CWJRAEFZ44HU,2021-02-18_10h23.08.683,MetaAwareness,2020.1.2,Win32,60,3Z3R5YC0P4QSFR1Q56BG23I2VAQFTR,A2CWJRAEFZ44HU,31JLPPHS2VXK87EJFWTHV3I6LZIO3Z,SPJ11,SPJ11,31JLPPHS2VXK87EJFWTHV3I6LZIO3Z,31JLPPHS2VXK87EJFWTHV3I6LZIO3Z,276411,276411,,,,,,,,,,
,,,,5,10.200125,0,9,9,29,1,a very stylish and contemporary looking bathroom that has a lot of tan and brown coloring and two sinks and one faucet,a very stylish and contemporary looking bathroom that has a lot of tan and brown coloring and two sinks and two faucets,wolfe2,042_R_tap,5,36,A2CWJRAEFZ44HU,2021-02-18_10h23.08.683,MetaAwareness,2020.1.2,Win32,60,3Z3R5YC0P4QSFR1Q56BG23I2VAQFTR,A2CWJRAEFZ44HU,31JLPPHS2VXK87EJFWTHV3I6LZIO3Z,SPJ11,SPJ11,31JLPPHS2VXK87EJFWTHV3I6LZIO3Z,31JLPPHS2VXK87EJFWTHV3I6LZIO3Z,276411,276411,,,,,,,,,,
,,,,6,5.959575,0,10,10,66,1,a classy vacation beach house space with open door,fresh air in the beach house,wolfe2,084_R_light,7,36,A2CWJRAEFZ44HU,2021-02-18_10h23.08.683,MetaAwareness,2020.1.2,Win32,60,3Z3R5YC0P4QSFR1Q56BG23I2VAQFTR,A2CWJRAEFZ44HU,31JLPPHS2VXK87EJFWTHV3I6LZIO3Z,SPJ11,SPJ11,31JLPPHS2VXK87EJFWTHV3I6LZIO3Z,31JLPPHS2VXK87EJFWTHV3I6LZIO3Z,276411,276411,,,,,,,,,,
,,,,5,3.95025,0,11,11,39,1,theres a tv mounted to the wall with nothing underneath it,theres a tv mounted to the wall with a soundbar underneath it,wolfe2,052_L_speaker,4,36,A2CWJRAEFZ44HU,2021-02-18_10h23.08.683,MetaAwareness,2020.1.2,Win32,60,3Z3R5YC0P4QSFR1Q56BG23I2VAQFTR,A2CWJRAEFZ44HU,31JLPPHS2VXK87EJFWTHV3I6LZIO3Z,SPJ11,SPJ11,31JLPPHS2VXK87EJFWTHV3I6LZIO3Z,31JLPPHS2VXK87EJFWTHV3I6LZIO3Z,276411,276411,,,,,,,,,,
,,,,5,5.51818,0,12,12,95,1,a large black and white living room with a small stool next to the windows,a large black and white living room without a small stool next to the windows,wolfe2,125_L_sofa,5,36,A2CWJRAEFZ44HU,2021-02-18_10h23.08.683,MetaAwareness,2020.1.2,Win32,60,3Z3R5YC0P4QSFR1Q56BG23I2VAQFTR,A2CWJRAEFZ44HU,31JLPPHS2VXK87EJFWTHV3I6LZIO3Z,SPJ11,SPJ11,31JLPPHS2VXK87EJFWTHV3I6LZIO3Z,31JLPPHS2VXK87EJFWTHV3I6LZIO3Z,276411,276411,,,,,,,,,,
,,,,4,5.73351,0,13,13,79,1,a modern powder room with devorations and gifts on the floor,a modern powder room with steps to the outside,wolfe2,102_L_shoppingbag,4,36,A2CWJRAEFZ44HU,2021-02-18_10h23.08.683,MetaAwareness,2020.1.2,Win32,60,3Z3R5YC0P4QSFR1Q56BG23I2VAQFTR,A2CWJRAEFZ44HU,31JLPPHS2VXK87EJFWTHV3I6LZIO3Z,SPJ11,SPJ11,31JLPPHS2VXK87EJFWTHV3I6LZIO3Z,31JLPPHS2VXK87EJFWTHV3I6LZIO3Z,276411,276411,,,,,,,,,,
,,,,5,4.58356,0,14,14,17,1,a nice bathroom with two sinks and two red cups sitting on a shelf,a nice bathroom with two sinks and three red cups sitting on a shelf.,wolfe2,029_R_glass,1,36,A2CWJRAEFZ44HU,2021-02-18_10h23.08.683,MetaAwareness,2020.1.2,Win32,60,3Z3R5YC0P4QSFR1Q56BG23I2VAQFTR,A2CWJRAEFZ44HU,31JLPPHS2VXK87EJFWTHV3I6LZIO3Z,SPJ11,SPJ11,31JLPPHS2VXK87EJFWTHV3I6LZIO3Z,31JLPPHS2VXK87EJFWTHV3I6LZIO3Z,276411,276411,,,,,,,,,,
,,,,5,6.08074,0,15,15,56,1,a meeting room with a brown shelf.,a meeting room that has a picture on the brown shelf.,wolfe2,067_R_painting,1,36,A2CWJRAEFZ44HU,2021-02-18_10h23.08.683,MetaAwareness,2020.1.2,Win32,60,3Z3R5YC0P4QSFR1Q56BG23I2VAQFTR,A2CWJRAEFZ44HU,31JLPPHS2VXK87EJFWTHV3I6LZIO3Z,SPJ11,SPJ11,31JLPPHS2VXK87EJFWTHV3I6LZIO3Z,31JLPPHS2VXK87EJFWTHV3I6LZIO3Z,276411,276411,,,,,,,,,,
,,,,5,5.60013,0,16,16,25,1,a red kitchen with tiled floor with one bowl on a shelf underneath a cabinet door,a red kitchen with tiled floor with two bowls on a shelf underneath a cabinet door,wolfe2,036_R_bowl,3,36,A2CWJRAEFZ44HU,2021-02-18_10h23.08.683,MetaAwareness,2020.1.2,Win32,60,3Z3R5YC0P4QSFR1Q56BG23I2VAQFTR,A2CWJRAEFZ44HU,31JLPPHS2VXK87EJFWTHV3I6LZIO3Z,SPJ11,SPJ11,31JLPPHS2VXK87EJFWTHV3I6LZIO3Z,31JLPPHS2VXK87EJFWTHV3I6LZIO3Z,276411,276411,,,,,,,,,,
,,,,5,5.021545,0,17,17,10,1,"a small, but cozy, office space with grass garden and 2 plates on the wall","a small, but cozy, office space with grass garden and 3 plates on the wall",wolfe2,020_L_walldeco,1,36,A2CWJRAEFZ44HU,2021-02-18_10h23.08.683,MetaAwareness,2020.1.2,Win32,60,3Z3R5YC0P4QSFR1Q56BG23I2VAQFTR,A2CWJRAEFZ44HU,31JLPPHS2VXK87EJFWTHV3I6LZIO3Z,SPJ11,SPJ11,31JLPPHS2VXK87EJFWTHV3I6LZIO3Z,31JLPPHS2VXK87EJFWTHV3I6LZIO3Z,276411,276411,,,,,,,,,,
,,,,4,5.22386,0,18,18,97,1,a living room with a decorative piece of art below the tv.,a living room with no items underneath the tv.,wolfe2,126_R_candles,2,36,A2CWJRAEFZ44HU,2021-02-18_10h23.08.683,MetaAwareness,2020.1.2,Win32,60,3Z3R5YC0P4QSFR1Q56BG23I2VAQFTR,A2CWJRAEFZ44HU,31JLPPHS2VXK87EJFWTHV3I6LZIO3Z,SPJ11,SPJ11,31JLPPHS2VXK87EJFWTHV3I6LZIO3Z,31JLPPHS2VXK87EJFWTHV3I6LZIO3Z,276411,276411,,,,,,,,,,
,,,,5,3.94685,0,19,19,16,1,a bathroom with one hanging bath towel,a bathroom with two hanging bath towels,wolfe2,028_R_vase,4,36,A2CWJRAEFZ44HU,2021-02-18_10h23.08.683,MetaAwareness,2020.1.2,Win32,60,3Z3R5YC0P4QSFR1Q56BG23I2VAQFTR,A2CWJRAEFZ44HU,31JLPPHS2VXK87EJFWTHV3I6LZIO3Z,SPJ11,SPJ11,31JLPPHS2VXK87EJFWTHV3I6LZIO3Z,31JLPPHS2VXK87EJFWTHV3I6LZIO3Z,276411,276411,,,,,,,,,,
,,,,5,6.61944,0,20,20,59,1,a comfortable living area with a large mirror above the fireplace and a light sconce on the right side of the mirror,a comfortable living area with a large mirror above the fireplace and a set of light sconces on either side of the mirror,wolfe2,070_L_lamp,2,36,A2CWJRAEFZ44HU,2021-02-18_10h23.08.683,MetaAwareness,2020.1.2,Win32,60,3Z3R5YC0P4QSFR1Q56BG23I2VAQFTR,A2CWJRAEFZ44HU,31JLPPHS2VXK87EJFWTHV3I6LZIO3Z,SPJ11,SPJ11,31JLPPHS2VXK87EJFWTHV3I6LZIO3Z,31JLPPHS2VXK87EJFWTHV3I6LZIO3Z,276411,276411,,,,,,,,,,
,,,,5,8.860805,0,21,21,45,1,"the library features large chandeliers, wide hallways, and five trash cans","the library features large chandeliers, wide hallways, and six trash cans",wolfe2,057_R_bin,4,36,A2CWJRAEFZ44HU,2021-02-18_10h23.08.683,MetaAwareness,2020.1.2,Win32,60,3Z3R5YC0P4QSFR1Q56BG23I2VAQFTR,A2CWJRAEFZ44HU,31JLPPHS2VXK87EJFWTHV3I6LZIO3Z,SPJ11,SPJ11,31JLPPHS2VXK87EJFWTHV3I6LZIO3Z,31JLPPHS2VXK87EJFWTHV3I6LZIO3Z,276411,276411,,,,,,,,,,
,,,,4,9.08001,0,22,22,94,1,it is a guest house there are chair and table present and natural scenary present there is an water can present inside the box,it is a guest house there are chair and table present and natural scenary present. there is no object present in the box,wolfe2,124_L_vase,1,36,A2CWJRAEFZ44HU,2021-02-18_10h23.08.683,MetaAwareness,2020.1.2,Win32,60,3Z3R5YC0P4QSFR1Q56BG23I2VAQFTR,A2CWJRAEFZ44HU,31JLPPHS2VXK87EJFWTHV3I6LZIO3Z,SPJ11,SPJ11,31JLPPHS2VXK87EJFWTHV3I6LZIO3Z,31JLPPHS2VXK87EJFWTHV3I6LZIO3Z,276411,276411,,,,,,,,,,
,,,,5,7.984395,0,23,23,15,1,"a modern living room with a view of a park, white couches, and two pointy art pieces on a built-in wood shelving system","a modern living room with a view of a park, white couches, and three pointy art pieces on a built-in wood shelving system",wolfe2,025_R_vase,5,36,A2CWJRAEFZ44HU,2021-02-18_10h23.08.683,MetaAwareness,2020.1.2,Win32,60,3Z3R5YC0P4QSFR1Q56BG23I2VAQFTR,A2CWJRAEFZ44HU,31JLPPHS2VXK87EJFWTHV3I6LZIO3Z,SPJ11,SPJ11,31JLPPHS2VXK87EJFWTHV3I6LZIO3Z,31JLPPHS2VXK87EJFWTHV3I6LZIO3Z,276411,276411,,,,,,,,,,
,,,,5,17.01754,0,24,24,8,1,"a minimalistic living room in a modern home, with a pedestal that has nothing on it.","a minimalistic living room in a modern home, with a pedestal that has an artistic object on it.",wolfe2,016_L_art,6,36,A2CWJRAEFZ44HU,2021-02-18_10h23.08.683,MetaAwareness,2020.1.2,Win32,60,3Z3R5YC0P4QSFR1Q56BG23I2VAQFTR,A2CWJRAEFZ44HU,31JLPPHS2VXK87EJFWTHV3I6LZIO3Z,SPJ11,SPJ11,31JLPPHS2VXK87EJFWTHV3I6LZIO3Z,31JLPPHS2VXK87EJFWTHV3I6LZIO3Z,276411,276411,,,,,,,,,,
,,,,5,5.68495,0,25,25,48,1,"a modern dining room set for four, with a wine glass missing from one setting",a modern dining room set for four,wolfe2,061_R_glass,1,36,A2CWJRAEFZ44HU,2021-02-18_10h23.08.683,MetaAwareness,2020.1.2,Win32,60,3Z3R5YC0P4QSFR1Q56BG23I2VAQFTR,A2CWJRAEFZ44HU,31JLPPHS2VXK87EJFWTHV3I6LZIO3Z,SPJ11,SPJ11,31JLPPHS2VXK87EJFWTHV3I6LZIO3Z,31JLPPHS2VXK87EJFWTHV3I6LZIO3Z,276411,276411,,,,,,,,,,
,,,,5,4.9969,0,26,26,51,1,a beige and white bedroom with desk and a shelf with books,a beige and white bedroom with desk and a shelf with books and cds,wolfe2,065_L_cd,1,36,A2CWJRAEFZ44HU,2021-02-18_10h23.08.683,MetaAwareness,2020.1.2,Win32,60,3Z3R5YC0P4QSFR1Q56BG23I2VAQFTR,A2CWJRAEFZ44HU,31JLPPHS2VXK87EJFWTHV3I6LZIO3Z,SPJ11,SPJ11,31JLPPHS2VXK87EJFWTHV3I6LZIO3Z,31JLPPHS2VXK87EJFWTHV3I6LZIO3Z,276411,276411,,,,,,,,,,
,,,,5,5.60753,0,27,27,62,1,"a very modern looking kitchen with four stools, one without a footrest","a very modern kitchen with four stools, all of which have a foot rest",wolfe2,077_L_footrest,2,36,A2CWJRAEFZ44HU,2021-02-18_10h23.08.683,MetaAwareness,2020.1.2,Win32,60,3Z3R5YC0P4QSFR1Q56BG23I2VAQFTR,A2CWJRAEFZ44HU,31JLPPHS2VXK87EJFWTHV3I6LZIO3Z,SPJ11,SPJ11,31JLPPHS2VXK87EJFWTHV3I6LZIO3Z,31JLPPHS2VXK87EJFWTHV3I6LZIO3Z,276411,276411,,,,,,,,,,
,,,,5,6.328445,0,28,28,31,1,a white and blue bathroom with white countertop and sink,a white and blue bathroom with a white countertop and sink with silver handles.,wolfe2,044_R_light,3,36,A2CWJRAEFZ44HU,2021-02-18_10h23.08.683,MetaAwareness,2020.1.2,Win32,60,3Z3R5YC0P4QSFR1Q56BG23I2VAQFTR,A2CWJRAEFZ44HU,31JLPPHS2VXK87EJFWTHV3I6LZIO3Z,SPJ11,SPJ11,31JLPPHS2VXK87EJFWTHV3I6LZIO3Z,31JLPPHS2VXK87EJFWTHV3I6LZIO3Z,276411,276411,,,,,,,,,,
,,,,5,4.664955,0,29,29,19,1,a bathroom where you can walk to the window,a bathroom with a counter in front of the window,wolfe2,030_L_drawer,4,36,A2CWJRAEFZ44HU,2021-02-18_10h23.08.683,MetaAwareness,2020.1.2,Win32,60,3Z3R5YC0P4QSFR1Q56BG23I2VAQFTR,A2CWJRAEFZ44HU,31JLPPHS2VXK87EJFWTHV3I6LZIO3Z,SPJ11,SPJ11,31JLPPHS2VXK87EJFWTHV3I6LZIO3Z,31JLPPHS2VXK87EJFWTHV3I6LZIO3Z,276411,276411,,,,,,,,,,
,,,,,,,,,,,,,,,,36,A2CWJRAEFZ44HU,2021-02-18_10h23.08.683,MetaAwareness,2020.1.2,Win32,60,3Z3R5YC0P4QSFR1Q56BG23I2VAQFTR,A2CWJRAEFZ44HU,31JLPPHS2VXK87EJFWTHV3I6LZIO3Z,SPJ11,SPJ11,31JLPPHS2VXK87EJFWTHV3I6LZIO3Z,31JLPPHS2VXK87EJFWTHV3I6LZIO3Z,276411,276411,6,6.521855,someone laying underneath a blue beach umbrella on a crowded beach,someone laying underneath a blue beach umbrella on a crowded beach,same,1,6.059475,members of a marching band crossing a track that all have feather plumes at the front of their hats,a cluttered and rustic looking cafe with 10 hanging lights,different
