consent_response.keys,consent_response.rt,key_resp_2.keys,key_resp_2.rt,user_resp.keys,user_resp.rt,trials.thisRepN,trials.thisTrialN,trials.thisN,trials.thisIndex,trials.ran,image_1_text,image_2_text,database,image,number,age,worker_ID,date,expName,psychopyVersion,OS,frameRate,hitId,workerId,assignmentId,a,tp_a,b,tp_b,c,tp_c,catch_same_resp.keys,catch_same_resp.rt,image_1_text_catch_same,image_2_text_catch_same,image_catch_same,catch_different_resp.keys,catch_different_resp.rt,image_1_text_catch_different,image_2_text_catch_different,image_catch_different
space,9.248945,space,26.13761,5,24.392095,0,0,0,158,1,three people and a seal on a rock outcropping,three people and a seal on a shorter rock outcropping,rensink,Seal,2,31,AIHUIAQ4922K3,2021-01-08_15h04.25.403,MetaAwareness,2020.1.2,Win32,60,3BC9H1KCYVFQ7ZMF518FE8WH3V5WYW,AIHUIAQ4922K3,3907X2AHF18D8PU1QWSR1TI4LWBP2B,HX095,HX095,3907X2AHF18D8PU1QWSR1TI4LWBP2B,3907X2AHF18D8PU1QWSR1TI4LWBP2B,268035,268035,,,,,,,,,,
,,,,1,29.139805,0,1,1,54,1,there have a shadow of the  helicopter,there haven't a  shadw of the helicopter,rensink,Chopper,4,31,AIHUIAQ4922K3,2021-01-08_15h04.25.403,MetaAwareness,2020.1.2,Win32,60,3BC9H1KCYVFQ7ZMF518FE8WH3V5WYW,AIHUIAQ4922K3,3907X2AHF18D8PU1QWSR1TI4LWBP2B,HX095,HX095,3907X2AHF18D8PU1QWSR1TI4LWBP2B,3907X2AHF18D8PU1QWSR1TI4LWBP2B,268035,268035,,,,,,,,,,
,,,,6,5.86903,0,2,2,121,1,"a man stands with a boat on the edge of a lake, looking out and possibly having  drink",a boat sits on the edge of a lake with no humans pictures,rensink,Lake,1,31,AIHUIAQ4922K3,2021-01-08_15h04.25.403,MetaAwareness,2020.1.2,Win32,60,3BC9H1KCYVFQ7ZMF518FE8WH3V5WYW,AIHUIAQ4922K3,3907X2AHF18D8PU1QWSR1TI4LWBP2B,HX095,HX095,3907X2AHF18D8PU1QWSR1TI4LWBP2B,3907X2AHF18D8PU1QWSR1TI4LWBP2B,268035,268035,,,,,,,,,,
,,,,3,10.44035,0,3,3,25,1,a group of birds standing in the grass at horizon level,a group of birds standing in the grass a little below horizon level,rensink,Birds,6,31,AIHUIAQ4922K3,2021-01-08_15h04.25.403,MetaAwareness,2020.1.2,Win32,60,3BC9H1KCYVFQ7ZMF518FE8WH3V5WYW,AIHUIAQ4922K3,3907X2AHF18D8PU1QWSR1TI4LWBP2B,HX095,HX095,3907X2AHF18D8PU1QWSR1TI4LWBP2B,3907X2AHF18D8PU1QWSR1TI4LWBP2B,268035,268035,,,,,,,,,,
,,,,4,10.02004,0,4,4,100,1,a silver helicopter hovering avove a city coast,a red helicopter hovering above a city coast,rensink,Harbor,4,31,AIHUIAQ4922K3,2021-01-08_15h04.25.403,MetaAwareness,2020.1.2,Win32,60,3BC9H1KCYVFQ7ZMF518FE8WH3V5WYW,AIHUIAQ4922K3,3907X2AHF18D8PU1QWSR1TI4LWBP2B,HX095,HX095,3907X2AHF18D8PU1QWSR1TI4LWBP2B,3907X2AHF18D8PU1QWSR1TI4LWBP2B,268035,268035,,,,,,,,,,
,,,,3,6.56202,0,5,5,52,1,vehicle  shadow show the big shadow,vehicle shadow show small,rensink,Chopper,2,31,AIHUIAQ4922K3,2021-01-08_15h04.25.403,MetaAwareness,2020.1.2,Win32,60,3BC9H1KCYVFQ7ZMF518FE8WH3V5WYW,AIHUIAQ4922K3,3907X2AHF18D8PU1QWSR1TI4LWBP2B,HX095,HX095,3907X2AHF18D8PU1QWSR1TI4LWBP2B,3907X2AHF18D8PU1QWSR1TI4LWBP2B,268035,268035,,,,,,,,,,
,,,,2,17.258125,0,6,6,144,1,a woman in a blue shirt with a purse and a piece of fruit is standing next to another person holding a bag of fruit on the sidewalk with cars in the background,a woman in blue shirt with a purse and piece of fruit is standing next to another person on a street with cars and buildings in the background,rensink,Nurses,5,31,AIHUIAQ4922K3,2021-01-08_15h04.25.403,MetaAwareness,2020.1.2,Win32,60,3BC9H1KCYVFQ7ZMF518FE8WH3V5WYW,AIHUIAQ4922K3,3907X2AHF18D8PU1QWSR1TI4LWBP2B,HX095,HX095,3907X2AHF18D8PU1QWSR1TI4LWBP2B,3907X2AHF18D8PU1QWSR1TI4LWBP2B,268035,268035,,,,,,,,,,
,,,,2,9.37733,0,7,7,177,1,the boat so far to the landthe b,the boat near to the land,rensink,Water,3,31,AIHUIAQ4922K3,2021-01-08_15h04.25.403,MetaAwareness,2020.1.2,Win32,60,3BC9H1KCYVFQ7ZMF518FE8WH3V5WYW,AIHUIAQ4922K3,3907X2AHF18D8PU1QWSR1TI4LWBP2B,HX095,HX095,3907X2AHF18D8PU1QWSR1TI4LWBP2B,3907X2AHF18D8PU1QWSR1TI4LWBP2B,268035,268035,,,,,,,,,,
,,,,5,8.6782,0,8,8,129,1,a man at a market wearing blue jean pants.,a man at a market wearing tan jean pants.,rensink,Market,5,31,AIHUIAQ4922K3,2021-01-08_15h04.25.403,MetaAwareness,2020.1.2,Win32,60,3BC9H1KCYVFQ7ZMF518FE8WH3V5WYW,AIHUIAQ4922K3,3907X2AHF18D8PU1QWSR1TI4LWBP2B,HX095,HX095,3907X2AHF18D8PU1QWSR1TI4LWBP2B,3907X2AHF18D8PU1QWSR1TI4LWBP2B,268035,268035,,,,,,,,,,
,,,,2,17.31586,0,9,9,38,1,a man standing next to a camel in the middle of the desert with no sand behind the tower,a man standing next to a camel in the midel of the desert with sand behind the tower,rensink,Camel,2,31,AIHUIAQ4922K3,2021-01-08_15h04.25.403,MetaAwareness,2020.1.2,Win32,60,3BC9H1KCYVFQ7ZMF518FE8WH3V5WYW,AIHUIAQ4922K3,3907X2AHF18D8PU1QWSR1TI4LWBP2B,HX095,HX095,3907X2AHF18D8PU1QWSR1TI4LWBP2B,3907X2AHF18D8PU1QWSR1TI4LWBP2B,268035,268035,,,,,,,,,,
,,,,5,10.31896,0,10,10,93,1,a lake under blue skies with a fisherman to the left of the large mountain,a lake under blue skies with a fisherman in front of the large mountain,rensink,Fishing,6,31,AIHUIAQ4922K3,2021-01-08_15h04.25.403,MetaAwareness,2020.1.2,Win32,60,3BC9H1KCYVFQ7ZMF518FE8WH3V5WYW,AIHUIAQ4922K3,3907X2AHF18D8PU1QWSR1TI4LWBP2B,HX095,HX095,3907X2AHF18D8PU1QWSR1TI4LWBP2B,3907X2AHF18D8PU1QWSR1TI4LWBP2B,268035,268035,,,,,,,,,,
,,,,4,11.21985,0,11,11,41,1,a man and camel in front of a structure with the sky in the background,a man and camel in front of a structure with mountains in the background,rensink,Camel,5,31,AIHUIAQ4922K3,2021-01-08_15h04.25.403,MetaAwareness,2020.1.2,Win32,60,3BC9H1KCYVFQ7ZMF518FE8WH3V5WYW,AIHUIAQ4922K3,3907X2AHF18D8PU1QWSR1TI4LWBP2B,HX095,HX095,3907X2AHF18D8PU1QWSR1TI4LWBP2B,3907X2AHF18D8PU1QWSR1TI4LWBP2B,268035,268035,,,,,,,,,,
,,,,2,11.872435,0,12,12,159,1,a seal being photographed on a bank with a long walk  rockway,a seal being photographed on a bank wih a short rock walkwayw,rensink,Seal,3,31,AIHUIAQ4922K3,2021-01-08_15h04.25.403,MetaAwareness,2020.1.2,Win32,60,3BC9H1KCYVFQ7ZMF518FE8WH3V5WYW,AIHUIAQ4922K3,3907X2AHF18D8PU1QWSR1TI4LWBP2B,HX095,HX095,3907X2AHF18D8PU1QWSR1TI4LWBP2B,3907X2AHF18D8PU1QWSR1TI4LWBP2B,268035,268035,,,,,,,,,,
,,,,1,15.0164,0,13,13,171,1,there are two boats and some people at the river.,there is one boat and some people at the river.,rensink,SummerLake,5,31,AIHUIAQ4922K3,2021-01-08_15h04.25.403,MetaAwareness,2020.1.2,Win32,60,3BC9H1KCYVFQ7ZMF518FE8WH3V5WYW,AIHUIAQ4922K3,3907X2AHF18D8PU1QWSR1TI4LWBP2B,HX095,HX095,3907X2AHF18D8PU1QWSR1TI4LWBP2B,3907X2AHF18D8PU1QWSR1TI4LWBP2B,268035,268035,,,,,,,,,,
,,,,6,14.72721,0,14,14,178,1,"a man paddles a boat on an island, while two others pull it to shore","a man paddles a boat onto an island, while two others pull it to shore",rensink,Water,4,31,AIHUIAQ4922K3,2021-01-08_15h04.25.403,MetaAwareness,2020.1.2,Win32,60,3BC9H1KCYVFQ7ZMF518FE8WH3V5WYW,AIHUIAQ4922K3,3907X2AHF18D8PU1QWSR1TI4LWBP2B,HX095,HX095,3907X2AHF18D8PU1QWSR1TI4LWBP2B,3907X2AHF18D8PU1QWSR1TI4LWBP2B,268035,268035,,,,,,,,,,
,,,,2,5.00977,0,15,15,64,1,"a meal of some kind of meat, potatoes, and vegetables sits on a red gingham table cloth  with a basket of bread, glass of wine, salt and pepper grinders, and silverware","a meal of some kind of meat, potatoes, and vegetables sits on a red gingham table cloth with a basket of bread, salt and pepper gringers, silverware, and a glass of wine further to the left and closer to the plate",rensink,Dinner,1,31,AIHUIAQ4922K3,2021-01-08_15h04.25.403,MetaAwareness,2020.1.2,Win32,60,3BC9H1KCYVFQ7ZMF518FE8WH3V5WYW,AIHUIAQ4922K3,3907X2AHF18D8PU1QWSR1TI4LWBP2B,HX095,HX095,3907X2AHF18D8PU1QWSR1TI4LWBP2B,3907X2AHF18D8PU1QWSR1TI4LWBP2B,268035,268035,,,,,,,,,,
,,,,2,0.087005,0,16,16,28,1,a group of people on a small boat almost at shore.,a group of people on a small boat slightly further away from shore.,rensink,Boat,6,31,AIHUIAQ4922K3,2021-01-08_15h04.25.403,MetaAwareness,2020.1.2,Win32,60,3BC9H1KCYVFQ7ZMF518FE8WH3V5WYW,AIHUIAQ4922K3,3907X2AHF18D8PU1QWSR1TI4LWBP2B,HX095,HX095,3907X2AHF18D8PU1QWSR1TI4LWBP2B,3907X2AHF18D8PU1QWSR1TI4LWBP2B,268035,268035,,,,,,,,,,
,,,,5,10.428295,0,17,17,79,1,people are standing outside of an old egyptian temple with a sculpture in front,people are observing an ancient egyptian pyramid with a sculpture statue outside,rensink,Egypt,7,31,AIHUIAQ4922K3,2021-01-08_15h04.25.403,MetaAwareness,2020.1.2,Win32,60,3BC9H1KCYVFQ7ZMF518FE8WH3V5WYW,AIHUIAQ4922K3,3907X2AHF18D8PU1QWSR1TI4LWBP2B,HX095,HX095,3907X2AHF18D8PU1QWSR1TI4LWBP2B,3907X2AHF18D8PU1QWSR1TI4LWBP2B,268035,268035,,,,,,,,,,
,,,,3,10.53565,0,18,18,169,1,train tracks in a station with more buildings beyond,train tracks in a station with people,rensink,Station,8,31,AIHUIAQ4922K3,2021-01-08_15h04.25.403,MetaAwareness,2020.1.2,Win32,60,3BC9H1KCYVFQ7ZMF518FE8WH3V5WYW,AIHUIAQ4922K3,3907X2AHF18D8PU1QWSR1TI4LWBP2B,HX095,HX095,3907X2AHF18D8PU1QWSR1TI4LWBP2B,3907X2AHF18D8PU1QWSR1TI4LWBP2B,268035,268035,,,,,,,,,,
,,,,3,9.54094,0,19,19,130,1,three people in a boat with a swordfish and yellow bag,three people in a boat with a swordfish without a yellow bag,rensink,Marling,1,31,AIHUIAQ4922K3,2021-01-08_15h04.25.403,MetaAwareness,2020.1.2,Win32,60,3BC9H1KCYVFQ7ZMF518FE8WH3V5WYW,AIHUIAQ4922K3,3907X2AHF18D8PU1QWSR1TI4LWBP2B,HX095,HX095,3907X2AHF18D8PU1QWSR1TI4LWBP2B,3907X2AHF18D8PU1QWSR1TI4LWBP2B,268035,268035,,,,,,,,,,
,,,,6,28.666555,0,20,20,24,1,a flock of birds sits behind two bgger bird that sit on rcks,a flock of birds sits behind two bigger birds that sit on rocks,rensink,Birds,3,31,AIHUIAQ4922K3,2021-01-08_15h04.25.403,MetaAwareness,2020.1.2,Win32,60,3BC9H1KCYVFQ7ZMF518FE8WH3V5WYW,AIHUIAQ4922K3,3907X2AHF18D8PU1QWSR1TI4LWBP2B,HX095,HX095,3907X2AHF18D8PU1QWSR1TI4LWBP2B,3907X2AHF18D8PU1QWSR1TI4LWBP2B,268035,268035,,,,,,,,,,
,,,,2,9.89373,0,21,21,82,1,there is a reflection of a house in a pond and the reflection is cut off by the other shoreline,there is a reflection of a house in a pond and the reflection is complete in the pond,rensink,FarmByPond,3,31,AIHUIAQ4922K3,2021-01-08_15h04.25.403,MetaAwareness,2020.1.2,Win32,60,3BC9H1KCYVFQ7ZMF518FE8WH3V5WYW,AIHUIAQ4922K3,3907X2AHF18D8PU1QWSR1TI4LWBP2B,HX095,HX095,3907X2AHF18D8PU1QWSR1TI4LWBP2B,3907X2AHF18D8PU1QWSR1TI4LWBP2B,268035,268035,,,,,,,,,,
,,,,2,8.24352,0,22,22,175,1,a turtle on a beach with a man and the sky is blue,a turtle on a beach with a man and the sky is pink,rensink,Turtle,2,31,AIHUIAQ4922K3,2021-01-08_15h04.25.403,MetaAwareness,2020.1.2,Win32,60,3BC9H1KCYVFQ7ZMF518FE8WH3V5WYW,AIHUIAQ4922K3,3907X2AHF18D8PU1QWSR1TI4LWBP2B,HX095,HX095,3907X2AHF18D8PU1QWSR1TI4LWBP2B,3907X2AHF18D8PU1QWSR1TI4LWBP2B,268035,268035,,,,,,,,,,
,,,,3,10.102615,0,23,23,61,1,three people are standing in front of a brown post,three people are standing in front of a yellow post,rensink,Description,2,31,AIHUIAQ4922K3,2021-01-08_15h04.25.403,MetaAwareness,2020.1.2,Win32,60,3BC9H1KCYVFQ7ZMF518FE8WH3V5WYW,AIHUIAQ4922K3,3907X2AHF18D8PU1QWSR1TI4LWBP2B,HX095,HX095,3907X2AHF18D8PU1QWSR1TI4LWBP2B,3907X2AHF18D8PU1QWSR1TI4LWBP2B,268035,268035,,,,,,,,,,
,,,,2,12.770275,0,24,24,13,1,green grass with a wooden bundary,brown sand with a wooden boundary,rensink,BarnTrack,5,31,AIHUIAQ4922K3,2021-01-08_15h04.25.403,MetaAwareness,2020.1.2,Win32,60,3BC9H1KCYVFQ7ZMF518FE8WH3V5WYW,AIHUIAQ4922K3,3907X2AHF18D8PU1QWSR1TI4LWBP2B,HX095,HX095,3907X2AHF18D8PU1QWSR1TI4LWBP2B,3907X2AHF18D8PU1QWSR1TI4LWBP2B,268035,268035,,,,,,,,,,
,,,,2,8.84499,0,25,25,42,1,a european city scene reflected in rippling water,a european city scene with no reflection on calm water,rensink,CanalBridge,1,31,AIHUIAQ4922K3,2021-01-08_15h04.25.403,MetaAwareness,2020.1.2,Win32,60,3BC9H1KCYVFQ7ZMF518FE8WH3V5WYW,AIHUIAQ4922K3,3907X2AHF18D8PU1QWSR1TI4LWBP2B,HX095,HX095,3907X2AHF18D8PU1QWSR1TI4LWBP2B,3907X2AHF18D8PU1QWSR1TI4LWBP2B,268035,268035,,,,,,,,,,
,,,,3,9.01225,0,26,26,120,1,children sitting outside facing eachother with one child sitting in a yellow chair,children sitting outside facing eachother with one child sitting in a pink chair,rensink,Kids,8,31,AIHUIAQ4922K3,2021-01-08_15h04.25.403,MetaAwareness,2020.1.2,Win32,60,3BC9H1KCYVFQ7ZMF518FE8WH3V5WYW,AIHUIAQ4922K3,3907X2AHF18D8PU1QWSR1TI4LWBP2B,HX095,HX095,3907X2AHF18D8PU1QWSR1TI4LWBP2B,3907X2AHF18D8PU1QWSR1TI4LWBP2B,268035,268035,,,,,,,,,,
,,,,3,10.36264,0,27,27,45,1,"large homes are pictured in front of the marina, the homes are reflected in the water","large homes are pictured in front of the marina, the water is clear and blue",rensink,CanalBridge,6,31,AIHUIAQ4922K3,2021-01-08_15h04.25.403,MetaAwareness,2020.1.2,Win32,60,3BC9H1KCYVFQ7ZMF518FE8WH3V5WYW,AIHUIAQ4922K3,3907X2AHF18D8PU1QWSR1TI4LWBP2B,HX095,HX095,3907X2AHF18D8PU1QWSR1TI4LWBP2B,3907X2AHF18D8PU1QWSR1TI4LWBP2B,268035,268035,,,,,,,,,,
,,,,3,10.39669,0,28,28,154,1,three pilots standing in front of a helicoper that is in front of a grey building,three pilots standing in front of a helicopter that is in front of a yellow building,rensink,Pilots,2,31,AIHUIAQ4922K3,2021-01-08_15h04.25.403,MetaAwareness,2020.1.2,Win32,60,3BC9H1KCYVFQ7ZMF518FE8WH3V5WYW,AIHUIAQ4922K3,3907X2AHF18D8PU1QWSR1TI4LWBP2B,HX095,HX095,3907X2AHF18D8PU1QWSR1TI4LWBP2B,3907X2AHF18D8PU1QWSR1TI4LWBP2B,268035,268035,,,,,,,,,,
,,,,3,24.839395,0,29,29,53,1,a military plane that has a cord hanging down that looks attached to the truck driving in the grass below-  the shadow of the plane can be seen in the grass,a military plane that has a cord hanging down that looks attached to the truck driving in the grass but in this picture the shadow can only be seen of the truck,rensink,Chopper,3,31,AIHUIAQ4922K3,2021-01-08_15h04.25.403,MetaAwareness,2020.1.2,Win32,60,3BC9H1KCYVFQ7ZMF518FE8WH3V5WYW,AIHUIAQ4922K3,3907X2AHF18D8PU1QWSR1TI4LWBP2B,HX095,HX095,3907X2AHF18D8PU1QWSR1TI4LWBP2B,3907X2AHF18D8PU1QWSR1TI4LWBP2B,268035,268035,,,,,,,,,,
,,,,,,,,,,,,,,,,31,AIHUIAQ4922K3,2021-01-08_15h04.25.403,MetaAwareness,2020.1.2,Win32,60,3BC9H1KCYVFQ7ZMF518FE8WH3V5WYW,AIHUIAQ4922K3,3907X2AHF18D8PU1QWSR1TI4LWBP2B,HX095,HX095,3907X2AHF18D8PU1QWSR1TI4LWBP2B,3907X2AHF18D8PU1QWSR1TI4LWBP2B,268035,268035,6,57.947035,someone laying underneath a blue beach umbrella on a crowded beach,someone laying underneath a blue beach umbrella on a crowded beach,same,1,4.84787,members of a marching band crossing a track that all have feather plumes at the front of their hats,a cluttered and rustic looking cafe with 10 hanging lights,different
