consent_response.keys,consent_response.rt,key_resp_2.keys,key_resp_2.rt,user_resp.keys,user_resp.rt,trials.thisRepN,trials.thisTrialN,trials.thisN,trials.thisIndex,trials.ran,image_1_text,image_2_text,database,image,number,age,worker_ID,date,expName,psychopyVersion,OS,frameRate,hitId,workerId,assignmentId,a,tp_a,b,tp_b,c,tp_c,catch_same_resp.keys,catch_same_resp.rt,image_1_text_catch_same,image_2_text_catch_same,image_catch_same,catch_different_resp.keys,catch_different_resp.rt,image_1_text_catch_different,image_2_text_catch_different,image_catch_different
space,20.960165,space,14.93878,1,50.55816,0,0,0,11,1,the light here is a bit wide ,the light here is a bit msllaer from the first one ,ma,10810329,5,42,A1SOFLJOEQB591,2021-01-07_08h48.26.535,MetaAwareness,2020.1.2,MacIntel,60,3N5YJ55YXH6ZONFYXU3CF31J7QKNA4,A1SOFLJOEQB591,3W92K5RLWVKIC6AKUR3O5SAYQOVV5I,LK9W5,LK9W5,3W92K5RLWVKIC6AKUR3O5SAYQOVV5I,3W92K5RLWVKIC6AKUR3O5SAYQOVV5I,267585,267585,,,,,,,,,,
,,,,2,0.152895,0,1,1,274,1,various pieces of china include a yellow bowl with green paint inside,various pieces of china including a yellow bowl with white paint inside,ma,62224663,10,42,A1SOFLJOEQB591,2021-01-07_08h48.26.535,MetaAwareness,2020.1.2,MacIntel,60,3N5YJ55YXH6ZONFYXU3CF31J7QKNA4,A1SOFLJOEQB591,3W92K5RLWVKIC6AKUR3O5SAYQOVV5I,LK9W5,LK9W5,3W92K5RLWVKIC6AKUR3O5SAYQOVV5I,3W92K5RLWVKIC6AKUR3O5SAYQOVV5I,267585,267585,,,,,,,,,,
,,,,3,0.090445,0,2,2,118,1,a cafe with a red leather padded bench and wood table with a dart board above it on a green square. the dart board is on the lower portion of the square,a cafe with a red leather padded bench and wood table with a dart board centered above on a green square,ma,27857618,3,42,A1SOFLJOEQB591,2021-01-07_08h48.26.535,MetaAwareness,2020.1.2,MacIntel,60,3N5YJ55YXH6ZONFYXU3CF31J7QKNA4,A1SOFLJOEQB591,3W92K5RLWVKIC6AKUR3O5SAYQOVV5I,LK9W5,LK9W5,3W92K5RLWVKIC6AKUR3O5SAYQOVV5I,3W92K5RLWVKIC6AKUR3O5SAYQOVV5I,267585,267585,,,,,,,,,,
,,,,2,25.10982,0,3,3,225,1,a egg shape with smaller size and less ingredient has been added,a egg shape with larger size and maximum amount of ingredient has been added.,ma,51537628,5,42,A1SOFLJOEQB591,2021-01-07_08h48.26.535,MetaAwareness,2020.1.2,MacIntel,60,3N5YJ55YXH6ZONFYXU3CF31J7QKNA4,A1SOFLJOEQB591,3W92K5RLWVKIC6AKUR3O5SAYQOVV5I,LK9W5,LK9W5,3W92K5RLWVKIC6AKUR3O5SAYQOVV5I,3W92K5RLWVKIC6AKUR3O5SAYQOVV5I,267585,267585,,,,,,,,,,
,,,,1,4.41262,0,4,4,244,1,there's a peable there ,there's none here,ma,56835136,5,42,A1SOFLJOEQB591,2021-01-07_08h48.26.535,MetaAwareness,2020.1.2,MacIntel,60,3N5YJ55YXH6ZONFYXU3CF31J7QKNA4,A1SOFLJOEQB591,3W92K5RLWVKIC6AKUR3O5SAYQOVV5I,LK9W5,LK9W5,3W92K5RLWVKIC6AKUR3O5SAYQOVV5I,3W92K5RLWVKIC6AKUR3O5SAYQOVV5I,267585,267585,,,,,,,,,,
,,,,5,9.964775,0,5,5,287,1,a checkerboard sheet containing a set of contact information and titles of a company with the website on the bottom of the square.,a checkerboard sheet containing a set of contact information and titles of a company with the website in the middle of the square,ma,69128765,7,42,A1SOFLJOEQB591,2021-01-07_08h48.26.535,MetaAwareness,2020.1.2,MacIntel,60,3N5YJ55YXH6ZONFYXU3CF31J7QKNA4,A1SOFLJOEQB591,3W92K5RLWVKIC6AKUR3O5SAYQOVV5I,LK9W5,LK9W5,3W92K5RLWVKIC6AKUR3O5SAYQOVV5I,3W92K5RLWVKIC6AKUR3O5SAYQOVV5I,267585,267585,,,,,,,,,,
,,,,5,11.7753,0,6,6,339,1,a collection of heart shaped trinkets with an orange heart turned to the left.,a collection of heart shaped trinkets with an orange heart turned at 45 degree angle to the left,ma,75958241,5,42,A1SOFLJOEQB591,2021-01-07_08h48.26.535,MetaAwareness,2020.1.2,MacIntel,60,3N5YJ55YXH6ZONFYXU3CF31J7QKNA4,A1SOFLJOEQB591,3W92K5RLWVKIC6AKUR3O5SAYQOVV5I,LK9W5,LK9W5,3W92K5RLWVKIC6AKUR3O5SAYQOVV5I,3W92K5RLWVKIC6AKUR3O5SAYQOVV5I,267585,267585,,,,,,,,,,
,,,,4,10.196155,0,7,7,18,1,a small game resembling a pool table has colored pieces on the table.  the one in yellow box is black.,a small game resembling a pool table has colored pieces on the table.  the one in the yellow box is white.,ma,1191801,2,42,A1SOFLJOEQB591,2021-01-07_08h48.26.535,MetaAwareness,2020.1.2,MacIntel,60,3N5YJ55YXH6ZONFYXU3CF31J7QKNA4,A1SOFLJOEQB591,3W92K5RLWVKIC6AKUR3O5SAYQOVV5I,LK9W5,LK9W5,3W92K5RLWVKIC6AKUR3O5SAYQOVV5I,3W92K5RLWVKIC6AKUR3O5SAYQOVV5I,267585,267585,,,,,,,,,,
,,,,5,6.20746,0,8,8,181,1,a work bench with a variety of tools including a pencil and a hammer.,a work bench with a variety of tools including a hammer.,ma,45525109,3,42,A1SOFLJOEQB591,2021-01-07_08h48.26.535,MetaAwareness,2020.1.2,MacIntel,60,3N5YJ55YXH6ZONFYXU3CF31J7QKNA4,A1SOFLJOEQB591,3W92K5RLWVKIC6AKUR3O5SAYQOVV5I,LK9W5,LK9W5,3W92K5RLWVKIC6AKUR3O5SAYQOVV5I,3W92K5RLWVKIC6AKUR3O5SAYQOVV5I,267585,267585,,,,,,,,,,
,,,,6,8.97533,0,9,9,115,1,elephant keychains laying on a table cloth with french writing ,elephant keychains laying on a tablecloth with the french word des emphasized,ma,25107991,6,42,A1SOFLJOEQB591,2021-01-07_08h48.26.535,MetaAwareness,2020.1.2,MacIntel,60,3N5YJ55YXH6ZONFYXU3CF31J7QKNA4,A1SOFLJOEQB591,3W92K5RLWVKIC6AKUR3O5SAYQOVV5I,LK9W5,LK9W5,3W92K5RLWVKIC6AKUR3O5SAYQOVV5I,3W92K5RLWVKIC6AKUR3O5SAYQOVV5I,267585,267585,,,,,,,,,,
,,,,5,9.269025,0,10,10,213,1,a beautiful rabbit doll with purple legs and bunch of toys.,a beautiful rabbit doll with blue legs and bunch of toys.,ma,48384711,12,42,A1SOFLJOEQB591,2021-01-07_08h48.26.535,MetaAwareness,2020.1.2,MacIntel,60,3N5YJ55YXH6ZONFYXU3CF31J7QKNA4,A1SOFLJOEQB591,3W92K5RLWVKIC6AKUR3O5SAYQOVV5I,LK9W5,LK9W5,3W92K5RLWVKIC6AKUR3O5SAYQOVV5I,3W92K5RLWVKIC6AKUR3O5SAYQOVV5I,267585,267585,,,,,,,,,,
,,,,5,15.807745,0,11,11,327,1,a shelf which displays objects including two instruments with their needles pointing upward,"a shelf which displays objects including two instruments, one with its needle pointing up and the other with its needle pointing slightly to the right.",ma,74173745,7,42,A1SOFLJOEQB591,2021-01-07_08h48.26.535,MetaAwareness,2020.1.2,MacIntel,60,3N5YJ55YXH6ZONFYXU3CF31J7QKNA4,A1SOFLJOEQB591,3W92K5RLWVKIC6AKUR3O5SAYQOVV5I,LK9W5,LK9W5,3W92K5RLWVKIC6AKUR3O5SAYQOVV5I,3W92K5RLWVKIC6AKUR3O5SAYQOVV5I,267585,267585,,,,,,,,,,
,,,,6,3.848375,0,12,12,415,1,the picture is like a scenerio,the picture is a sea,ma,83691215,3,42,A1SOFLJOEQB591,2021-01-07_08h48.26.535,MetaAwareness,2020.1.2,MacIntel,60,3N5YJ55YXH6ZONFYXU3CF31J7QKNA4,A1SOFLJOEQB591,3W92K5RLWVKIC6AKUR3O5SAYQOVV5I,LK9W5,LK9W5,3W92K5RLWVKIC6AKUR3O5SAYQOVV5I,3W92K5RLWVKIC6AKUR3O5SAYQOVV5I,267585,267585,,,,,,,,,,
,,,,5,5.64818,0,13,13,30,1,a parachute with gas fire at pink color edges.,a parachute with gas fire at yellow color edges.,ma,12178414,1,42,A1SOFLJOEQB591,2021-01-07_08h48.26.535,MetaAwareness,2020.1.2,MacIntel,60,3N5YJ55YXH6ZONFYXU3CF31J7QKNA4,A1SOFLJOEQB591,3W92K5RLWVKIC6AKUR3O5SAYQOVV5I,LK9W5,LK9W5,3W92K5RLWVKIC6AKUR3O5SAYQOVV5I,3W92K5RLWVKIC6AKUR3O5SAYQOVV5I,267585,267585,,,,,,,,,,
,,,,5,8.62285,0,14,14,134,1,a birthday cake with a toybox and toys in it. the star is upside down .,a birthday cake with a toybox and toys in it. the star is rightside up,ma,32289063,4,42,A1SOFLJOEQB591,2021-01-07_08h48.26.535,MetaAwareness,2020.1.2,MacIntel,60,3N5YJ55YXH6ZONFYXU3CF31J7QKNA4,A1SOFLJOEQB591,3W92K5RLWVKIC6AKUR3O5SAYQOVV5I,LK9W5,LK9W5,3W92K5RLWVKIC6AKUR3O5SAYQOVV5I,3W92K5RLWVKIC6AKUR3O5SAYQOVV5I,267585,267585,,,,,,,,,,
,,,,6,13.422145,0,15,15,73,1,pirate-themed cupcakes with a small pirate with a red bandana and eyepatch decoration with brown bags in the back with a smiley face on them,pirate themed cupcakes with a small pirates with red bandana and eyepatch decorations with brown bags with a smiley face on them,ma,18345691,3,42,A1SOFLJOEQB591,2021-01-07_08h48.26.535,MetaAwareness,2020.1.2,MacIntel,60,3N5YJ55YXH6ZONFYXU3CF31J7QKNA4,A1SOFLJOEQB591,3W92K5RLWVKIC6AKUR3O5SAYQOVV5I,LK9W5,LK9W5,3W92K5RLWVKIC6AKUR3O5SAYQOVV5I,3W92K5RLWVKIC6AKUR3O5SAYQOVV5I,267585,267585,,,,,,,,,,
,,,,5,11.59111,0,16,16,215,1,sushi dish with a long piece of white sushi,sushu dish with a white short piece of sushi,ma,48486405,2,42,A1SOFLJOEQB591,2021-01-07_08h48.26.535,MetaAwareness,2020.1.2,MacIntel,60,3N5YJ55YXH6ZONFYXU3CF31J7QKNA4,A1SOFLJOEQB591,3W92K5RLWVKIC6AKUR3O5SAYQOVV5I,LK9W5,LK9W5,3W92K5RLWVKIC6AKUR3O5SAYQOVV5I,3W92K5RLWVKIC6AKUR3O5SAYQOVV5I,267585,267585,,,,,,,,,,
,,,,6,9.98544,0,17,17,460,1,a table with craft and sewing stuff with organizers,a table with arts and crafts things and organizers,ma,89354846,4,42,A1SOFLJOEQB591,2021-01-07_08h48.26.535,MetaAwareness,2020.1.2,MacIntel,60,3N5YJ55YXH6ZONFYXU3CF31J7QKNA4,A1SOFLJOEQB591,3W92K5RLWVKIC6AKUR3O5SAYQOVV5I,LK9W5,LK9W5,3W92K5RLWVKIC6AKUR3O5SAYQOVV5I,3W92K5RLWVKIC6AKUR3O5SAYQOVV5I,267585,267585,,,,,,,,,,
,,,,5,4.855265,0,18,18,365,1,"a table of desserts, in the center a green ribbon","a table of desserts, in the center a brown ribbon",ma,77793328,5,42,A1SOFLJOEQB591,2021-01-07_08h48.26.535,MetaAwareness,2020.1.2,MacIntel,60,3N5YJ55YXH6ZONFYXU3CF31J7QKNA4,A1SOFLJOEQB591,3W92K5RLWVKIC6AKUR3O5SAYQOVV5I,LK9W5,LK9W5,3W92K5RLWVKIC6AKUR3O5SAYQOVV5I,3W92K5RLWVKIC6AKUR3O5SAYQOVV5I,267585,267585,,,,,,,,,,
,,,,5,6.18495,0,19,19,334,1,decorated cookies with a reindeer at an angle  ,decorated cookies with a reindeer straight on the plate,ma,75081153,5,42,A1SOFLJOEQB591,2021-01-07_08h48.26.535,MetaAwareness,2020.1.2,MacIntel,60,3N5YJ55YXH6ZONFYXU3CF31J7QKNA4,A1SOFLJOEQB591,3W92K5RLWVKIC6AKUR3O5SAYQOVV5I,LK9W5,LK9W5,3W92K5RLWVKIC6AKUR3O5SAYQOVV5I,3W92K5RLWVKIC6AKUR3O5SAYQOVV5I,267585,267585,,,,,,,,,,
,,,,5,5.00314,0,20,20,414,1,picture gallery on wall with all pictures straight up,picture gallery on wall with one picture upside down,ma,83691215,2,42,A1SOFLJOEQB591,2021-01-07_08h48.26.535,MetaAwareness,2020.1.2,MacIntel,60,3N5YJ55YXH6ZONFYXU3CF31J7QKNA4,A1SOFLJOEQB591,3W92K5RLWVKIC6AKUR3O5SAYQOVV5I,LK9W5,LK9W5,3W92K5RLWVKIC6AKUR3O5SAYQOVV5I,3W92K5RLWVKIC6AKUR3O5SAYQOVV5I,267585,267585,,,,,,,,,,
,,,,6,23.22463,0,21,21,420,1,neatly arranged photos in frames on a wall with one smaller photo in a frame with a backgroun of a tree and a hill,neatly arranged photos in frames on a wall with one smaller photo in a frame of another scene,ma,83691215,8,42,A1SOFLJOEQB591,2021-01-07_08h48.26.535,MetaAwareness,2020.1.2,MacIntel,60,3N5YJ55YXH6ZONFYXU3CF31J7QKNA4,A1SOFLJOEQB591,3W92K5RLWVKIC6AKUR3O5SAYQOVV5I,LK9W5,LK9W5,3W92K5RLWVKIC6AKUR3O5SAYQOVV5I,3W92K5RLWVKIC6AKUR3O5SAYQOVV5I,267585,267585,,,,,,,,,,
,,,,5,8.82138,0,22,22,442,1,a picture of a table set up for dinner. the table is covered with a table cloth that has printings of red and yellow flowers.,a picture of a table set up for dinner. the table is covered with a table cloth that has printings of red flowers.,ma,87983207,1,42,A1SOFLJOEQB591,2021-01-07_08h48.26.535,MetaAwareness,2020.1.2,MacIntel,60,3N5YJ55YXH6ZONFYXU3CF31J7QKNA4,A1SOFLJOEQB591,3W92K5RLWVKIC6AKUR3O5SAYQOVV5I,LK9W5,LK9W5,3W92K5RLWVKIC6AKUR3O5SAYQOVV5I,3W92K5RLWVKIC6AKUR3O5SAYQOVV5I,267585,267585,,,,,,,,,,
,,,,5,13.04131,0,23,23,90,1,a wooden framed quilt with houses one is a purple house with a square window in the middle there is also houses besides the frame,a wooden framed quilt with houss one is a purple house with a rectangular window near the top of the side of the house there is also houses besides the frame,ma,23024660,7,42,A1SOFLJOEQB591,2021-01-07_08h48.26.535,MetaAwareness,2020.1.2,MacIntel,60,3N5YJ55YXH6ZONFYXU3CF31J7QKNA4,A1SOFLJOEQB591,3W92K5RLWVKIC6AKUR3O5SAYQOVV5I,LK9W5,LK9W5,3W92K5RLWVKIC6AKUR3O5SAYQOVV5I,3W92K5RLWVKIC6AKUR3O5SAYQOVV5I,267585,267585,,,,,,,,,,
,,,,5,8.52641,0,24,24,228,1,a table of appetizers consisting of a tray of deviled eggs. the furtherst egg being pointed directly staight ahead,a table of appetizers consisting of a tray of deviled eggs. the furtherst eggs is pointed sideways ,ma,51537628,8,42,A1SOFLJOEQB591,2021-01-07_08h48.26.535,MetaAwareness,2020.1.2,MacIntel,60,3N5YJ55YXH6ZONFYXU3CF31J7QKNA4,A1SOFLJOEQB591,3W92K5RLWVKIC6AKUR3O5SAYQOVV5I,LK9W5,LK9W5,3W92K5RLWVKIC6AKUR3O5SAYQOVV5I,3W92K5RLWVKIC6AKUR3O5SAYQOVV5I,267585,267585,,,,,,,,,,
,,,,5,5.08474,0,25,25,363,1,a variety of desserts including one that is tied wuth a green ribbon.,a variety of desserts inclusing one that is tied with a brown ribbon.,ma,77793328,3,42,A1SOFLJOEQB591,2021-01-07_08h48.26.535,MetaAwareness,2020.1.2,MacIntel,60,3N5YJ55YXH6ZONFYXU3CF31J7QKNA4,A1SOFLJOEQB591,3W92K5RLWVKIC6AKUR3O5SAYQOVV5I,LK9W5,LK9W5,3W92K5RLWVKIC6AKUR3O5SAYQOVV5I,3W92K5RLWVKIC6AKUR3O5SAYQOVV5I,267585,267585,,,,,,,,,,
,,,,1,2.87001,0,26,26,246,1,there's a violin box here,there's nothing here ,ma,57861456,1,42,A1SOFLJOEQB591,2021-01-07_08h48.26.535,MetaAwareness,2020.1.2,MacIntel,60,3N5YJ55YXH6ZONFYXU3CF31J7QKNA4,A1SOFLJOEQB591,3W92K5RLWVKIC6AKUR3O5SAYQOVV5I,LK9W5,LK9W5,3W92K5RLWVKIC6AKUR3O5SAYQOVV5I,3W92K5RLWVKIC6AKUR3O5SAYQOVV5I,267585,267585,,,,,,,,,,
,,,,5,6.77108,0,27,27,88,1,village pieces with a village quilt frame behind it the house has a large window,willage pieces with a village quilt frame behind it the house has a small window,ma,23024660,5,42,A1SOFLJOEQB591,2021-01-07_08h48.26.535,MetaAwareness,2020.1.2,MacIntel,60,3N5YJ55YXH6ZONFYXU3CF31J7QKNA4,A1SOFLJOEQB591,3W92K5RLWVKIC6AKUR3O5SAYQOVV5I,LK9W5,LK9W5,3W92K5RLWVKIC6AKUR3O5SAYQOVV5I,3W92K5RLWVKIC6AKUR3O5SAYQOVV5I,267585,267585,,,,,,,,,,
,,,,5,6.508445,0,28,28,173,1,"office desk with shelving onthe wall that holds two plastic containers, one  labelled high and one low.","office desk with shelving on the wall that holds two plastic containers, both with labels near their top.",ma,4247084,8,42,A1SOFLJOEQB591,2021-01-07_08h48.26.535,MetaAwareness,2020.1.2,MacIntel,60,3N5YJ55YXH6ZONFYXU3CF31J7QKNA4,A1SOFLJOEQB591,3W92K5RLWVKIC6AKUR3O5SAYQOVV5I,LK9W5,LK9W5,3W92K5RLWVKIC6AKUR3O5SAYQOVV5I,3W92K5RLWVKIC6AKUR3O5SAYQOVV5I,267585,267585,,,,,,,,,,
,,,,4,10.625035,0,29,29,312,1,halloween themed candies with a cat that has a right-tilted orange bat on its chest.,halloween themed candies with a cat that has a left-tilted bat on its chest.,ma,72488522,12,42,A1SOFLJOEQB591,2021-01-07_08h48.26.535,MetaAwareness,2020.1.2,MacIntel,60,3N5YJ55YXH6ZONFYXU3CF31J7QKNA4,A1SOFLJOEQB591,3W92K5RLWVKIC6AKUR3O5SAYQOVV5I,LK9W5,LK9W5,3W92K5RLWVKIC6AKUR3O5SAYQOVV5I,3W92K5RLWVKIC6AKUR3O5SAYQOVV5I,267585,267585,,,,,,,,,,
,,,,,,,,,,,,,,,,42,A1SOFLJOEQB591,2021-01-07_08h48.26.535,MetaAwareness,2020.1.2,MacIntel,60,3N5YJ55YXH6ZONFYXU3CF31J7QKNA4,A1SOFLJOEQB591,3W92K5RLWVKIC6AKUR3O5SAYQOVV5I,LK9W5,LK9W5,3W92K5RLWVKIC6AKUR3O5SAYQOVV5I,3W92K5RLWVKIC6AKUR3O5SAYQOVV5I,267585,267585,5,11.930565,someone laying underneath a blue beach umbrella on a crowded beach,someone laying underneath a blue beach umbrella on a crowded beach,same,1,14.951295,members of a marching band crossing a track that all have feather plumes at the front of their hats,a cluttered and rustic looking cafe with 10 hanging lights,different