consent_response.keys,consent_response.rt,key_resp_2.keys,key_resp_2.rt,user_resp.keys,user_resp.rt,trials.thisRepN,trials.thisTrialN,trials.thisN,trials.thisIndex,trials.ran,image_1_text,image_2_text,database,image,number,age,worker_ID,date,expName,psychopyVersion,OS,frameRate,hitId,workerId,assignmentId,a,tp_a,b,tp_b,c,tp_c,catch_same_resp.keys,catch_same_resp.rt,image_1_text_catch_same,image_2_text_catch_same,image_catch_same,catch_different_resp.keys,catch_different_resp.rt,image_1_text_catch_different,image_2_text_catch_different,image_catch_different
space,4.226105,space,11.664495,5,22.469215,0,0,0,44,1,a figurine of a small dog outside with a yellow toy on the ground.,a figurine of  a small dog outside with a red toy on the ground.,ma,13141692,4,60,A1V2H0UF94ATWY,2021-01-07_09h05.30.640,MetaAwareness,2020.1.2,Win32,60,3N5YJ55YXH6ZONFYXU3CF31J7QKNA4,A1V2H0UF94ATWY,3MRNMEIQW69AKEDJVTJ1GV0OC7RLDX,QMRM5,QMRM5,3MRNMEIQW69AKEDJVTJ1GV0OC7RLDX,3MRNMEIQW69AKEDJVTJ1GV0OC7RLDX,267585,267585,,,,,,,,,,
,,,,5,33.88628,0,1,1,166,1,a table with a computer and a box on the top shelf with label on the bottom of the box,a table with a computer and a box on the top shelf with label on the top of the box,ma,4247084,1,60,A1V2H0UF94ATWY,2021-01-07_09h05.30.640,MetaAwareness,2020.1.2,Win32,60,3N5YJ55YXH6ZONFYXU3CF31J7QKNA4,A1V2H0UF94ATWY,3MRNMEIQW69AKEDJVTJ1GV0OC7RLDX,QMRM5,QMRM5,3MRNMEIQW69AKEDJVTJ1GV0OC7RLDX,3MRNMEIQW69AKEDJVTJ1GV0OC7RLDX,267585,267585,,,,,,,,,,
,,,,4,9.971615,0,2,2,367,1,a table with elegant desserts and flowere decorations,a table with delicious desserts and flowers and bows,ma,77793328,7,60,A1V2H0UF94ATWY,2021-01-07_09h05.30.640,MetaAwareness,2020.1.2,Win32,60,3N5YJ55YXH6ZONFYXU3CF31J7QKNA4,A1V2H0UF94ATWY,3MRNMEIQW69AKEDJVTJ1GV0OC7RLDX,QMRM5,QMRM5,3MRNMEIQW69AKEDJVTJ1GV0OC7RLDX,3MRNMEIQW69AKEDJVTJ1GV0OC7RLDX,267585,267585,,,,,,,,,,
,,,,3,15.917235,0,3,3,68,1,a ruffled circular blanket with different yellow pears and a pear with red dot without a stem.,a ruffled circular blanket with different yellow pears and a pear with  small red dots and a stem with a  leaf.,ma,18169626,2,60,A1V2H0UF94ATWY,2021-01-07_09h05.30.640,MetaAwareness,2020.1.2,Win32,60,3N5YJ55YXH6ZONFYXU3CF31J7QKNA4,A1V2H0UF94ATWY,3MRNMEIQW69AKEDJVTJ1GV0OC7RLDX,QMRM5,QMRM5,3MRNMEIQW69AKEDJVTJ1GV0OC7RLDX,3MRNMEIQW69AKEDJVTJ1GV0OC7RLDX,267585,267585,,,,,,,,,,
,,,,3,14.219185,0,4,4,459,1,a craft room with three red storage bins one has 2 handles on the front,a craft room with three red storage bins all identical with one handle each,ma,89354846,3,60,A1V2H0UF94ATWY,2021-01-07_09h05.30.640,MetaAwareness,2020.1.2,Win32,60,3N5YJ55YXH6ZONFYXU3CF31J7QKNA4,A1V2H0UF94ATWY,3MRNMEIQW69AKEDJVTJ1GV0OC7RLDX,QMRM5,QMRM5,3MRNMEIQW69AKEDJVTJ1GV0OC7RLDX,3MRNMEIQW69AKEDJVTJ1GV0OC7RLDX,267585,267585,,,,,,,,,,
,,,,4,24.46783,0,5,5,389,1,a decorated bedroom the poster in the yellow box in longer than the other picture.,a decorated bedroom the poster in the yellow box is shorter in this picture.,ma,79573638,1,60,A1V2H0UF94ATWY,2021-01-07_09h05.30.640,MetaAwareness,2020.1.2,Win32,60,3N5YJ55YXH6ZONFYXU3CF31J7QKNA4,A1V2H0UF94ATWY,3MRNMEIQW69AKEDJVTJ1GV0OC7RLDX,QMRM5,QMRM5,3MRNMEIQW69AKEDJVTJ1GV0OC7RLDX,3MRNMEIQW69AKEDJVTJ1GV0OC7RLDX,267585,267585,,,,,,,,,,
,,,,4,15.60982,0,6,6,176,1,a bunch of christmas cookies sit on a plate. the cookie in the bottom right corner has a small snowflake design.,a bunchof christmas cookies sit on a plate. the cookie in the bottom right corner has a large snowflake design.,ma,44993860,3,60,A1V2H0UF94ATWY,2021-01-07_09h05.30.640,MetaAwareness,2020.1.2,Win32,60,3N5YJ55YXH6ZONFYXU3CF31J7QKNA4,A1V2H0UF94ATWY,3MRNMEIQW69AKEDJVTJ1GV0OC7RLDX,QMRM5,QMRM5,3MRNMEIQW69AKEDJVTJ1GV0OC7RLDX,3MRNMEIQW69AKEDJVTJ1GV0OC7RLDX,267585,267585,,,,,,,,,,
,,,,3,31.659195,0,7,7,357,1,a table with dishes and a vase with yellow and blue flowers,a table with flowers and a lot of blue flowers with dishes,ma,77574131,4,60,A1V2H0UF94ATWY,2021-01-07_09h05.30.640,MetaAwareness,2020.1.2,Win32,60,3N5YJ55YXH6ZONFYXU3CF31J7QKNA4,A1V2H0UF94ATWY,3MRNMEIQW69AKEDJVTJ1GV0OC7RLDX,QMRM5,QMRM5,3MRNMEIQW69AKEDJVTJ1GV0OC7RLDX,3MRNMEIQW69AKEDJVTJ1GV0OC7RLDX,267585,267585,,,,,,,,,,
,,,,3,22.63567,0,8,8,274,1,various pieces of china include a yellow bowl with green paint inside,various pieces of china including a yellow bowl with white paint inside,ma,62224663,10,60,A1V2H0UF94ATWY,2021-01-07_09h05.30.640,MetaAwareness,2020.1.2,Win32,60,3N5YJ55YXH6ZONFYXU3CF31J7QKNA4,A1V2H0UF94ATWY,3MRNMEIQW69AKEDJVTJ1GV0OC7RLDX,QMRM5,QMRM5,3MRNMEIQW69AKEDJVTJ1GV0OC7RLDX,3MRNMEIQW69AKEDJVTJ1GV0OC7RLDX,267585,267585,,,,,,,,,,
,,,,4,40.10769,0,9,9,365,1,"a table of desserts, in the center a green ribbon","a table of desserts, in the center a brown ribbon",ma,77793328,5,60,A1V2H0UF94ATWY,2021-01-07_09h05.30.640,MetaAwareness,2020.1.2,Win32,60,3N5YJ55YXH6ZONFYXU3CF31J7QKNA4,A1V2H0UF94ATWY,3MRNMEIQW69AKEDJVTJ1GV0OC7RLDX,QMRM5,QMRM5,3MRNMEIQW69AKEDJVTJ1GV0OC7RLDX,3MRNMEIQW69AKEDJVTJ1GV0OC7RLDX,267585,267585,,,,,,,,,,
,,,,4,11.65872,0,10,10,191,1,a brown cake with face features  and a yellow mouth is put next to a big red cake on a bakery shelf.,a brown cake with face features and a red mouth is put next to a big red cake on a bakery shelf.,ma,46635293,1,60,A1V2H0UF94ATWY,2021-01-07_09h05.30.640,MetaAwareness,2020.1.2,Win32,60,3N5YJ55YXH6ZONFYXU3CF31J7QKNA4,A1V2H0UF94ATWY,3MRNMEIQW69AKEDJVTJ1GV0OC7RLDX,QMRM5,QMRM5,3MRNMEIQW69AKEDJVTJ1GV0OC7RLDX,3MRNMEIQW69AKEDJVTJ1GV0OC7RLDX,267585,267585,,,,,,,,,,
,,,,3,6.922595,0,11,11,437,1,a candy setup with a broken stick on the right,a candy setup with perfect stick candies,ma,86520382,2,60,A1V2H0UF94ATWY,2021-01-07_09h05.30.640,MetaAwareness,2020.1.2,Win32,60,3N5YJ55YXH6ZONFYXU3CF31J7QKNA4,A1V2H0UF94ATWY,3MRNMEIQW69AKEDJVTJ1GV0OC7RLDX,QMRM5,QMRM5,3MRNMEIQW69AKEDJVTJ1GV0OC7RLDX,3MRNMEIQW69AKEDJVTJ1GV0OC7RLDX,267585,267585,,,,,,,,,,
,,,,5,12.891875,0,12,12,197,1, a selection of cakes and pastries are on display. a cake in the foreground has a face with a yellowing smiling mouth,a selectin of cases and pastries are on display. a cake in the foreground has a face with a red smiling mouth,ma,46635293,7,60,A1V2H0UF94ATWY,2021-01-07_09h05.30.640,MetaAwareness,2020.1.2,Win32,60,3N5YJ55YXH6ZONFYXU3CF31J7QKNA4,A1V2H0UF94ATWY,3MRNMEIQW69AKEDJVTJ1GV0OC7RLDX,QMRM5,QMRM5,3MRNMEIQW69AKEDJVTJ1GV0OC7RLDX,3MRNMEIQW69AKEDJVTJ1GV0OC7RLDX,267585,267585,,,,,,,,,,
,,,,5,9.37116,0,13,13,266,1,a yellow bowl with a light green inside.,a yellow bowl with a beige colored inside,ma,62224663,2,60,A1V2H0UF94ATWY,2021-01-07_09h05.30.640,MetaAwareness,2020.1.2,Win32,60,3N5YJ55YXH6ZONFYXU3CF31J7QKNA4,A1V2H0UF94ATWY,3MRNMEIQW69AKEDJVTJ1GV0OC7RLDX,QMRM5,QMRM5,3MRNMEIQW69AKEDJVTJ1GV0OC7RLDX,3MRNMEIQW69AKEDJVTJ1GV0OC7RLDX,267585,267585,,,,,,,,,,
,,,,5,4.70729,0,14,14,430,1,a variety of colorful lamps and one with a yellow top,a variety of colored lamps and one  with a white top.,ma,85741618,1,60,A1V2H0UF94ATWY,2021-01-07_09h05.30.640,MetaAwareness,2020.1.2,Win32,60,3N5YJ55YXH6ZONFYXU3CF31J7QKNA4,A1V2H0UF94ATWY,3MRNMEIQW69AKEDJVTJ1GV0OC7RLDX,QMRM5,QMRM5,3MRNMEIQW69AKEDJVTJ1GV0OC7RLDX,3MRNMEIQW69AKEDJVTJ1GV0OC7RLDX,267585,267585,,,,,,,,,,
,,,,5,11.416595,0,15,15,435,1,"near the big light, middle light is coated with green color","near te big light, middle light is coated wth white color",ma,85741618,6,60,A1V2H0UF94ATWY,2021-01-07_09h05.30.640,MetaAwareness,2020.1.2,Win32,60,3N5YJ55YXH6ZONFYXU3CF31J7QKNA4,A1V2H0UF94ATWY,3MRNMEIQW69AKEDJVTJ1GV0OC7RLDX,QMRM5,QMRM5,3MRNMEIQW69AKEDJVTJ1GV0OC7RLDX,3MRNMEIQW69AKEDJVTJ1GV0OC7RLDX,267585,267585,,,,,,,,,,
,,,,5,8.61698,0,16,16,33,1,four brightly colored panels on hot air like balloon with small patch of pink,four brightly colored panels on hot air like baloon,ma,12178414,4,60,A1V2H0UF94ATWY,2021-01-07_09h05.30.640,MetaAwareness,2020.1.2,Win32,60,3N5YJ55YXH6ZONFYXU3CF31J7QKNA4,A1V2H0UF94ATWY,3MRNMEIQW69AKEDJVTJ1GV0OC7RLDX,QMRM5,QMRM5,3MRNMEIQW69AKEDJVTJ1GV0OC7RLDX,3MRNMEIQW69AKEDJVTJ1GV0OC7RLDX,267585,267585,,,,,,,,,,
,,,,3,12.63359,0,17,17,446,1,a set dinner table with a floral covering. one flower in the pattern is orange rather than red.,a set dinner table with a floral covering. all flowers in the pattern are red.,ma,87983207,5,60,A1V2H0UF94ATWY,2021-01-07_09h05.30.640,MetaAwareness,2020.1.2,Win32,60,3N5YJ55YXH6ZONFYXU3CF31J7QKNA4,A1V2H0UF94ATWY,3MRNMEIQW69AKEDJVTJ1GV0OC7RLDX,QMRM5,QMRM5,3MRNMEIQW69AKEDJVTJ1GV0OC7RLDX,3MRNMEIQW69AKEDJVTJ1GV0OC7RLDX,267585,267585,,,,,,,,,,
,,,,4,20.366215,0,18,18,124,1,a blanket with children's handprints and a fruit tile including a green apple,a blanket with chiden's handprints and fruit tile including and orange apple,ma,3099758,3,60,A1V2H0UF94ATWY,2021-01-07_09h05.30.640,MetaAwareness,2020.1.2,Win32,60,3N5YJ55YXH6ZONFYXU3CF31J7QKNA4,A1V2H0UF94ATWY,3MRNMEIQW69AKEDJVTJ1GV0OC7RLDX,QMRM5,QMRM5,3MRNMEIQW69AKEDJVTJ1GV0OC7RLDX,3MRNMEIQW69AKEDJVTJ1GV0OC7RLDX,267585,267585,,,,,,,,,,
,,,,3,14.50717,0,19,19,173,1,"office desk with shelving onthe wall that holds two plastic containers, one  labelled high and one low.","office desk with shelving on the wall that holds two plastic containers, both with labels near their top.",ma,4247084,8,60,A1V2H0UF94ATWY,2021-01-07_09h05.30.640,MetaAwareness,2020.1.2,Win32,60,3N5YJ55YXH6ZONFYXU3CF31J7QKNA4,A1V2H0UF94ATWY,3MRNMEIQW69AKEDJVTJ1GV0OC7RLDX,QMRM5,QMRM5,3MRNMEIQW69AKEDJVTJ1GV0OC7RLDX,3MRNMEIQW69AKEDJVTJ1GV0OC7RLDX,267585,267585,,,,,,,,,,
,,,,3,10.428275,0,20,20,141,1,a picture of various dimetrodon toys including a small silver one,"a picture of dimetrodon toys of various colors and sizes, including a small, silver toy at the bottom center.",ma,38466626,1,60,A1V2H0UF94ATWY,2021-01-07_09h05.30.640,MetaAwareness,2020.1.2,Win32,60,3N5YJ55YXH6ZONFYXU3CF31J7QKNA4,A1V2H0UF94ATWY,3MRNMEIQW69AKEDJVTJ1GV0OC7RLDX,QMRM5,QMRM5,3MRNMEIQW69AKEDJVTJ1GV0OC7RLDX,3MRNMEIQW69AKEDJVTJ1GV0OC7RLDX,267585,267585,,,,,,,,,,
,,,,3,12.683865,0,21,21,325,1,a wooden shelf with a variety of books and objects and a glass clock at 11 oclock,a wooden shelf with a variety of books and objects and a glass clock at 2 oclock,ma,74173745,5,60,A1V2H0UF94ATWY,2021-01-07_09h05.30.640,MetaAwareness,2020.1.2,Win32,60,3N5YJ55YXH6ZONFYXU3CF31J7QKNA4,A1V2H0UF94ATWY,3MRNMEIQW69AKEDJVTJ1GV0OC7RLDX,QMRM5,QMRM5,3MRNMEIQW69AKEDJVTJ1GV0OC7RLDX,3MRNMEIQW69AKEDJVTJ1GV0OC7RLDX,267585,267585,,,,,,,,,,
,,,,3,13.983555,0,22,22,462,1,a craft room with the three red baskets all with one rectangular hole except one that has two holes.,a craft room with three red baskets all with one rectangular hole. ,ma,89354846,6,60,A1V2H0UF94ATWY,2021-01-07_09h05.30.640,MetaAwareness,2020.1.2,Win32,60,3N5YJ55YXH6ZONFYXU3CF31J7QKNA4,A1V2H0UF94ATWY,3MRNMEIQW69AKEDJVTJ1GV0OC7RLDX,QMRM5,QMRM5,3MRNMEIQW69AKEDJVTJ1GV0OC7RLDX,3MRNMEIQW69AKEDJVTJ1GV0OC7RLDX,267585,267585,,,,,,,,,,
,,,,3,9.307465,0,23,23,382,1,a blanket with letters and numbers stiched on. the green 4 is too close the the pink g,a blanket with letters and numbers stitched on. the green 4 is evenly spaced from the pink g now closer to the top of the blanket,ma,79222679,5,60,A1V2H0UF94ATWY,2021-01-07_09h05.30.640,MetaAwareness,2020.1.2,Win32,60,3N5YJ55YXH6ZONFYXU3CF31J7QKNA4,A1V2H0UF94ATWY,3MRNMEIQW69AKEDJVTJ1GV0OC7RLDX,QMRM5,QMRM5,3MRNMEIQW69AKEDJVTJ1GV0OC7RLDX,3MRNMEIQW69AKEDJVTJ1GV0OC7RLDX,267585,267585,,,,,,,,,,
,,,,3,8.50201,0,24,24,188,1,"ingredients on shelves for various coffees and teas, including one red container with red emblem on the front","ingredients on shelves for various coffees and teas, including one green container with yellow emblem on the front",ma,46475259,4,60,A1V2H0UF94ATWY,2021-01-07_09h05.30.640,MetaAwareness,2020.1.2,Win32,60,3N5YJ55YXH6ZONFYXU3CF31J7QKNA4,A1V2H0UF94ATWY,3MRNMEIQW69AKEDJVTJ1GV0OC7RLDX,QMRM5,QMRM5,3MRNMEIQW69AKEDJVTJ1GV0OC7RLDX,3MRNMEIQW69AKEDJVTJ1GV0OC7RLDX,267585,267585,,,,,,,,,,
,,,,3,6.940105,0,25,25,420,1,neatly arranged photos in frames on a wall with one smaller photo in a frame with a backgroun of a tree and a hill,neatly arranged photos in frames on a wall with one smaller photo in a frame of another scene,ma,83691215,8,60,A1V2H0UF94ATWY,2021-01-07_09h05.30.640,MetaAwareness,2020.1.2,Win32,60,3N5YJ55YXH6ZONFYXU3CF31J7QKNA4,A1V2H0UF94ATWY,3MRNMEIQW69AKEDJVTJ1GV0OC7RLDX,QMRM5,QMRM5,3MRNMEIQW69AKEDJVTJ1GV0OC7RLDX,3MRNMEIQW69AKEDJVTJ1GV0OC7RLDX,267585,267585,,,,,,,,,,
,,,,3,16.399295,0,26,26,182,1,"a hammer sits on a table, next to a yellow squirt jar, a cloth, and an open box. next to the hammer appears to be a pencil.","a hammer sits on a table, next to a yellow squirt jar, a cloth, and an open box. there appears to be nothing sitting directly next to the hammer.",ma,45525109,4,60,A1V2H0UF94ATWY,2021-01-07_09h05.30.640,MetaAwareness,2020.1.2,Win32,60,3N5YJ55YXH6ZONFYXU3CF31J7QKNA4,A1V2H0UF94ATWY,3MRNMEIQW69AKEDJVTJ1GV0OC7RLDX,QMRM5,QMRM5,3MRNMEIQW69AKEDJVTJ1GV0OC7RLDX,3MRNMEIQW69AKEDJVTJ1GV0OC7RLDX,267585,267585,,,,,,,,,,
,,,,2,11.774505,0,27,27,483,1,"a building with red bricks, white windows, and a white doorframe sits in front of a white sky","a building with red brick, white windows, and a white doorframe sits in front of a white sky. one of the windows is different from the rest and is divided into 3 colors instead of 2.",ma,95091295,4,60,A1V2H0UF94ATWY,2021-01-07_09h05.30.640,MetaAwareness,2020.1.2,Win32,60,3N5YJ55YXH6ZONFYXU3CF31J7QKNA4,A1V2H0UF94ATWY,3MRNMEIQW69AKEDJVTJ1GV0OC7RLDX,QMRM5,QMRM5,3MRNMEIQW69AKEDJVTJ1GV0OC7RLDX,3MRNMEIQW69AKEDJVTJ1GV0OC7RLDX,267585,267585,,,,,,,,,,
,,,,4,9.34196,0,28,28,151,1,"two flowers and a few picture frames, with on that has two dots on it","two flowers and a few picture frames, with one that has one dot on it",ma,38546029,5,60,A1V2H0UF94ATWY,2021-01-07_09h05.30.640,MetaAwareness,2020.1.2,Win32,60,3N5YJ55YXH6ZONFYXU3CF31J7QKNA4,A1V2H0UF94ATWY,3MRNMEIQW69AKEDJVTJ1GV0OC7RLDX,QMRM5,QMRM5,3MRNMEIQW69AKEDJVTJ1GV0OC7RLDX,3MRNMEIQW69AKEDJVTJ1GV0OC7RLDX,267585,267585,,,,,,,,,,
,,,,4,16.26687,0,29,29,118,1,a cafe with a red leather padded bench and wood table with a dart board above it on a green square. the dart board is on the lower portion of the square,a cafe with a red leather padded bench and wood table with a dart board centered above on a green square,ma,27857618,3,60,A1V2H0UF94ATWY,2021-01-07_09h05.30.640,MetaAwareness,2020.1.2,Win32,60,3N5YJ55YXH6ZONFYXU3CF31J7QKNA4,A1V2H0UF94ATWY,3MRNMEIQW69AKEDJVTJ1GV0OC7RLDX,QMRM5,QMRM5,3MRNMEIQW69AKEDJVTJ1GV0OC7RLDX,3MRNMEIQW69AKEDJVTJ1GV0OC7RLDX,267585,267585,,,,,,,,,,
,,,,,,,,,,,,,,,,60,A1V2H0UF94ATWY,2021-01-07_09h05.30.640,MetaAwareness,2020.1.2,Win32,60,3N5YJ55YXH6ZONFYXU3CF31J7QKNA4,A1V2H0UF94ATWY,3MRNMEIQW69AKEDJVTJ1GV0OC7RLDX,QMRM5,QMRM5,3MRNMEIQW69AKEDJVTJ1GV0OC7RLDX,3MRNMEIQW69AKEDJVTJ1GV0OC7RLDX,267585,267585,6,15.866525,someone laying underneath a blue beach umbrella on a crowded beach,someone laying underneath a blue beach umbrella on a crowded beach,same,1,23.905025,members of a marching band crossing a track that all have feather plumes at the front of their hats,a cluttered and rustic looking cafe with 10 hanging lights,different