consent_response.keys,consent_response.rt,key_resp_2.keys,key_resp_2.rt,user_resp.keys,user_resp.rt,trials.thisRepN,trials.thisTrialN,trials.thisN,trials.thisIndex,trials.ran,image_1_text,image_2_text,database,image,number,age,worker_ID,date,expName,psychopyVersion,OS,frameRate,hitId,workerId,assignmentId,a,tp_a,b,tp_b,c,tp_c,catch_same_resp.keys,catch_same_resp.rt,image_1_text_catch_same,image_2_text_catch_same,image_catch_same,catch_different_resp.keys,catch_different_resp.rt,image_1_text_catch_different,image_2_text_catch_different,image_catch_different
space,2.95505,space,13.568955,4,9.392395,0,0,0,27,1,"a group of archers practices their shots, with every archer having a quiver and arrows at their feet.","a group of archers practices their shots, with the last archer's quiver and arrows being missing.",wolfe1,image-021,4,33,A2CJFO19NY4T5R,2021-02-18_09h16.55.834,MetaAwareness,2020.1.2,Win32,60,34O39PNDK7BPMVCIWFKPJYQZSRUBRL,A2CJFO19NY4T5R,3UWN2HHPUZ86A3ZM4WU5OMQDN4QNSN,P2WU9,P2WU9,3UWN2HHPUZ86A3ZM4WU5OMQDN4QNSN,3UWN2HHPUZ86A3ZM4WU5OMQDN4QNSN,276349,276349,,,,,,,,,,
,,,,5,5.329144999,0,1,1,99,1,walking thru a park with one person wearing a red backpack.,walking thru a park with one person wearing an orange backpack.,wolfe1,image-118,4,33,A2CJFO19NY4T5R,2021-02-18_09h16.55.834,MetaAwareness,2020.1.2,Win32,60,34O39PNDK7BPMVCIWFKPJYQZSRUBRL,A2CJFO19NY4T5R,3UWN2HHPUZ86A3ZM4WU5OMQDN4QNSN,P2WU9,P2WU9,3UWN2HHPUZ86A3ZM4WU5OMQDN4QNSN,3UWN2HHPUZ86A3ZM4WU5OMQDN4QNSN,276349,276349,,,,,,,,,,
,,,,5,6.490705,0,2,2,87,1,people are at an outdoor event. there is a man looking to the right in a yellow shirt.,people seated at an outdoor event. there is a man looking to the right in a brown shirt.,wolfe1,image-105,4,33,A2CJFO19NY4T5R,2021-02-18_09h16.55.834,MetaAwareness,2020.1.2,Win32,60,34O39PNDK7BPMVCIWFKPJYQZSRUBRL,A2CJFO19NY4T5R,3UWN2HHPUZ86A3ZM4WU5OMQDN4QNSN,P2WU9,P2WU9,3UWN2HHPUZ86A3ZM4WU5OMQDN4QNSN,3UWN2HHPUZ86A3ZM4WU5OMQDN4QNSN,276349,276349,,,,,,,,,,
,,,,1,4.174925,0,3,3,48,1,there was one light placed in the photo,no lights are paced in the photo,wolfe1,image-040,1,33,A2CJFO19NY4T5R,2021-02-18_09h16.55.834,MetaAwareness,2020.1.2,Win32,60,34O39PNDK7BPMVCIWFKPJYQZSRUBRL,A2CJFO19NY4T5R,3UWN2HHPUZ86A3ZM4WU5OMQDN4QNSN,P2WU9,P2WU9,3UWN2HHPUZ86A3ZM4WU5OMQDN4QNSN,3UWN2HHPUZ86A3ZM4WU5OMQDN4QNSN,276349,276349,,,,,,,,,,
,,,,5,5.83016,0,4,4,107,1,a group of people cleaning off a car with the lady on the right using a blue shovel.,a group of people cleaning off a car with the lady on the right using a green shovel.,wolfe1,image-127,2,33,A2CJFO19NY4T5R,2021-02-18_09h16.55.834,MetaAwareness,2020.1.2,Win32,60,34O39PNDK7BPMVCIWFKPJYQZSRUBRL,A2CJFO19NY4T5R,3UWN2HHPUZ86A3ZM4WU5OMQDN4QNSN,P2WU9,P2WU9,3UWN2HHPUZ86A3ZM4WU5OMQDN4QNSN,3UWN2HHPUZ86A3ZM4WU5OMQDN4QNSN,276349,276349,,,,,,,,,,
,,,,5,3.65044,0,5,5,88,1,a set of stairs with a yellow cushion on the top stair.,a set of stairs with a white cushion on the top stair.,wolfe1,image-106,1,33,A2CJFO19NY4T5R,2021-02-18_09h16.55.834,MetaAwareness,2020.1.2,Win32,60,34O39PNDK7BPMVCIWFKPJYQZSRUBRL,A2CJFO19NY4T5R,3UWN2HHPUZ86A3ZM4WU5OMQDN4QNSN,P2WU9,P2WU9,3UWN2HHPUZ86A3ZM4WU5OMQDN4QNSN,3UWN2HHPUZ86A3ZM4WU5OMQDN4QNSN,276349,276349,,,,,,,,,,
,,,,6,8.500275,0,6,6,12,1,a short coffee table bearing two small cactuses and other objects sits near a chair in a room,a short coffee table bearing a cactus and other objects sits hear a chair in a room,wolfe1,image-011,5,33,A2CJFO19NY4T5R,2021-02-18_09h16.55.834,MetaAwareness,2020.1.2,Win32,60,34O39PNDK7BPMVCIWFKPJYQZSRUBRL,A2CJFO19NY4T5R,3UWN2HHPUZ86A3ZM4WU5OMQDN4QNSN,P2WU9,P2WU9,3UWN2HHPUZ86A3ZM4WU5OMQDN4QNSN,3UWN2HHPUZ86A3ZM4WU5OMQDN4QNSN,276349,276349,,,,,,,,,,
,,,,5,21.44638,0,7,7,4,1,people gathered in a circle in a classroom with a window and blinds on the wall with a speaker below,people gathered in a circle in a classroom with a blank wall and a speaker behind them,wolfe1,image-003,6,33,A2CJFO19NY4T5R,2021-02-18_09h16.55.834,MetaAwareness,2020.1.2,Win32,60,34O39PNDK7BPMVCIWFKPJYQZSRUBRL,A2CJFO19NY4T5R,3UWN2HHPUZ86A3ZM4WU5OMQDN4QNSN,P2WU9,P2WU9,3UWN2HHPUZ86A3ZM4WU5OMQDN4QNSN,3UWN2HHPUZ86A3ZM4WU5OMQDN4QNSN,276349,276349,,,,,,,,,,
,,,,5,3.002660001,0,8,8,89,1,there is a blue candlestick on top of the purple ones,there is only a green candlestick on top of the purple candle,wolfe1,image-107,8,33,A2CJFO19NY4T5R,2021-02-18_09h16.55.834,MetaAwareness,2020.1.2,Win32,60,34O39PNDK7BPMVCIWFKPJYQZSRUBRL,A2CJFO19NY4T5R,3UWN2HHPUZ86A3ZM4WU5OMQDN4QNSN,P2WU9,P2WU9,3UWN2HHPUZ86A3ZM4WU5OMQDN4QNSN,3UWN2HHPUZ86A3ZM4WU5OMQDN4QNSN,276349,276349,,,,,,,,,,
,,,,5,3.442609999,0,9,9,90,1,a series of buildings. one has a red roof,a series of buildings. one has a dark blue roof,wolfe1,image-110,6,33,A2CJFO19NY4T5R,2021-02-18_09h16.55.834,MetaAwareness,2020.1.2,Win32,60,34O39PNDK7BPMVCIWFKPJYQZSRUBRL,A2CJFO19NY4T5R,3UWN2HHPUZ86A3ZM4WU5OMQDN4QNSN,P2WU9,P2WU9,3UWN2HHPUZ86A3ZM4WU5OMQDN4QNSN,3UWN2HHPUZ86A3ZM4WU5OMQDN4QNSN,276349,276349,,,,,,,,,,
,,,,5,3.87351,0,10,10,111,1,elderly tour group in asia with one lady wearing blue jeans,elderly tour group in asia with one lady wearing grey jeans,wolfe1,image-129,2,33,A2CJFO19NY4T5R,2021-02-18_09h16.55.834,MetaAwareness,2020.1.2,Win32,60,34O39PNDK7BPMVCIWFKPJYQZSRUBRL,A2CJFO19NY4T5R,3UWN2HHPUZ86A3ZM4WU5OMQDN4QNSN,P2WU9,P2WU9,3UWN2HHPUZ86A3ZM4WU5OMQDN4QNSN,3UWN2HHPUZ86A3ZM4WU5OMQDN4QNSN,276349,276349,,,,,,,,,,
,,,,5,4.27728,0,11,11,113,1,a helicopter with a group of people getting supplies with yellow boxes,a helicopter with a group of people getting supplies with blue boxes,wolfe1,image-130,5,33,A2CJFO19NY4T5R,2021-02-18_09h16.55.834,MetaAwareness,2020.1.2,Win32,60,34O39PNDK7BPMVCIWFKPJYQZSRUBRL,A2CJFO19NY4T5R,3UWN2HHPUZ86A3ZM4WU5OMQDN4QNSN,P2WU9,P2WU9,3UWN2HHPUZ86A3ZM4WU5OMQDN4QNSN,3UWN2HHPUZ86A3ZM4WU5OMQDN4QNSN,276349,276349,,,,,,,,,,
,,,,5,2.754425,0,12,12,47,1,a table with 6 food containers on it.,a table with 5 food containers on it.,wolfe1,image-037,4,33,A2CJFO19NY4T5R,2021-02-18_09h16.55.834,MetaAwareness,2020.1.2,Win32,60,34O39PNDK7BPMVCIWFKPJYQZSRUBRL,A2CJFO19NY4T5R,3UWN2HHPUZ86A3ZM4WU5OMQDN4QNSN,P2WU9,P2WU9,3UWN2HHPUZ86A3ZM4WU5OMQDN4QNSN,3UWN2HHPUZ86A3ZM4WU5OMQDN4QNSN,276349,276349,,,,,,,,,,
,,,,5,3.724505,0,13,13,117,1,a comfortable outdoor lounge area with a red surfboard laying against a wall,a comfortable outdoor lounge area with a green surfboard laying against a wal,wolfe1,image-133,5,33,A2CJFO19NY4T5R,2021-02-18_09h16.55.834,MetaAwareness,2020.1.2,Win32,60,34O39PNDK7BPMVCIWFKPJYQZSRUBRL,A2CJFO19NY4T5R,3UWN2HHPUZ86A3ZM4WU5OMQDN4QNSN,P2WU9,P2WU9,3UWN2HHPUZ86A3ZM4WU5OMQDN4QNSN,3UWN2HHPUZ86A3ZM4WU5OMQDN4QNSN,276349,276349,,,,,,,,,,
,,,,5,4.910535,0,14,14,98,1,large jungle gym park with parents and kids playing. one parent watches their kid wearing a red backpack,large jungle gym park with parents and kids playing. one parent watches their kid wearing a orange backpack.,wolfe1,image-118,3,33,A2CJFO19NY4T5R,2021-02-18_09h16.55.834,MetaAwareness,2020.1.2,Win32,60,34O39PNDK7BPMVCIWFKPJYQZSRUBRL,A2CJFO19NY4T5R,3UWN2HHPUZ86A3ZM4WU5OMQDN4QNSN,P2WU9,P2WU9,3UWN2HHPUZ86A3ZM4WU5OMQDN4QNSN,3UWN2HHPUZ86A3ZM4WU5OMQDN4QNSN,276349,276349,,,,,,,,,,
,,,,4,6.730655,0,15,15,28,1,three runners jogging next to a building and two patches of grass that contain an object on one of them,three runners jogging next to a building and two patches of grass that are open and do not have any objects on them,wolfe1,image-022,1,33,A2CJFO19NY4T5R,2021-02-18_09h16.55.834,MetaAwareness,2020.1.2,Win32,60,34O39PNDK7BPMVCIWFKPJYQZSRUBRL,A2CJFO19NY4T5R,3UWN2HHPUZ86A3ZM4WU5OMQDN4QNSN,P2WU9,P2WU9,3UWN2HHPUZ86A3ZM4WU5OMQDN4QNSN,3UWN2HHPUZ86A3ZM4WU5OMQDN4QNSN,276349,276349,,,,,,,,,,
,,,,5,2.524675,0,16,16,85,1,a man attending a meeting wearing a light blue shirt.,a man attending a meeting wearing a green shirt.,wolfe1,image-104,9,33,A2CJFO19NY4T5R,2021-02-18_09h16.55.834,MetaAwareness,2020.1.2,Win32,60,34O39PNDK7BPMVCIWFKPJYQZSRUBRL,A2CJFO19NY4T5R,3UWN2HHPUZ86A3ZM4WU5OMQDN4QNSN,P2WU9,P2WU9,3UWN2HHPUZ86A3ZM4WU5OMQDN4QNSN,3UWN2HHPUZ86A3ZM4WU5OMQDN4QNSN,276349,276349,,,,,,,,,,
,,,,5,3.93573,0,17,17,67,1,two men one in yellow shirt watch motorcross biking,two men one in a green shirt watch motorcross biking,wolfe1,image-076,7,33,A2CJFO19NY4T5R,2021-02-18_09h16.55.834,MetaAwareness,2020.1.2,Win32,60,34O39PNDK7BPMVCIWFKPJYQZSRUBRL,A2CJFO19NY4T5R,3UWN2HHPUZ86A3ZM4WU5OMQDN4QNSN,P2WU9,P2WU9,3UWN2HHPUZ86A3ZM4WU5OMQDN4QNSN,3UWN2HHPUZ86A3ZM4WU5OMQDN4QNSN,276349,276349,,,,,,,,,,
,,,,6,5.026085,0,18,18,60,1,people shoveling gravel outside of a home with a toy in the gravel,people shoveling gravel outside of a home,wolfe1,image-047,1,33,A2CJFO19NY4T5R,2021-02-18_09h16.55.834,MetaAwareness,2020.1.2,Win32,60,34O39PNDK7BPMVCIWFKPJYQZSRUBRL,A2CJFO19NY4T5R,3UWN2HHPUZ86A3ZM4WU5OMQDN4QNSN,P2WU9,P2WU9,3UWN2HHPUZ86A3ZM4WU5OMQDN4QNSN,3UWN2HHPUZ86A3ZM4WU5OMQDN4QNSN,276349,276349,,,,,,,,,,
,,,,4,15.152775,0,19,19,15,1,a large concert in an outdoor tent with a lot of people sitting on the ground and a baby in the grass alone,a large concert in an outdoor tent with a lot people sitting on the ground. there is no baby in the grass in this image,wolfe1,image-014,7,33,A2CJFO19NY4T5R,2021-02-18_09h16.55.834,MetaAwareness,2020.1.2,Win32,60,34O39PNDK7BPMVCIWFKPJYQZSRUBRL,A2CJFO19NY4T5R,3UWN2HHPUZ86A3ZM4WU5OMQDN4QNSN,P2WU9,P2WU9,3UWN2HHPUZ86A3ZM4WU5OMQDN4QNSN,3UWN2HHPUZ86A3ZM4WU5OMQDN4QNSN,276349,276349,,,,,,,,,,
,,,,5,4.442319999,0,20,20,11,1,"guy unpacking supplies in the snow which include red, blue and yellow pails",guy unpacking supplies in the snw which include red and blue pails,wolfe1,image-010,4,33,A2CJFO19NY4T5R,2021-02-18_09h16.55.834,MetaAwareness,2020.1.2,Win32,60,34O39PNDK7BPMVCIWFKPJYQZSRUBRL,A2CJFO19NY4T5R,3UWN2HHPUZ86A3ZM4WU5OMQDN4QNSN,P2WU9,P2WU9,3UWN2HHPUZ86A3ZM4WU5OMQDN4QNSN,3UWN2HHPUZ86A3ZM4WU5OMQDN4QNSN,276349,276349,,,,,,,,,,
,,,,5,5.240465,0,21,21,93,1,a plane on the red way getting filled up with gasoline by a yellow and blue truck,a plane sitting on the tarmac getting filled up with gasoline by a red and blue truck,wolfe1,image-111,4,33,A2CJFO19NY4T5R,2021-02-18_09h16.55.834,MetaAwareness,2020.1.2,Win32,60,34O39PNDK7BPMVCIWFKPJYQZSRUBRL,A2CJFO19NY4T5R,3UWN2HHPUZ86A3ZM4WU5OMQDN4QNSN,P2WU9,P2WU9,3UWN2HHPUZ86A3ZM4WU5OMQDN4QNSN,3UWN2HHPUZ86A3ZM4WU5OMQDN4QNSN,276349,276349,,,,,,,,,,
,,,,5,4.91173,0,22,22,103,1,a block of multi colored buildings connected to each other. the blue building has a white sign in the window of the door,a block of multi colored buildings connected to each other. the blue building has a white sign in the window of the door,wolfe1,image-123,6,33,A2CJFO19NY4T5R,2021-02-18_09h16.55.834,MetaAwareness,2020.1.2,Win32,60,34O39PNDK7BPMVCIWFKPJYQZSRUBRL,A2CJFO19NY4T5R,3UWN2HHPUZ86A3ZM4WU5OMQDN4QNSN,P2WU9,P2WU9,3UWN2HHPUZ86A3ZM4WU5OMQDN4QNSN,3UWN2HHPUZ86A3ZM4WU5OMQDN4QNSN,276349,276349,,,,,,,,,,
,,,,5,6.970275,0,23,23,33,1,people at an outdoor market in a park where some are sitting on concrete benches with small lights underneath.,people at an outdoor market in a park where some are sitting on concrete benches with small lights underneath but one is missing the light.,wolfe1,image-027,3,33,A2CJFO19NY4T5R,2021-02-18_09h16.55.834,MetaAwareness,2020.1.2,Win32,60,34O39PNDK7BPMVCIWFKPJYQZSRUBRL,A2CJFO19NY4T5R,3UWN2HHPUZ86A3ZM4WU5OMQDN4QNSN,P2WU9,P2WU9,3UWN2HHPUZ86A3ZM4WU5OMQDN4QNSN,3UWN2HHPUZ86A3ZM4WU5OMQDN4QNSN,276349,276349,,,,,,,,,,
,,,,6,4.291800001,0,24,24,0,1,there is a table by the beach with 8 place settings.,there is a table by the beach with 8 place settings and two glass jars in the center.,wolfe1,image-001,1,33,A2CJFO19NY4T5R,2021-02-18_09h16.55.834,MetaAwareness,2020.1.2,Win32,60,34O39PNDK7BPMVCIWFKPJYQZSRUBRL,A2CJFO19NY4T5R,3UWN2HHPUZ86A3ZM4WU5OMQDN4QNSN,P2WU9,P2WU9,3UWN2HHPUZ86A3ZM4WU5OMQDN4QNSN,3UWN2HHPUZ86A3ZM4WU5OMQDN4QNSN,276349,276349,,,,,,,,,,
,,,,4,4.551390001,0,25,25,25,1,an outdoor event with many people and a white tent. there is a pink and white striped bag on the grass,"an outdoor event with many people and a whitee tent, there is no pink and white striped bag on the grass in this image",wolfe1,image-020,6,33,A2CJFO19NY4T5R,2021-02-18_09h16.55.834,MetaAwareness,2020.1.2,Win32,60,34O39PNDK7BPMVCIWFKPJYQZSRUBRL,A2CJFO19NY4T5R,3UWN2HHPUZ86A3ZM4WU5OMQDN4QNSN,P2WU9,P2WU9,3UWN2HHPUZ86A3ZM4WU5OMQDN4QNSN,3UWN2HHPUZ86A3ZM4WU5OMQDN4QNSN,276349,276349,,,,,,,,,,
,,,,5,2.728695001,0,26,26,102,1,a boat with red life vests hanging over the side of it,a boat with green life vests hanging over the side of it,wolfe1,image-121,5,33,A2CJFO19NY4T5R,2021-02-18_09h16.55.834,MetaAwareness,2020.1.2,Win32,60,34O39PNDK7BPMVCIWFKPJYQZSRUBRL,A2CJFO19NY4T5R,3UWN2HHPUZ86A3ZM4WU5OMQDN4QNSN,P2WU9,P2WU9,3UWN2HHPUZ86A3ZM4WU5OMQDN4QNSN,3UWN2HHPUZ86A3ZM4WU5OMQDN4QNSN,276349,276349,,,,,,,,,,
,,,,6,3.35052,0,27,27,54,1,a waiting room with a few seats and a table decorated with a white vase,a waiting room with a few seats and a table,wolfe1,image-043,1,33,A2CJFO19NY4T5R,2021-02-18_09h16.55.834,MetaAwareness,2020.1.2,Win32,60,34O39PNDK7BPMVCIWFKPJYQZSRUBRL,A2CJFO19NY4T5R,3UWN2HHPUZ86A3ZM4WU5OMQDN4QNSN,P2WU9,P2WU9,3UWN2HHPUZ86A3ZM4WU5OMQDN4QNSN,3UWN2HHPUZ86A3ZM4WU5OMQDN4QNSN,276349,276349,,,,,,,,,,
,,,,6,5.3408,0,28,28,16,1,two guys pose with an eagle cutout with a building and a garbage can in the background,two guys pose with an eagle cutout with a building in the background,wolfe1,image-015,3,33,A2CJFO19NY4T5R,2021-02-18_09h16.55.834,MetaAwareness,2020.1.2,Win32,60,34O39PNDK7BPMVCIWFKPJYQZSRUBRL,A2CJFO19NY4T5R,3UWN2HHPUZ86A3ZM4WU5OMQDN4QNSN,P2WU9,P2WU9,3UWN2HHPUZ86A3ZM4WU5OMQDN4QNSN,3UWN2HHPUZ86A3ZM4WU5OMQDN4QNSN,276349,276349,,,,,,,,,,
,,,,5,4.856285,0,29,29,65,1,several participants participate in a motorcross race. one member of the crowd is wearing a yellow shirt.,several partipants are in a motorcross race. one member of the crowd is wearing an aqua green shirt.,wolfe1,image-076,2,33,A2CJFO19NY4T5R,2021-02-18_09h16.55.834,MetaAwareness,2020.1.2,Win32,60,34O39PNDK7BPMVCIWFKPJYQZSRUBRL,A2CJFO19NY4T5R,3UWN2HHPUZ86A3ZM4WU5OMQDN4QNSN,P2WU9,P2WU9,3UWN2HHPUZ86A3ZM4WU5OMQDN4QNSN,3UWN2HHPUZ86A3ZM4WU5OMQDN4QNSN,276349,276349,,,,,,,,,,
,,,,,,,,,,,,,,,,33,A2CJFO19NY4T5R,2021-02-18_09h16.55.834,MetaAwareness,2020.1.2,Win32,60,34O39PNDK7BPMVCIWFKPJYQZSRUBRL,A2CJFO19NY4T5R,3UWN2HHPUZ86A3ZM4WU5OMQDN4QNSN,P2WU9,P2WU9,3UWN2HHPUZ86A3ZM4WU5OMQDN4QNSN,3UWN2HHPUZ86A3ZM4WU5OMQDN4QNSN,276349,276349,6,7.037210001,someone laying underneath a blue beach umbrella on a crowded beach,someone laying underneath a blue beach umbrella on a crowded beach,same,1,5.0833,members of a marching band crossing a track that all have feather plumes at the front of their hats,a cluttered and rustic looking cafe with 10 hanging lights,different
