start_time,opening_start_time,opening_end_time,consent_start_time,consent_response_keys,consent_response_rt,consent_end_time,instructions_1_start_time,key_resp_2_keys,key_resp_2_rt,instructions_1_end_time,Example_1_start_time,Example_1_resp_keys,Example_1_response_keys,Example_1_response_rt,Example_1_end_time,Example_1_a_text,Example_1_b_text,Example_1_mouse_x,Example_1_mouse_y,Example_1_mouse_leftButton,Example_1_mouse_midButton,Example_1_mouse_rightButton,Example_2_start_time,Example_2_resp_keys,Example_2_response_keys,Example_2_response_rt,Example_2_end_time,Example_2_a_text,Example_2_b_text,Example_2_mouse_x,Example_2_mouse_y,Example_2_mouse_leftButton,Example_2_mouse_midButton,Example_2_mouse_rightButton,Example_3_start_time,Example_3_resp_keys,Example_3_response_keys,Example_3_response_rt,Example_3_end_time,Example_3_a_text,Example_3_b_text,Example_3_mouse_x,Example_3_mouse_y,Example_3_mouse_leftButton,Example_3_mouse_midButton,Example_3_mouse_rightButton,instructions_2_start_time,Start_resp_2_keys,Start_resp_2_rt,instructions_2_end_time,trial_start_time,user_resp_keys,trial_response_keys,trial_response_rt,trial_end_time,image_1_text,image_2_text,trial_mouse_x,trial_mouse_y,trial_mouse_leftButton,trial_mouse_midButton,trial_mouse_rightButton,trials.thisRepN,trials.thisTrialN,trials.thisN,trials.thisIndex,trials.ran,workerId,trial_num,image_a,image_b,age,worker_ID,date,expName,psychopyVersion,OS,frameRate,hitId,assignmentId,a,tp_a,b,tp_b,c,tp_c,Cow_start_time,Cow_resp_keys,Cow_response_keys,Cow_response_rt,Cow_end_time,Cow_a_text,Cow_b_text,Cow_mouse_x,Cow_mouse_y,Cow_mouse_leftButton,Cow_mouse_midButton,Cow_mouse_rightButton,Airplane_start_time,Airplane_resp_keys,Airplane_response_keys,Airplane_response_rt,Airplane_end_time,Airplane_a_text,Airplane_b_text,Airplane_mouse_x,Airplane_mouse_y,Airplane_mouse_leftButton,Airplane_mouse_midButton,Airplane_mouse_rightButton
11:41:17:832,11:41:27:269,11:41:42:130,11:41:42:138,space,8.358,11:41:50:515,11:41:50:532,space,12.56,11:42:3:101,11:42:4:118,,space,16.726,11:42:20:896,members of a marching band crossing a track that all have feather plumes at the front of their hats,members of a marching band crossing a track with one player who has their feather plume at the back of their hat,0.5625,-0.141927083,0,0,0,11:42:21:932,,space,4.214,11:42:26:174,a cluttered and rustic looking cafe with 10 hanging lights,a cluttered and rustic looking cafe with 9 hanging lights,0.5625,-0.141927083,0,0,0,11:42:27:179,,space,24.259,11:42:51:460,someone laying underneath a blue beach umbrella on a crowded beach,someone laying underneath a purple beach umbrella on a crowded beach,0.5625,-0.141927083,0,0,0,11:42:52:477,return,7.846,11:43:0:335,11:43:1:375,,return,59.97,11:44:1:362,a double vanity sink with a soap on top of the counter and towels hanging next to it. ,"a double vanity sink with two different hand soaps on it, and towels hanging next to it",0.192708333,-0.30078125,0,0,0,0,0,0,1,1,A3VTOW7WLPTBRR,21,wolfe_011_L_parfum-a_w_outline.jpg,wolfe_011_L_parfum-b_w_outline.jpg,33,A3VTOW7WLPTBRR,2021-01-12_11h41.26.722,MetaAwareness,2020.1.2,Win32,60,3SZYX62S5H3DFWBUMRV6BVZ7F2U75X,3LYA37P8IRQ6LBXHWXGU65Z9L34BK6,83YL0,83YL0,3LYA37P8IRQ6LBXHWXGU65Z9L34BK6,3LYA37P8IRQ6LBXHWXGU65Z9L34BK6,268330,268330,,,,,,,,,,,,,,,,,,,,,,,,
,,,,,,,,,,,,,,,,,,,,,,,,,,,,,,,,,,,,,,,,,,,,,,,,,,,11:44:2:370,,return,41.994,11:44:44:383,a large bathroom mirror with neatly folded towels on the shelves. ,"a large bathroom mirror with a hanging rack next to it, and neatly folded towels in the shelving unit. ",0.212239583,-0.278645833,0,0,0,0,1,1,7,1,A3VTOW7WLPTBRR,151,wolfe_076_L_hook-a_w_outline.jpg,wolfe_076_L_hook-b_w_outline.jpg,33,A3VTOW7WLPTBRR,2021-01-12_11h41.26.722,MetaAwareness,2020.1.2,Win32,60,3SZYX62S5H3DFWBUMRV6BVZ7F2U75X,3LYA37P8IRQ6LBXHWXGU65Z9L34BK6,83YL0,83YL0,3LYA37P8IRQ6LBXHWXGU65Z9L34BK6,3LYA37P8IRQ6LBXHWXGU65Z9L34BK6,268330,268330,,,,,,,,,,,,,,,,,,,,,,,,
,,,,,,,,,,,,,,,,,,,,,,,,,,,,,,,,,,,,,,,,,,,,,,,,,,,11:44:45:406,,return,44.905,11:45:30:329,"a dining room that contains a table and chairs, and several plates are displayed. ","a dining room with a table, chairs and plates displayed behind  it. there is artwork hanging on the wall.",0.143229167,-0.309895833,0,0,0,0,2,2,5,1,A3VTOW7WLPTBRR,75,wolfe_038_L_art-a_w_outline.jpg,wolfe_038_L_art-b_w_outline.jpg,33,A3VTOW7WLPTBRR,2021-01-12_11h41.26.722,MetaAwareness,2020.1.2,Win32,60,3SZYX62S5H3DFWBUMRV6BVZ7F2U75X,3LYA37P8IRQ6LBXHWXGU65Z9L34BK6,83YL0,83YL0,3LYA37P8IRQ6LBXHWXGU65Z9L34BK6,3LYA37P8IRQ6LBXHWXGU65Z9L34BK6,268330,268330,,,,,,,,,,,,,,,,,,,,,,,,
,,,,,,,,,,,,,,,,,,,,,,,,,,,,,,,,,,,,,,,,,,,,,,,,,,,11:45:31:332,,return,136.838,11:47:48:190,"a bedroom with a bed, tv on a dresser, a large mirror, and a desk and chair. ","a bedroom that contains a bed, a tv on a dresser, a large mirror, a desk with four knobs, and a chair.",0.153645833,-0.268229167,0,0,0,0,3,3,6,1,A3VTOW7WLPTBRR,93,wolfe_047_L_handle-a_w_outline.jpg,wolfe_047_L_handle-b_w_outline.jpg,33,A3VTOW7WLPTBRR,2021-01-12_11h41.26.722,MetaAwareness,2020.1.2,Win32,60,3SZYX62S5H3DFWBUMRV6BVZ7F2U75X,3LYA37P8IRQ6LBXHWXGU65Z9L34BK6,83YL0,83YL0,3LYA37P8IRQ6LBXHWXGU65Z9L34BK6,3LYA37P8IRQ6LBXHWXGU65Z9L34BK6,268330,268330,,,,,,,,,,,,,,,,,,,,,,,,
,,,,,,,,,,,,,,,,,,,,,,,,,,,,,,,,,,,,,,,,,,,,,,,,,,,11:47:49:199,,return,48.032,11:48:37:254,"a bright bedroom with a bunk bed, a dresser system and a small kids table. ","a brightly colored bedroom with bunk beds, a kids table and chairs and a dresser system with white knobs. ",0.21875,-0.29296875,0,0,0,0,4,4,8,1,A3VTOW7WLPTBRR,165,wolfe_083_L_knob-a_w_outline.jpg,wolfe_083_L_knob-b_w_outline.jpg,33,A3VTOW7WLPTBRR,2021-01-12_11h41.26.722,MetaAwareness,2020.1.2,Win32,60,3SZYX62S5H3DFWBUMRV6BVZ7F2U75X,3LYA37P8IRQ6LBXHWXGU65Z9L34BK6,83YL0,83YL0,3LYA37P8IRQ6LBXHWXGU65Z9L34BK6,3LYA37P8IRQ6LBXHWXGU65Z9L34BK6,268330,268330,,,,,,,,,,,,,,,,,,,,,,,,
,,,,,,,,,,,,,,,,,,,,,,,,,,,,,,,,,,,,,,,,,,,,,,,,,,,11:48:38:284,,return,354.132,11:54:32:434,"a dining rom with a table and chairs, a mirror, a storage unit and a candle hanging on the wall. "," a dining room with a table and chairs, a storage unit and a large mirror. ",0.256510417,-0.272135417,0,0,0,0,5,5,9,1,A3VTOW7WLPTBRR,197,wolfe_099_L_sconce-a_w_outline.jpg,wolfe_099_L_sconce-b_w_outline.jpg,33,A3VTOW7WLPTBRR,2021-01-12_11h41.26.722,MetaAwareness,2020.1.2,Win32,60,3SZYX62S5H3DFWBUMRV6BVZ7F2U75X,3LYA37P8IRQ6LBXHWXGU65Z9L34BK6,83YL0,83YL0,3LYA37P8IRQ6LBXHWXGU65Z9L34BK6,3LYA37P8IRQ6LBXHWXGU65Z9L34BK6,268330,268330,,,,,,,,,,,,,,,,,,,,,,,,
,,,,,,,,,,,,,,,,,,,,,,,,,,,,,,,,,,,,,,,,,,,,,,,,,,,11:54:33:452,,return,34.317,11:55:7:791,a living room with a large walk out sliding glass door.,"a living room with a large glass sliding door, and an architectural piece.",0.1015625,-0.326822917,0,0,0,0,6,6,2,1,A3VTOW7WLPTBRR,31,wolfe_016_L_art-a_w_outline.jpg,wolfe_016_L_art-b_w_outline.jpg,33,A3VTOW7WLPTBRR,2021-01-12_11h41.26.722,MetaAwareness,2020.1.2,Win32,60,3SZYX62S5H3DFWBUMRV6BVZ7F2U75X,3LYA37P8IRQ6LBXHWXGU65Z9L34BK6,83YL0,83YL0,3LYA37P8IRQ6LBXHWXGU65Z9L34BK6,3LYA37P8IRQ6LBXHWXGU65Z9L34BK6,268330,268330,,,,,,,,,,,,,,,,,,,,,,,,
,,,,,,,,,,,,,,,,,,,,,,,,,,,,,,,,,,,,,,,,,,,,,,,,,,,11:55:8:805,,return,48.591,11:55:57:421,"an outdoor living sace with a tv on a fire place, several chairs and snacks on a table. ","an outdoor living space with a large tv on a fire place, chairs and snacks, and a remote on the table.",0.201822917,-0.34765625,0,0,0,0,7,7,3,1,A3VTOW7WLPTBRR,45,wolfe_023_L_remote-a_w_outline.jpg,wolfe_023_L_remote-b_w_outline.jpg,33,A3VTOW7WLPTBRR,2021-01-12_11h41.26.722,MetaAwareness,2020.1.2,Win32,60,3SZYX62S5H3DFWBUMRV6BVZ7F2U75X,3LYA37P8IRQ6LBXHWXGU65Z9L34BK6,83YL0,83YL0,3LYA37P8IRQ6LBXHWXGU65Z9L34BK6,3LYA37P8IRQ6LBXHWXGU65Z9L34BK6,268330,268330,,,,,,,,,,,,,,,,,,,,,,,,
,,,,,,,,,,,,,,,,,,,,,,,,,,,,,,,,,,,,,,,,,,,,,,,,,,,11:55:58:437,,return,63.934,11:57:2:394,"a very clean white bathroom with a tub, a walk in shower, a toilet andfive neatly folded towels in a storage unit. ","a clean white bathroom with a walk in shower, a tub, a toilet, and six neatly folded towels in a storage unit. ",0.234375,-0.29296875,0,0,0,0,8,8,4,1,A3VTOW7WLPTBRR,73,wolfe_037_L_towel-a_w_outline.jpg,wolfe_037_L_towel-b_w_outline.jpg,33,A3VTOW7WLPTBRR,2021-01-12_11h41.26.722,MetaAwareness,2020.1.2,Win32,60,3SZYX62S5H3DFWBUMRV6BVZ7F2U75X,3LYA37P8IRQ6LBXHWXGU65Z9L34BK6,83YL0,83YL0,3LYA37P8IRQ6LBXHWXGU65Z9L34BK6,3LYA37P8IRQ6LBXHWXGU65Z9L34BK6,268330,268330,,,,,,,,,,,,,,,,,,,,,,,,
,,,,,,,,,,,,,,,,,,,,,,,,,,,,,,,,,,,,,,,,,,,,,,,,,,,11:57:3:396,,return,75.839,11:58:19:262,"a restaurant dining room with the tables set with cups, plates, silverware and folded orange towels at almost every seat. ","a restaurant dining room with table set, containing plates, cups, silverware, and folded orange towels at every seat. ",0.209635417,-0.309895833,0,0,0,0,9,9,0,1,A3VTOW7WLPTBRR,3,wolfe_002_L_napkin-a_w_outline.jpg,wolfe_002_L_napkin-b_w_outline.jpg,33,A3VTOW7WLPTBRR,2021-01-12_11h41.26.722,MetaAwareness,2020.1.2,Win32,60,3SZYX62S5H3DFWBUMRV6BVZ7F2U75X,3LYA37P8IRQ6LBXHWXGU65Z9L34BK6,83YL0,83YL0,3LYA37P8IRQ6LBXHWXGU65Z9L34BK6,3LYA37P8IRQ6LBXHWXGU65Z9L34BK6,268330,268330,,,,,,,,,,,,,,,,,,,,,,,,
,,,,,,,,,,,,,,,,,,,,,,,,,,,,,,,,,,,,,,,,,,,,,,,,,,,,,,,,,,,,,,,,,,,,A3VTOW7WLPTBRR,,,,33,A3VTOW7WLPTBRR,2021-01-12_11h41.26.722,MetaAwareness,2020.1.2,Win32,60,3SZYX62S5H3DFWBUMRV6BVZ7F2U75X,3LYA37P8IRQ6LBXHWXGU65Z9L34BK6,83YL0,83YL0,3LYA37P8IRQ6LBXHWXGU65Z9L34BK6,3LYA37P8IRQ6LBXHWXGU65Z9L34BK6,268330,268330,11:58:20:293,,return,18.711,11:58:39:44,a large grassy area with a cow eating grass. ,a large grassy green area. ,0.192708333,-0.313802083,0,0,0,11:58:40:59,,return,59.867,11:59:39:959,"a pink and orange sunrise above the clouds,with an airplane flying. ",a pink and orange sun rise above the clouds.,0.147135417,-0.33203125,0,0,0
