consent_response.keys,consent_response.rt,key_resp_2.keys,key_resp_2.rt,user_resp.keys,user_resp.rt,trials.thisRepN,trials.thisTrialN,trials.thisN,trials.thisIndex,trials.ran,image_1_text,image_2_text,database,image,number,age,worker_ID,date,expName,psychopyVersion,OS,frameRate,hitId,workerId,assignmentId,a,tp_a,b,tp_b,c,tp_c,catch_same_resp.keys,catch_same_resp.rt,image_1_text_catch_same,image_2_text_catch_same,image_catch_same,catch_different_resp.keys,catch_different_resp.rt,image_1_text_catch_different,image_2_text_catch_different,image_catch_different
space,14.506755,space,18.37135,5,7.466875,0,0,0,246,1,"a bathroom with a large mirror, without a towel hanger","a bathroom with a large mirror, with a towel hanger.",wolfe2,076_L_hook,6,46,A2NO3OTBZYY43Z,2021-01-25_18h27.51.633,MetaAwareness,2020.1.2,Win32,60,3MXX6RQ9EW8KPJBU486D6PKEGG1P4A,A2NO3OTBZYY43Z,3V5Q80FXIYU610PESYVKOQF3HL1322,X85V1,X85V1,3V5Q80FXIYU610PESYVKOQF3HL1322,3V5Q80FXIYU610PESYVKOQF3HL1322,271351,271351,,,,,,,,,,
,,,,4,14.85376,0,1,1,16,1,"a combined home office and living space with a modern look and feel, with the wall above the couch being empty","a combined home office and living space with a modern look and feel, with the wall above the couch containing a mirror with three panels",wolfe2,005_L_mirror,1,46,A2NO3OTBZYY43Z,2021-01-25_18h27.51.633,MetaAwareness,2020.1.2,Win32,60,3MXX6RQ9EW8KPJBU486D6PKEGG1P4A,A2NO3OTBZYY43Z,3V5Q80FXIYU610PESYVKOQF3HL1322,X85V1,X85V1,3V5Q80FXIYU610PESYVKOQF3HL1322,3V5Q80FXIYU610PESYVKOQF3HL1322,271351,271351,,,,,,,,,,
,,,,3,9.505105,0,2,2,144,1,a white drawer with black on top,a design insignia on front of a white drawer,wolfe2,047_R_handle,6,46,A2NO3OTBZYY43Z,2021-01-25_18h27.51.633,MetaAwareness,2020.1.2,Win32,60,3MXX6RQ9EW8KPJBU486D6PKEGG1P4A,A2NO3OTBZYY43Z,3V5Q80FXIYU610PESYVKOQF3HL1322,X85V1,X85V1,3V5Q80FXIYU610PESYVKOQF3HL1322,3V5Q80FXIYU610PESYVKOQF3HL1322,271351,271351,,,,,,,,,,
,,,,5,9.352815,0,3,3,133,1,a living room with a wall-mounted tv and built-in shelves. one shelf is empty.,a living room with a wall-mounted tv and built-in shelves. one shelf holds a clock.,wolfe2,043_R_clock,4,46,A2NO3OTBZYY43Z,2021-01-25_18h27.51.633,MetaAwareness,2020.1.2,Win32,60,3MXX6RQ9EW8KPJBU486D6PKEGG1P4A,A2NO3OTBZYY43Z,3V5Q80FXIYU610PESYVKOQF3HL1322,X85V1,X85V1,3V5Q80FXIYU610PESYVKOQF3HL1322,3V5Q80FXIYU610PESYVKOQF3HL1322,271351,271351,,,,,,,,,,
,,,,5,4.98552,0,4,4,100,1,a bedroom with a vase on the shelf,a bedroom without a vase on the shelf,wolfe2,033_R_vase,1,46,A2NO3OTBZYY43Z,2021-01-25_18h27.51.633,MetaAwareness,2020.1.2,Win32,60,3MXX6RQ9EW8KPJBU486D6PKEGG1P4A,A2NO3OTBZYY43Z,3V5Q80FXIYU610PESYVKOQF3HL1322,X85V1,X85V1,3V5Q80FXIYU610PESYVKOQF3HL1322,3V5Q80FXIYU610PESYVKOQF3HL1322,271351,271351,,,,,,,,,,
,,,,3,6.67718,0,5,5,165,1,a white chaise lounge sofa,a white chaise lounge sofa with a brown throw blanket draped,wolfe2,056_R_comforter,2,46,A2NO3OTBZYY43Z,2021-01-25_18h27.51.633,MetaAwareness,2020.1.2,Win32,60,3MXX6RQ9EW8KPJBU486D6PKEGG1P4A,A2NO3OTBZYY43Z,3V5Q80FXIYU610PESYVKOQF3HL1322,X85V1,X85V1,3V5Q80FXIYU610PESYVKOQF3HL1322,3V5Q80FXIYU610PESYVKOQF3HL1322,271351,271351,,,,,,,,,,
,,,,5,8.234925,0,6,6,243,1,an antique kitchen with three hanging lights,an antique kitchen with three hanging lights and a ceiling light is missing.,wolfe2,075_L_light,4,46,A2NO3OTBZYY43Z,2021-01-25_18h27.51.633,MetaAwareness,2020.1.2,Win32,60,3MXX6RQ9EW8KPJBU486D6PKEGG1P4A,A2NO3OTBZYY43Z,3V5Q80FXIYU610PESYVKOQF3HL1322,X85V1,X85V1,3V5Q80FXIYU610PESYVKOQF3HL1322,3V5Q80FXIYU610PESYVKOQF3HL1322,271351,271351,,,,,,,,,,
,,,,4,10.15248,0,7,7,356,1,it is a picture of a kitchen with a plant next to the oven and under a light.,it is a picture of a kitchen with nothing on the counter next to the oven.,wolfe2,115_R_pot,3,46,A2NO3OTBZYY43Z,2021-01-25_18h27.51.633,MetaAwareness,2020.1.2,Win32,60,3MXX6RQ9EW8KPJBU486D6PKEGG1P4A,A2NO3OTBZYY43Z,3V5Q80FXIYU610PESYVKOQF3HL1322,X85V1,X85V1,3V5Q80FXIYU610PESYVKOQF3HL1322,3V5Q80FXIYU610PESYVKOQF3HL1322,271351,271351,,,,,,,,,,
,,,,3,6.969055,0,8,8,321,1,a brown vase on a table in a cozy restaurant,a red candle placed on a table on a cozy restaurant,wolfe2,104_L_bottle,1,46,A2NO3OTBZYY43Z,2021-01-25_18h27.51.633,MetaAwareness,2020.1.2,Win32,60,3MXX6RQ9EW8KPJBU486D6PKEGG1P4A,A2NO3OTBZYY43Z,3V5Q80FXIYU610PESYVKOQF3HL1322,X85V1,X85V1,3V5Q80FXIYU610PESYVKOQF3HL1322,3V5Q80FXIYU610PESYVKOQF3HL1322,271351,271351,,,,,,,,,,
,,,,5,10.70746,0,9,9,262,1,a tidy master bedroom with a hanging light and a white nightstand with an open shelf,a tidy master bedroom with a hanging light and a white nightstand with a bowl on the open shelf,wolfe2,082_L_bowl,3,46,A2NO3OTBZYY43Z,2021-01-25_18h27.51.633,MetaAwareness,2020.1.2,Win32,60,3MXX6RQ9EW8KPJBU486D6PKEGG1P4A,A2NO3OTBZYY43Z,3V5Q80FXIYU610PESYVKOQF3HL1322,X85V1,X85V1,3V5Q80FXIYU610PESYVKOQF3HL1322,3V5Q80FXIYU610PESYVKOQF3HL1322,271351,271351,,,,,,,,,,
,,,,5,7.188755,0,10,10,152,1,an old fashioned living room with a lot of decor,"an old fashioned living room with a lot of decor, including a bird on the mantle",wolfe2,051_R_owl,6,46,A2NO3OTBZYY43Z,2021-01-25_18h27.51.633,MetaAwareness,2020.1.2,Win32,60,3MXX6RQ9EW8KPJBU486D6PKEGG1P4A,A2NO3OTBZYY43Z,3V5Q80FXIYU610PESYVKOQF3HL1322,X85V1,X85V1,3V5Q80FXIYU610PESYVKOQF3HL1322,3V5Q80FXIYU610PESYVKOQF3HL1322,271351,271351,,,,,,,,,,
,,,,5,12.61893,0,11,11,331,1,a spacious house with a notable consumer box mounted on th wall  beside the door,a spacious house without a consumerbox mounted on the wall beside the door,wolfe2,106_L_toweldispenser,3,46,A2NO3OTBZYY43Z,2021-01-25_18h27.51.633,MetaAwareness,2020.1.2,Win32,60,3MXX6RQ9EW8KPJBU486D6PKEGG1P4A,A2NO3OTBZYY43Z,3V5Q80FXIYU610PESYVKOQF3HL1322,X85V1,X85V1,3V5Q80FXIYU610PESYVKOQF3HL1322,3V5Q80FXIYU610PESYVKOQF3HL1322,271351,271351,,,,,,,,,,
,,,,5,13.567335,0,12,12,80,1,a calm looking room overlooking the mountains with one set of towels on the left side of a basket on the bottom shelf of a cabinet,"a calm looking room overlooking the mountains with two sets of towels, one on the right and one on the left side of a basket on the bottom shelf of a cabinet",wolfe2,024_L_towels,5,46,A2NO3OTBZYY43Z,2021-01-25_18h27.51.633,MetaAwareness,2020.1.2,Win32,60,3MXX6RQ9EW8KPJBU486D6PKEGG1P4A,A2NO3OTBZYY43Z,3V5Q80FXIYU610PESYVKOQF3HL1322,X85V1,X85V1,3V5Q80FXIYU610PESYVKOQF3HL1322,3V5Q80FXIYU610PESYVKOQF3HL1322,271351,271351,,,,,,,,,,
,,,,5,17.700395,0,13,13,20,1,a modern living room with a futon and large window overlooking a city,"a modern living room with a futon, a large window overlooking a city, and a mirror on the wall",wolfe2,005_R_mirror,4,46,A2NO3OTBZYY43Z,2021-01-25_18h27.51.633,MetaAwareness,2020.1.2,Win32,60,3MXX6RQ9EW8KPJBU486D6PKEGG1P4A,A2NO3OTBZYY43Z,3V5Q80FXIYU610PESYVKOQF3HL1322,X85V1,X85V1,3V5Q80FXIYU610PESYVKOQF3HL1322,3V5Q80FXIYU610PESYVKOQF3HL1322,271351,271351,,,,,,,,,,
,,,,5,5.333455,0,14,14,43,1,an apartment with a hanging light over the breakfast nook.,an apartment with two hanging lights over the breakfast nook.,wolfe2,013_L_lamp,9,46,A2NO3OTBZYY43Z,2021-01-25_18h27.51.633,MetaAwareness,2020.1.2,Win32,60,3MXX6RQ9EW8KPJBU486D6PKEGG1P4A,A2NO3OTBZYY43Z,3V5Q80FXIYU610PESYVKOQF3HL1322,X85V1,X85V1,3V5Q80FXIYU610PESYVKOQF3HL1322,3V5Q80FXIYU610PESYVKOQF3HL1322,271351,271351,,,,,,,,,,
,,,,4,9.916445,0,15,15,137,1,a blue and white bathroom with a glass shower and a large jacuzzi tub that does not have any lights on the front right side,a blue and white bathroom with a glass shower and a large jacuzzitub that has a light on the front right side,wolfe2,044_R_light,4,46,A2NO3OTBZYY43Z,2021-01-25_18h27.51.633,MetaAwareness,2020.1.2,Win32,60,3MXX6RQ9EW8KPJBU486D6PKEGG1P4A,A2NO3OTBZYY43Z,3V5Q80FXIYU610PESYVKOQF3HL1322,X85V1,X85V1,3V5Q80FXIYU610PESYVKOQF3HL1322,3V5Q80FXIYU610PESYVKOQF3HL1322,271351,271351,,,,,,,,,,
,,,,5,8.47016,0,16,16,239,1,"a large kitchen with wood floors, warm lighting, and an item on the far counter below the microwave","a large kitchen with wood floors, warm lighting, and a colorful item on the far counter below the  microwave",wolfe2,073_R_coffeemug,4,46,A2NO3OTBZYY43Z,2021-01-25_18h27.51.633,MetaAwareness,2020.1.2,Win32,60,3MXX6RQ9EW8KPJBU486D6PKEGG1P4A,A2NO3OTBZYY43Z,3V5Q80FXIYU610PESYVKOQF3HL1322,X85V1,X85V1,3V5Q80FXIYU610PESYVKOQF3HL1322,3V5Q80FXIYU610PESYVKOQF3HL1322,271351,271351,,,,,,,,,,
,,,,6,6.25284,0,17,17,59,1,livingroom with white furniture and fireplace,living room with white furniture and fireplace,wolfe2,017_R_wood,3,46,A2NO3OTBZYY43Z,2021-01-25_18h27.51.633,MetaAwareness,2020.1.2,Win32,60,3MXX6RQ9EW8KPJBU486D6PKEGG1P4A,A2NO3OTBZYY43Z,3V5Q80FXIYU610PESYVKOQF3HL1322,X85V1,X85V1,3V5Q80FXIYU610PESYVKOQF3HL1322,3V5Q80FXIYU610PESYVKOQF3HL1322,271351,271351,,,,,,,,,,
,,,,5,36.239655,0,18,18,83,1,"bathroom wit wood toilet, shower, and 4 decrative soaps","bathroom with wood toilet, shower, 4 decrative soaps under a shelf",wolfe2,026_L_rack,2,46,A2NO3OTBZYY43Z,2021-01-25_18h27.51.633,MetaAwareness,2020.1.2,Win32,60,3MXX6RQ9EW8KPJBU486D6PKEGG1P4A,A2NO3OTBZYY43Z,3V5Q80FXIYU610PESYVKOQF3HL1322,X85V1,X85V1,3V5Q80FXIYU610PESYVKOQF3HL1322,3V5Q80FXIYU610PESYVKOQF3HL1322,271351,271351,,,,,,,,,,
,,,,5,7.13769,0,19,19,324,1,a restaurant that has food on one of the tables,a restaurant that does not have food on any of the tables,wolfe2,104_L_bottle,5,46,A2NO3OTBZYY43Z,2021-01-25_18h27.51.633,MetaAwareness,2020.1.2,Win32,60,3MXX6RQ9EW8KPJBU486D6PKEGG1P4A,A2NO3OTBZYY43Z,3V5Q80FXIYU610PESYVKOQF3HL1322,X85V1,X85V1,3V5Q80FXIYU610PESYVKOQF3HL1322,3V5Q80FXIYU610PESYVKOQF3HL1322,271351,271351,,,,,,,,,,
,,,,5,7.599765,0,20,20,143,1,"a bedroom with a bed, tv on a dresser, a large mirror, and a desk and chair.","a bedroom that contains a bed, a tv on a dresser, a large mirror, a desk with four knobs, and a chair.",wolfe2,047_L_handle,3,46,A2NO3OTBZYY43Z,2021-01-25_18h27.51.633,MetaAwareness,2020.1.2,Win32,60,3MXX6RQ9EW8KPJBU486D6PKEGG1P4A,A2NO3OTBZYY43Z,3V5Q80FXIYU610PESYVKOQF3HL1322,X85V1,X85V1,3V5Q80FXIYU610PESYVKOQF3HL1322,3V5Q80FXIYU610PESYVKOQF3HL1322,271351,271351,,,,,,,,,,
,,,,4,5.86783,0,21,21,19,1,"a living room with a computer desk, couch, a window with a city view, and a set of three mirrors on the wall","a living room with a computer desk, couch, and a window with a city view",wolfe2,005_R_mirror,2,46,A2NO3OTBZYY43Z,2021-01-25_18h27.51.633,MetaAwareness,2020.1.2,Win32,60,3MXX6RQ9EW8KPJBU486D6PKEGG1P4A,A2NO3OTBZYY43Z,3V5Q80FXIYU610PESYVKOQF3HL1322,X85V1,X85V1,3V5Q80FXIYU610PESYVKOQF3HL1322,3V5Q80FXIYU610PESYVKOQF3HL1322,271351,271351,,,,,,,,,,
,,,,5,7.15866,0,22,22,327,1,"a bedroom with a cheetah print comforter, two blankets and a hat on the bed",a bedroom with a cheetah print comforter and two blankets on the bed,wolfe2,105_L_hat,2,46,A2NO3OTBZYY43Z,2021-01-25_18h27.51.633,MetaAwareness,2020.1.2,Win32,60,3MXX6RQ9EW8KPJBU486D6PKEGG1P4A,A2NO3OTBZYY43Z,3V5Q80FXIYU610PESYVKOQF3HL1322,X85V1,X85V1,3V5Q80FXIYU610PESYVKOQF3HL1322,3V5Q80FXIYU610PESYVKOQF3HL1322,271351,271351,,,,,,,,,,
,,,,5,4.76816,0,23,23,153,1,4 speakers  are available in the room,there is 5 speakers available in the room,wolfe2,052_R_speaker,1,46,A2NO3OTBZYY43Z,2021-01-25_18h27.51.633,MetaAwareness,2020.1.2,Win32,60,3MXX6RQ9EW8KPJBU486D6PKEGG1P4A,A2NO3OTBZYY43Z,3V5Q80FXIYU610PESYVKOQF3HL1322,X85V1,X85V1,3V5Q80FXIYU610PESYVKOQF3HL1322,3V5Q80FXIYU610PESYVKOQF3HL1322,271351,271351,,,,,,,,,,
,,,,5,7.339615,0,24,24,367,1,a pair of shoes is present in a well-lighted living area.,the shoes are no longer present in the well-lighted living area.,wolfe2,118_R_shoes,3,46,A2NO3OTBZYY43Z,2021-01-25_18h27.51.633,MetaAwareness,2020.1.2,Win32,60,3MXX6RQ9EW8KPJBU486D6PKEGG1P4A,A2NO3OTBZYY43Z,3V5Q80FXIYU610PESYVKOQF3HL1322,X85V1,X85V1,3V5Q80FXIYU610PESYVKOQF3HL1322,3V5Q80FXIYU610PESYVKOQF3HL1322,271351,271351,,,,,,,,,,
,,,,2,12.633805,0,25,25,379,1,a picture of a bedroom that has a white night stand with a lamp and car on it,a bedroom that has a white night stand with a lamp on it,wolfe2,121_L_car,2,46,A2NO3OTBZYY43Z,2021-01-25_18h27.51.633,MetaAwareness,2020.1.2,Win32,60,3MXX6RQ9EW8KPJBU486D6PKEGG1P4A,A2NO3OTBZYY43Z,3V5Q80FXIYU610PESYVKOQF3HL1322,X85V1,X85V1,3V5Q80FXIYU610PESYVKOQF3HL1322,3V5Q80FXIYU610PESYVKOQF3HL1322,271351,271351,,,,,,,,,,
,,,,2,23.254875,0,26,26,11,1,"this hotel room has a nice view of the skyline, you can see a nice hill or small mountain in the back, as well as a pretty treeline.","this hotel room is facing a nice view of the skyline. behind the buildings you can see some nice trees, and behind the trees there appears to be a large tower looming over it all.",wolfe2,004_L_electricalgrid,2,46,A2NO3OTBZYY43Z,2021-01-25_18h27.51.633,MetaAwareness,2020.1.2,Win32,60,3MXX6RQ9EW8KPJBU486D6PKEGG1P4A,A2NO3OTBZYY43Z,3V5Q80FXIYU610PESYVKOQF3HL1322,X85V1,X85V1,3V5Q80FXIYU610PESYVKOQF3HL1322,3V5Q80FXIYU610PESYVKOQF3HL1322,271351,271351,,,,,,,,,,
,,,,5,4.82649,0,27,27,392,1,a sun room with a jaccuzi and plants at 3 of its corners,a sun room with a jaccuzi and plants at 2 of its corners,wolfe2,123_R_pot,4,46,A2NO3OTBZYY43Z,2021-01-25_18h27.51.633,MetaAwareness,2020.1.2,Win32,60,3MXX6RQ9EW8KPJBU486D6PKEGG1P4A,A2NO3OTBZYY43Z,3V5Q80FXIYU610PESYVKOQF3HL1322,X85V1,X85V1,3V5Q80FXIYU610PESYVKOQF3HL1322,3V5Q80FXIYU610PESYVKOQF3HL1322,271351,271351,,,,,,,,,,
,,,,5,9.10775,0,28,28,132,1,a clean living room with a shelving unit to the left of the tv that has the largest shelf empty,a clean living room with a shelving unit to the left of the tv that has a clock in the largest shelf,wolfe2,043_R_clock,3,46,A2NO3OTBZYY43Z,2021-01-25_18h27.51.633,MetaAwareness,2020.1.2,Win32,60,3MXX6RQ9EW8KPJBU486D6PKEGG1P4A,A2NO3OTBZYY43Z,3V5Q80FXIYU610PESYVKOQF3HL1322,X85V1,X85V1,3V5Q80FXIYU610PESYVKOQF3HL1322,3V5Q80FXIYU610PESYVKOQF3HL1322,271351,271351,,,,,,,,,,
,,,,3,7.91871,0,29,29,205,1,a modern bedroom with a black painted wall,a modern bedroom decorated with thin white sculptures,wolfe2,066_L_vase,5,46,A2NO3OTBZYY43Z,2021-01-25_18h27.51.633,MetaAwareness,2020.1.2,Win32,60,3MXX6RQ9EW8KPJBU486D6PKEGG1P4A,A2NO3OTBZYY43Z,3V5Q80FXIYU610PESYVKOQF3HL1322,X85V1,X85V1,3V5Q80FXIYU610PESYVKOQF3HL1322,3V5Q80FXIYU610PESYVKOQF3HL1322,271351,271351,,,,,,,,,,
,,,,,,,,,,,,,,,,46,A2NO3OTBZYY43Z,2021-01-25_18h27.51.633,MetaAwareness,2020.1.2,Win32,60,3MXX6RQ9EW8KPJBU486D6PKEGG1P4A,A2NO3OTBZYY43Z,3V5Q80FXIYU610PESYVKOQF3HL1322,X85V1,X85V1,3V5Q80FXIYU610PESYVKOQF3HL1322,3V5Q80FXIYU610PESYVKOQF3HL1322,271351,271351,6,6.942605,someone laying underneath a blue beach umbrella on a crowded beach,someone laying underneath a blue beach umbrella on a crowded beach,same,1,11.171695,members of a marching band crossing a track that all have feather plumes at the front of their hats,a cluttered and rustic looking cafe with 10 hanging lights,different
