consent_response.keys,consent_response.rt,key_resp_2.keys,key_resp_2.rt,user_resp.keys,user_resp.rt,trials.thisRepN,trials.thisTrialN,trials.thisN,trials.thisIndex,trials.ran,image_1_text,image_2_text,database,image,number,age,worker_ID,date,expName,psychopyVersion,OS,frameRate,hitId,workerId,assignmentId,a,tp_a,b,tp_b,c,tp_c,catch_same_resp.keys,catch_same_resp.rt,image_1_text_catch_same,image_2_text_catch_same,image_catch_same,catch_different_resp.keys,catch_different_resp.rt,image_1_text_catch_different,image_2_text_catch_different,image_catch_different
space,8.752225,space,7.5288,5,26.37159,0,0,0,14,1,a building in a beautiful meadow that's painted red.,a building in a beautiful meadow that's paited green.,rensink,Barns,7,47,A2L26DMSVUEDP6,2021-01-07_18h49.31.002,MetaAwareness,2020.1.2,Win32,60,3H1C3QRA02MJNWZJO9WKVBXYT2PCET,A2L26DMSVUEDP6,3RRCEFRB7NFL798EB5TEZOADO25B4D,BERR8,BERR8,3RRCEFRB7NFL798EB5TEZOADO25B4D,3RRCEFRB7NFL798EB5TEZOADO25B4D,267888,267888,,,,,,,,,,
,,,,3,10.98757,0,1,1,70,1,a massive castle with a circular window under an arch,a massive castle with an arch,rensink,Castle,5,47,A2L26DMSVUEDP6,2021-01-07_18h49.31.002,MetaAwareness,2020.1.2,Win32,60,3H1C3QRA02MJNWZJO9WKVBXYT2PCET,A2L26DMSVUEDP6,3RRCEFRB7NFL798EB5TEZOADO25B4D,BERR8,BERR8,3RRCEFRB7NFL798EB5TEZOADO25B4D,3RRCEFRB7NFL798EB5TEZOADO25B4D,267888,267888,,,,,,,,,,
,,,,3,13.19867,0,2,2,115,1,"people viewing a statue in a desert terrain, behind the statue the are columns that are evenly spaced","people viewing a statue in a desert terrain, behind the statue a column is missing",rensink,Egypt,10,47,A2L26DMSVUEDP6,2021-01-07_18h49.31.002,MetaAwareness,2020.1.2,Win32,60,3H1C3QRA02MJNWZJO9WKVBXYT2PCET,A2L26DMSVUEDP6,3RRCEFRB7NFL798EB5TEZOADO25B4D,BERR8,BERR8,3RRCEFRB7NFL798EB5TEZOADO25B4D,3RRCEFRB7NFL798EB5TEZOADO25B4D,267888,267888,,,,,,,,,,
,,,,5,6.580715,0,3,3,177,1,children sitting outside facing eachother with one child sitting in a yellow chair,children sitting outside facing eachother with one child sitting in a pink chair,rensink,Kids,8,47,A2L26DMSVUEDP6,2021-01-07_18h49.31.002,MetaAwareness,2020.1.2,Win32,60,3H1C3QRA02MJNWZJO9WKVBXYT2PCET,A2L26DMSVUEDP6,3RRCEFRB7NFL798EB5TEZOADO25B4D,BERR8,BERR8,3RRCEFRB7NFL798EB5TEZOADO25B4D,3RRCEFRB7NFL798EB5TEZOADO25B4D,267888,267888,,,,,,,,,,
,,,,5,10.435415,0,4,4,148,1,some people in said boats are colliding and the horizon is slightly above the boats,some people in sail boats are colliding and the horizon is near the top of the frame,rensink,Horizon,5,47,A2L26DMSVUEDP6,2021-01-07_18h49.31.002,MetaAwareness,2020.1.2,Win32,60,3H1C3QRA02MJNWZJO9WKVBXYT2PCET,A2L26DMSVUEDP6,3RRCEFRB7NFL798EB5TEZOADO25B4D,BERR8,BERR8,3RRCEFRB7NFL798EB5TEZOADO25B4D,3RRCEFRB7NFL798EB5TEZOADO25B4D,267888,267888,,,,,,,,,,
,,,,5,5.02405,0,5,5,96,1,the unde water coral is  green color,the underwater coral is red color,rensink,Diver,2,47,A2L26DMSVUEDP6,2021-01-07_18h49.31.002,MetaAwareness,2020.1.2,Win32,60,3H1C3QRA02MJNWZJO9WKVBXYT2PCET,A2L26DMSVUEDP6,3RRCEFRB7NFL798EB5TEZOADO25B4D,BERR8,BERR8,3RRCEFRB7NFL798EB5TEZOADO25B4D,3RRCEFRB7NFL798EB5TEZOADO25B4D,267888,267888,,,,,,,,,,
,,,,5,14.483075,0,6,6,2,1,a man in a blue shirt sitting on a cart being dragged by a horse,a man in a pink shirt sitting on a cart being dragged by a horse,rensink,Amish,3,47,A2L26DMSVUEDP6,2021-01-07_18h49.31.002,MetaAwareness,2020.1.2,Win32,60,3H1C3QRA02MJNWZJO9WKVBXYT2PCET,A2L26DMSVUEDP6,3RRCEFRB7NFL798EB5TEZOADO25B4D,BERR8,BERR8,3RRCEFRB7NFL798EB5TEZOADO25B4D,3RRCEFRB7NFL798EB5TEZOADO25B4D,267888,267888,,,,,,,,,,
,,,,6,11.83651,0,7,7,34,1,a flock of birds sits behind two bgger bird that sit on rcks,a flock of birds sits behind two bigger birds that sit on rocks,rensink,Birds,3,47,A2L26DMSVUEDP6,2021-01-07_18h49.31.002,MetaAwareness,2020.1.2,Win32,60,3H1C3QRA02MJNWZJO9WKVBXYT2PCET,A2L26DMSVUEDP6,3RRCEFRB7NFL798EB5TEZOADO25B4D,BERR8,BERR8,3RRCEFRB7NFL798EB5TEZOADO25B4D,3RRCEFRB7NFL798EB5TEZOADO25B4D,267888,267888,,,,,,,,,,
,,,,3,13.82069,0,8,8,40,1,"people are very close to a boat that is in the water, people are standing near it and others are in the boat",people are standing by a boat but it is further away in the water,rensink,Boat,2,47,A2L26DMSVUEDP6,2021-01-07_18h49.31.002,MetaAwareness,2020.1.2,Win32,60,3H1C3QRA02MJNWZJO9WKVBXYT2PCET,A2L26DMSVUEDP6,3RRCEFRB7NFL798EB5TEZOADO25B4D,BERR8,BERR8,3RRCEFRB7NFL798EB5TEZOADO25B4D,3RRCEFRB7NFL798EB5TEZOADO25B4D,267888,267888,,,,,,,,,,
,,,,5,9.835735,0,9,9,79,1,a canadian pilot flies an aircraft even with a helicopter visible out the windshield,a canadian pilot flies an aircraft slightly lower than a helicopter visible throug the windshield,rensink,Cockpit,1,47,A2L26DMSVUEDP6,2021-01-07_18h49.31.002,MetaAwareness,2020.1.2,Win32,60,3H1C3QRA02MJNWZJO9WKVBXYT2PCET,A2L26DMSVUEDP6,3RRCEFRB7NFL798EB5TEZOADO25B4D,BERR8,BERR8,3RRCEFRB7NFL798EB5TEZOADO25B4D,3RRCEFRB7NFL798EB5TEZOADO25B4D,267888,267888,,,,,,,,,,
,,,,2,11.9852,0,10,10,181,1,a man stands near a canoe on a lake shore,a canoe is on the shore of a lake,rensink,Lake,4,47,A2L26DMSVUEDP6,2021-01-07_18h49.31.002,MetaAwareness,2020.1.2,Win32,60,3H1C3QRA02MJNWZJO9WKVBXYT2PCET,A2L26DMSVUEDP6,3RRCEFRB7NFL798EB5TEZOADO25B4D,BERR8,BERR8,3RRCEFRB7NFL798EB5TEZOADO25B4D,3RRCEFRB7NFL798EB5TEZOADO25B4D,267888,267888,,,,,,,,,,
,,,,4,11.852475,0,11,11,93,1,a glass of wine sits next to the bottle in front of aplate of food,"a glass of wine sits behind a plate of food, a little far away from the bottle",rensink,Dinner,5,47,A2L26DMSVUEDP6,2021-01-07_18h49.31.002,MetaAwareness,2020.1.2,Win32,60,3H1C3QRA02MJNWZJO9WKVBXYT2PCET,A2L26DMSVUEDP6,3RRCEFRB7NFL798EB5TEZOADO25B4D,BERR8,BERR8,3RRCEFRB7NFL798EB5TEZOADO25B4D,3RRCEFRB7NFL798EB5TEZOADO25B4D,267888,267888,,,,,,,,,,
,,,,5,13.235795,0,12,12,103,1,there is a man and woman sitting at an outside table smiling at one another and a bush blocking the view slightly.,there is a man and woman sitting at an outside table smiling at one another and a bush blocking the view on the left.,rensink,Eating,3,47,A2L26DMSVUEDP6,2021-01-07_18h49.31.002,MetaAwareness,2020.1.2,Win32,60,3H1C3QRA02MJNWZJO9WKVBXYT2PCET,A2L26DMSVUEDP6,3RRCEFRB7NFL798EB5TEZOADO25B4D,BERR8,BERR8,3RRCEFRB7NFL798EB5TEZOADO25B4D,3RRCEFRB7NFL798EB5TEZOADO25B4D,267888,267888,,,,,,,,,,
,,,,5,17.634825,0,13,13,164,1,a person on a boat looking at cliffs,a person in a boat looking at smaller cliffs,rensink,Kayaker,1,47,A2L26DMSVUEDP6,2021-01-07_18h49.31.002,MetaAwareness,2020.1.2,Win32,60,3H1C3QRA02MJNWZJO9WKVBXYT2PCET,A2L26DMSVUEDP6,3RRCEFRB7NFL798EB5TEZOADO25B4D,BERR8,BERR8,3RRCEFRB7NFL798EB5TEZOADO25B4D,3RRCEFRB7NFL798EB5TEZOADO25B4D,267888,267888,,,,,,,,,,
,,,,5,8.82537,0,14,14,256,1,a man and a woman next a tortoise on with a bright blue sky behin them.,"a man and woman nex to a tortoise, with a pink sky behind them.",rensink,Turtle,1,47,A2L26DMSVUEDP6,2021-01-07_18h49.31.002,MetaAwareness,2020.1.2,Win32,60,3H1C3QRA02MJNWZJO9WKVBXYT2PCET,A2L26DMSVUEDP6,3RRCEFRB7NFL798EB5TEZOADO25B4D,BERR8,BERR8,3RRCEFRB7NFL798EB5TEZOADO25B4D,3RRCEFRB7NFL798EB5TEZOADO25B4D,267888,267888,,,,,,,,,,
,,,,5,4.70512,0,15,15,139,1,the helcopter was in blue color,helcopter wasin red color,rensink,Harbor,1,47,A2L26DMSVUEDP6,2021-01-07_18h49.31.002,MetaAwareness,2020.1.2,Win32,60,3H1C3QRA02MJNWZJO9WKVBXYT2PCET,A2L26DMSVUEDP6,3RRCEFRB7NFL798EB5TEZOADO25B4D,BERR8,BERR8,3RRCEFRB7NFL798EB5TEZOADO25B4D,3RRCEFRB7NFL798EB5TEZOADO25B4D,267888,267888,,,,,,,,,,
,,,,4,8.976055,0,16,16,217,1,there are egyptian ruins in the foreground and a large tree in the background,"egyptian ruins are in the foreground, there is sparse vegetation in the background",rensink,Obelisk,3,47,A2L26DMSVUEDP6,2021-01-07_18h49.31.002,MetaAwareness,2020.1.2,Win32,60,3H1C3QRA02MJNWZJO9WKVBXYT2PCET,A2L26DMSVUEDP6,3RRCEFRB7NFL798EB5TEZOADO25B4D,BERR8,BERR8,3RRCEFRB7NFL798EB5TEZOADO25B4D,3RRCEFRB7NFL798EB5TEZOADO25B4D,267888,267888,,,,,,,,,,
,,,,5,19.74681,0,17,17,234,1,there is a woman posing next to a seal and there is a rock over the water.,there is a woman posing next to a seal and there is a rock over the water with several smaller rocks next to it.,rensink,Seal,4,47,A2L26DMSVUEDP6,2021-01-07_18h49.31.002,MetaAwareness,2020.1.2,Win32,60,3H1C3QRA02MJNWZJO9WKVBXYT2PCET,A2L26DMSVUEDP6,3RRCEFRB7NFL798EB5TEZOADO25B4D,BERR8,BERR8,3RRCEFRB7NFL798EB5TEZOADO25B4D,3RRCEFRB7NFL798EB5TEZOADO25B4D,267888,267888,,,,,,,,,,
,,,,5,6.0036,0,18,18,67,1,a big castle which has half of its front door hidden by a wall,a big castle which has most of its front door hidden by a wall,rensink,Castle,2,47,A2L26DMSVUEDP6,2021-01-07_18h49.31.002,MetaAwareness,2020.1.2,Win32,60,3H1C3QRA02MJNWZJO9WKVBXYT2PCET,A2L26DMSVUEDP6,3RRCEFRB7NFL798EB5TEZOADO25B4D,BERR8,BERR8,3RRCEFRB7NFL798EB5TEZOADO25B4D,3RRCEFRB7NFL798EB5TEZOADO25B4D,267888,267888,,,,,,,,,,
,,,,5,7.536845,0,19,19,274,1,"a food display with bread, fruits, wine, and cheese","a food display with bread, fruits, and wine",rensink,Wine,3,47,A2L26DMSVUEDP6,2021-01-07_18h49.31.002,MetaAwareness,2020.1.2,Win32,60,3H1C3QRA02MJNWZJO9WKVBXYT2PCET,A2L26DMSVUEDP6,3RRCEFRB7NFL798EB5TEZOADO25B4D,BERR8,BERR8,3RRCEFRB7NFL798EB5TEZOADO25B4D,3RRCEFRB7NFL798EB5TEZOADO25B4D,267888,267888,,,,,,,,,,
,,,,4,8.536535,0,20,20,78,1,a helicopter and truck's shadows are visible on the grass beneath them.,a helicopter and truck are present with only the truck's shadow visible on the grass beneath them.,rensink,Chopper,7,47,A2L26DMSVUEDP6,2021-01-07_18h49.31.002,MetaAwareness,2020.1.2,Win32,60,3H1C3QRA02MJNWZJO9WKVBXYT2PCET,A2L26DMSVUEDP6,3RRCEFRB7NFL798EB5TEZOADO25B4D,BERR8,BERR8,3RRCEFRB7NFL798EB5TEZOADO25B4D,3RRCEFRB7NFL798EB5TEZOADO25B4D,267888,267888,,,,,,,,,,
,,,,5,3.95696,0,21,21,95,1,a woman scuba diving next to green coral,a woman scuba diving next to red coral,rensink,Diver,1,47,A2L26DMSVUEDP6,2021-01-07_18h49.31.002,MetaAwareness,2020.1.2,Win32,60,3H1C3QRA02MJNWZJO9WKVBXYT2PCET,A2L26DMSVUEDP6,3RRCEFRB7NFL798EB5TEZOADO25B4D,BERR8,BERR8,3RRCEFRB7NFL798EB5TEZOADO25B4D,3RRCEFRB7NFL798EB5TEZOADO25B4D,267888,267888,,,,,,,,,,
,,,,5,24.963345,0,22,22,74,1,a military plane that has a cord hanging down that looks attached to the truck driving in the grass below-  the shadow of the plane can be seen in the grass,a military plane that has a cord hanging down that looks attached to the truck driving in the grass but in this picture the shadow can only be seen of the truck,rensink,Chopper,3,47,A2L26DMSVUEDP6,2021-01-07_18h49.31.002,MetaAwareness,2020.1.2,Win32,60,3H1C3QRA02MJNWZJO9WKVBXYT2PCET,A2L26DMSVUEDP6,3RRCEFRB7NFL798EB5TEZOADO25B4D,BERR8,BERR8,3RRCEFRB7NFL798EB5TEZOADO25B4D,3RRCEFRB7NFL798EB5TEZOADO25B4D,267888,267888,,,,,,,,,,
,,,,5,11.918385,0,23,23,116,1,"several red farm buildings sit in a field, overlooking a pond where the reflections of the buildings are visible at the near edge of the pond","several red farm buildings sit in a field, overlooking a pond whre the reflections f the buildings are visible in the middle of the pond",rensink,FarmByPond,1,47,A2L26DMSVUEDP6,2021-01-07_18h49.31.002,MetaAwareness,2020.1.2,Win32,60,3H1C3QRA02MJNWZJO9WKVBXYT2PCET,A2L26DMSVUEDP6,3RRCEFRB7NFL798EB5TEZOADO25B4D,BERR8,BERR8,3RRCEFRB7NFL798EB5TEZOADO25B4D,3RRCEFRB7NFL798EB5TEZOADO25B4D,267888,267888,,,,,,,,,,
,,,,5,8.27877,0,24,24,230,1,3 military personel standing in fron of a fighter jet packed in fron of a white building,3 military personel standing in front of a fighter jet packed in front of a yellow building,rensink,Pilots,6,47,A2L26DMSVUEDP6,2021-01-07_18h49.31.002,MetaAwareness,2020.1.2,Win32,60,3H1C3QRA02MJNWZJO9WKVBXYT2PCET,A2L26DMSVUEDP6,3RRCEFRB7NFL798EB5TEZOADO25B4D,BERR8,BERR8,3RRCEFRB7NFL798EB5TEZOADO25B4D,3RRCEFRB7NFL798EB5TEZOADO25B4D,267888,267888,,,,,,,,,,
,,,,5,17.28057,0,25,25,104,1,a man and a woman dining outside by a railing,a man and a woman dining outside by a railing near their heads,rensink,Eating,4,47,A2L26DMSVUEDP6,2021-01-07_18h49.31.002,MetaAwareness,2020.1.2,Win32,60,3H1C3QRA02MJNWZJO9WKVBXYT2PCET,A2L26DMSVUEDP6,3RRCEFRB7NFL798EB5TEZOADO25B4D,BERR8,BERR8,3RRCEFRB7NFL798EB5TEZOADO25B4D,3RRCEFRB7NFL798EB5TEZOADO25B4D,267888,267888,,,,,,,,,,
,,,,5,4.32597,0,26,26,175,1,there is a little boy sitting with other children on a yellow chair.,there is a little boy sitting with other children on a pink chair.,rensink,Kids,6,47,A2L26DMSVUEDP6,2021-01-07_18h49.31.002,MetaAwareness,2020.1.2,Win32,60,3H1C3QRA02MJNWZJO9WKVBXYT2PCET,A2L26DMSVUEDP6,3RRCEFRB7NFL798EB5TEZOADO25B4D,BERR8,BERR8,3RRCEFRB7NFL798EB5TEZOADO25B4D,3RRCEFRB7NFL798EB5TEZOADO25B4D,267888,267888,,,,,,,,,,
,,,,5,5.951445,0,27,27,45,1,four men stand on top of a bus fixing the baggage that is secured to the top,three men stand on top of a bus fixing the baggage that is secured to the top,rensink,Bus,4,47,A2L26DMSVUEDP6,2021-01-07_18h49.31.002,MetaAwareness,2020.1.2,Win32,60,3H1C3QRA02MJNWZJO9WKVBXYT2PCET,A2L26DMSVUEDP6,3RRCEFRB7NFL798EB5TEZOADO25B4D,BERR8,BERR8,3RRCEFRB7NFL798EB5TEZOADO25B4D,3RRCEFRB7NFL798EB5TEZOADO25B4D,267888,267888,,,,,,,,,,
,,,,5,4.301685,0,28,28,44,1,four men are on top of a truck loading boxes,three men are on top of a truck loading boxes,rensink,Bus,3,47,A2L26DMSVUEDP6,2021-01-07_18h49.31.002,MetaAwareness,2020.1.2,Win32,60,3H1C3QRA02MJNWZJO9WKVBXYT2PCET,A2L26DMSVUEDP6,3RRCEFRB7NFL798EB5TEZOADO25B4D,BERR8,BERR8,3RRCEFRB7NFL798EB5TEZOADO25B4D,3RRCEFRB7NFL798EB5TEZOADO25B4D,267888,267888,,,,,,,,,,
,,,,3,5.935895,0,29,29,68,1,the window shown on the wall,the  window hide on the wall,rensink,Castle,3,47,A2L26DMSVUEDP6,2021-01-07_18h49.31.002,MetaAwareness,2020.1.2,Win32,60,3H1C3QRA02MJNWZJO9WKVBXYT2PCET,A2L26DMSVUEDP6,3RRCEFRB7NFL798EB5TEZOADO25B4D,BERR8,BERR8,3RRCEFRB7NFL798EB5TEZOADO25B4D,3RRCEFRB7NFL798EB5TEZOADO25B4D,267888,267888,,,,,,,,,,
,,,,,,,,,,,,,,,,47,A2L26DMSVUEDP6,2021-01-07_18h49.31.002,MetaAwareness,2020.1.2,Win32,60,3H1C3QRA02MJNWZJO9WKVBXYT2PCET,A2L26DMSVUEDP6,3RRCEFRB7NFL798EB5TEZOADO25B4D,BERR8,BERR8,3RRCEFRB7NFL798EB5TEZOADO25B4D,3RRCEFRB7NFL798EB5TEZOADO25B4D,267888,267888,6,9.836005,someone laying underneath a blue beach umbrella on a crowded beach,someone laying underneath a blue beach umbrella on a crowded beach,same,1,5.769465,members of a marching band crossing a track that all have feather plumes at the front of their hats,a cluttered and rustic looking cafe with 10 hanging lights,different
