consent_response.keys,consent_response.rt,key_resp_2.keys,key_resp_2.rt,user_resp.keys,user_resp.rt,trials.thisRepN,trials.thisTrialN,trials.thisN,trials.thisIndex,trials.ran,image_1_text,image_2_text,database,image,number,age,worker_ID,date,expName,psychopyVersion,OS,frameRate,hitId,workerId,assignmentId,a,tp_a,b,tp_b,c,tp_c,catch_same_resp.keys,catch_same_resp.rt,image_1_text_catch_same,image_2_text_catch_same,image_catch_same,catch_different_resp.keys,catch_different_resp.rt,image_1_text_catch_different,image_2_text_catch_different,image_catch_different
space,3.15361,space,11.248155,1,15.242935,0,0,0,1002,1,a mostly-empty cafe with one dark-haired person seen sitting alone in a booth with his back to the camera,"a cafe with several booths visible, none of which have anyone seated in them",wolfe2,104_L_bottle,2,36,A28O8I1SYFZO7A,2021-01-24_10h53.15.687,MetaAwareness,2020.1.2,Win32,60,3TZDZ3Y0JT9I5XY401REM1DWZQN19O,A28O8I1SYFZO7A,3NOKK93PR2B16EHRA27H9ISP591EEI,PKON6,PKON6,3NOKK93PR2B16EHRA27H9ISP591EEI,3NOKK93PR2B16EHRA27H9ISP591EEI,271016,271016,,,,,,,,,,
,,,,1,13.75147,0,1,1,1230,1,the studying room is good  thereis a flower to simle and good enegry to the room,there is no flower in my room are a planted,wolfe2,128_L_pot,1,36,A28O8I1SYFZO7A,2021-01-24_10h53.15.687,MetaAwareness,2020.1.2,Win32,60,3TZDZ3Y0JT9I5XY401REM1DWZQN19O,A28O8I1SYFZO7A,3NOKK93PR2B16EHRA27H9ISP591EEI,PKON6,PKON6,3NOKK93PR2B16EHRA27H9ISP591EEI,3NOKK93PR2B16EHRA27H9ISP591EEI,271016,271016,,,,,,,,,,
,,,,5,11.25272,0,2,2,604,1,a wooden living room with an empty desk,a wooden living room with a desk that has a notbook on it,wolfe2,063_L_laptop,1,36,A28O8I1SYFZO7A,2021-01-24_10h53.15.687,MetaAwareness,2020.1.2,Win32,60,3TZDZ3Y0JT9I5XY401REM1DWZQN19O,A28O8I1SYFZO7A,3NOKK93PR2B16EHRA27H9ISP591EEI,PKON6,PKON6,3NOKK93PR2B16EHRA27H9ISP591EEI,3NOKK93PR2B16EHRA27H9ISP591EEI,271016,271016,,,,,,,,,,
,,,,3,4.70504,0,3,3,295,1,there is a gap between two countertops in this bathroom,there is a lower countertop that connects two countertops in this bathroom,wolfe2,030_R_drawer,4,36,A28O8I1SYFZO7A,2021-01-24_10h53.15.687,MetaAwareness,2020.1.2,Win32,60,3TZDZ3Y0JT9I5XY401REM1DWZQN19O,A28O8I1SYFZO7A,3NOKK93PR2B16EHRA27H9ISP591EEI,PKON6,PKON6,3NOKK93PR2B16EHRA27H9ISP591EEI,3NOKK93PR2B16EHRA27H9ISP591EEI,271016,271016,,,,,,,,,,
,,,,5,15.299175,0,4,4,1102,1,a victorian styled living room opening to a stone patio. the living room consists of dark furniture including a coffee table that has two small figurines on it.,a victorian styled living room opening to a stone patio. the living room consists of dark furniture including a coffee table with one small figurine on it.,wolfe2,114_R_bird,4,36,A28O8I1SYFZO7A,2021-01-24_10h53.15.687,MetaAwareness,2020.1.2,Win32,60,3TZDZ3Y0JT9I5XY401REM1DWZQN19O,A28O8I1SYFZO7A,3NOKK93PR2B16EHRA27H9ISP591EEI,PKON6,PKON6,3NOKK93PR2B16EHRA27H9ISP591EEI,3NOKK93PR2B16EHRA27H9ISP591EEI,271016,271016,,,,,,,,,,
,,,,2,9.310985,0,5,5,821,1,a well appointed living area contains a vast assortment of accoutremonts.,a wall sconce appears in the busy livingroom,wolfe2,084_R_light,5,36,A28O8I1SYFZO7A,2021-01-24_10h53.15.687,MetaAwareness,2020.1.2,Win32,60,3TZDZ3Y0JT9I5XY401REM1DWZQN19O,A28O8I1SYFZO7A,3NOKK93PR2B16EHRA27H9ISP591EEI,PKON6,PKON6,3NOKK93PR2B16EHRA27H9ISP591EEI,3NOKK93PR2B16EHRA27H9ISP591EEI,271016,271016,,,,,,,,,,
,,,,5,9.965865,0,6,6,1105,1,a fancy looking kitchen area. there is an island in the center and a section off to the side that looks like a dinning room. there is a plant in a pot near a window on the counter.,a fancy looking kitchen area. there is an island in the center and a section off to the side that looks like a dinning area. there is nothing on the counter near the window.,wolfe2,115_L_pot,2,36,A28O8I1SYFZO7A,2021-01-24_10h53.15.687,MetaAwareness,2020.1.2,Win32,60,3TZDZ3Y0JT9I5XY401REM1DWZQN19O,A28O8I1SYFZO7A,3NOKK93PR2B16EHRA27H9ISP591EEI,PKON6,PKON6,3NOKK93PR2B16EHRA27H9ISP591EEI,3NOKK93PR2B16EHRA27H9ISP591EEI,271016,271016,,,,,,,,,,
,,,,5,9.86962,0,7,7,176,1,a backyard where plants on the ground and two chairs at the patio and without one plant that stick above the patio,a backyard where plants on the ground and two chairs at the patio and with one plant that stick above the patio,wolfe2,018_L_plant,5,36,A28O8I1SYFZO7A,2021-01-24_10h53.15.687,MetaAwareness,2020.1.2,Win32,60,3TZDZ3Y0JT9I5XY401REM1DWZQN19O,A28O8I1SYFZO7A,3NOKK93PR2B16EHRA27H9ISP591EEI,PKON6,PKON6,3NOKK93PR2B16EHRA27H9ISP591EEI,3NOKK93PR2B16EHRA27H9ISP591EEI,271016,271016,,,,,,,,,,
,,,,5,5.767245,0,8,8,697,1,"a bedroom with a bed, night stand, chair and dresser with a missing handle","a bedroom with a bed, night stand, chair and dresser",wolfe2,072_R_handle,4,36,A28O8I1SYFZO7A,2021-01-24_10h53.15.687,MetaAwareness,2020.1.2,Win32,60,3TZDZ3Y0JT9I5XY401REM1DWZQN19O,A28O8I1SYFZO7A,3NOKK93PR2B16EHRA27H9ISP591EEI,PKON6,PKON6,3NOKK93PR2B16EHRA27H9ISP591EEI,3NOKK93PR2B16EHRA27H9ISP591EEI,271016,271016,,,,,,,,,,
,,,,5,7.390615,0,9,9,534,1,a living room with dark brown drapes and rug and a white l-shaped couch,a living room with dark brown drapes and rug and a white l-shaped couch with a folded blanket on one corner,wolfe2,056_L_comforter,1,36,A28O8I1SYFZO7A,2021-01-24_10h53.15.687,MetaAwareness,2020.1.2,Win32,60,3TZDZ3Y0JT9I5XY401REM1DWZQN19O,A28O8I1SYFZO7A,3NOKK93PR2B16EHRA27H9ISP591EEI,PKON6,PKON6,3NOKK93PR2B16EHRA27H9ISP591EEI,3NOKK93PR2B16EHRA27H9ISP591EEI,271016,271016,,,,,,,,,,
,,,,3,10.27483,0,10,10,569,1,an empty wardrobe top in the chilren room,a toy car placed on the wardrobe in te children room.,wolfe2,059_R_car,4,36,A28O8I1SYFZO7A,2021-01-24_10h53.15.687,MetaAwareness,2020.1.2,Win32,60,3TZDZ3Y0JT9I5XY401REM1DWZQN19O,A28O8I1SYFZO7A,3NOKK93PR2B16EHRA27H9ISP591EEI,PKON6,PKON6,3NOKK93PR2B16EHRA27H9ISP591EEI,3NOKK93PR2B16EHRA27H9ISP591EEI,271016,271016,,,,,,,,,,
,,,,5,5.725785,0,11,11,566,1,a very modern and fun looking child's bedroom that has an armoir with nothing on top of it,a very modern and fun looking child's bedroom that has an armoir with a model car on top of it,wolfe2,059_R_car,1,36,A28O8I1SYFZO7A,2021-01-24_10h53.15.687,MetaAwareness,2020.1.2,Win32,60,3TZDZ3Y0JT9I5XY401REM1DWZQN19O,A28O8I1SYFZO7A,3NOKK93PR2B16EHRA27H9ISP591EEI,PKON6,PKON6,3NOKK93PR2B16EHRA27H9ISP591EEI,3NOKK93PR2B16EHRA27H9ISP591EEI,271016,271016,,,,,,,,,,
,,,,5,6.744115,0,12,12,1207,1,a living room with an unknown item on the floor near the window.,a living room with nothing on the floor or near the windows.,wolfe2,125_R_sofa,2,36,A28O8I1SYFZO7A,2021-01-24_10h53.15.687,MetaAwareness,2020.1.2,Win32,60,3TZDZ3Y0JT9I5XY401REM1DWZQN19O,A28O8I1SYFZO7A,3NOKK93PR2B16EHRA27H9ISP591EEI,PKON6,PKON6,3NOKK93PR2B16EHRA27H9ISP591EEI,3NOKK93PR2B16EHRA27H9ISP591EEI,271016,271016,,,,,,,,,,
,,,,5,7.61536,0,13,13,590,1,a dark wood dining room with a table set with place settings. the place setting on the left of the table has two glasses,a dark wood dining room with a table set with place settings. the place setting on the left of the table has one glass.,wolfe2,061_R_glass,5,36,A28O8I1SYFZO7A,2021-01-24_10h53.15.687,MetaAwareness,2020.1.2,Win32,60,3TZDZ3Y0JT9I5XY401REM1DWZQN19O,A28O8I1SYFZO7A,3NOKK93PR2B16EHRA27H9ISP591EEI,PKON6,PKON6,3NOKK93PR2B16EHRA27H9ISP591EEI,3NOKK93PR2B16EHRA27H9ISP591EEI,271016,271016,,,,,,,,,,
,,,,5,8.87286,0,14,14,364,1,"a brown, retro dining room without a long sculpture hanging on the wall","a brown, retro dining room with a long sculpture hanging on the wall",wolfe2,038_L_art,3,36,A28O8I1SYFZO7A,2021-01-24_10h53.15.687,MetaAwareness,2020.1.2,Win32,60,3TZDZ3Y0JT9I5XY401REM1DWZQN19O,A28O8I1SYFZO7A,3NOKK93PR2B16EHRA27H9ISP591EEI,PKON6,PKON6,3NOKK93PR2B16EHRA27H9ISP591EEI,3NOKK93PR2B16EHRA27H9ISP591EEI,271016,271016,,,,,,,,,,
,,,,5,6.54268,0,15,15,485,1,"a fireplace and mirror in a white room, containing classic accent pieces with a mantle as the centerpiece","a fireplace and mirror in a white room containing classic accent pieces with a mantle as the centerpiece, which has a small glass bird on top of it",wolfe2,051_L_owl,3,36,A28O8I1SYFZO7A,2021-01-24_10h53.15.687,MetaAwareness,2020.1.2,Win32,60,3TZDZ3Y0JT9I5XY401REM1DWZQN19O,A28O8I1SYFZO7A,3NOKK93PR2B16EHRA27H9ISP591EEI,PKON6,PKON6,3NOKK93PR2B16EHRA27H9ISP591EEI,3NOKK93PR2B16EHRA27H9ISP591EEI,271016,271016,,,,,,,,,,
,,,,1,5.262155,0,16,16,1212,1,there is a pair of deodrant,the contains an empty wall,wolfe2,126_L_candles,3,36,A28O8I1SYFZO7A,2021-01-24_10h53.15.687,MetaAwareness,2020.1.2,Win32,60,3TZDZ3Y0JT9I5XY401REM1DWZQN19O,A28O8I1SYFZO7A,3NOKK93PR2B16EHRA27H9ISP591EEI,PKON6,PKON6,3NOKK93PR2B16EHRA27H9ISP591EEI,3NOKK93PR2B16EHRA27H9ISP591EEI,271016,271016,,,,,,,,,,
,,,,6,7.148505,0,17,17,1073,1,a sun porch with many plants in front of a window and an empty vase beside them,a sun porch with many plants in front of a window,wolfe2,111_L_pot,5,36,A28O8I1SYFZO7A,2021-01-24_10h53.15.687,MetaAwareness,2020.1.2,Win32,60,3TZDZ3Y0JT9I5XY401REM1DWZQN19O,A28O8I1SYFZO7A,3NOKK93PR2B16EHRA27H9ISP591EEI,PKON6,PKON6,3NOKK93PR2B16EHRA27H9ISP591EEI,3NOKK93PR2B16EHRA27H9ISP591EEI,271016,271016,,,,,,,,,,
,,,,5,7.978345,0,18,18,947,1,a nice bedroom with a large bed and chair with a pillow on the floor between them,a nice bedroom with a large bed and chair,wolfe2,098_L_slippers,2,36,A28O8I1SYFZO7A,2021-01-24_10h53.15.687,MetaAwareness,2020.1.2,Win32,60,3TZDZ3Y0JT9I5XY401REM1DWZQN19O,A28O8I1SYFZO7A,3NOKK93PR2B16EHRA27H9ISP591EEI,PKON6,PKON6,3NOKK93PR2B16EHRA27H9ISP591EEI,3NOKK93PR2B16EHRA27H9ISP591EEI,271016,271016,,,,,,,,,,
,,,,4,7.26428,0,19,19,644,1,an empty office with 1 huge picture on the wall,an empty office with a couple artwork pictures,wolfe2,067_L_painting,1,36,A28O8I1SYFZO7A,2021-01-24_10h53.15.687,MetaAwareness,2020.1.2,Win32,60,3TZDZ3Y0JT9I5XY401REM1DWZQN19O,A28O8I1SYFZO7A,3NOKK93PR2B16EHRA27H9ISP591EEI,PKON6,PKON6,3NOKK93PR2B16EHRA27H9ISP591EEI,3NOKK93PR2B16EHRA27H9ISP591EEI,271016,271016,,,,,,,,,,
,,,,5,8.364995,0,20,20,982,1,"a bathroom containing a toilet, sink, and cabinet beside the sink with three cups on the third shelf up","a bathroom containing a toilet, sink, and cabinet beside the sink with two cups on the third shelf up",wolfe2,101_R_cup,5,36,A28O8I1SYFZO7A,2021-01-24_10h53.15.687,MetaAwareness,2020.1.2,Win32,60,3TZDZ3Y0JT9I5XY401REM1DWZQN19O,A28O8I1SYFZO7A,3NOKK93PR2B16EHRA27H9ISP591EEI,PKON6,PKON6,3NOKK93PR2B16EHRA27H9ISP591EEI,3NOKK93PR2B16EHRA27H9ISP591EEI,271016,271016,,,,,,,,,,
,,,,4,8.18097,0,21,21,956,1,a somewhat cluttered dining room with a mirror on the wall next to a painting .,a somewhat cluttered dining room with only a painting on the wall.,wolfe2,099_L_sconce,1,36,A28O8I1SYFZO7A,2021-01-24_10h53.15.687,MetaAwareness,2020.1.2,Win32,60,3TZDZ3Y0JT9I5XY401REM1DWZQN19O,A28O8I1SYFZO7A,3NOKK93PR2B16EHRA27H9ISP591EEI,PKON6,PKON6,3NOKK93PR2B16EHRA27H9ISP591EEI,3NOKK93PR2B16EHRA27H9ISP591EEI,271016,271016,,,,,,,,,,
,,,,4,4.669945,0,22,22,55,1,there is nothing by the lamp,there is a vase near the lamp ,wolfe2,006_R_vase,3,36,A28O8I1SYFZO7A,2021-01-24_10h53.15.687,MetaAwareness,2020.1.2,Win32,60,3TZDZ3Y0JT9I5XY401REM1DWZQN19O,A28O8I1SYFZO7A,3NOKK93PR2B16EHRA27H9ISP591EEI,PKON6,PKON6,3NOKK93PR2B16EHRA27H9ISP591EEI,3NOKK93PR2B16EHRA27H9ISP591EEI,271016,271016,,,,,,,,,,
,,,,5,11.140165,0,23,23,21,1,cabin-style living room overlooking a small body of water,"cabin-style living room looking out onto a body of water, with multiple ducks",wolfe2,003_L_ducks,4,36,A28O8I1SYFZO7A,2021-01-24_10h53.15.687,MetaAwareness,2020.1.2,Win32,60,3TZDZ3Y0JT9I5XY401REM1DWZQN19O,A28O8I1SYFZO7A,3NOKK93PR2B16EHRA27H9ISP591EEI,PKON6,PKON6,3NOKK93PR2B16EHRA27H9ISP591EEI,3NOKK93PR2B16EHRA27H9ISP591EEI,271016,271016,,,,,,,,,,
,,,,3,22.36231,0,24,24,727,1,a well painted ceiling appears in a well outfitted kitchen.,a can light appears in the kitchen.,wolfe2,075_R_light,5,36,A28O8I1SYFZO7A,2021-01-24_10h53.15.687,MetaAwareness,2020.1.2,Win32,60,3TZDZ3Y0JT9I5XY401REM1DWZQN19O,A28O8I1SYFZO7A,3NOKK93PR2B16EHRA27H9ISP591EEI,PKON6,PKON6,3NOKK93PR2B16EHRA27H9ISP591EEI,3NOKK93PR2B16EHRA27H9ISP591EEI,271016,271016,,,,,,,,,,
,,,,5,5.04874,0,25,25,536,1,a brown and white living room with nothing on the couch,a brown and white living room with a brown blanket on the couch,wolfe2,056_L_comforter,3,36,A28O8I1SYFZO7A,2021-01-24_10h53.15.687,MetaAwareness,2020.1.2,Win32,60,3TZDZ3Y0JT9I5XY401REM1DWZQN19O,A28O8I1SYFZO7A,3NOKK93PR2B16EHRA27H9ISP591EEI,PKON6,PKON6,3NOKK93PR2B16EHRA27H9ISP591EEI,3NOKK93PR2B16EHRA27H9ISP591EEI,271016,271016,,,,,,,,,,
,,,,5,7.81721,0,26,26,107,1,a double vanity sink with a soap on top of the counter and towels hanging next to it. ,"a double vanity sink with two different hand soaps on it, and towels hanging next to it",wolfe2,011_L_parfum,4,36,A28O8I1SYFZO7A,2021-01-24_10h53.15.687,MetaAwareness,2020.1.2,Win32,60,3TZDZ3Y0JT9I5XY401REM1DWZQN19O,A28O8I1SYFZO7A,3NOKK93PR2B16EHRA27H9ISP591EEI,PKON6,PKON6,3NOKK93PR2B16EHRA27H9ISP591EEI,3NOKK93PR2B16EHRA27H9ISP591EEI,271016,271016,,,,,,,,,,
,,,,4,9.114065,0,27,27,22,1,no body swim in the lake,three person are swim in the lake,wolfe2,003_R_ducks,1,36,A28O8I1SYFZO7A,2021-01-24_10h53.15.687,MetaAwareness,2020.1.2,Win32,60,3TZDZ3Y0JT9I5XY401REM1DWZQN19O,A28O8I1SYFZO7A,3NOKK93PR2B16EHRA27H9ISP591EEI,PKON6,PKON6,3NOKK93PR2B16EHRA27H9ISP591EEI,3NOKK93PR2B16EHRA27H9ISP591EEI,271016,271016,,,,,,,,,,
,,,,5,5.941545,0,28,28,837,1,this is a bathroom vanity. to the right of the mirror is a light switch,this is a bathroom vanity. there is no light switch on the wall,wolfe2,085_R_switchboard,8,36,A28O8I1SYFZO7A,2021-01-24_10h53.15.687,MetaAwareness,2020.1.2,Win32,60,3TZDZ3Y0JT9I5XY401REM1DWZQN19O,A28O8I1SYFZO7A,3NOKK93PR2B16EHRA27H9ISP591EEI,PKON6,PKON6,3NOKK93PR2B16EHRA27H9ISP591EEI,3NOKK93PR2B16EHRA27H9ISP591EEI,271016,271016,,,,,,,,,,
,,,,5,12.558985,0,29,29,207,1,"a colorful office with a desk, chair and computer","a colorful office with a desk, chair, keyboard, and computer",wolfe2,021_R_keyboard,3,36,A28O8I1SYFZO7A,2021-01-24_10h53.15.687,MetaAwareness,2020.1.2,Win32,60,3TZDZ3Y0JT9I5XY401REM1DWZQN19O,A28O8I1SYFZO7A,3NOKK93PR2B16EHRA27H9ISP591EEI,PKON6,PKON6,3NOKK93PR2B16EHRA27H9ISP591EEI,3NOKK93PR2B16EHRA27H9ISP591EEI,271016,271016,,,,,,,,,,
,,,,,,,,,,,,,,,,36,A28O8I1SYFZO7A,2021-01-24_10h53.15.687,MetaAwareness,2020.1.2,Win32,60,3TZDZ3Y0JT9I5XY401REM1DWZQN19O,A28O8I1SYFZO7A,3NOKK93PR2B16EHRA27H9ISP591EEI,PKON6,PKON6,3NOKK93PR2B16EHRA27H9ISP591EEI,3NOKK93PR2B16EHRA27H9ISP591EEI,271016,271016,6,7.57953,someone laying underneath a blue beach umbrella on a crowded beach,someone laying underneath a blue beach umbrella on a crowded beach,same,1,6.111185,members of a marching band crossing a track that all have feather plumes at the front of their hats,a cluttered and rustic looking cafe with 10 hanging lights,different
