consent_response.keys,consent_response.rt,key_resp_2.keys,key_resp_2.rt,user_resp.keys,user_resp.rt,trials.thisRepN,trials.thisTrialN,trials.thisN,trials.thisIndex,trials.ran,image_1_text,image_2_text,database,image,number,age,worker_ID,date,expName,psychopyVersion,OS,frameRate,hitId,workerId,assignmentId,a,tp_a,b,tp_b,c,tp_c,catch_same_resp.keys,catch_same_resp.rt,image_1_text_catch_same,image_2_text_catch_same,image_catch_same,catch_different_resp.keys,catch_different_resp.rt,image_1_text_catch_different,image_2_text_catch_different,image_catch_different
space,14.290305,space,11.062545,4,15.26505,0,0,0,913,1,"this room looks comfortable and plain at the same time.  the outlet, maybe, in the middle provides a little variety.",the missing outlet would probably not be noticed by someone who wasn't expecting it.  the room is plain but the photo does help a little.,wolfe2,093_R_switch,1,40,AWZPYE91AF7KU,2021-01-24_14h51.34.536,MetaAwareness,2020.1.2,Win32,60,3AC6MFV69LL8FZ1V6OOYRCVWVIBZH4,AWZPYE91AF7KU,3GNA64GUZF7Q7YE38S9EZ5BQBJZQ5E,U6NG6,U6NG6,3GNA64GUZF7Q7YE38S9EZ5BQBJZQ5E,3GNA64GUZF7Q7YE38S9EZ5BQBJZQ5E,271016,271016,,,,,,,,,,
,,,,3,9.65103,0,1,1,11,1,a special event dining room with 7 napkins on the closest table,a special event dining room with 8 napkins on the closest table,wolfe2,002_L_napkin,2,40,AWZPYE91AF7KU,2021-01-24_14h51.34.536,MetaAwareness,2020.1.2,Win32,60,3AC6MFV69LL8FZ1V6OOYRCVWVIBZH4,AWZPYE91AF7KU,3GNA64GUZF7Q7YE38S9EZ5BQBJZQ5E,U6NG6,U6NG6,3GNA64GUZF7Q7YE38S9EZ5BQBJZQ5E,3GNA64GUZF7Q7YE38S9EZ5BQBJZQ5E,271016,271016,,,,,,,,,,
,,,,5,5.195565,0,2,2,903,1,a living room with a white couch and a large mirror,"a living room with a white couch, a large mirror and candles on the floor",wolfe2,092_R_candles,5,40,AWZPYE91AF7KU,2021-01-24_14h51.34.536,MetaAwareness,2020.1.2,Win32,60,3AC6MFV69LL8FZ1V6OOYRCVWVIBZH4,AWZPYE91AF7KU,3GNA64GUZF7Q7YE38S9EZ5BQBJZQ5E,U6NG6,U6NG6,3GNA64GUZF7Q7YE38S9EZ5BQBJZQ5E,3GNA64GUZF7Q7YE38S9EZ5BQBJZQ5E,271016,271016,,,,,,,,,,
,,,,5,7.01051,0,3,3,268,1,spa like bathroom with an open clear shower,bathroom with a spa like feel with a soap holder in the shower,wolfe2,027_R_soapdish,5,40,AWZPYE91AF7KU,2021-01-24_14h51.34.536,MetaAwareness,2020.1.2,Win32,60,3AC6MFV69LL8FZ1V6OOYRCVWVIBZH4,AWZPYE91AF7KU,3GNA64GUZF7Q7YE38S9EZ5BQBJZQ5E,U6NG6,U6NG6,3GNA64GUZF7Q7YE38S9EZ5BQBJZQ5E,3GNA64GUZF7Q7YE38S9EZ5BQBJZQ5E,271016,271016,,,,,,,,,,
,,,,3,11.50643,0,4,4,1010,1,a rustic looking cafe with a table that has a vase and flowers,a rustic looking cafe with tables that don't have a vase or flowers on them,wolfe2,104_R_bottle,4,40,AWZPYE91AF7KU,2021-01-24_14h51.34.536,MetaAwareness,2020.1.2,Win32,60,3AC6MFV69LL8FZ1V6OOYRCVWVIBZH4,AWZPYE91AF7KU,3GNA64GUZF7Q7YE38S9EZ5BQBJZQ5E,U6NG6,U6NG6,3GNA64GUZF7Q7YE38S9EZ5BQBJZQ5E,3GNA64GUZF7Q7YE38S9EZ5BQBJZQ5E,271016,271016,,,,,,,,,,
,,,,4,6.937455,0,5,5,193,1,a small office with two discs on the wall,a small office with three discs on the wall,wolfe2,020_L_walldeco,4,40,AWZPYE91AF7KU,2021-01-24_14h51.34.536,MetaAwareness,2020.1.2,Win32,60,3AC6MFV69LL8FZ1V6OOYRCVWVIBZH4,AWZPYE91AF7KU,3GNA64GUZF7Q7YE38S9EZ5BQBJZQ5E,U6NG6,U6NG6,3GNA64GUZF7Q7YE38S9EZ5BQBJZQ5E,3GNA64GUZF7Q7YE38S9EZ5BQBJZQ5E,271016,271016,,,,,,,,,,
,,,,3,6.893225,0,6,6,393,1,there is an empty bowl atop the countertop in this large kitchen,there is a fruit filled bowl atop the countertop in this large kitchen,wolfe2,041_R_fruit,3,40,AWZPYE91AF7KU,2021-01-24_14h51.34.536,MetaAwareness,2020.1.2,Win32,60,3AC6MFV69LL8FZ1V6OOYRCVWVIBZH4,AWZPYE91AF7KU,3GNA64GUZF7Q7YE38S9EZ5BQBJZQ5E,U6NG6,U6NG6,3GNA64GUZF7Q7YE38S9EZ5BQBJZQ5E,3GNA64GUZF7Q7YE38S9EZ5BQBJZQ5E,271016,271016,,,,,,,,,,
,,,,5,7.66471,0,7,7,1103,1,"a room with a small couch and coffee table that has some things on it, including two nicknacks","a room with a small couch and coffee table that has some things on it, including one nicknack",wolfe2,114_R_bird,5,40,AWZPYE91AF7KU,2021-01-24_14h51.34.536,MetaAwareness,2020.1.2,Win32,60,3AC6MFV69LL8FZ1V6OOYRCVWVIBZH4,AWZPYE91AF7KU,3GNA64GUZF7Q7YE38S9EZ5BQBJZQ5E,U6NG6,U6NG6,3GNA64GUZF7Q7YE38S9EZ5BQBJZQ5E,3GNA64GUZF7Q7YE38S9EZ5BQBJZQ5E,271016,271016,,,,,,,,,,
,,,,5,12.40403,0,8,8,960,1,"a dining rom with a table and chairs, a mirror, a storage unit and a candle hanging on the wall. "," a dining room with a table and chairs, a storage unit and a large mirror. ",wolfe2,099_L_sconce,5,40,AWZPYE91AF7KU,2021-01-24_14h51.34.536,MetaAwareness,2020.1.2,Win32,60,3AC6MFV69LL8FZ1V6OOYRCVWVIBZH4,AWZPYE91AF7KU,3GNA64GUZF7Q7YE38S9EZ5BQBJZQ5E,U6NG6,U6NG6,3GNA64GUZF7Q7YE38S9EZ5BQBJZQ5E,3GNA64GUZF7Q7YE38S9EZ5BQBJZQ5E,271016,271016,,,,,,,,,,
,,,,2,6.716755,0,9,9,996,1,design tiles on the kitchen,the tiles has been missing on kitchen,wolfe2,103_R_hook,1,40,AWZPYE91AF7KU,2021-01-24_14h51.34.536,MetaAwareness,2020.1.2,Win32,60,3AC6MFV69LL8FZ1V6OOYRCVWVIBZH4,AWZPYE91AF7KU,3GNA64GUZF7Q7YE38S9EZ5BQBJZQ5E,U6NG6,U6NG6,3GNA64GUZF7Q7YE38S9EZ5BQBJZQ5E,3GNA64GUZF7Q7YE38S9EZ5BQBJZQ5E,271016,271016,,,,,,,,,,
,,,,5,11.372545,0,10,10,1079,1,flowery couch and chair with basket,flowery couch and chair,wolfe2,112_L_basket,1,40,AWZPYE91AF7KU,2021-01-24_14h51.34.536,MetaAwareness,2020.1.2,Win32,60,3AC6MFV69LL8FZ1V6OOYRCVWVIBZH4,AWZPYE91AF7KU,3GNA64GUZF7Q7YE38S9EZ5BQBJZQ5E,U6NG6,U6NG6,3GNA64GUZF7Q7YE38S9EZ5BQBJZQ5E,3GNA64GUZF7Q7YE38S9EZ5BQBJZQ5E,271016,271016,,,,,,,,,,
,,,,4,10.138755,0,11,11,171,1,an airy living room with nothing in the entertainment center shelf,an airy living room with something in the entertainment center shelf,wolfe2,017_R_wood,4,40,AWZPYE91AF7KU,2021-01-24_14h51.34.536,MetaAwareness,2020.1.2,Win32,60,3AC6MFV69LL8FZ1V6OOYRCVWVIBZH4,AWZPYE91AF7KU,3GNA64GUZF7Q7YE38S9EZ5BQBJZQ5E,U6NG6,U6NG6,3GNA64GUZF7Q7YE38S9EZ5BQBJZQ5E,3GNA64GUZF7Q7YE38S9EZ5BQBJZQ5E,271016,271016,,,,,,,,,,
,,,,5,5.2156,0,12,12,1055,1,a modern looking family room that has a yellow and orange decorative pillows,a modern looking family room that has a yellow decorative pillow,wolfe2,109_L_pillow,4,40,AWZPYE91AF7KU,2021-01-24_14h51.34.536,MetaAwareness,2020.1.2,Win32,60,3AC6MFV69LL8FZ1V6OOYRCVWVIBZH4,AWZPYE91AF7KU,3GNA64GUZF7Q7YE38S9EZ5BQBJZQ5E,U6NG6,U6NG6,3GNA64GUZF7Q7YE38S9EZ5BQBJZQ5E,3GNA64GUZF7Q7YE38S9EZ5BQBJZQ5E,271016,271016,,,,,,,,,,
,,,,4,7.4946,0,13,13,1208,1,there is a box on the right side of the large living room,there is nothing on the right side of the large living room,wolfe2,125_R_sofa,3,40,AWZPYE91AF7KU,2021-01-24_14h51.34.536,MetaAwareness,2020.1.2,Win32,60,3AC6MFV69LL8FZ1V6OOYRCVWVIBZH4,AWZPYE91AF7KU,3GNA64GUZF7Q7YE38S9EZ5BQBJZQ5E,U6NG6,U6NG6,3GNA64GUZF7Q7YE38S9EZ5BQBJZQ5E,3GNA64GUZF7Q7YE38S9EZ5BQBJZQ5E,271016,271016,,,,,,,,,,
,,,,5,6.003995,0,14,14,418,1,a very modern bathroom with a large white marble tub,a very modern bathroom with a large white marble tub with lights,wolfe2,044_L_light,1,40,AWZPYE91AF7KU,2021-01-24_14h51.34.536,MetaAwareness,2020.1.2,Win32,60,3AC6MFV69LL8FZ1V6OOYRCVWVIBZH4,AWZPYE91AF7KU,3GNA64GUZF7Q7YE38S9EZ5BQBJZQ5E,U6NG6,U6NG6,3GNA64GUZF7Q7YE38S9EZ5BQBJZQ5E,3GNA64GUZF7Q7YE38S9EZ5BQBJZQ5E,271016,271016,,,,,,,,,,
,,,,4,7.91207,0,15,15,75,1,a blue themed bathroom ,a blue themed bathroom with a bottle missing ,wolfe2,008_R_bottle,1,40,AWZPYE91AF7KU,2021-01-24_14h51.34.536,MetaAwareness,2020.1.2,Win32,60,3AC6MFV69LL8FZ1V6OOYRCVWVIBZH4,AWZPYE91AF7KU,3GNA64GUZF7Q7YE38S9EZ5BQBJZQ5E,U6NG6,U6NG6,3GNA64GUZF7Q7YE38S9EZ5BQBJZQ5E,3GNA64GUZF7Q7YE38S9EZ5BQBJZQ5E,271016,271016,,,,,,,,,,
,,,,3,8.713855,0,16,16,324,1,the bedroom is very clean and good thedryes are missed the lock,the bedroom dryes are not missed ,wolfe2,034_L_handle,1,40,AWZPYE91AF7KU,2021-01-24_14h51.34.536,MetaAwareness,2020.1.2,Win32,60,3AC6MFV69LL8FZ1V6OOYRCVWVIBZH4,AWZPYE91AF7KU,3GNA64GUZF7Q7YE38S9EZ5BQBJZQ5E,U6NG6,U6NG6,3GNA64GUZF7Q7YE38S9EZ5BQBJZQ5E,3GNA64GUZF7Q7YE38S9EZ5BQBJZQ5E,271016,271016,,,,,,,,,,
,,,,4,6.330095,0,17,17,224,1,there is a tv in this outdoor living space but the tv is missing a remote.,this outdoor living space is complete with everything it needs to function well.,wolfe2,023_L_remote,5,40,AWZPYE91AF7KU,2021-01-24_14h51.34.536,MetaAwareness,2020.1.2,Win32,60,3AC6MFV69LL8FZ1V6OOYRCVWVIBZH4,AWZPYE91AF7KU,3GNA64GUZF7Q7YE38S9EZ5BQBJZQ5E,U6NG6,U6NG6,3GNA64GUZF7Q7YE38S9EZ5BQBJZQ5E,3GNA64GUZF7Q7YE38S9EZ5BQBJZQ5E,271016,271016,,,,,,,,,,
,,,,4,9.906925,0,18,18,854,1,it's a modern cool toned bathroom with a large mirror and sink,"still a modern cool toned bathroom, but it's missing a wall hanger by the toilet now.",wolfe2,087_R_towelhandle,3,40,AWZPYE91AF7KU,2021-01-24_14h51.34.536,MetaAwareness,2020.1.2,Win32,60,3AC6MFV69LL8FZ1V6OOYRCVWVIBZH4,AWZPYE91AF7KU,3GNA64GUZF7Q7YE38S9EZ5BQBJZQ5E,U6NG6,U6NG6,3GNA64GUZF7Q7YE38S9EZ5BQBJZQ5E,3GNA64GUZF7Q7YE38S9EZ5BQBJZQ5E,271016,271016,,,,,,,,,,
,,,,3,7.09816,0,19,19,858,1,the picture is very union and clock is showing the time,the picture is very union and there is no clock,wolfe2,088_L_clock,3,40,AWZPYE91AF7KU,2021-01-24_14h51.34.536,MetaAwareness,2020.1.2,Win32,60,3AC6MFV69LL8FZ1V6OOYRCVWVIBZH4,AWZPYE91AF7KU,3GNA64GUZF7Q7YE38S9EZ5BQBJZQ5E,U6NG6,U6NG6,3GNA64GUZF7Q7YE38S9EZ5BQBJZQ5E,3GNA64GUZF7Q7YE38S9EZ5BQBJZQ5E,271016,271016,,,,,,,,,,
,,,,5,8.1008,0,20,20,1217,1,a cozy living room setting with decorative vases on the wall shelves,a cozy living room setting with some wall shelves,wolfe2,126_R_candles,4,40,AWZPYE91AF7KU,2021-01-24_14h51.34.536,MetaAwareness,2020.1.2,Win32,60,3AC6MFV69LL8FZ1V6OOYRCVWVIBZH4,AWZPYE91AF7KU,3GNA64GUZF7Q7YE38S9EZ5BQBJZQ5E,U6NG6,U6NG6,3GNA64GUZF7Q7YE38S9EZ5BQBJZQ5E,3GNA64GUZF7Q7YE38S9EZ5BQBJZQ5E,271016,271016,,,,,,,,,,
,,,,5,3.86382,0,21,21,144,1,"a bright, modern restaurant with three overhead lights","a bright, modern restaurant with four overhead lights",wolfe2,014_R_lamp,5,40,AWZPYE91AF7KU,2021-01-24_14h51.34.536,MetaAwareness,2020.1.2,Win32,60,3AC6MFV69LL8FZ1V6OOYRCVWVIBZH4,AWZPYE91AF7KU,3GNA64GUZF7Q7YE38S9EZ5BQBJZQ5E,U6NG6,U6NG6,3GNA64GUZF7Q7YE38S9EZ5BQBJZQ5E,3GNA64GUZF7Q7YE38S9EZ5BQBJZQ5E,271016,271016,,,,,,,,,,
,,,,6,14.37306,0,22,22,346,1,"white dishes sit on a shelf underneath a cabinet in a beautiful, modern kitchen.","white dishes sit on a shelf underneath a cabinet in a beautiful, modern kitchen.",wolfe2,036_L_bowl,3,40,AWZPYE91AF7KU,2021-01-24_14h51.34.536,MetaAwareness,2020.1.2,Win32,60,3AC6MFV69LL8FZ1V6OOYRCVWVIBZH4,AWZPYE91AF7KU,3GNA64GUZF7Q7YE38S9EZ5BQBJZQ5E,U6NG6,U6NG6,3GNA64GUZF7Q7YE38S9EZ5BQBJZQ5E,3GNA64GUZF7Q7YE38S9EZ5BQBJZQ5E,271016,271016,,,,,,,,,,
,,,,5,6.928035,0,23,23,24,1,a lakeside view from a large multi-panel window,a lakeside view from a large multi-panel window that shows three ducks swimming,wolfe2,003_R_ducks,3,40,AWZPYE91AF7KU,2021-01-24_14h51.34.536,MetaAwareness,2020.1.2,Win32,60,3AC6MFV69LL8FZ1V6OOYRCVWVIBZH4,AWZPYE91AF7KU,3GNA64GUZF7Q7YE38S9EZ5BQBJZQ5E,U6NG6,U6NG6,3GNA64GUZF7Q7YE38S9EZ5BQBJZQ5E,3GNA64GUZF7Q7YE38S9EZ5BQBJZQ5E,271016,271016,,,,,,,,,,
,,,,5,8.31153,0,24,24,1128,1,plant on stand in room with large windows looking out to yard,room with large windows looking out to yard,wolfe2,117_R_plant_sized,2,40,AWZPYE91AF7KU,2021-01-24_14h51.34.536,MetaAwareness,2020.1.2,Win32,60,3AC6MFV69LL8FZ1V6OOYRCVWVIBZH4,AWZPYE91AF7KU,3GNA64GUZF7Q7YE38S9EZ5BQBJZQ5E,U6NG6,U6NG6,3GNA64GUZF7Q7YE38S9EZ5BQBJZQ5E,3GNA64GUZF7Q7YE38S9EZ5BQBJZQ5E,271016,271016,,,,,,,,,,
,,,,4,7.19735,0,25,25,1124,1," room with four doors to the yard , a couch with pillows and a plant on a stand","room with four doors to the yard, a couch with pillows and an empty stand",wolfe2,117_L_plant_sized,3,40,AWZPYE91AF7KU,2021-01-24_14h51.34.536,MetaAwareness,2020.1.2,Win32,60,3AC6MFV69LL8FZ1V6OOYRCVWVIBZH4,AWZPYE91AF7KU,3GNA64GUZF7Q7YE38S9EZ5BQBJZQ5E,U6NG6,U6NG6,3GNA64GUZF7Q7YE38S9EZ5BQBJZQ5E,3GNA64GUZF7Q7YE38S9EZ5BQBJZQ5E,271016,271016,,,,,,,,,,
,,,,4,6.17806,0,26,26,1058,1,a large living area with a lot interesting looking furniture including an orange pillow on a white couch.,a large living room with a lot of interesting furniture and a white couch.,wolfe2,109_R_pillow,3,40,AWZPYE91AF7KU,2021-01-24_14h51.34.536,MetaAwareness,2020.1.2,Win32,60,3AC6MFV69LL8FZ1V6OOYRCVWVIBZH4,AWZPYE91AF7KU,3GNA64GUZF7Q7YE38S9EZ5BQBJZQ5E,U6NG6,U6NG6,3GNA64GUZF7Q7YE38S9EZ5BQBJZQ5E,3GNA64GUZF7Q7YE38S9EZ5BQBJZQ5E,271016,271016,,,,,,,,,,
,,,,4,4.99602,0,27,27,500,1,theres a tv mounted to the wall with nothing underneath it,theres a tv mounted to the wall with a soundbar underneath it,wolfe2,052_L_speaker,4,40,AWZPYE91AF7KU,2021-01-24_14h51.34.536,MetaAwareness,2020.1.2,Win32,60,3AC6MFV69LL8FZ1V6OOYRCVWVIBZH4,AWZPYE91AF7KU,3GNA64GUZF7Q7YE38S9EZ5BQBJZQ5E,U6NG6,U6NG6,3GNA64GUZF7Q7YE38S9EZ5BQBJZQ5E,3GNA64GUZF7Q7YE38S9EZ5BQBJZQ5E,271016,271016,,,,,,,,,,
,,,,3,5.239515,0,28,28,598,1,a living room with an empty fireplace.,a living room with something in the fireplace.,wolfe2,062_R_flowers,2,40,AWZPYE91AF7KU,2021-01-24_14h51.34.536,MetaAwareness,2020.1.2,Win32,60,3AC6MFV69LL8FZ1V6OOYRCVWVIBZH4,AWZPYE91AF7KU,3GNA64GUZF7Q7YE38S9EZ5BQBJZQ5E,U6NG6,U6NG6,3GNA64GUZF7Q7YE38S9EZ5BQBJZQ5E,3GNA64GUZF7Q7YE38S9EZ5BQBJZQ5E,271016,271016,,,,,,,,,,
,,,,6,11.04311,0,29,29,1172,1, a room with several dinnig table present,a room with several dinning table present,wolfe2,122_L_chair,2,40,AWZPYE91AF7KU,2021-01-24_14h51.34.536,MetaAwareness,2020.1.2,Win32,60,3AC6MFV69LL8FZ1V6OOYRCVWVIBZH4,AWZPYE91AF7KU,3GNA64GUZF7Q7YE38S9EZ5BQBJZQ5E,U6NG6,U6NG6,3GNA64GUZF7Q7YE38S9EZ5BQBJZQ5E,3GNA64GUZF7Q7YE38S9EZ5BQBJZQ5E,271016,271016,,,,,,,,,,
,,,,,,,,,,,,,,,,40,AWZPYE91AF7KU,2021-01-24_14h51.34.536,MetaAwareness,2020.1.2,Win32,60,3AC6MFV69LL8FZ1V6OOYRCVWVIBZH4,AWZPYE91AF7KU,3GNA64GUZF7Q7YE38S9EZ5BQBJZQ5E,U6NG6,U6NG6,3GNA64GUZF7Q7YE38S9EZ5BQBJZQ5E,3GNA64GUZF7Q7YE38S9EZ5BQBJZQ5E,271016,271016,6,5.577415,someone laying underneath a blue beach umbrella on a crowded beach,someone laying underneath a blue beach umbrella on a crowded beach,same,1,8.69243,members of a marching band crossing a track that all have feather plumes at the front of their hats,a cluttered and rustic looking cafe with 10 hanging lights,different
