consent_response.keys,consent_response.rt,key_resp_2.keys,key_resp_2.rt,user_resp.keys,user_resp.rt,trials.thisRepN,trials.thisTrialN,trials.thisN,trials.thisIndex,trials.ran,image_1_text,image_2_text,database,image,number,age,worker_ID,date,expName,psychopyVersion,OS,frameRate,hitId,workerId,assignmentId,a,tp_a,b,tp_b,c,tp_c,catch_same_resp.keys,catch_same_resp.rt,image_1_text_catch_same,image_2_text_catch_same,image_catch_same,catch_different_resp.keys,catch_different_resp.rt,image_1_text_catch_different,image_2_text_catch_different,image_catch_different
space,24.053595,space,8.79553,5,16.999045,0,0,0,441,1,a crowd is sitting in the sun while a man in a green shirt is turned the opposite way,a crowd is sitting in the sun while a man in a pink shirt is turned the opposite way,wolfe1,image-105,1,35,AXCEP8NBG5RHV,2021-01-07_19h21.11.661,MetaAwareness,2020.1.2,Win32,60,3GONHBMNHW1U7D26XL4BJH3SBM1MZQ,AXCEP8NBG5RHV,30H4UDGLT3L3FTYU0EBBG2W2RX4MP3,LUH02,LUH02,30H4UDGLT3L3FTYU0EBBG2W2RX4MP3,30H4UDGLT3L3FTYU0EBBG2W2RX4MP3,267902,267902,,,,,,,,,,
,,,,4,10.488315,0,1,1,195,1,there are 6 stepping stones on the ground.,there are 5 stepping stones on the ground.,wolfe1,image-034,7,35,AXCEP8NBG5RHV,2021-01-07_19h21.11.661,MetaAwareness,2020.1.2,Win32,60,3GONHBMNHW1U7D26XL4BJH3SBM1MZQ,AXCEP8NBG5RHV,30H4UDGLT3L3FTYU0EBBG2W2RX4MP3,LUH02,LUH02,30H4UDGLT3L3FTYU0EBBG2W2RX4MP3,30H4UDGLT3L3FTYU0EBBG2W2RX4MP3,267902,267902,,,,,,,,,,
,,,,1,14.18181,0,2,2,426,1,men posing for a photo in front of a seal with one man in a red tie.,twenty men standing in front of a seal and one man has on a purple tie.,wolfe1,image-102,7,35,AXCEP8NBG5RHV,2021-01-07_19h21.11.661,MetaAwareness,2020.1.2,Win32,60,3GONHBMNHW1U7D26XL4BJH3SBM1MZQ,AXCEP8NBG5RHV,30H4UDGLT3L3FTYU0EBBG2W2RX4MP3,LUH02,LUH02,30H4UDGLT3L3FTYU0EBBG2W2RX4MP3,30H4UDGLT3L3FTYU0EBBG2W2RX4MP3,267902,267902,,,,,,,,,,
,,,,3,21.21991,0,3,3,279,1,three adults stand before a small classroom of students and there is a large stack of papers and-or files in the background behind one of the teachers,three adults stand before a small classroom of students and there is a projector screen behind the three instructors,wolfe1,image-050,2,35,AXCEP8NBG5RHV,2021-01-07_19h21.11.661,MetaAwareness,2020.1.2,Win32,60,3GONHBMNHW1U7D26XL4BJH3SBM1MZQ,AXCEP8NBG5RHV,30H4UDGLT3L3FTYU0EBBG2W2RX4MP3,LUH02,LUH02,30H4UDGLT3L3FTYU0EBBG2W2RX4MP3,30H4UDGLT3L3FTYU0EBBG2W2RX4MP3,267902,267902,,,,,,,,,,
,,,,1,12.994525,0,4,4,429,1,people walking down the street in the rain including a person wearing green shoes,people walking down the street in the rain including a person wearing red shoes,wolfe1,image-103,3,35,AXCEP8NBG5RHV,2021-01-07_19h21.11.661,MetaAwareness,2020.1.2,Win32,60,3GONHBMNHW1U7D26XL4BJH3SBM1MZQ,AXCEP8NBG5RHV,30H4UDGLT3L3FTYU0EBBG2W2RX4MP3,LUH02,LUH02,30H4UDGLT3L3FTYU0EBBG2W2RX4MP3,30H4UDGLT3L3FTYU0EBBG2W2RX4MP3,267902,267902,,,,,,,,,,
,,,,1,13.859755,0,5,5,1,1,dining tables with place settings and a salt shaker and also chairs next to a blue ocean.,dining tables with place mats and  silverware but lacking salt and pepper overlooking a blue ocean.,wolfe1,image-001,2,35,AXCEP8NBG5RHV,2021-01-07_19h21.11.661,MetaAwareness,2020.1.2,Win32,60,3GONHBMNHW1U7D26XL4BJH3SBM1MZQ,AXCEP8NBG5RHV,30H4UDGLT3L3FTYU0EBBG2W2RX4MP3,LUH02,LUH02,30H4UDGLT3L3FTYU0EBBG2W2RX4MP3,30H4UDGLT3L3FTYU0EBBG2W2RX4MP3,267902,267902,,,,,,,,,,
,,,,5,11.902905,0,6,6,132,1,3 people running in front of a park with a bench next to a fountain,3 people running in front of a park that has a view of a fountain.,wolfe1,image-022,6,35,AXCEP8NBG5RHV,2021-01-07_19h21.11.661,MetaAwareness,2020.1.2,Win32,60,3GONHBMNHW1U7D26XL4BJH3SBM1MZQ,AXCEP8NBG5RHV,30H4UDGLT3L3FTYU0EBBG2W2RX4MP3,LUH02,LUH02,30H4UDGLT3L3FTYU0EBBG2W2RX4MP3,30H4UDGLT3L3FTYU0EBBG2W2RX4MP3,267902,267902,,,,,,,,,,
,,,,4,14.00437,0,7,7,568,1,a person with a blue shirt begins climbing up a pocked rockside to a cliff from the waters below,a person with a green shirt begins climbing up a pocked rockside to a cliff from the waters below,wolfe1,image-128,4,35,AXCEP8NBG5RHV,2021-01-07_19h21.11.661,MetaAwareness,2020.1.2,Win32,60,3GONHBMNHW1U7D26XL4BJH3SBM1MZQ,AXCEP8NBG5RHV,30H4UDGLT3L3FTYU0EBBG2W2RX4MP3,LUH02,LUH02,30H4UDGLT3L3FTYU0EBBG2W2RX4MP3,30H4UDGLT3L3FTYU0EBBG2W2RX4MP3,267902,267902,,,,,,,,,,
,,,,4,9.272215,0,8,8,402,1,food stalls in front of bleachers with one customer wearing mint blue pants.,food stalls in front of bleachers with one customer wearing green pants.,wolfe1,image-097,4,35,AXCEP8NBG5RHV,2021-01-07_19h21.11.661,MetaAwareness,2020.1.2,Win32,60,3GONHBMNHW1U7D26XL4BJH3SBM1MZQ,AXCEP8NBG5RHV,30H4UDGLT3L3FTYU0EBBG2W2RX4MP3,LUH02,LUH02,30H4UDGLT3L3FTYU0EBBG2W2RX4MP3,30H4UDGLT3L3FTYU0EBBG2W2RX4MP3,267902,267902,,,,,,,,,,
,,,,4,8.017715,0,9,9,113,1,guy in red wall climbing,people wall climbing,wolfe1,image-019,2,35,AXCEP8NBG5RHV,2021-01-07_19h21.11.661,MetaAwareness,2020.1.2,Win32,60,3GONHBMNHW1U7D26XL4BJH3SBM1MZQ,AXCEP8NBG5RHV,30H4UDGLT3L3FTYU0EBBG2W2RX4MP3,LUH02,LUH02,30H4UDGLT3L3FTYU0EBBG2W2RX4MP3,30H4UDGLT3L3FTYU0EBBG2W2RX4MP3,267902,267902,,,,,,,,,,
,,,,2,8.5781,0,10,10,229,1,a factory near a lake with rocks,a factory near a lake with no rocks in it,wolfe1,image-041,7,35,AXCEP8NBG5RHV,2021-01-07_19h21.11.661,MetaAwareness,2020.1.2,Win32,60,3GONHBMNHW1U7D26XL4BJH3SBM1MZQ,AXCEP8NBG5RHV,30H4UDGLT3L3FTYU0EBBG2W2RX4MP3,LUH02,LUH02,30H4UDGLT3L3FTYU0EBBG2W2RX4MP3,30H4UDGLT3L3FTYU0EBBG2W2RX4MP3,267902,267902,,,,,,,,,,
,,,,2,7.505535,0,11,11,564,1,woman clearing car with bluw shovel,women clearing car with green shovel,wolfe1,image-127,5,35,AXCEP8NBG5RHV,2021-01-07_19h21.11.661,MetaAwareness,2020.1.2,Win32,60,3GONHBMNHW1U7D26XL4BJH3SBM1MZQ,AXCEP8NBG5RHV,30H4UDGLT3L3FTYU0EBBG2W2RX4MP3,LUH02,LUH02,30H4UDGLT3L3FTYU0EBBG2W2RX4MP3,30H4UDGLT3L3FTYU0EBBG2W2RX4MP3,267902,267902,,,,,,,,,,
,,,,5,17.655855,0,12,12,505,1,two women help a young man prepare for a running marathon with a small building showing in the background which has reddish windows,two women help a young man prepare for a running marathon with a small building showing in the background which has black windows,wolfe1,image-116,4,35,AXCEP8NBG5RHV,2021-01-07_19h21.11.661,MetaAwareness,2020.1.2,Win32,60,3GONHBMNHW1U7D26XL4BJH3SBM1MZQ,AXCEP8NBG5RHV,30H4UDGLT3L3FTYU0EBBG2W2RX4MP3,LUH02,LUH02,30H4UDGLT3L3FTYU0EBBG2W2RX4MP3,30H4UDGLT3L3FTYU0EBBG2W2RX4MP3,267902,267902,,,,,,,,,,
,,,,2,10.684355,0,13,13,468,1,sseveral people outdoors with backpacks,several people outdoors and a bman with a blue backpack,wolfe1,image-109,4,35,AXCEP8NBG5RHV,2021-01-07_19h21.11.661,MetaAwareness,2020.1.2,Win32,60,3GONHBMNHW1U7D26XL4BJH3SBM1MZQ,AXCEP8NBG5RHV,30H4UDGLT3L3FTYU0EBBG2W2RX4MP3,LUH02,LUH02,30H4UDGLT3L3FTYU0EBBG2W2RX4MP3,30H4UDGLT3L3FTYU0EBBG2W2RX4MP3,267902,267902,,,,,,,,,,
,,,,5,18.24913,0,14,14,98,1,"a group of four men stand on a golf course, and one of them is getting ready to swing, and there is a peg in the ground behind him","a group of four men stand on a gold course, and one of them is getting ready to swing",wolfe1,image-017,4,35,AXCEP8NBG5RHV,2021-01-07_19h21.11.661,MetaAwareness,2020.1.2,Win32,60,3GONHBMNHW1U7D26XL4BJH3SBM1MZQ,AXCEP8NBG5RHV,30H4UDGLT3L3FTYU0EBBG2W2RX4MP3,LUH02,LUH02,30H4UDGLT3L3FTYU0EBBG2W2RX4MP3,30H4UDGLT3L3FTYU0EBBG2W2RX4MP3,267902,267902,,,,,,,,,,
,,,,5,9.30499,0,15,15,125,1,"a group of archers practices their shots, with every archer having a quiver and arrows at their feet.","a group of archers practices their shots, with the last archer's quiver and arrows being missing.",wolfe1,image-021,4,35,AXCEP8NBG5RHV,2021-01-07_19h21.11.661,MetaAwareness,2020.1.2,Win32,60,3GONHBMNHW1U7D26XL4BJH3SBM1MZQ,AXCEP8NBG5RHV,30H4UDGLT3L3FTYU0EBBG2W2RX4MP3,LUH02,LUH02,30H4UDGLT3L3FTYU0EBBG2W2RX4MP3,30H4UDGLT3L3FTYU0EBBG2W2RX4MP3,267902,267902,,,,,,,,,,
,,,,5,4.51611,0,16,16,625,1,umbrellas sit on a beach with a blue one at the rear,umbrellas sit on a beach with a yellow one at the rear,wolfe1,image-137,3,35,AXCEP8NBG5RHV,2021-01-07_19h21.11.661,MetaAwareness,2020.1.2,Win32,60,3GONHBMNHW1U7D26XL4BJH3SBM1MZQ,AXCEP8NBG5RHV,30H4UDGLT3L3FTYU0EBBG2W2RX4MP3,LUH02,LUH02,30H4UDGLT3L3FTYU0EBBG2W2RX4MP3,30H4UDGLT3L3FTYU0EBBG2W2RX4MP3,267902,267902,,,,,,,,,,
,,,,5,5.8334,0,17,17,474,1,a series of buildings. one has a red roof,a series of buildings. one has a dark blue roof,wolfe1,image-110,6,35,AXCEP8NBG5RHV,2021-01-07_19h21.11.661,MetaAwareness,2020.1.2,Win32,60,3GONHBMNHW1U7D26XL4BJH3SBM1MZQ,AXCEP8NBG5RHV,30H4UDGLT3L3FTYU0EBBG2W2RX4MP3,LUH02,LUH02,30H4UDGLT3L3FTYU0EBBG2W2RX4MP3,30H4UDGLT3L3FTYU0EBBG2W2RX4MP3,267902,267902,,,,,,,,,,
,,,,5,1.327215,0,18,18,163,1,"a university building with seven windows on the roof, a person walking a path, and many bikes in the foreground.","a university building with six windows on the roof, a person walking a path, and many bikes in the foreground.",wolfe1,image-029,4,35,AXCEP8NBG5RHV,2021-01-07_19h21.11.661,MetaAwareness,2020.1.2,Win32,60,3GONHBMNHW1U7D26XL4BJH3SBM1MZQ,AXCEP8NBG5RHV,30H4UDGLT3L3FTYU0EBBG2W2RX4MP3,LUH02,LUH02,30H4UDGLT3L3FTYU0EBBG2W2RX4MP3,30H4UDGLT3L3FTYU0EBBG2W2RX4MP3,267902,267902,,,,,,,,,,
,,,,4,2.552865,0,19,19,508,1,a woman looking at products under a blue tent in a large street farmers market with many other people.,a woman looking at products under a red tent in a large street farmers market with many other people.,wolfe1,image-117,1,35,AXCEP8NBG5RHV,2021-01-07_19h21.11.661,MetaAwareness,2020.1.2,Win32,60,3GONHBMNHW1U7D26XL4BJH3SBM1MZQ,AXCEP8NBG5RHV,30H4UDGLT3L3FTYU0EBBG2W2RX4MP3,LUH02,LUH02,30H4UDGLT3L3FTYU0EBBG2W2RX4MP3,30H4UDGLT3L3FTYU0EBBG2W2RX4MP3,267902,267902,,,,,,,,,,
,,,,4,3.11096,0,20,20,196,1,"the back yard of a house, containing a path with six stones connecting two sets of patios through grass","the back yard of a house, containing a path with five stones connecting two sets of patios through grass",wolfe1,image-034,8,35,AXCEP8NBG5RHV,2021-01-07_19h21.11.661,MetaAwareness,2020.1.2,Win32,60,3GONHBMNHW1U7D26XL4BJH3SBM1MZQ,AXCEP8NBG5RHV,30H4UDGLT3L3FTYU0EBBG2W2RX4MP3,LUH02,LUH02,30H4UDGLT3L3FTYU0EBBG2W2RX4MP3,30H4UDGLT3L3FTYU0EBBG2W2RX4MP3,267902,267902,,,,,,,,,,
,,,,4,4.93006,0,21,21,475,1,"a downtown city street with shops and stores, one of which is under a red awning","a downtown city street with shops and stores, one of which is under a blue awning",wolfe1,image-110,7,35,AXCEP8NBG5RHV,2021-01-07_19h21.11.661,MetaAwareness,2020.1.2,Win32,60,3GONHBMNHW1U7D26XL4BJH3SBM1MZQ,AXCEP8NBG5RHV,30H4UDGLT3L3FTYU0EBBG2W2RX4MP3,LUH02,LUH02,30H4UDGLT3L3FTYU0EBBG2W2RX4MP3,30H4UDGLT3L3FTYU0EBBG2W2RX4MP3,267902,267902,,,,,,,,,,
,,,,3,3.060675,0,22,22,174,1,a scout troop marches in a parade. one of the scouts in front has badges on both sides of her uniform.,a scout troop marches in a parade. one of the scouts in front has badges on one side of her uniform.,wolfe1,image-031,7,35,AXCEP8NBG5RHV,2021-01-07_19h21.11.661,MetaAwareness,2020.1.2,Win32,60,3GONHBMNHW1U7D26XL4BJH3SBM1MZQ,AXCEP8NBG5RHV,30H4UDGLT3L3FTYU0EBBG2W2RX4MP3,LUH02,LUH02,30H4UDGLT3L3FTYU0EBBG2W2RX4MP3,30H4UDGLT3L3FTYU0EBBG2W2RX4MP3,267902,267902,,,,,,,,,,
,,,,4,3.104105,0,23,23,595,1,a living room scene including a couch with two orange pillows,a living room scene including a couch with one orange and one yellow pillow,wolfe1,image-132,4,35,AXCEP8NBG5RHV,2021-01-07_19h21.11.661,MetaAwareness,2020.1.2,Win32,60,3GONHBMNHW1U7D26XL4BJH3SBM1MZQ,AXCEP8NBG5RHV,30H4UDGLT3L3FTYU0EBBG2W2RX4MP3,LUH02,LUH02,30H4UDGLT3L3FTYU0EBBG2W2RX4MP3,30H4UDGLT3L3FTYU0EBBG2W2RX4MP3,267902,267902,,,,,,,,,,
,,,,3,2.89724,0,24,24,158,1,a group of people are listening to a speaker while sitting on the grass in front of a building with a piece of paper behind them.,a group of people are listening to a speaker while sitting on the grass with no litter.,wolfe1,image-028,4,35,AXCEP8NBG5RHV,2021-01-07_19h21.11.661,MetaAwareness,2020.1.2,Win32,60,3GONHBMNHW1U7D26XL4BJH3SBM1MZQ,AXCEP8NBG5RHV,30H4UDGLT3L3FTYU0EBBG2W2RX4MP3,LUH02,LUH02,30H4UDGLT3L3FTYU0EBBG2W2RX4MP3,30H4UDGLT3L3FTYU0EBBG2W2RX4MP3,267902,267902,,,,,,,,,,
,,,,4,1.486,0,25,25,365,1,a group exercise event where one of the participants is wearing white shoes,a group exercise event where one of the participants is wearing purple shoes,wolfe1,image-092,2,35,AXCEP8NBG5RHV,2021-01-07_19h21.11.661,MetaAwareness,2020.1.2,Win32,60,3GONHBMNHW1U7D26XL4BJH3SBM1MZQ,AXCEP8NBG5RHV,30H4UDGLT3L3FTYU0EBBG2W2RX4MP3,LUH02,LUH02,30H4UDGLT3L3FTYU0EBBG2W2RX4MP3,30H4UDGLT3L3FTYU0EBBG2W2RX4MP3,267902,267902,,,,,,,,,,
,,,,5,1.93753,0,26,26,159,1,there is an object behind the person sitting in the center of the photo,there is more grass behind the person sitting in the center of the photo,wolfe1,image-028,5,35,AXCEP8NBG5RHV,2021-01-07_19h21.11.661,MetaAwareness,2020.1.2,Win32,60,3GONHBMNHW1U7D26XL4BJH3SBM1MZQ,AXCEP8NBG5RHV,30H4UDGLT3L3FTYU0EBBG2W2RX4MP3,LUH02,LUH02,30H4UDGLT3L3FTYU0EBBG2W2RX4MP3,30H4UDGLT3L3FTYU0EBBG2W2RX4MP3,267902,267902,,,,,,,,,,
,,,,3,4.590835,0,27,27,529,1,red safety floating vests on a boat,green safety floating vests on a boat,wolfe1,image-121,1,35,AXCEP8NBG5RHV,2021-01-07_19h21.11.661,MetaAwareness,2020.1.2,Win32,60,3GONHBMNHW1U7D26XL4BJH3SBM1MZQ,AXCEP8NBG5RHV,30H4UDGLT3L3FTYU0EBBG2W2RX4MP3,LUH02,LUH02,30H4UDGLT3L3FTYU0EBBG2W2RX4MP3,30H4UDGLT3L3FTYU0EBBG2W2RX4MP3,267902,267902,,,,,,,,,,
,,,,4,2.52959,0,28,28,289,1,some men in hats watching a dirt bike race,some men in hats watching a dirt bike race,wolfe1,image-076,8,35,AXCEP8NBG5RHV,2021-01-07_19h21.11.661,MetaAwareness,2020.1.2,Win32,60,3GONHBMNHW1U7D26XL4BJH3SBM1MZQ,AXCEP8NBG5RHV,30H4UDGLT3L3FTYU0EBBG2W2RX4MP3,LUH02,LUH02,30H4UDGLT3L3FTYU0EBBG2W2RX4MP3,30H4UDGLT3L3FTYU0EBBG2W2RX4MP3,267902,267902,,,,,,,,,,
,,,,5,5.013645,0,29,29,331,1,hikers rest on the top of a mountain while a man gets something out of his red pack,hikers rest on the top of a mountain while a man gets something out of his gren pack,wolfe1,image-084,5,35,AXCEP8NBG5RHV,2021-01-07_19h21.11.661,MetaAwareness,2020.1.2,Win32,60,3GONHBMNHW1U7D26XL4BJH3SBM1MZQ,AXCEP8NBG5RHV,30H4UDGLT3L3FTYU0EBBG2W2RX4MP3,LUH02,LUH02,30H4UDGLT3L3FTYU0EBBG2W2RX4MP3,30H4UDGLT3L3FTYU0EBBG2W2RX4MP3,267902,267902,,,,,,,,,,
,,,,,,,,,,,,,,,,35,AXCEP8NBG5RHV,2021-01-07_19h21.11.661,MetaAwareness,2020.1.2,Win32,60,3GONHBMNHW1U7D26XL4BJH3SBM1MZQ,AXCEP8NBG5RHV,30H4UDGLT3L3FTYU0EBBG2W2RX4MP3,LUH02,LUH02,30H4UDGLT3L3FTYU0EBBG2W2RX4MP3,30H4UDGLT3L3FTYU0EBBG2W2RX4MP3,267902,267902,4,2.50858,someone laying underneath a blue beach umbrella on a crowded beach,someone laying underneath a blue beach umbrella on a crowded beach,same,4,5.223885,members of a marching band crossing a track that all have feather plumes at the front of their hats,a cluttered and rustic looking cafe with 10 hanging lights,different
