consent_response.keys,consent_response.rt,key_resp_2.keys,key_resp_2.rt,user_resp.keys,user_resp.rt,trials.thisRepN,trials.thisTrialN,trials.thisN,trials.thisIndex,trials.ran,image_1_text,image_2_text,database,image,number,age,worker_ID,date,expName,psychopyVersion,OS,frameRate,hitId,workerId,assignmentId,a,tp_a,b,tp_b,c,tp_c,catch_same_resp.keys,catch_same_resp.rt,image_1_text_catch_same,image_2_text_catch_same,image_catch_same,catch_different_resp.keys,catch_different_resp.rt,image_1_text_catch_different,image_2_text_catch_different,image_catch_different
space,43.394,space,69.666,4,41.778,0,0,0,48,1,there is a study desk in the bedroom near the window.there are two windows in the background with a fence and trees.,there is a round tan rug under the study desk extending to the first leg of the bed. there are two windows in the background with a fence and trees.,wolfe2,009_R_carpet,4,30,A25N8DM670K4MA,2021-01-25_14h44.18.676,MetaAwareness,2020.1.2,Win32,60,3UY4PIS8QSO3UZ2Y1BAJ428G4GG1N1,A25N8DM670K4MA,35LDD5557B72421ENM63KLA3YB3KMI,5DL55,5DL55,35LDD5557B72421ENM63KLA3YB3KMI,35LDD5557B72421ENM63KLA3YB3KMI,271255,271255,,,,,,,,,,
,,,,4,26.638,0,1,1,626,1,open living and kitchen in deep wood tones with a potted plant on the counter,rich wood open concept family and kitchen rooms with a window by the oven.,wolfe2,115_R_pot,4,30,A25N8DM670K4MA,2021-01-25_14h44.18.676,MetaAwareness,2020.1.2,Win32,60,3UY4PIS8QSO3UZ2Y1BAJ428G4GG1N1,A25N8DM670K4MA,35LDD5557B72421ENM63KLA3YB3KMI,5DL55,5DL55,35LDD5557B72421ENM63KLA3YB3KMI,35LDD5557B72421ENM63KLA3YB3KMI,271255,271255,,,,,,,,,,
,,,,6,13.428,0,2,2,650,1,a living room with a screen door to the outside and a flower and two gold statues on the mantle,a living room with a screen door to the outside and a flower and one gold statue on the mantle,wolfe2,120_L_art,4,30,A25N8DM670K4MA,2021-01-25_14h44.18.676,MetaAwareness,2020.1.2,Win32,60,3UY4PIS8QSO3UZ2Y1BAJ428G4GG1N1,A25N8DM670K4MA,35LDD5557B72421ENM63KLA3YB3KMI,5DL55,5DL55,35LDD5557B72421ENM63KLA3YB3KMI,35LDD5557B72421ENM63KLA3YB3KMI,271255,271255,,,,,,,,,,
,,,,5,17.981,0,3,3,72,1,there are table and chairs at the office kitchen with one lamp hang on the top of ceiling,there are table and chairs at the office kitchen with two lamps hang on the top of ceiling,wolfe2,013_L_lamp,7,30,A25N8DM670K4MA,2021-01-25_14h44.18.676,MetaAwareness,2020.1.2,Win32,60,3UY4PIS8QSO3UZ2Y1BAJ428G4GG1N1,A25N8DM670K4MA,35LDD5557B72421ENM63KLA3YB3KMI,5DL55,5DL55,35LDD5557B72421ENM63KLA3YB3KMI,35LDD5557B72421ENM63KLA3YB3KMI,271255,271255,,,,,,,,,,
,,,,4,9.508,0,4,4,580,1,a bathroom with a hanging towel dispencer,a bathroom,wolfe2,106_R_toweldispenser,5,30,A25N8DM670K4MA,2021-01-25_14h44.18.676,MetaAwareness,2020.1.2,Win32,60,3UY4PIS8QSO3UZ2Y1BAJ428G4GG1N1,A25N8DM670K4MA,35LDD5557B72421ENM63KLA3YB3KMI,5DL55,5DL55,35LDD5557B72421ENM63KLA3YB3KMI,35LDD5557B72421ENM63KLA3YB3KMI,271255,271255,,,,,,,,,,
,,,,5,15.953,0,5,5,198,1,"a bedroom with some tables and a couple of lamps, and a long table with two vases on it","a bedroom with some tables and a couple of lamps, and a long table with two vases and a small art object on it",wolfe2,035_R_fruit,4,30,A25N8DM670K4MA,2021-01-25_14h44.18.676,MetaAwareness,2020.1.2,Win32,60,3UY4PIS8QSO3UZ2Y1BAJ428G4GG1N1,A25N8DM670K4MA,35LDD5557B72421ENM63KLA3YB3KMI,5DL55,5DL55,35LDD5557B72421ENM63KLA3YB3KMI,35LDD5557B72421ENM63KLA3YB3KMI,271255,271255,,,,,,,,,,
,,,,5,9.921,0,6,6,139,1,there are two stacks of towels folded under the sink in the bathroom.,there are three stacks of folded towels under the sink in the bathroom.,wolfe2,024_R_towels,2,30,A25N8DM670K4MA,2021-01-25_14h44.18.676,MetaAwareness,2020.1.2,Win32,60,3UY4PIS8QSO3UZ2Y1BAJ428G4GG1N1,A25N8DM670K4MA,35LDD5557B72421ENM63KLA3YB3KMI,5DL55,5DL55,35LDD5557B72421ENM63KLA3YB3KMI,35LDD5557B72421ENM63KLA3YB3KMI,271255,271255,,,,,,,,,,
,,,,5,8.665,0,7,7,27,1,modern apartment with bare wall over couch.,modern apartment with mirror over couch.,wolfe2,005_L_mirror,5,30,A25N8DM670K4MA,2021-01-25_14h44.18.676,MetaAwareness,2020.1.2,Win32,60,3UY4PIS8QSO3UZ2Y1BAJ428G4GG1N1,A25N8DM670K4MA,35LDD5557B72421ENM63KLA3YB3KMI,5DL55,5DL55,35LDD5557B72421ENM63KLA3YB3KMI,35LDD5557B72421ENM63KLA3YB3KMI,271255,271255,,,,,,,,,,
,,,,5,13.191,0,8,8,473,1,a cluttered bathroom counter with an empty towel holder on the wall,a cluttered bathroom counter with no empty towel holders on the wall,wolfe2,087_L_towelhandle,2,30,A25N8DM670K4MA,2021-01-25_14h44.18.676,MetaAwareness,2020.1.2,Win32,60,3UY4PIS8QSO3UZ2Y1BAJ428G4GG1N1,A25N8DM670K4MA,35LDD5557B72421ENM63KLA3YB3KMI,5DL55,5DL55,35LDD5557B72421ENM63KLA3YB3KMI,35LDD5557B72421ENM63KLA3YB3KMI,271255,271255,,,,,,,,,,
,,,,6,11.629,0,9,9,396,1,a large morden kitchen with white cabintry and a large island in the middle as well as some flowers by the appliances,a large modern kitchen with white cabintry and a large island in the middle as well as some flowers by the appliances.,wolfe2,073_R_coffeemug,1,30,A25N8DM670K4MA,2021-01-25_14h44.18.676,MetaAwareness,2020.1.2,Win32,60,3UY4PIS8QSO3UZ2Y1BAJ428G4GG1N1,A25N8DM670K4MA,35LDD5557B72421ENM63KLA3YB3KMI,5DL55,5DL55,35LDD5557B72421ENM63KLA3YB3KMI,35LDD5557B72421ENM63KLA3YB3KMI,271255,271255,,,,,,,,,,
,,,,4,33.825,0,10,10,450,1,"a child's bedroom with a bunkbed, small green chair, square white table, shelves, and a chest of drawers including two blue drawers, one of which is missing a knob","a child's bedroom with a bunkbed, small green chair, square white table, shelves, and a chest of drawers including two blue drawers that both have knobs",wolfe2,083_R_knob,3,30,A25N8DM670K4MA,2021-01-25_14h44.18.676,MetaAwareness,2020.1.2,Win32,60,3UY4PIS8QSO3UZ2Y1BAJ428G4GG1N1,A25N8DM670K4MA,35LDD5557B72421ENM63KLA3YB3KMI,5DL55,5DL55,35LDD5557B72421ENM63KLA3YB3KMI,35LDD5557B72421ENM63KLA3YB3KMI,271255,271255,,,,,,,,,,
,,,,4,12.743,0,11,11,543,1,nice looking bathroom that has a makeup or detail mirror on the wall,nice looking bathroom that does not have a makeup or detail mirror,wolfe2,100_R_mirror,4,30,A25N8DM670K4MA,2021-01-25_14h44.18.676,MetaAwareness,2020.1.2,Win32,60,3UY4PIS8QSO3UZ2Y1BAJ428G4GG1N1,A25N8DM670K4MA,35LDD5557B72421ENM63KLA3YB3KMI,5DL55,5DL55,35LDD5557B72421ENM63KLA3YB3KMI,35LDD5557B72421ENM63KLA3YB3KMI,271255,271255,,,,,,,,,,
,,,,5,9.859,0,12,12,255,1,"a master bedroom with a bed, couch, and a short glass sculpture next to a full length mirror","a master bedroom with a bed, couch, and a tall glass sculpture next to a full length mirror",wolfe2,048_R_art,3,30,A25N8DM670K4MA,2021-01-25_14h44.18.676,MetaAwareness,2020.1.2,Win32,60,3UY4PIS8QSO3UZ2Y1BAJ428G4GG1N1,A25N8DM670K4MA,35LDD5557B72421ENM63KLA3YB3KMI,5DL55,5DL55,35LDD5557B72421ENM63KLA3YB3KMI,35LDD5557B72421ENM63KLA3YB3KMI,271255,271255,,,,,,,,,,
,,,,3,24.012,0,13,13,509,1,"this room looks comfortable and plain at the same time.  the outlet, maybe, in the middle provides a little variety.",the missing outlet would probably not be noticed by someone who wasn't expecting it.  the room is plain but the photo does help a little.,wolfe2,093_R_switch,1,30,A25N8DM670K4MA,2021-01-25_14h44.18.676,MetaAwareness,2020.1.2,Win32,60,3UY4PIS8QSO3UZ2Y1BAJ428G4GG1N1,A25N8DM670K4MA,35LDD5557B72421ENM63KLA3YB3KMI,5DL55,5DL55,35LDD5557B72421ENM63KLA3YB3KMI,35LDD5557B72421ENM63KLA3YB3KMI,271255,271255,,,,,,,,,,
,,,,4,12.851,0,14,14,3,1,"a master bedroom with green walls. on the walls are a tapestry of a swan, and a picture of nature.","a master bedroom with green walls. on the walls are a tapestry of a swan, a picture of nature, and a mirror.",wolfe2,001_L_mirror,5,30,A25N8DM670K4MA,2021-01-25_14h44.18.676,MetaAwareness,2020.1.2,Win32,60,3UY4PIS8QSO3UZ2Y1BAJ428G4GG1N1,A25N8DM670K4MA,35LDD5557B72421ENM63KLA3YB3KMI,5DL55,5DL55,35LDD5557B72421ENM63KLA3YB3KMI,35LDD5557B72421ENM63KLA3YB3KMI,271255,271255,,,,,,,,,,
,,,,5,9.527,0,15,15,392,1,in a kitchen there is a pot with many utencils next to the stove,in a kitchen there is a pot with few utencils next to the stove,wolfe2,073_L_coffeemug,1,30,A25N8DM670K4MA,2021-01-25_14h44.18.676,MetaAwareness,2020.1.2,Win32,60,3UY4PIS8QSO3UZ2Y1BAJ428G4GG1N1,A25N8DM670K4MA,35LDD5557B72421ENM63KLA3YB3KMI,5DL55,5DL55,35LDD5557B72421ENM63KLA3YB3KMI,35LDD5557B72421ENM63KLA3YB3KMI,271255,271255,,,,,,,,,,
,,,,4,12.576,0,16,16,398,1,"a large kitchen with wood floors, warm lighting, and an item on the far counter below the microwave","a large kitchen with wood floors, warm lighting, and a colorful item on the far counter below the  microwave",wolfe2,073_R_coffeemug,4,30,A25N8DM670K4MA,2021-01-25_14h44.18.676,MetaAwareness,2020.1.2,Win32,60,3UY4PIS8QSO3UZ2Y1BAJ428G4GG1N1,A25N8DM670K4MA,35LDD5557B72421ENM63KLA3YB3KMI,5DL55,5DL55,35LDD5557B72421ENM63KLA3YB3KMI,35LDD5557B72421ENM63KLA3YB3KMI,271255,271255,,,,,,,,,,
,,,,3,39.469,0,17,17,445,1,the side of a coffee table that is grey,a bowl is sitting underneath a table,wolfe2,082_R_bowl,8,30,A25N8DM670K4MA,2021-01-25_14h44.18.676,MetaAwareness,2020.1.2,Win32,60,3UY4PIS8QSO3UZ2Y1BAJ428G4GG1N1,A25N8DM670K4MA,35LDD5557B72421ENM63KLA3YB3KMI,5DL55,5DL55,35LDD5557B72421ENM63KLA3YB3KMI,35LDD5557B72421ENM63KLA3YB3KMI,271255,271255,,,,,,,,,,
,,,,4,9.341,0,18,18,278,1,a living room with a bookcase and no logs in the fireplace,a living room with a bookcase and logs in the fireplace,wolfe2,054_L_firewood,2,30,A25N8DM670K4MA,2021-01-25_14h44.18.676,MetaAwareness,2020.1.2,Win32,60,3UY4PIS8QSO3UZ2Y1BAJ428G4GG1N1,A25N8DM670K4MA,35LDD5557B72421ENM63KLA3YB3KMI,5DL55,5DL55,35LDD5557B72421ENM63KLA3YB3KMI,35LDD5557B72421ENM63KLA3YB3KMI,271255,271255,,,,,,,,,,
,,,,5,11.163,0,19,19,421,1,a bathroom with a faucet and left side handle.,a bathroom with a faucet and left and right side handle.,wolfe2,078_R_faucet,1,30,A25N8DM670K4MA,2021-01-25_14h44.18.676,MetaAwareness,2020.1.2,Win32,60,3UY4PIS8QSO3UZ2Y1BAJ428G4GG1N1,A25N8DM670K4MA,35LDD5557B72421ENM63KLA3YB3KMI,5DL55,5DL55,35LDD5557B72421ENM63KLA3YB3KMI,35LDD5557B72421ENM63KLA3YB3KMI,271255,271255,,,,,,,,,,
,,,,4,16.886,0,20,20,426,1,a country kitcjen with many open shelves.one of the shelves has a bowl.,a country kitchen with many open shelves all of which haves bowls and other things.,wolfe2,079_L_bowl,3,30,A25N8DM670K4MA,2021-01-25_14h44.18.676,MetaAwareness,2020.1.2,Win32,60,3UY4PIS8QSO3UZ2Y1BAJ428G4GG1N1,A25N8DM670K4MA,35LDD5557B72421ENM63KLA3YB3KMI,5DL55,5DL55,35LDD5557B72421ENM63KLA3YB3KMI,35LDD5557B72421ENM63KLA3YB3KMI,271255,271255,,,,,,,,,,
,,,,4,10.183,0,21,21,374,1,"a living area with fancy decor, white couches and white walls.","a mostly white living area with white couches, white walls, and a candle holder hanging on the wall",wolfe2,070_R_lamp,4,30,A25N8DM670K4MA,2021-01-25_14h44.18.676,MetaAwareness,2020.1.2,Win32,60,3UY4PIS8QSO3UZ2Y1BAJ428G4GG1N1,A25N8DM670K4MA,35LDD5557B72421ENM63KLA3YB3KMI,5DL55,5DL55,35LDD5557B72421ENM63KLA3YB3KMI,35LDD5557B72421ENM63KLA3YB3KMI,271255,271255,,,,,,,,,,
,,,,4,9.685,0,22,22,154,1,"a fancy bathroom with two sinks, a bathtub and a shower","a fancy bathroom with two sinks, a bathtub, and a shower with a soap holder",wolfe2,027_R_soapdish,2,30,A25N8DM670K4MA,2021-01-25_14h44.18.676,MetaAwareness,2020.1.2,Win32,60,3UY4PIS8QSO3UZ2Y1BAJ428G4GG1N1,A25N8DM670K4MA,35LDD5557B72421ENM63KLA3YB3KMI,5DL55,5DL55,35LDD5557B72421ENM63KLA3YB3KMI,35LDD5557B72421ENM63KLA3YB3KMI,271255,271255,,,,,,,,,,
,,,,3,9.132,0,23,23,606,1,"a glass-enclosed sunroom with plants, a couch, a coffee table, and pottery on the floor","a glass-enclosed sunroom with a couch, a coffee table, a chair, and a potted plant on the floor",wolfe2,111_R_pot,2,30,A25N8DM670K4MA,2021-01-25_14h44.18.676,MetaAwareness,2020.1.2,Win32,60,3UY4PIS8QSO3UZ2Y1BAJ428G4GG1N1,A25N8DM670K4MA,35LDD5557B72421ENM63KLA3YB3KMI,5DL55,5DL55,35LDD5557B72421ENM63KLA3YB3KMI,35LDD5557B72421ENM63KLA3YB3KMI,271255,271255,,,,,,,,,,
,,,,5,7.943,0,24,24,169,1,a modern looking living room that has 1 ceiling beam.,a modern looking living room that has 2 ceiling beams.,wolfe2,031_R_log,1,30,A25N8DM670K4MA,2021-01-25_14h44.18.676,MetaAwareness,2020.1.2,Win32,60,3UY4PIS8QSO3UZ2Y1BAJ428G4GG1N1,A25N8DM670K4MA,35LDD5557B72421ENM63KLA3YB3KMI,5DL55,5DL55,35LDD5557B72421ENM63KLA3YB3KMI,35LDD5557B72421ENM63KLA3YB3KMI,271255,271255,,,,,,,,,,
,,,,5,11.989,0,25,25,271,1,a stone floored bathroom with linen closet that has 1 large drawer on the bottom,a stone floored bathroom with linen closet that has 2 small drawers on the bottom,wolfe2,053_L_handle,2,30,A25N8DM670K4MA,2021-01-25_14h44.18.676,MetaAwareness,2020.1.2,Win32,60,3UY4PIS8QSO3UZ2Y1BAJ428G4GG1N1,A25N8DM670K4MA,35LDD5557B72421ENM63KLA3YB3KMI,5DL55,5DL55,35LDD5557B72421ENM63KLA3YB3KMI,35LDD5557B72421ENM63KLA3YB3KMI,271255,271255,,,,,,,,,,
,,,,4,11.486,0,26,26,175,1,modern bathroom with one soap container on a lower shelf,very modern bathroom with two soap containers,wolfe2,032_L_bottle,3,30,A25N8DM670K4MA,2021-01-25_14h44.18.676,MetaAwareness,2020.1.2,Win32,60,3UY4PIS8QSO3UZ2Y1BAJ428G4GG1N1,A25N8DM670K4MA,35LDD5557B72421ENM63KLA3YB3KMI,5DL55,5DL55,35LDD5557B72421ENM63KLA3YB3KMI,35LDD5557B72421ENM63KLA3YB3KMI,271255,271255,,,,,,,,,,
,,,,4,13.536,0,27,27,521,1,"a pink themed decorated room, with a radio sitting on top of the pink desk",a pink themed decorated room with an empty pink desk,wolfe2,096_R_painting,4,30,A25N8DM670K4MA,2021-01-25_14h44.18.676,MetaAwareness,2020.1.2,Win32,60,3UY4PIS8QSO3UZ2Y1BAJ428G4GG1N1,A25N8DM670K4MA,35LDD5557B72421ENM63KLA3YB3KMI,5DL55,5DL55,35LDD5557B72421ENM63KLA3YB3KMI,35LDD5557B72421ENM63KLA3YB3KMI,271255,271255,,,,,,,,,,
,,,,1,14.103,0,28,28,410,1,the beige wall is waiting for the right decor to liven the bathroom up abit.,"the decor that is in this image, seems to promote a healthy body image.  the space is nice and roomy.",wolfe2,076_R_hook,1,30,A25N8DM670K4MA,2021-01-25_14h44.18.676,MetaAwareness,2020.1.2,Win32,60,3UY4PIS8QSO3UZ2Y1BAJ428G4GG1N1,A25N8DM670K4MA,35LDD5557B72421ENM63KLA3YB3KMI,5DL55,5DL55,35LDD5557B72421ENM63KLA3YB3KMI,35LDD5557B72421ENM63KLA3YB3KMI,271255,271255,,,,,,,,,,
,,,,4,5.75,0,29,29,176,1,retro bathroom,retro bathroom with circular shelves. the shelves have tolietries,wolfe2,032_L_bottle,4,30,A25N8DM670K4MA,2021-01-25_14h44.18.676,MetaAwareness,2020.1.2,Win32,60,3UY4PIS8QSO3UZ2Y1BAJ428G4GG1N1,A25N8DM670K4MA,35LDD5557B72421ENM63KLA3YB3KMI,5DL55,5DL55,35LDD5557B72421ENM63KLA3YB3KMI,35LDD5557B72421ENM63KLA3YB3KMI,271255,271255,,,,,,,,,,
,,,,,,,,,,,,,,,,30,A25N8DM670K4MA,2021-01-25_14h44.18.676,MetaAwareness,2020.1.2,Win32,60,3UY4PIS8QSO3UZ2Y1BAJ428G4GG1N1,A25N8DM670K4MA,35LDD5557B72421ENM63KLA3YB3KMI,5DL55,5DL55,35LDD5557B72421ENM63KLA3YB3KMI,35LDD5557B72421ENM63KLA3YB3KMI,271255,271255,6,14.014,someone laying underneath a blue beach umbrella on a crowded beach,someone laying underneath a blue beach umbrella on a crowded beach,same,1,10.754,members of a marching band crossing a track that all have feather plumes at the front of their hats,a cluttered and rustic looking cafe with 10 hanging lights,different
