consent_response.keys,consent_response.rt,key_resp_2.keys,key_resp_2.rt,user_resp.keys,user_resp.rt,trials.thisRepN,trials.thisTrialN,trials.thisN,trials.thisIndex,trials.ran,image_1_text,image_2_text,database,image,number,age,worker_ID,date,expName,psychopyVersion,OS,frameRate,hitId,workerId,assignmentId,a,tp_a,b,tp_b,c,tp_c,catch_same_resp.keys,catch_same_resp.rt,image_1_text_catch_same,image_2_text_catch_same,image_catch_same,catch_different_resp.keys,catch_different_resp.rt,image_1_text_catch_different,image_2_text_catch_different,image_catch_different
space,163.606,space,3.71,5,14.933,0,0,0,364,1,living room with fireplace and shelf with some decorations,living room with fireplace with four more decorations on upper shelf,wolfe2,069_L_things,4,51,AVPZJ69E3WFYM,2021-01-25_13h38.00.723,MetaAwareness,2020.1.2,Win32,60,3TZ0XG8CBVN0GXIPZM0T1B04DYC892,AVPZJ69E3WFYM,37W3JXSD67BTTJK9V3DH2RR5UTGYWA,DJW75,DJW75,37W3JXSD67BTTJK9V3DH2RR5UTGYWA,37W3JXSD67BTTJK9V3DH2RR5UTGYWA,271255,271255,,,,,,,,,,
,,,,6,3.759,0,1,1,268,1,a modern living room with painted white walls,flat speakers hung against the wall in a living room,wolfe2,052_L_speaker,3,51,AVPZJ69E3WFYM,2021-01-25_13h38.00.723,MetaAwareness,2020.1.2,Win32,60,3TZ0XG8CBVN0GXIPZM0T1B04DYC892,AVPZJ69E3WFYM,37W3JXSD67BTTJK9V3DH2RR5UTGYWA,DJW75,DJW75,37W3JXSD67BTTJK9V3DH2RR5UTGYWA,37W3JXSD67BTTJK9V3DH2RR5UTGYWA,271255,271255,,,,,,,,,,
,,,,2,7.841,0,2,2,131,1,it is a picutre of a living room or family room with lounge furniture and glass tables.,it is a picture of a living room or family room with lounge furniture and glass tables and the tv remote is on top of the closest table.,wolfe2,023_R_remote,2,51,AVPZJ69E3WFYM,2021-01-25_13h38.00.723,MetaAwareness,2020.1.2,Win32,60,3TZ0XG8CBVN0GXIPZM0T1B04DYC892,AVPZJ69E3WFYM,37W3JXSD67BTTJK9V3DH2RR5UTGYWA,DJW75,DJW75,37W3JXSD67BTTJK9V3DH2RR5UTGYWA,37W3JXSD67BTTJK9V3DH2RR5UTGYWA,271255,271255,,,,,,,,,,
,,,,3,4.046,0,3,3,692,1,in a living room there is a light fixture on a wall next to a window,in a living room there is no light fixture on a wall next to a window,wolfe2,127_L_light,1,51,AVPZJ69E3WFYM,2021-01-25_13h38.00.723,MetaAwareness,2020.1.2,Win32,60,3TZ0XG8CBVN0GXIPZM0T1B04DYC892,AVPZJ69E3WFYM,37W3JXSD67BTTJK9V3DH2RR5UTGYWA,DJW75,DJW75,37W3JXSD67BTTJK9V3DH2RR5UTGYWA,37W3JXSD67BTTJK9V3DH2RR5UTGYWA,271255,271255,,,,,,,,,,
,,,,6,7.29,0,4,4,196,1,a warm colored bedroom with two lights on the desk near the bed.,a warm colored bedroom with two lights and a red decoration on the desk near the bed.,wolfe2,035_R_fruit,1,51,AVPZJ69E3WFYM,2021-01-25_13h38.00.723,MetaAwareness,2020.1.2,Win32,60,3TZ0XG8CBVN0GXIPZM0T1B04DYC892,AVPZJ69E3WFYM,37W3JXSD67BTTJK9V3DH2RR5UTGYWA,DJW75,DJW75,37W3JXSD67BTTJK9V3DH2RR5UTGYWA,37W3JXSD67BTTJK9V3DH2RR5UTGYWA,271255,271255,,,,,,,,,,
,,,,5,5.476,0,5,5,585,1,a dressing room at a retailer with 3 unique stalls where at the end there is a clothes rack with 2 white garments on the far left,a dressing room at a retailer with 3 unique stalls where at the end there is a clothes rack with 1 white garment on the far left,wolfe2,107_L_shirts,4,51,AVPZJ69E3WFYM,2021-01-25_13h38.00.723,MetaAwareness,2020.1.2,Win32,60,3TZ0XG8CBVN0GXIPZM0T1B04DYC892,AVPZJ69E3WFYM,37W3JXSD67BTTJK9V3DH2RR5UTGYWA,DJW75,DJW75,37W3JXSD67BTTJK9V3DH2RR5UTGYWA,37W3JXSD67BTTJK9V3DH2RR5UTGYWA,271255,271255,,,,,,,,,,
,,,,4,8.467,0,6,6,537,1,a bathroom with an odd looking sink. there is a mirror to the left of the sink connected to the wall.,a bathroom with an odd looking sink. there is a cut out in the wall to the left of the sink.,wolfe2,100_L_mirror,1,51,AVPZJ69E3WFYM,2021-01-25_13h38.00.723,MetaAwareness,2020.1.2,Win32,60,3TZ0XG8CBVN0GXIPZM0T1B04DYC892,AVPZJ69E3WFYM,37W3JXSD67BTTJK9V3DH2RR5UTGYWA,DJW75,DJW75,37W3JXSD67BTTJK9V3DH2RR5UTGYWA,37W3JXSD67BTTJK9V3DH2RR5UTGYWA,271255,271255,,,,,,,,,,
,,,,4,6.928,0,7,7,619,1,an antique styled room with french doors opening to a stone patio with four items on the table,an antique styled room with french doors opening to a stone path with three items on the table,wolfe2,114_L_bird,4,51,AVPZJ69E3WFYM,2021-01-25_13h38.00.723,MetaAwareness,2020.1.2,Win32,60,3TZ0XG8CBVN0GXIPZM0T1B04DYC892,AVPZJ69E3WFYM,37W3JXSD67BTTJK9V3DH2RR5UTGYWA,DJW75,DJW75,37W3JXSD67BTTJK9V3DH2RR5UTGYWA,37W3JXSD67BTTJK9V3DH2RR5UTGYWA,271255,271255,,,,,,,,,,
,,,,6,7.889,0,8,8,168,1,an open living room with beige couch and one visible roof beam,an open living room with beige couch and two visible roof beams,wolfe2,031_L_log,4,51,AVPZJ69E3WFYM,2021-01-25_13h38.00.723,MetaAwareness,2020.1.2,Win32,60,3TZ0XG8CBVN0GXIPZM0T1B04DYC892,AVPZJ69E3WFYM,37W3JXSD67BTTJK9V3DH2RR5UTGYWA,DJW75,DJW75,37W3JXSD67BTTJK9V3DH2RR5UTGYWA,37W3JXSD67BTTJK9V3DH2RR5UTGYWA,271255,271255,,,,,,,,,,
,,,,4,7.527,0,9,9,453,1,yopen door to the balcony looking at the water with a scope,open door to the balcony looking at the water with a scope and mirror on the wall,wolfe2,084_L_light,3,51,AVPZJ69E3WFYM,2021-01-25_13h38.00.723,MetaAwareness,2020.1.2,Win32,60,3TZ0XG8CBVN0GXIPZM0T1B04DYC892,AVPZJ69E3WFYM,37W3JXSD67BTTJK9V3DH2RR5UTGYWA,DJW75,DJW75,37W3JXSD67BTTJK9V3DH2RR5UTGYWA,37W3JXSD67BTTJK9V3DH2RR5UTGYWA,271255,271255,,,,,,,,,,
,,,,4,5.13,0,10,10,260,1,a room with a couch and a bookcase with five full shelves,a room with a couch and a bookcase with six full shelves,wolfe2,050_R_book,2,51,AVPZJ69E3WFYM,2021-01-25_13h38.00.723,MetaAwareness,2020.1.2,Win32,60,3TZ0XG8CBVN0GXIPZM0T1B04DYC892,AVPZJ69E3WFYM,37W3JXSD67BTTJK9V3DH2RR5UTGYWA,DJW75,DJW75,37W3JXSD67BTTJK9V3DH2RR5UTGYWA,37W3JXSD67BTTJK9V3DH2RR5UTGYWA,271255,271255,,,,,,,,,,
,,,,1,9.707,0,11,11,380,1,there is taxky wallpaper in the awful looking living room with cream furniture,there is a piece of coral that sits near the lamp and candle holder in the living room with cream furniture,wolfe2,071_R_art,1,51,AVPZJ69E3WFYM,2021-01-25_13h38.00.723,MetaAwareness,2020.1.2,Win32,60,3TZ0XG8CBVN0GXIPZM0T1B04DYC892,AVPZJ69E3WFYM,37W3JXSD67BTTJK9V3DH2RR5UTGYWA,DJW75,DJW75,37W3JXSD67BTTJK9V3DH2RR5UTGYWA,37W3JXSD67BTTJK9V3DH2RR5UTGYWA,271255,271255,,,,,,,,,,
,,,,4,12.229,0,12,12,557,1,"a bathroom with beige colored walls, with a mirror, a towel holder, a towel hook, and electrical fixtures on the wall","a bathroom with beige colored walls, with a mirror, a towel holder, and electrical fixtures on the wall",wolfe2,103_R_hook,3,51,AVPZJ69E3WFYM,2021-01-25_13h38.00.723,MetaAwareness,2020.1.2,Win32,60,3TZ0XG8CBVN0GXIPZM0T1B04DYC892,AVPZJ69E3WFYM,37W3JXSD67BTTJK9V3DH2RR5UTGYWA,DJW75,DJW75,37W3JXSD67BTTJK9V3DH2RR5UTGYWA,37W3JXSD67BTTJK9V3DH2RR5UTGYWA,271255,271255,,,,,,,,,,
,,,,5,4.887,0,13,13,93,1,a clean and bright living room without a sculpture on a pedastal that is next to the couh.,a clean and bright living room with a strange scultpture on a pedastal that is next to the couch.,wolfe2,016_L_art,4,51,AVPZJ69E3WFYM,2021-01-25_13h38.00.723,MetaAwareness,2020.1.2,Win32,60,3TZ0XG8CBVN0GXIPZM0T1B04DYC892,AVPZJ69E3WFYM,37W3JXSD67BTTJK9V3DH2RR5UTGYWA,DJW75,DJW75,37W3JXSD67BTTJK9V3DH2RR5UTGYWA,37W3JXSD67BTTJK9V3DH2RR5UTGYWA,271255,271255,,,,,,,,,,
,,,,6,9.779,0,14,14,564,1,in the dark restaurant there are cozy tables with candles on them.,in the dark restaurant most of the cozy tables have candles on them.,wolfe2,104_R_bottle,3,51,AVPZJ69E3WFYM,2021-01-25_13h38.00.723,MetaAwareness,2020.1.2,Win32,60,3TZ0XG8CBVN0GXIPZM0T1B04DYC892,AVPZJ69E3WFYM,37W3JXSD67BTTJK9V3DH2RR5UTGYWA,DJW75,DJW75,37W3JXSD67BTTJK9V3DH2RR5UTGYWA,37W3JXSD67BTTJK9V3DH2RR5UTGYWA,271255,271255,,,,,,,,,,
,,,,5,5.534,0,15,15,617,1,a living room with a brown table with a bird looking figurine on the table,a living room with a brown wood table with books and vases on the table,wolfe2,114_L_bird,1,51,AVPZJ69E3WFYM,2021-01-25_13h38.00.723,MetaAwareness,2020.1.2,Win32,60,3TZ0XG8CBVN0GXIPZM0T1B04DYC892,AVPZJ69E3WFYM,37W3JXSD67BTTJK9V3DH2RR5UTGYWA,DJW75,DJW75,37W3JXSD67BTTJK9V3DH2RR5UTGYWA,37W3JXSD67BTTJK9V3DH2RR5UTGYWA,271255,271255,,,,,,,,,,
,,,,6,19.086,0,16,16,295,1,a library room with three trash cans.,a library room with four trash cans.,wolfe2,057_L_bin,4,51,AVPZJ69E3WFYM,2021-01-25_13h38.00.723,MetaAwareness,2020.1.2,Win32,60,3TZ0XG8CBVN0GXIPZM0T1B04DYC892,AVPZJ69E3WFYM,37W3JXSD67BTTJK9V3DH2RR5UTGYWA,DJW75,DJW75,37W3JXSD67BTTJK9V3DH2RR5UTGYWA,37W3JXSD67BTTJK9V3DH2RR5UTGYWA,271255,271255,,,,,,,,,,
,,,,4,15.936,0,17,17,689,1,"a spacious living room with a large couch in an l-shape and a round coffee tale, with a set of candles sitting on a plate under the television","a spacious living room with a large couch in an l-shape and a round coffee table, with no set of candles sitting underneath the television",wolfe2,126_R_candles,1,51,AVPZJ69E3WFYM,2021-01-25_13h38.00.723,MetaAwareness,2020.1.2,Win32,60,3TZ0XG8CBVN0GXIPZM0T1B04DYC892,AVPZJ69E3WFYM,37W3JXSD67BTTJK9V3DH2RR5UTGYWA,DJW75,DJW75,37W3JXSD67BTTJK9V3DH2RR5UTGYWA,37W3JXSD67BTTJK9V3DH2RR5UTGYWA,271255,271255,,,,,,,,,,
,,,,6,11.876,0,18,18,204,1,a gorgeous white and wood bathroom includes small shelves near the bath and shower for washcloths and decor.,a gorgeous white and wood bathroom includes small shelves near the bath and shower for washcloths and decor.,wolfe2,037_L_towel,2,51,AVPZJ69E3WFYM,2021-01-25_13h38.00.723,MetaAwareness,2020.1.2,Win32,60,3TZ0XG8CBVN0GXIPZM0T1B04DYC892,AVPZJ69E3WFYM,37W3JXSD67BTTJK9V3DH2RR5UTGYWA,DJW75,DJW75,37W3JXSD67BTTJK9V3DH2RR5UTGYWA,37W3JXSD67BTTJK9V3DH2RR5UTGYWA,271255,271255,,,,,,,,,,
,,,,4,6.58,0,19,19,144,1,there is one piece of art on the right side of a shelf in the living room,there are two pieces of art on the right side of a shelf in the living room,wolfe2,025_R_vase,2,51,AVPZJ69E3WFYM,2021-01-25_13h38.00.723,MetaAwareness,2020.1.2,Win32,60,3TZ0XG8CBVN0GXIPZM0T1B04DYC892,AVPZJ69E3WFYM,37W3JXSD67BTTJK9V3DH2RR5UTGYWA,DJW75,DJW75,37W3JXSD67BTTJK9V3DH2RR5UTGYWA,37W3JXSD67BTTJK9V3DH2RR5UTGYWA,271255,271255,,,,,,,,,,
,,,,4,16.693,0,20,20,83,1,atrium area of a business with three lights on the wall,atrium area of a business with four lights on the wall,wolfe2,014_R_lamp,4,51,AVPZJ69E3WFYM,2021-01-25_13h38.00.723,MetaAwareness,2020.1.2,Win32,60,3TZ0XG8CBVN0GXIPZM0T1B04DYC892,AVPZJ69E3WFYM,37W3JXSD67BTTJK9V3DH2RR5UTGYWA,DJW75,DJW75,37W3JXSD67BTTJK9V3DH2RR5UTGYWA,37W3JXSD67BTTJK9V3DH2RR5UTGYWA,271255,271255,,,,,,,,,,
,,,,4,9.48,0,21,21,449,1,"a bright and sunny children's room with white bunk beds, a colorful carpet, a small white table with a small blue and a small green chair, and a colorful cabinet with white knobs","a bright and sunny children's room with white bunk beds, a colorful carpet, a small white table with a small blue chair and a small green chair, and a colorful cabinet with white knobs on some of the drawers.",wolfe2,083_R_knob,1,51,AVPZJ69E3WFYM,2021-01-25_13h38.00.723,MetaAwareness,2020.1.2,Win32,60,3TZ0XG8CBVN0GXIPZM0T1B04DYC892,AVPZJ69E3WFYM,37W3JXSD67BTTJK9V3DH2RR5UTGYWA,DJW75,DJW75,37W3JXSD67BTTJK9V3DH2RR5UTGYWA,37W3JXSD67BTTJK9V3DH2RR5UTGYWA,271255,271255,,,,,,,,,,
,,,,4,4.82,0,22,22,296,1,a well lit library with two metal trash bins.,a well lit library with three trash bins.,wolfe2,057_L_bin,5,51,AVPZJ69E3WFYM,2021-01-25_13h38.00.723,MetaAwareness,2020.1.2,Win32,60,3TZ0XG8CBVN0GXIPZM0T1B04DYC892,AVPZJ69E3WFYM,37W3JXSD67BTTJK9V3DH2RR5UTGYWA,DJW75,DJW75,37W3JXSD67BTTJK9V3DH2RR5UTGYWA,37W3JXSD67BTTJK9V3DH2RR5UTGYWA,271255,271255,,,,,,,,,,
,,,,5,6.486,0,23,23,111,1,a desk sits in the corner of the room with some decorations on the wall.,a desk sits in the corner of the room with three decorations of circles o the wall.,wolfe2,020_L_walldeco,3,51,AVPZJ69E3WFYM,2021-01-25_13h38.00.723,MetaAwareness,2020.1.2,Win32,60,3TZ0XG8CBVN0GXIPZM0T1B04DYC892,AVPZJ69E3WFYM,37W3JXSD67BTTJK9V3DH2RR5UTGYWA,DJW75,DJW75,37W3JXSD67BTTJK9V3DH2RR5UTGYWA,37W3JXSD67BTTJK9V3DH2RR5UTGYWA,271255,271255,,,,,,,,,,
,,,,6,12.762,0,24,24,177,1,"a modern-looking bathroom with two shelves, one of which is empty and the other of which has one white bottle","a modern-looking bathroom with two shelves, one of which is empty and the other of which has two white bottles",wolfe2,032_R_bottle,1,51,AVPZJ69E3WFYM,2021-01-25_13h38.00.723,MetaAwareness,2020.1.2,Win32,60,3TZ0XG8CBVN0GXIPZM0T1B04DYC892,AVPZJ69E3WFYM,37W3JXSD67BTTJK9V3DH2RR5UTGYWA,DJW75,DJW75,37W3JXSD67BTTJK9V3DH2RR5UTGYWA,37W3JXSD67BTTJK9V3DH2RR5UTGYWA,271255,271255,,,,,,,,,,
,,,,5,8.655,0,25,25,681,1,"room with 11 windows, leather couches and an end table and piano","room with 11 windows, leather couches and piano",wolfe2,125_L_sofa,3,51,AVPZJ69E3WFYM,2021-01-25_13h38.00.723,MetaAwareness,2020.1.2,Win32,60,3TZ0XG8CBVN0GXIPZM0T1B04DYC892,AVPZJ69E3WFYM,37W3JXSD67BTTJK9V3DH2RR5UTGYWA,DJW75,DJW75,37W3JXSD67BTTJK9V3DH2RR5UTGYWA,37W3JXSD67BTTJK9V3DH2RR5UTGYWA,271255,271255,,,,,,,,,,
,,,,5,6.364,0,26,26,501,1,a fancy family room complete with a fireplace ready with wood,a fancy family room complete with an empty fireplace,wolfe2,092_L_candles,2,51,AVPZJ69E3WFYM,2021-01-25_13h38.00.723,MetaAwareness,2020.1.2,Win32,60,3TZ0XG8CBVN0GXIPZM0T1B04DYC892,AVPZJ69E3WFYM,37W3JXSD67BTTJK9V3DH2RR5UTGYWA,DJW75,DJW75,37W3JXSD67BTTJK9V3DH2RR5UTGYWA,37W3JXSD67BTTJK9V3DH2RR5UTGYWA,271255,271255,,,,,,,,,,
,,,,5,6.837,0,27,27,363,1,"a fireplace, table, mirror and bookshelf all wooden","a wooden fireplace, table, mirror and bookshelf with candles",wolfe2,069_L_things,2,51,AVPZJ69E3WFYM,2021-01-25_13h38.00.723,MetaAwareness,2020.1.2,Win32,60,3TZ0XG8CBVN0GXIPZM0T1B04DYC892,AVPZJ69E3WFYM,37W3JXSD67BTTJK9V3DH2RR5UTGYWA,DJW75,DJW75,37W3JXSD67BTTJK9V3DH2RR5UTGYWA,37W3JXSD67BTTJK9V3DH2RR5UTGYWA,271255,271255,,,,,,,,,,
,,,,3,6.402,0,28,28,32,1,this room has a study desk and seating. there is a window in the back of the room with gray walls.the city can be seen in the window.,there is a mirror on the gray wall next to the window overlooking the city.,wolfe2,005_R_mirror,5,51,AVPZJ69E3WFYM,2021-01-25_13h38.00.723,MetaAwareness,2020.1.2,Win32,60,3TZ0XG8CBVN0GXIPZM0T1B04DYC892,AVPZJ69E3WFYM,37W3JXSD67BTTJK9V3DH2RR5UTGYWA,DJW75,DJW75,37W3JXSD67BTTJK9V3DH2RR5UTGYWA,37W3JXSD67BTTJK9V3DH2RR5UTGYWA,271255,271255,,,,,,,,,,
,,,,4,11.749,0,29,29,198,1,"a bedroom with some tables and a couple of lamps, and a long table with two vases on it","a bedroom with some tables and a couple of lamps, and a long table with two vases and a small art object on it",wolfe2,035_R_fruit,4,51,AVPZJ69E3WFYM,2021-01-25_13h38.00.723,MetaAwareness,2020.1.2,Win32,60,3TZ0XG8CBVN0GXIPZM0T1B04DYC892,AVPZJ69E3WFYM,37W3JXSD67BTTJK9V3DH2RR5UTGYWA,DJW75,DJW75,37W3JXSD67BTTJK9V3DH2RR5UTGYWA,37W3JXSD67BTTJK9V3DH2RR5UTGYWA,271255,271255,,,,,,,,,,
,,,,,,,,,,,,,,,,51,AVPZJ69E3WFYM,2021-01-25_13h38.00.723,MetaAwareness,2020.1.2,Win32,60,3TZ0XG8CBVN0GXIPZM0T1B04DYC892,AVPZJ69E3WFYM,37W3JXSD67BTTJK9V3DH2RR5UTGYWA,DJW75,DJW75,37W3JXSD67BTTJK9V3DH2RR5UTGYWA,37W3JXSD67BTTJK9V3DH2RR5UTGYWA,271255,271255,6,5.808,someone laying underneath a blue beach umbrella on a crowded beach,someone laying underneath a blue beach umbrella on a crowded beach,same,1,4.188,members of a marching band crossing a track that all have feather plumes at the front of their hats,a cluttered and rustic looking cafe with 10 hanging lights,different
