consent_response.keys,consent_response.rt,key_resp_2.keys,key_resp_2.rt,user_resp.keys,user_resp.rt,trials.thisRepN,trials.thisTrialN,trials.thisN,trials.thisIndex,trials.ran,image_1_text,image_2_text,database,image,number,age,worker_ID,date,expName,psychopyVersion,OS,frameRate,hitId,workerId,assignmentId,a,tp_a,b,tp_b,c,tp_c,catch_same_resp.keys,catch_same_resp.rt,image_1_text_catch_same,image_2_text_catch_same,image_catch_same,catch_different_resp.keys,catch_different_resp.rt,image_1_text_catch_different,image_2_text_catch_different,image_catch_different
space,11.709085,space,0.56714,5,6.82169,0,0,0,265,1,there is a small concert happening on a lawn. many people are watching. there is a green chair facing the stage on the left side.,there is a small concert happening on a lawn. many people are watching. there is a purple chair facing the stage on the left side.,wolfe1,image-115,5,34,A1JRP31XJIU7NV,2021-01-09_10h59.18.641,MetaAwareness,2020.1.2,Win32,60,3CVDZS288I3O2WB6W9A4GPNAZIMFMC,A1JRP31XJIU7NV,3VHP9MDGRONEFUX99MLS1CDMVJCCFJ,G9HV1,G9HV1,3VHP9MDGRONEFUX99MLS1CDMVJCCFJ,3VHP9MDGRONEFUX99MLS1CDMVJCCFJ,268121,268121,,,,,,,,,,
,,,,5,4.536355,0,1,1,180,1,several children are playing in a grass field together.the child furthest away is wearing a red shirt.,several children are playing in a grass frield toether. the child furthest away is wearing a purple shirt,wolfe1,image-086,1,34,A1JRP31XJIU7NV,2021-01-09_10h59.18.641,MetaAwareness,2020.1.2,Win32,60,3CVDZS288I3O2WB6W9A4GPNAZIMFMC,A1JRP31XJIU7NV,3VHP9MDGRONEFUX99MLS1CDMVJCCFJ,G9HV1,G9HV1,3VHP9MDGRONEFUX99MLS1CDMVJCCFJ,3VHP9MDGRONEFUX99MLS1CDMVJCCFJ,268121,268121,,,,,,,,,,
,,,,5,3.848045,0,2,2,151,1,guy in yellow shirt watching the bikes,guy in green shirt watching the bikes,wolfe1,image-076,3,34,A1JRP31XJIU7NV,2021-01-09_10h59.18.641,MetaAwareness,2020.1.2,Win32,60,3CVDZS288I3O2WB6W9A4GPNAZIMFMC,A1JRP31XJIU7NV,3VHP9MDGRONEFUX99MLS1CDMVJCCFJ,G9HV1,G9HV1,3VHP9MDGRONEFUX99MLS1CDMVJCCFJ,3VHP9MDGRONEFUX99MLS1CDMVJCCFJ,268121,268121,,,,,,,,,,
,,,,5,2.33481,0,3,3,183,1,a blue bowl sits on a table at garage sale,a purple bowl sits on a table at a garage sale,wolfe1,image-087,1,34,A1JRP31XJIU7NV,2021-01-09_10h59.18.641,MetaAwareness,2020.1.2,Win32,60,3CVDZS288I3O2WB6W9A4GPNAZIMFMC,A1JRP31XJIU7NV,3VHP9MDGRONEFUX99MLS1CDMVJCCFJ,G9HV1,G9HV1,3VHP9MDGRONEFUX99MLS1CDMVJCCFJ,3VHP9MDGRONEFUX99MLS1CDMVJCCFJ,268121,268121,,,,,,,,,,
,,,,4,6.057145,0,4,4,79,1,a stone school building with three features on the roof and many bikes parked as students are in class.,a stone school builiding with two features on the roof and many bikes parked as students are in class,wolfe1,image-029,3,34,A1JRP31XJIU7NV,2021-01-09_10h59.18.641,MetaAwareness,2020.1.2,Win32,60,3CVDZS288I3O2WB6W9A4GPNAZIMFMC,A1JRP31XJIU7NV,3VHP9MDGRONEFUX99MLS1CDMVJCCFJ,G9HV1,G9HV1,3VHP9MDGRONEFUX99MLS1CDMVJCCFJ,3VHP9MDGRONEFUX99MLS1CDMVJCCFJ,268121,268121,,,,,,,,,,
,,,,5,34.28755,0,5,5,114,1,and old red building behind a creek that has lots of rocks on the land and in the water,an old red building behind a creek that has lots of rocks on the land and few in the water,wolfe1,image-041,1,34,A1JRP31XJIU7NV,2021-01-09_10h59.18.641,MetaAwareness,2020.1.2,Win32,60,3CVDZS288I3O2WB6W9A4GPNAZIMFMC,A1JRP31XJIU7NV,3VHP9MDGRONEFUX99MLS1CDMVJCCFJ,G9HV1,G9HV1,3VHP9MDGRONEFUX99MLS1CDMVJCCFJ,3VHP9MDGRONEFUX99MLS1CDMVJCCFJ,268121,268121,,,,,,,,,,
,,,,5,10.59976,0,6,6,145,1,a tropical beach scene with a blue sky background and hamock on a white beach with a palm frond in the upper left corner of some palm trees scattered around,some palm frond pieces on one of several palm trees on a white beach with a hammock hanging above the sand,wolfe1,image-049,1,34,A1JRP31XJIU7NV,2021-01-09_10h59.18.641,MetaAwareness,2020.1.2,Win32,60,3CVDZS288I3O2WB6W9A4GPNAZIMFMC,A1JRP31XJIU7NV,3VHP9MDGRONEFUX99MLS1CDMVJCCFJ,G9HV1,G9HV1,3VHP9MDGRONEFUX99MLS1CDMVJCCFJ,3VHP9MDGRONEFUX99MLS1CDMVJCCFJ,268121,268121,,,,,,,,,,
,,,,5,35.939355,0,7,7,45,1,two friends with a cardboard cut out posing infront of a garbage can.,two friends posing with a cardboard cutout of a person in a bird suit.,wolfe1,image-015,5,34,A1JRP31XJIU7NV,2021-01-09_10h59.18.641,MetaAwareness,2020.1.2,Win32,60,3CVDZS288I3O2WB6W9A4GPNAZIMFMC,A1JRP31XJIU7NV,3VHP9MDGRONEFUX99MLS1CDMVJCCFJ,G9HV1,G9HV1,3VHP9MDGRONEFUX99MLS1CDMVJCCFJ,3VHP9MDGRONEFUX99MLS1CDMVJCCFJ,268121,268121,,,,,,,,,,
,,,,3,10.48672,0,8,8,281,1,a storefront with a blue placard and cars out front,a storefront with a red placard and vars out front,wolfe1,image-123,2,34,A1JRP31XJIU7NV,2021-01-09_10h59.18.641,MetaAwareness,2020.1.2,Win32,60,3CVDZS288I3O2WB6W9A4GPNAZIMFMC,A1JRP31XJIU7NV,3VHP9MDGRONEFUX99MLS1CDMVJCCFJ,G9HV1,G9HV1,3VHP9MDGRONEFUX99MLS1CDMVJCCFJ,3VHP9MDGRONEFUX99MLS1CDMVJCCFJ,268121,268121,,,,,,,,,,
,,,,3,9.399445,0,9,9,324,1,a fancy outside living room with a red surfboard hung on the wall.,a fancy outside sitting area with a green surf board hung on the wall.,wolfe1,image-133,8,34,A1JRP31XJIU7NV,2021-01-09_10h59.18.641,MetaAwareness,2020.1.2,Win32,60,3CVDZS288I3O2WB6W9A4GPNAZIMFMC,A1JRP31XJIU7NV,3VHP9MDGRONEFUX99MLS1CDMVJCCFJ,G9HV1,G9HV1,3VHP9MDGRONEFUX99MLS1CDMVJCCFJ,3VHP9MDGRONEFUX99MLS1CDMVJCCFJ,268121,268121,,,,,,,,,,
,,,,5,14.37126,0,10,10,93,1,a backyard with a patio and black chairs with red cushions and six stepping stones,a backyard with a patio and black chairs  with red cushions and five stepping stones,wolfe1,image-034,1,34,A1JRP31XJIU7NV,2021-01-09_10h59.18.641,MetaAwareness,2020.1.2,Win32,60,3CVDZS288I3O2WB6W9A4GPNAZIMFMC,A1JRP31XJIU7NV,3VHP9MDGRONEFUX99MLS1CDMVJCCFJ,G9HV1,G9HV1,3VHP9MDGRONEFUX99MLS1CDMVJCCFJ,3VHP9MDGRONEFUX99MLS1CDMVJCCFJ,268121,268121,,,,,,,,,,
,,,,4,6.39019,0,11,11,330,1,a rooftop patio overlooking a light blue building.,a rooftop patio overlooking a pink building.,wolfe1,image-136,3,34,A1JRP31XJIU7NV,2021-01-09_10h59.18.641,MetaAwareness,2020.1.2,Win32,60,3CVDZS288I3O2WB6W9A4GPNAZIMFMC,A1JRP31XJIU7NV,3VHP9MDGRONEFUX99MLS1CDMVJCCFJ,G9HV1,G9HV1,3VHP9MDGRONEFUX99MLS1CDMVJCCFJ,3VHP9MDGRONEFUX99MLS1CDMVJCCFJ,268121,268121,,,,,,,,,,
,,,,4,64.398835,0,12,12,6,1,a man fishing on a wooden bench with a huge metal chain on it,a man fishing on a bench made of two wooden planks,wolfe1,image-004,4,34,A1JRP31XJIU7NV,2021-01-09_10h59.18.641,MetaAwareness,2020.1.2,Win32,60,3CVDZS288I3O2WB6W9A4GPNAZIMFMC,A1JRP31XJIU7NV,3VHP9MDGRONEFUX99MLS1CDMVJCCFJ,G9HV1,G9HV1,3VHP9MDGRONEFUX99MLS1CDMVJCCFJ,3VHP9MDGRONEFUX99MLS1CDMVJCCFJ,268121,268121,,,,,,,,,,
,,,,4,8.698255,0,13,13,65,1,three women are firing arrows from four firing positions,three women are firing arrows from three firing positions,wolfe1,image-021,5,34,A1JRP31XJIU7NV,2021-01-09_10h59.18.641,MetaAwareness,2020.1.2,Win32,60,3CVDZS288I3O2WB6W9A4GPNAZIMFMC,A1JRP31XJIU7NV,3VHP9MDGRONEFUX99MLS1CDMVJCCFJ,G9HV1,G9HV1,3VHP9MDGRONEFUX99MLS1CDMVJCCFJ,3VHP9MDGRONEFUX99MLS1CDMVJCCFJ,268121,268121,,,,,,,,,,
,,,,6,13.001275,0,14,14,144,1,a group of boys relax in the grass in front of a stone by a building,a group of boys relax in the grass by a building,wolfe1,image-048,4,34,A1JRP31XJIU7NV,2021-01-09_10h59.18.641,MetaAwareness,2020.1.2,Win32,60,3CVDZS288I3O2WB6W9A4GPNAZIMFMC,A1JRP31XJIU7NV,3VHP9MDGRONEFUX99MLS1CDMVJCCFJ,G9HV1,G9HV1,3VHP9MDGRONEFUX99MLS1CDMVJCCFJ,3VHP9MDGRONEFUX99MLS1CDMVJCCFJ,268121,268121,,,,,,,,,,
,,,,6,18.934405,0,15,15,246,1,three men are playing golf with a roofline visible between the trees.,men are playing golf in a neighborhood with a roofline of a house in the background.,wolfe1,image-108,5,34,A1JRP31XJIU7NV,2021-01-09_10h59.18.641,MetaAwareness,2020.1.2,Win32,60,3CVDZS288I3O2WB6W9A4GPNAZIMFMC,A1JRP31XJIU7NV,3VHP9MDGRONEFUX99MLS1CDMVJCCFJ,G9HV1,G9HV1,3VHP9MDGRONEFUX99MLS1CDMVJCCFJ,3VHP9MDGRONEFUX99MLS1CDMVJCCFJ,268121,268121,,,,,,,,,,
,,,,3,5.246,0,16,16,55,1,there is a blue lawn chair right beside the yellow kayak,there is open sand behind the yellow kayak,wolfe1,image-018,8,34,A1JRP31XJIU7NV,2021-01-09_10h59.18.641,MetaAwareness,2020.1.2,Win32,60,3CVDZS288I3O2WB6W9A4GPNAZIMFMC,A1JRP31XJIU7NV,3VHP9MDGRONEFUX99MLS1CDMVJCCFJ,G9HV1,G9HV1,3VHP9MDGRONEFUX99MLS1CDMVJCCFJ,3VHP9MDGRONEFUX99MLS1CDMVJCCFJ,268121,268121,,,,,,,,,,
,,,,3,24.354835,0,17,17,214,1,a man in green shorts walks to an ancient arch,a man in brown shorts walks to an ancient arch,wolfe1,image-098,1,34,A1JRP31XJIU7NV,2021-01-09_10h59.18.641,MetaAwareness,2020.1.2,Win32,60,3CVDZS288I3O2WB6W9A4GPNAZIMFMC,A1JRP31XJIU7NV,3VHP9MDGRONEFUX99MLS1CDMVJCCFJ,G9HV1,G9HV1,3VHP9MDGRONEFUX99MLS1CDMVJCCFJ,3VHP9MDGRONEFUX99MLS1CDMVJCCFJ,268121,268121,,,,,,,,,,
,,,,4,24.668995,0,18,18,203,1,a bush with red flowers along a trail a hiker is hiking,a bush with yellow flowers along a trail a hiker is hiking,wolfe1,image-095,2,34,A1JRP31XJIU7NV,2021-01-09_10h59.18.641,MetaAwareness,2020.1.2,Win32,60,3CVDZS288I3O2WB6W9A4GPNAZIMFMC,A1JRP31XJIU7NV,3VHP9MDGRONEFUX99MLS1CDMVJCCFJ,G9HV1,G9HV1,3VHP9MDGRONEFUX99MLS1CDMVJCCFJ,3VHP9MDGRONEFUX99MLS1CDMVJCCFJ,268121,268121,,,,,,,,,,
,,,,4,4.444885,0,19,19,228,1,man in blue shirt looking at woman,man in green shirt looking at womnan,wolfe1,image-104,1,34,A1JRP31XJIU7NV,2021-01-09_10h59.18.641,MetaAwareness,2020.1.2,Win32,60,3CVDZS288I3O2WB6W9A4GPNAZIMFMC,A1JRP31XJIU7NV,3VHP9MDGRONEFUX99MLS1CDMVJCCFJ,G9HV1,G9HV1,3VHP9MDGRONEFUX99MLS1CDMVJCCFJ,3VHP9MDGRONEFUX99MLS1CDMVJCCFJ,268121,268121,,,,,,,,,,
,,,,5,16.705075,0,20,20,33,1,a relaxing indoor retreat with a small planter embedded in the stone in the front which surrounds it,a relaxing indoor retreat with stone surrounding it,wolfe1,image-012,5,34,A1JRP31XJIU7NV,2021-01-09_10h59.18.641,MetaAwareness,2020.1.2,Win32,60,3CVDZS288I3O2WB6W9A4GPNAZIMFMC,A1JRP31XJIU7NV,3VHP9MDGRONEFUX99MLS1CDMVJCCFJ,G9HV1,G9HV1,3VHP9MDGRONEFUX99MLS1CDMVJCCFJ,3VHP9MDGRONEFUX99MLS1CDMVJCCFJ,268121,268121,,,,,,,,,,
,,,,5,14.77252,0,21,21,13,1,a living area with couch and kitchen with a microwave,a living area with couch and kitchen with cabinets,wolfe1,image-006,1,34,A1JRP31XJIU7NV,2021-01-09_10h59.18.641,MetaAwareness,2020.1.2,Win32,60,3CVDZS288I3O2WB6W9A4GPNAZIMFMC,A1JRP31XJIU7NV,3VHP9MDGRONEFUX99MLS1CDMVJCCFJ,G9HV1,G9HV1,3VHP9MDGRONEFUX99MLS1CDMVJCCFJ,3VHP9MDGRONEFUX99MLS1CDMVJCCFJ,268121,268121,,,,,,,,,,
,,,,5,4.44002,0,22,22,194,1,"a group of older people exercising, and the woman in the middle is wearing white shoes.","a group of older people exercising, and the woman in the middle is wearing grey shoes.",wolfe1,image-092,1,34,A1JRP31XJIU7NV,2021-01-09_10h59.18.641,MetaAwareness,2020.1.2,Win32,60,3CVDZS288I3O2WB6W9A4GPNAZIMFMC,A1JRP31XJIU7NV,3VHP9MDGRONEFUX99MLS1CDMVJCCFJ,G9HV1,G9HV1,3VHP9MDGRONEFUX99MLS1CDMVJCCFJ,3VHP9MDGRONEFUX99MLS1CDMVJCCFJ,268121,268121,,,,,,,,,,
,,,,6,10.01831,0,23,23,107,1,looks like a black and white office with shelves and tables and a camera,looks like a black and white office with shelves and tables,wolfe1,image-039,1,34,A1JRP31XJIU7NV,2021-01-09_10h59.18.641,MetaAwareness,2020.1.2,Win32,60,3CVDZS288I3O2WB6W9A4GPNAZIMFMC,A1JRP31XJIU7NV,3VHP9MDGRONEFUX99MLS1CDMVJCCFJ,G9HV1,G9HV1,3VHP9MDGRONEFUX99MLS1CDMVJCCFJ,3VHP9MDGRONEFUX99MLS1CDMVJCCFJ,268121,268121,,,,,,,,,,
,,,,3,48.43926,0,24,24,89,1,a group of men playing basketball on a court next to a blue building and a crowd of people watching,a group of men playing basketball on a court next to no building and a crowd of people watching,wolfe1,image-033,2,34,A1JRP31XJIU7NV,2021-01-09_10h59.18.641,MetaAwareness,2020.1.2,Win32,60,3CVDZS288I3O2WB6W9A4GPNAZIMFMC,A1JRP31XJIU7NV,3VHP9MDGRONEFUX99MLS1CDMVJCCFJ,G9HV1,G9HV1,3VHP9MDGRONEFUX99MLS1CDMVJCCFJ,3VHP9MDGRONEFUX99MLS1CDMVJCCFJ,268121,268121,,,,,,,,,,
,,,,3,8.148575,0,25,25,92,1,men playing a game of basket ball while people watch in the shade under a canopy,men playing basketball while people watch behind a barricade,wolfe1,image-033,7,34,A1JRP31XJIU7NV,2021-01-09_10h59.18.641,MetaAwareness,2020.1.2,Win32,60,3CVDZS288I3O2WB6W9A4GPNAZIMFMC,A1JRP31XJIU7NV,3VHP9MDGRONEFUX99MLS1CDMVJCCFJ,G9HV1,G9HV1,3VHP9MDGRONEFUX99MLS1CDMVJCCFJ,3VHP9MDGRONEFUX99MLS1CDMVJCCFJ,268121,268121,,,,,,,,,,
,,,,4,115.9946,0,26,26,190,1,people walking along a street and a woman in a pink shirt,people walking along a street and a woman in a green shirt,wolfe1,image-090,3,34,A1JRP31XJIU7NV,2021-01-09_10h59.18.641,MetaAwareness,2020.1.2,Win32,60,3CVDZS288I3O2WB6W9A4GPNAZIMFMC,A1JRP31XJIU7NV,3VHP9MDGRONEFUX99MLS1CDMVJCCFJ,G9HV1,G9HV1,3VHP9MDGRONEFUX99MLS1CDMVJCCFJ,3VHP9MDGRONEFUX99MLS1CDMVJCCFJ,268121,268121,,,,,,,,,,
,,,,3,12.85744,0,27,27,125,1,a minimalistic living room with a vase on the floor.,a minimalistic living room with a carpet and nothing on the floor.,wolfe1,image-043,3,34,A1JRP31XJIU7NV,2021-01-09_10h59.18.641,MetaAwareness,2020.1.2,Win32,60,3CVDZS288I3O2WB6W9A4GPNAZIMFMC,A1JRP31XJIU7NV,3VHP9MDGRONEFUX99MLS1CDMVJCCFJ,G9HV1,G9HV1,3VHP9MDGRONEFUX99MLS1CDMVJCCFJ,3VHP9MDGRONEFUX99MLS1CDMVJCCFJ,268121,268121,,,,,,,,,,
,,,,5,62.13572,0,28,28,192,1,"various people are seaed in outdoor tables, one of them is a woman in a pink jacket","various people are seated in outdoor tables, one of them is a woman in a purple jacket",wolfe1,image-091,1,34,A1JRP31XJIU7NV,2021-01-09_10h59.18.641,MetaAwareness,2020.1.2,Win32,60,3CVDZS288I3O2WB6W9A4GPNAZIMFMC,A1JRP31XJIU7NV,3VHP9MDGRONEFUX99MLS1CDMVJCCFJ,G9HV1,G9HV1,3VHP9MDGRONEFUX99MLS1CDMVJCCFJ,3VHP9MDGRONEFUX99MLS1CDMVJCCFJ,268121,268121,,,,,,,,,,
,,,,5,6.766145,0,29,29,163,1,"a crowded outdoor cafe area, with people standing and sitting, and a green awning","a crowded outdoor cafe area, with people standing and sitting, and a red awning",wolfe1,image-080,2,34,A1JRP31XJIU7NV,2021-01-09_10h59.18.641,MetaAwareness,2020.1.2,Win32,60,3CVDZS288I3O2WB6W9A4GPNAZIMFMC,A1JRP31XJIU7NV,3VHP9MDGRONEFUX99MLS1CDMVJCCFJ,G9HV1,G9HV1,3VHP9MDGRONEFUX99MLS1CDMVJCCFJ,3VHP9MDGRONEFUX99MLS1CDMVJCCFJ,268121,268121,,,,,,,,,,
,,,,,,,,,,,,,,,,34,A1JRP31XJIU7NV,2021-01-09_10h59.18.641,MetaAwareness,2020.1.2,Win32,60,3CVDZS288I3O2WB6W9A4GPNAZIMFMC,A1JRP31XJIU7NV,3VHP9MDGRONEFUX99MLS1CDMVJCCFJ,G9HV1,G9HV1,3VHP9MDGRONEFUX99MLS1CDMVJCCFJ,3VHP9MDGRONEFUX99MLS1CDMVJCCFJ,268121,268121,6,41.48333,someone laying underneath a blue beach umbrella on a crowded beach,someone laying underneath a blue beach umbrella on a crowded beach,same,1,2.71194,members of a marching band crossing a track that all have feather plumes at the front of their hats,a cluttered and rustic looking cafe with 10 hanging lights,different
