consent_response.keys,consent_response.rt,key_resp_2.keys,key_resp_2.rt,user_resp.keys,user_resp.rt,trials.thisRepN,trials.thisTrialN,trials.thisN,trials.thisIndex,trials.ran,image_1_text,image_2_text,database,image,number,age,worker_ID,date,expName,psychopyVersion,OS,frameRate,hitId,workerId,assignmentId,a,tp_a,b,tp_b,c,tp_c,catch_same_resp.keys,catch_same_resp.rt,image_1_text_catch_same,image_2_text_catch_same,image_catch_same,catch_different_resp.keys,catch_different_resp.rt,image_1_text_catch_different,image_2_text_catch_different,image_catch_different
space,56.22785,space,23.53634,2,10.951855,0,0,0,325,1,the lady is wearing red,the lady is wearing blue,wolfe1,image-134,2,31,A3QXFWX1PVH5MJ,2021-01-09_10h47.36.242,MetaAwareness,2020.1.2,Win32,60,3CVDZS288I3O2WB6W9A4GPNAZIMFMC,A3QXFWX1PVH5MJ,3PS7W85Z805M0187SMGQGQRFG7H9T7,ZWSP1,ZWSP1,3PS7W85Z805M0187SMGQGQRFG7H9T7,3PS7W85Z805M0187SMGQGQRFG7H9T7,268121,268121,,,,,,,,,,
,,,,2,21.887905,0,1,1,42,1,people are sitting in a field for an outdoor concert with one empty blanket that no one is using,people are sitting in a field for an outdoor concert with a large patch of empty grass to the left side of the stage,wolfe1,image-014,5,31,A3QXFWX1PVH5MJ,2021-01-09_10h47.36.242,MetaAwareness,2020.1.2,Win32,60,3CVDZS288I3O2WB6W9A4GPNAZIMFMC,A3QXFWX1PVH5MJ,3PS7W85Z805M0187SMGQGQRFG7H9T7,ZWSP1,ZWSP1,3PS7W85Z805M0187SMGQGQRFG7H9T7,3PS7W85Z805M0187SMGQGQRFG7H9T7,268121,268121,,,,,,,,,,
,,,,6,13.294455,0,2,2,297,1,there is a car that is under a large amount of snow. a person is using a blue snowshovel to dig the car out.,there is a car that is under a large amount of snow. a person is using a green snowshovel to dig the car out.,wolfe1,image-127,1,31,A3QXFWX1PVH5MJ,2021-01-09_10h47.36.242,MetaAwareness,2020.1.2,Win32,60,3CVDZS288I3O2WB6W9A4GPNAZIMFMC,A3QXFWX1PVH5MJ,3PS7W85Z805M0187SMGQGQRFG7H9T7,ZWSP1,ZWSP1,3PS7W85Z805M0187SMGQGQRFG7H9T7,3PS7W85Z805M0187SMGQGQRFG7H9T7,268121,268121,,,,,,,,,,
,,,,4,11.97377,0,3,3,313,1,a girl in a pink skirt does exercise with a group of other children.,a girl in a purple skirt does exercise with a group of other children.,wolfe1,image-131,2,31,A3QXFWX1PVH5MJ,2021-01-09_10h47.36.242,MetaAwareness,2020.1.2,Win32,60,3CVDZS288I3O2WB6W9A4GPNAZIMFMC,A3QXFWX1PVH5MJ,3PS7W85Z805M0187SMGQGQRFG7H9T7,ZWSP1,ZWSP1,3PS7W85Z805M0187SMGQGQRFG7H9T7,3PS7W85Z805M0187SMGQGQRFG7H9T7,268121,268121,,,,,,,,,,
,,,,4,12.826545,0,4,4,310,1,people walking in the snow towards a helicopter and some yellow supplies,people walking in the snow towards a helicopter and some blue supplies,wolfe1,image-130,4,31,A3QXFWX1PVH5MJ,2021-01-09_10h47.36.242,MetaAwareness,2020.1.2,Win32,60,3CVDZS288I3O2WB6W9A4GPNAZIMFMC,A3QXFWX1PVH5MJ,3PS7W85Z805M0187SMGQGQRFG7H9T7,ZWSP1,ZWSP1,3PS7W85Z805M0187SMGQGQRFG7H9T7,3PS7W85Z805M0187SMGQGQRFG7H9T7,268121,268121,,,,,,,,,,
,,,,4,9.347145,0,5,5,296,1,"a group of guys playing volleyball, one guy is wearing a blue shirt.","a group of guys playing volleyball, one guy is wearing a green shirt.",wolfe1,image-126,5,31,A3QXFWX1PVH5MJ,2021-01-09_10h47.36.242,MetaAwareness,2020.1.2,Win32,60,3CVDZS288I3O2WB6W9A4GPNAZIMFMC,A3QXFWX1PVH5MJ,3PS7W85Z805M0187SMGQGQRFG7H9T7,ZWSP1,ZWSP1,3PS7W85Z805M0187SMGQGQRFG7H9T7,3PS7W85Z805M0187SMGQGQRFG7H9T7,268121,268121,,,,,,,,,,
,,,,3,8.881135,0,6,6,123,1,people in front of a temple with several spires,people in front of a temple with a missing spire,wolfe1,image-042,7,31,A3QXFWX1PVH5MJ,2021-01-09_10h47.36.242,MetaAwareness,2020.1.2,Win32,60,3CVDZS288I3O2WB6W9A4GPNAZIMFMC,A3QXFWX1PVH5MJ,3PS7W85Z805M0187SMGQGQRFG7H9T7,ZWSP1,ZWSP1,3PS7W85Z805M0187SMGQGQRFG7H9T7,3PS7W85Z805M0187SMGQGQRFG7H9T7,268121,268121,,,,,,,,,,
,,,,4,12.01371,0,7,7,115,1,a landscape photo of a red building and a lake with 1 rock in the lake,a landscape photo of a red building and a lake without any rocks in the lake,wolfe1,image-041,3,31,A3QXFWX1PVH5MJ,2021-01-09_10h47.36.242,MetaAwareness,2020.1.2,Win32,60,3CVDZS288I3O2WB6W9A4GPNAZIMFMC,A3QXFWX1PVH5MJ,3PS7W85Z805M0187SMGQGQRFG7H9T7,ZWSP1,ZWSP1,3PS7W85Z805M0187SMGQGQRFG7H9T7,3PS7W85Z805M0187SMGQGQRFG7H9T7,268121,268121,,,,,,,,,,
,,,,4,10.80288,0,8,8,208,1,looks like people worjing on music in a room with pianos and chairs. there is a stool with something that is blue underneath it,looks like people working on music in a room with pianos and chairs. there is a stool with something green underneath it.,wolfe1,image-096,2,31,A3QXFWX1PVH5MJ,2021-01-09_10h47.36.242,MetaAwareness,2020.1.2,Win32,60,3CVDZS288I3O2WB6W9A4GPNAZIMFMC,A3QXFWX1PVH5MJ,3PS7W85Z805M0187SMGQGQRFG7H9T7,ZWSP1,ZWSP1,3PS7W85Z805M0187SMGQGQRFG7H9T7,3PS7W85Z805M0187SMGQGQRFG7H9T7,268121,268121,,,,,,,,,,
,,,,4,7.67966,0,9,9,229,1,a man wearing a blue shirt has a discussion with his co-workers,a man wearing a green shirt has a discussion with his co-workers,wolfe1,image-104,2,31,A3QXFWX1PVH5MJ,2021-01-09_10h47.36.242,MetaAwareness,2020.1.2,Win32,60,3CVDZS288I3O2WB6W9A4GPNAZIMFMC,A3QXFWX1PVH5MJ,3PS7W85Z805M0187SMGQGQRFG7H9T7,ZWSP1,ZWSP1,3PS7W85Z805M0187SMGQGQRFG7H9T7,3PS7W85Z805M0187SMGQGQRFG7H9T7,268121,268121,,,,,,,,,,
,,,,3,15.165215,0,10,10,153,1,"a dirtbike race with several people in the audience, one is wearing a yellow shirt","a dirt bike race with several people watching, the person wearing a yellow shirt is now wearing a green shirt.",wolfe1,image-076,6,31,A3QXFWX1PVH5MJ,2021-01-09_10h47.36.242,MetaAwareness,2020.1.2,Win32,60,3CVDZS288I3O2WB6W9A4GPNAZIMFMC,A3QXFWX1PVH5MJ,3PS7W85Z805M0187SMGQGQRFG7H9T7,ZWSP1,ZWSP1,3PS7W85Z805M0187SMGQGQRFG7H9T7,3PS7W85Z805M0187SMGQGQRFG7H9T7,268121,268121,,,,,,,,,,
,,,,3,15.97907,0,11,11,120,1,a palace is on display with three points on the top closest to the crowd below,a palace is on diplay with two points on the top closest to the crowd below,wolfe1,image-042,3,31,A3QXFWX1PVH5MJ,2021-01-09_10h47.36.242,MetaAwareness,2020.1.2,Win32,60,3CVDZS288I3O2WB6W9A4GPNAZIMFMC,A3QXFWX1PVH5MJ,3PS7W85Z805M0187SMGQGQRFG7H9T7,ZWSP1,ZWSP1,3PS7W85Z805M0187SMGQGQRFG7H9T7,3PS7W85Z805M0187SMGQGQRFG7H9T7,268121,268121,,,,,,,,,,
,,,,5,26.419125,0,12,12,105,1,two cars are shown on a street parked in front of a yellow house with a yellow sign while someone sweeps the sidewalks,two cars are shown on a street parked in front of a yellow house while someone sweeps the sidewalks,wolfe1,image-038,3,31,A3QXFWX1PVH5MJ,2021-01-09_10h47.36.242,MetaAwareness,2020.1.2,Win32,60,3CVDZS288I3O2WB6W9A4GPNAZIMFMC,A3QXFWX1PVH5MJ,3PS7W85Z805M0187SMGQGQRFG7H9T7,ZWSP1,ZWSP1,3PS7W85Z805M0187SMGQGQRFG7H9T7,3PS7W85Z805M0187SMGQGQRFG7H9T7,268121,268121,,,,,,,,,,
,,,,5,22.276895,0,13,13,67,1,there is a building tha appears to be a clinic. there are bushes outside and people are walking into the building,there is  large building that appears to be a clinic. there is one bush outside and people are walking into the building.,wolfe1,image-023,4,31,A3QXFWX1PVH5MJ,2021-01-09_10h47.36.242,MetaAwareness,2020.1.2,Win32,60,3CVDZS288I3O2WB6W9A4GPNAZIMFMC,A3QXFWX1PVH5MJ,3PS7W85Z805M0187SMGQGQRFG7H9T7,ZWSP1,ZWSP1,3PS7W85Z805M0187SMGQGQRFG7H9T7,3PS7W85Z805M0187SMGQGQRFG7H9T7,268121,268121,,,,,,,,,,
,,,,4,10.744255,0,14,14,0,1,"an outdoor dining area on the beach, the table towards the front has salt and pepper shakers in the middle",an outdoor dining area on the beach,wolfe1,image-001,5,31,A3QXFWX1PVH5MJ,2021-01-09_10h47.36.242,MetaAwareness,2020.1.2,Win32,60,3CVDZS288I3O2WB6W9A4GPNAZIMFMC,A3QXFWX1PVH5MJ,3PS7W85Z805M0187SMGQGQRFG7H9T7,ZWSP1,ZWSP1,3PS7W85Z805M0187SMGQGQRFG7H9T7,3PS7W85Z805M0187SMGQGQRFG7H9T7,268121,268121,,,,,,,,,,
,,,,3,10.36004,0,15,15,12,1,recent graduates celebrating in front of a park bench.,recent graduates celebrating in front of a park.,wolfe1,image-005,9,31,A3QXFWX1PVH5MJ,2021-01-09_10h47.36.242,MetaAwareness,2020.1.2,Win32,60,3CVDZS288I3O2WB6W9A4GPNAZIMFMC,A3QXFWX1PVH5MJ,3PS7W85Z805M0187SMGQGQRFG7H9T7,ZWSP1,ZWSP1,3PS7W85Z805M0187SMGQGQRFG7H9T7,3PS7W85Z805M0187SMGQGQRFG7H9T7,268121,268121,,,,,,,,,,
,,,,3,13.57636,0,16,16,170,1,papers and a pink folder on a table with other items in front of two women looking at reports - they are outdoors,papers and a blue folder on a table with other items in front of two women looking at reports - they are outdoors,wolfe1,image-081,5,31,A3QXFWX1PVH5MJ,2021-01-09_10h47.36.242,MetaAwareness,2020.1.2,Win32,60,3CVDZS288I3O2WB6W9A4GPNAZIMFMC,A3QXFWX1PVH5MJ,3PS7W85Z805M0187SMGQGQRFG7H9T7,ZWSP1,ZWSP1,3PS7W85Z805M0187SMGQGQRFG7H9T7,3PS7W85Z805M0187SMGQGQRFG7H9T7,268121,268121,,,,,,,,,,
,,,,2,7.44753,0,17,17,34,1,a very modern cabin with a hammock and a fire pit,a very modern cabin with a hammock and a gravel yard,wolfe1,image-012,6,31,A3QXFWX1PVH5MJ,2021-01-09_10h47.36.242,MetaAwareness,2020.1.2,Win32,60,3CVDZS288I3O2WB6W9A4GPNAZIMFMC,A3QXFWX1PVH5MJ,3PS7W85Z805M0187SMGQGQRFG7H9T7,ZWSP1,ZWSP1,3PS7W85Z805M0187SMGQGQRFG7H9T7,3PS7W85Z805M0187SMGQGQRFG7H9T7,268121,268121,,,,,,,,,,
,,,,3,6.906035,0,18,18,103,1,table with dinner set and white drink holder,table with dinner set and no white drink holder,wolfe1,image-037,5,31,A3QXFWX1PVH5MJ,2021-01-09_10h47.36.242,MetaAwareness,2020.1.2,Win32,60,3CVDZS288I3O2WB6W9A4GPNAZIMFMC,A3QXFWX1PVH5MJ,3PS7W85Z805M0187SMGQGQRFG7H9T7,ZWSP1,ZWSP1,3PS7W85Z805M0187SMGQGQRFG7H9T7,3PS7W85Z805M0187SMGQGQRFG7H9T7,268121,268121,,,,,,,,,,
,,,,4,5.894775,0,19,19,236,1,a man wearing a green shirt looking to the side while waiting on a concert.,a man wearing a pink shirt looking to the side while waiting on a concert.,wolfe1,image-105,5,31,A3QXFWX1PVH5MJ,2021-01-09_10h47.36.242,MetaAwareness,2020.1.2,Win32,60,3CVDZS288I3O2WB6W9A4GPNAZIMFMC,A3QXFWX1PVH5MJ,3PS7W85Z805M0187SMGQGQRFG7H9T7,ZWSP1,ZWSP1,3PS7W85Z805M0187SMGQGQRFG7H9T7,3PS7W85Z805M0187SMGQGQRFG7H9T7,268121,268121,,,,,,,,,,
,,,,3,12.88107,0,20,20,232,1,a meeting in a small room and people are crowded around a conference table the man to the far left has a blue shirt,a meeting in a small room and people are crowded around a conference table the man to the far left has a green shirt,wolfe1,image-104,5,31,A3QXFWX1PVH5MJ,2021-01-09_10h47.36.242,MetaAwareness,2020.1.2,Win32,60,3CVDZS288I3O2WB6W9A4GPNAZIMFMC,A3QXFWX1PVH5MJ,3PS7W85Z805M0187SMGQGQRFG7H9T7,ZWSP1,ZWSP1,3PS7W85Z805M0187SMGQGQRFG7H9T7,3PS7W85Z805M0187SMGQGQRFG7H9T7,268121,268121,,,,,,,,,,
,,,,4,6.24398,0,21,21,96,1,there are 6 stepping stones on the ground.,there are 5 stepping stones on the ground.,wolfe1,image-034,7,31,A3QXFWX1PVH5MJ,2021-01-09_10h47.36.242,MetaAwareness,2020.1.2,Win32,60,3CVDZS288I3O2WB6W9A4GPNAZIMFMC,A3QXFWX1PVH5MJ,3PS7W85Z805M0187SMGQGQRFG7H9T7,ZWSP1,ZWSP1,3PS7W85Z805M0187SMGQGQRFG7H9T7,3PS7W85Z805M0187SMGQGQRFG7H9T7,268121,268121,,,,,,,,,,
,,,,5,14.470235,0,22,22,277,1,an asian gardan with a statue in the center in front of a light blue fabic with a tassel,an asian garden with a statue in the center in front of a dark blue puple fabric with a tassel,wolfe1,image-120,2,31,A3QXFWX1PVH5MJ,2021-01-09_10h47.36.242,MetaAwareness,2020.1.2,Win32,60,3CVDZS288I3O2WB6W9A4GPNAZIMFMC,A3QXFWX1PVH5MJ,3PS7W85Z805M0187SMGQGQRFG7H9T7,ZWSP1,ZWSP1,3PS7W85Z805M0187SMGQGQRFG7H9T7,3PS7W85Z805M0187SMGQGQRFG7H9T7,268121,268121,,,,,,,,,,
,,,,4,17.972785,0,23,23,251,1,a group of stores connected together the one on the end has a red sign at the top of it.,a group of stores connected together the one on the end has a blue sign at the top of it.,wolfe1,image-110,5,31,A3QXFWX1PVH5MJ,2021-01-09_10h47.36.242,MetaAwareness,2020.1.2,Win32,60,3CVDZS288I3O2WB6W9A4GPNAZIMFMC,A3QXFWX1PVH5MJ,3PS7W85Z805M0187SMGQGQRFG7H9T7,ZWSP1,ZWSP1,3PS7W85Z805M0187SMGQGQRFG7H9T7,3PS7W85Z805M0187SMGQGQRFG7H9T7,268121,268121,,,,,,,,,,
,,,,3,6.306635,0,24,24,309,1,the person in foreground is wearing blue jeans,the person in the forground is wearing grey jeans,wolfe1,image-129,9,31,A3QXFWX1PVH5MJ,2021-01-09_10h47.36.242,MetaAwareness,2020.1.2,Win32,60,3CVDZS288I3O2WB6W9A4GPNAZIMFMC,A3QXFWX1PVH5MJ,3PS7W85Z805M0187SMGQGQRFG7H9T7,ZWSP1,ZWSP1,3PS7W85Z805M0187SMGQGQRFG7H9T7,3PS7W85Z805M0187SMGQGQRFG7H9T7,268121,268121,,,,,,,,,,
,,,,3,5.423735,0,25,25,249,1,listening with red backpack,listening with blue backpack,wolfe1,image-109,3,31,A3QXFWX1PVH5MJ,2021-01-09_10h47.36.242,MetaAwareness,2020.1.2,Win32,60,3CVDZS288I3O2WB6W9A4GPNAZIMFMC,A3QXFWX1PVH5MJ,3PS7W85Z805M0187SMGQGQRFG7H9T7,ZWSP1,ZWSP1,3PS7W85Z805M0187SMGQGQRFG7H9T7,3PS7W85Z805M0187SMGQGQRFG7H9T7,268121,268121,,,,,,,,,,
,,,,3,43.685115,0,26,26,293,1,a volley ball game in a wooded park setting with a group of three people watching a ball about to be volleyed back,a volleyball game with a group of three players watching on the right watching one person about to hit the ball across in a park setting,wolfe1,image-126,1,31,A3QXFWX1PVH5MJ,2021-01-09_10h47.36.242,MetaAwareness,2020.1.2,Win32,60,3CVDZS288I3O2WB6W9A4GPNAZIMFMC,A3QXFWX1PVH5MJ,3PS7W85Z805M0187SMGQGQRFG7H9T7,ZWSP1,ZWSP1,3PS7W85Z805M0187SMGQGQRFG7H9T7,3PS7W85Z805M0187SMGQGQRFG7H9T7,268121,268121,,,,,,,,,,
,,,,3,7.493285,0,27,27,255,1,a busy street with a man walking down the middle of the crowd wearing a red shirt.,a busy street with a man walking down the middle of the crowd wearing a blue shirt.,wolfe1,image-112,2,31,A3QXFWX1PVH5MJ,2021-01-09_10h47.36.242,MetaAwareness,2020.1.2,Win32,60,3CVDZS288I3O2WB6W9A4GPNAZIMFMC,A3QXFWX1PVH5MJ,3PS7W85Z805M0187SMGQGQRFG7H9T7,ZWSP1,ZWSP1,3PS7W85Z805M0187SMGQGQRFG7H9T7,3PS7W85Z805M0187SMGQGQRFG7H9T7,268121,268121,,,,,,,,,,
,,,,4,15.286345,0,28,28,79,1,a stone school building with three features on the roof and many bikes parked as students are in class.,a stone school builiding with two features on the roof and many bikes parked as students are in class,wolfe1,image-029,3,31,A3QXFWX1PVH5MJ,2021-01-09_10h47.36.242,MetaAwareness,2020.1.2,Win32,60,3CVDZS288I3O2WB6W9A4GPNAZIMFMC,A3QXFWX1PVH5MJ,3PS7W85Z805M0187SMGQGQRFG7H9T7,ZWSP1,ZWSP1,3PS7W85Z805M0187SMGQGQRFG7H9T7,3PS7W85Z805M0187SMGQGQRFG7H9T7,268121,268121,,,,,,,,,,
,,,,4,11.87339,0,29,29,164,1,people congurgating at a outdoor restarurant. there is a table with a green umbrella.,people congrugating at a outdoor restaurant. there is a table with a pink umbrella.,wolfe1,image-080,4,31,A3QXFWX1PVH5MJ,2021-01-09_10h47.36.242,MetaAwareness,2020.1.2,Win32,60,3CVDZS288I3O2WB6W9A4GPNAZIMFMC,A3QXFWX1PVH5MJ,3PS7W85Z805M0187SMGQGQRFG7H9T7,ZWSP1,ZWSP1,3PS7W85Z805M0187SMGQGQRFG7H9T7,3PS7W85Z805M0187SMGQGQRFG7H9T7,268121,268121,,,,,,,,,,
,,,,,,,,,,,,,,,,31,A3QXFWX1PVH5MJ,2021-01-09_10h47.36.242,MetaAwareness,2020.1.2,Win32,60,3CVDZS288I3O2WB6W9A4GPNAZIMFMC,A3QXFWX1PVH5MJ,3PS7W85Z805M0187SMGQGQRFG7H9T7,ZWSP1,ZWSP1,3PS7W85Z805M0187SMGQGQRFG7H9T7,3PS7W85Z805M0187SMGQGQRFG7H9T7,268121,268121,6,10.623975,someone laying underneath a blue beach umbrella on a crowded beach,someone laying underneath a blue beach umbrella on a crowded beach,same,1,9.617355,members of a marching band crossing a track that all have feather plumes at the front of their hats,a cluttered and rustic looking cafe with 10 hanging lights,different
