consent_response.keys,consent_response.rt,key_resp_2.keys,key_resp_2.rt,user_resp.keys,user_resp.rt,trials.thisRepN,trials.thisTrialN,trials.thisN,trials.thisIndex,trials.ran,image_1_text,image_2_text,database,image,number,age,worker_ID,date,expName,psychopyVersion,OS,frameRate,hitId,workerId,assignmentId,a,tp_a,b,tp_b,c,tp_c,catch_same_resp.keys,catch_same_resp.rt,image_1_text_catch_same,image_2_text_catch_same,image_catch_same,catch_different_resp.keys,catch_different_resp.rt,image_1_text_catch_different,image_2_text_catch_different,image_catch_different
space,3.07709,space,20.915115,5,28.604825,0,0,0,73,1,a male and female student walking together and her backpack has a blue sticker,a male and female student waking together and her backpack has a green sticker,wolfe1,image-094,9,35,A3V9FP3JACXUCH,2021-01-09_15h58.45.174,MetaAwareness,2020.1.2,Win32,60,3OWZNK3RYMSNEA43HGMJNGAF30OU23,A3V9FP3JACXUCH,31LM9EDVOMVDB0GWH2LRWLZQNVUNJ4,V9L19,V9L19,31LM9EDVOMVDB0GWH2LRWLZQNVUNJ4,31LM9EDVOMVDB0GWH2LRWLZQNVUNJ4,268159,268159,,,,,,,,,,
,,,,5,20.735425,0,1,1,82,1,a man in blue sits opposite a man in turquoise as they attentively listen to a group meeting,a man in green sits opposite a man in turquoise as they attentively listen to a group meeting,wolfe1,image-104,8,35,A3V9FP3JACXUCH,2021-01-09_15h58.45.174,MetaAwareness,2020.1.2,Win32,60,3OWZNK3RYMSNEA43HGMJNGAF30OU23,A3V9FP3JACXUCH,31LM9EDVOMVDB0GWH2LRWLZQNVUNJ4,V9L19,V9L19,31LM9EDVOMVDB0GWH2LRWLZQNVUNJ4,31LM9EDVOMVDB0GWH2LRWLZQNVUNJ4,268159,268159,,,,,,,,,,
,,,,4,18.45643,0,2,2,71,1,a girl walks with her friend and her black and blue backpack,a girl walks with her friend and her black and green backpack,wolfe1,image-094,2,35,A3V9FP3JACXUCH,2021-01-09_15h58.45.174,MetaAwareness,2020.1.2,Win32,60,3OWZNK3RYMSNEA43HGMJNGAF30OU23,A3V9FP3JACXUCH,31LM9EDVOMVDB0GWH2LRWLZQNVUNJ4,V9L19,V9L19,31LM9EDVOMVDB0GWH2LRWLZQNVUNJ4,31LM9EDVOMVDB0GWH2LRWLZQNVUNJ4,268159,268159,,,,,,,,,,
,,,,4,15.798845,0,3,3,90,1,a plane at the airport with a yellow jet truck parked next to it,a plane at the airport with a red jet truck parked next to it,wolfe1,image-111,1,35,A3V9FP3JACXUCH,2021-01-09_15h58.45.174,MetaAwareness,2020.1.2,Win32,60,3OWZNK3RYMSNEA43HGMJNGAF30OU23,A3V9FP3JACXUCH,31LM9EDVOMVDB0GWH2LRWLZQNVUNJ4,V9L19,V9L19,31LM9EDVOMVDB0GWH2LRWLZQNVUNJ4,31LM9EDVOMVDB0GWH2LRWLZQNVUNJ4,268159,268159,,,,,,,,,,
,,,,2,18.96838,0,4,4,112,1,two white couches sit in front of a fireplace in a nice living room. the closest couch has a red throw pillow at the end next to the fireplace,two white couches sit in front of fireplace in a nice living room. the closest couch has a green throw pillow at the end next to the fireplace,wolfe1,image-132,2,35,A3V9FP3JACXUCH,2021-01-09_15h58.45.174,MetaAwareness,2020.1.2,Win32,60,3OWZNK3RYMSNEA43HGMJNGAF30OU23,A3V9FP3JACXUCH,31LM9EDVOMVDB0GWH2LRWLZQNVUNJ4,V9L19,V9L19,31LM9EDVOMVDB0GWH2LRWLZQNVUNJ4,31LM9EDVOMVDB0GWH2LRWLZQNVUNJ4,268159,268159,,,,,,,,,,
,,,,2,5.583685,0,5,5,87,1,"a group of hikers, with one man wearing a red backpack.",a group of hikers with one man wearing a blue backpack.,wolfe1,image-109,1,35,A3V9FP3JACXUCH,2021-01-09_15h58.45.174,MetaAwareness,2020.1.2,Win32,60,3OWZNK3RYMSNEA43HGMJNGAF30OU23,A3V9FP3JACXUCH,31LM9EDVOMVDB0GWH2LRWLZQNVUNJ4,V9L19,V9L19,31LM9EDVOMVDB0GWH2LRWLZQNVUNJ4,31LM9EDVOMVDB0GWH2LRWLZQNVUNJ4,268159,268159,,,,,,,,,,
,,,,2,6.832445,0,6,6,108,1,a group of old ladies and men with one old woman wearing a pair of blue jeans,a group of old ladies and men with one old woman wearing a pair of gray jeans,wolfe1,image-129,3,35,A3V9FP3JACXUCH,2021-01-09_15h58.45.174,MetaAwareness,2020.1.2,Win32,60,3OWZNK3RYMSNEA43HGMJNGAF30OU23,A3V9FP3JACXUCH,31LM9EDVOMVDB0GWH2LRWLZQNVUNJ4,V9L19,V9L19,31LM9EDVOMVDB0GWH2LRWLZQNVUNJ4,31LM9EDVOMVDB0GWH2LRWLZQNVUNJ4,268159,268159,,,,,,,,,,
,,,,1,16.282485,0,7,7,109,1,an old woman wearing blue jeans is standing in a crowd of people on a road,an elderly woman wearing grey pants is standing in a crowd of people on the roadside,wolfe1,image-129,6,35,A3V9FP3JACXUCH,2021-01-09_15h58.45.174,MetaAwareness,2020.1.2,Win32,60,3OWZNK3RYMSNEA43HGMJNGAF30OU23,A3V9FP3JACXUCH,31LM9EDVOMVDB0GWH2LRWLZQNVUNJ4,V9L19,V9L19,31LM9EDVOMVDB0GWH2LRWLZQNVUNJ4,31LM9EDVOMVDB0GWH2LRWLZQNVUNJ4,268159,268159,,,,,,,,,,
,,,,1,12.399545,0,8,8,36,1,"a picnic table is inside an enclosure, there is a white food carton sitting in the middle of the table.","a picnic table is inside an enclosure, there is no white food carton sitting in the middle.",wolfe1,image-037,1,35,A3V9FP3JACXUCH,2021-01-09_15h58.45.174,MetaAwareness,2020.1.2,Win32,60,3OWZNK3RYMSNEA43HGMJNGAF30OU23,A3V9FP3JACXUCH,31LM9EDVOMVDB0GWH2LRWLZQNVUNJ4,V9L19,V9L19,31LM9EDVOMVDB0GWH2LRWLZQNVUNJ4,31LM9EDVOMVDB0GWH2LRWLZQNVUNJ4,268159,268159,,,,,,,,,,
,,,,1,9.90455,0,9,9,32,1,house with tile walkway in back yard,house with tile walkway missing one tile,wolfe1,image-034,2,35,A3V9FP3JACXUCH,2021-01-09_15h58.45.174,MetaAwareness,2020.1.2,Win32,60,3OWZNK3RYMSNEA43HGMJNGAF30OU23,A3V9FP3JACXUCH,31LM9EDVOMVDB0GWH2LRWLZQNVUNJ4,V9L19,V9L19,31LM9EDVOMVDB0GWH2LRWLZQNVUNJ4,31LM9EDVOMVDB0GWH2LRWLZQNVUNJ4,268159,268159,,,,,,,,,,
,,,,2,14.236825,0,10,10,101,1,two people walking a dog towards a pier with three green poles in the water,two people walking a dog towards a pier with two green poles and one brown pole in the water,wolfe1,image-124,5,35,A3V9FP3JACXUCH,2021-01-09_15h58.45.174,MetaAwareness,2020.1.2,Win32,60,3OWZNK3RYMSNEA43HGMJNGAF30OU23,A3V9FP3JACXUCH,31LM9EDVOMVDB0GWH2LRWLZQNVUNJ4,V9L19,V9L19,31LM9EDVOMVDB0GWH2LRWLZQNVUNJ4,31LM9EDVOMVDB0GWH2LRWLZQNVUNJ4,268159,268159,,,,,,,,,,
,,,,2,7.048105,0,11,11,85,1,three men playing golf with a white house that has a grey roof in the background.,three men playing golf with a white house that has a brown roof in the background.,wolfe1,image-108,3,35,A3V9FP3JACXUCH,2021-01-09_15h58.45.174,MetaAwareness,2020.1.2,Win32,60,3OWZNK3RYMSNEA43HGMJNGAF30OU23,A3V9FP3JACXUCH,31LM9EDVOMVDB0GWH2LRWLZQNVUNJ4,V9L19,V9L19,31LM9EDVOMVDB0GWH2LRWLZQNVUNJ4,31LM9EDVOMVDB0GWH2LRWLZQNVUNJ4,268159,268159,,,,,,,,,,
,,,,6,9.624455,0,12,12,96,1,people are gathered at an outdoor market filled with various fruits and vegetables. one of the awnings covering the stalls is blue,people are gathered at an outdoor market filled with various fruits and vegetables. one of the awnings covering the stalls is red.,wolfe1,image-117,7,35,A3V9FP3JACXUCH,2021-01-09_15h58.45.174,MetaAwareness,2020.1.2,Win32,60,3OWZNK3RYMSNEA43HGMJNGAF30OU23,A3V9FP3JACXUCH,31LM9EDVOMVDB0GWH2LRWLZQNVUNJ4,V9L19,V9L19,31LM9EDVOMVDB0GWH2LRWLZQNVUNJ4,31LM9EDVOMVDB0GWH2LRWLZQNVUNJ4,268159,268159,,,,,,,,,,
,,,,5,6.78717,0,13,13,49,1,an empty field with 7 bails of hay scatterered around.,an empty field with 6 bails of hay scattered around.,wolfe1,image-045,6,35,A3V9FP3JACXUCH,2021-01-09_15h58.45.174,MetaAwareness,2020.1.2,Win32,60,3OWZNK3RYMSNEA43HGMJNGAF30OU23,A3V9FP3JACXUCH,31LM9EDVOMVDB0GWH2LRWLZQNVUNJ4,V9L19,V9L19,31LM9EDVOMVDB0GWH2LRWLZQNVUNJ4,31LM9EDVOMVDB0GWH2LRWLZQNVUNJ4,268159,268159,,,,,,,,,,
,,,,5,17.596535,0,14,14,12,1,six men playing instruments outside of a store that has a sign on the building next to them,six men playing instruments outside of a store that has a plain building next to it,wolfe1,image-013,1,35,A3V9FP3JACXUCH,2021-01-09_15h58.45.174,MetaAwareness,2020.1.2,Win32,60,3OWZNK3RYMSNEA43HGMJNGAF30OU23,A3V9FP3JACXUCH,31LM9EDVOMVDB0GWH2LRWLZQNVUNJ4,V9L19,V9L19,31LM9EDVOMVDB0GWH2LRWLZQNVUNJ4,31LM9EDVOMVDB0GWH2LRWLZQNVUNJ4,268159,268159,,,,,,,,,,
,,,,1,14.051725,0,15,15,7,1,"a petting zoo with a couple of reindeer next to a woman in the foreground and a man bending over, facing the viewer in the background",a petting zoo with a woman in a pink dress smiling at two reindeer in the foreground and a gravelly area of ground in the background near a group of other people,wolfe1,image-008,3,35,A3V9FP3JACXUCH,2021-01-09_15h58.45.174,MetaAwareness,2020.1.2,Win32,60,3OWZNK3RYMSNEA43HGMJNGAF30OU23,A3V9FP3JACXUCH,31LM9EDVOMVDB0GWH2LRWLZQNVUNJ4,V9L19,V9L19,31LM9EDVOMVDB0GWH2LRWLZQNVUNJ4,31LM9EDVOMVDB0GWH2LRWLZQNVUNJ4,268159,268159,,,,,,,,,,
,,,,5,6.21556,0,16,16,102,1,person taking landscape photo with another person holding a blue backpack,person taking landscape phone and another person holding a yellow backpack,wolfe1,image-125,3,35,A3V9FP3JACXUCH,2021-01-09_15h58.45.174,MetaAwareness,2020.1.2,Win32,60,3OWZNK3RYMSNEA43HGMJNGAF30OU23,A3V9FP3JACXUCH,31LM9EDVOMVDB0GWH2LRWLZQNVUNJ4,V9L19,V9L19,31LM9EDVOMVDB0GWH2LRWLZQNVUNJ4,31LM9EDVOMVDB0GWH2LRWLZQNVUNJ4,268159,268159,,,,,,,,,,
,,,,5,10.080985,0,17,17,10,1,a short coffee table bearing two small cactuses and other objects sits near a chair in a room,a short coffee table bearing a cactus and other objects sits hear a chair in a room,wolfe1,image-011,5,35,A3V9FP3JACXUCH,2021-01-09_15h58.45.174,MetaAwareness,2020.1.2,Win32,60,3OWZNK3RYMSNEA43HGMJNGAF30OU23,A3V9FP3JACXUCH,31LM9EDVOMVDB0GWH2LRWLZQNVUNJ4,V9L19,V9L19,31LM9EDVOMVDB0GWH2LRWLZQNVUNJ4,31LM9EDVOMVDB0GWH2LRWLZQNVUNJ4,268159,268159,,,,,,,,,,
,,,,4,2.570195,0,18,18,38,1,looks like a black and white office with shelves and tables and a camera,looks like a black and white office with shelves and tables,wolfe1,image-039,1,35,A3V9FP3JACXUCH,2021-01-09_15h58.45.174,MetaAwareness,2020.1.2,Win32,60,3OWZNK3RYMSNEA43HGMJNGAF30OU23,A3V9FP3JACXUCH,31LM9EDVOMVDB0GWH2LRWLZQNVUNJ4,V9L19,V9L19,31LM9EDVOMVDB0GWH2LRWLZQNVUNJ4,31LM9EDVOMVDB0GWH2LRWLZQNVUNJ4,268159,268159,,,,,,,,,,
,,,,5,2.536435,0,19,19,22,1,there is a brown pillow,there is a white pillow,wolfe1,image-026,2,35,A3V9FP3JACXUCH,2021-01-09_15h58.45.174,MetaAwareness,2020.1.2,Win32,60,3OWZNK3RYMSNEA43HGMJNGAF30OU23,A3V9FP3JACXUCH,31LM9EDVOMVDB0GWH2LRWLZQNVUNJ4,V9L19,V9L19,31LM9EDVOMVDB0GWH2LRWLZQNVUNJ4,31LM9EDVOMVDB0GWH2LRWLZQNVUNJ4,268159,268159,,,,,,,,,,
,,,,5,2.38533,0,20,20,116,1,a grassy outdoor seating area with a red surfboard leaning against the wall,a grassy outdoor seating area with a blue surfboard leaning against the wall,wolfe1,image-133,6,35,A3V9FP3JACXUCH,2021-01-09_15h58.45.174,MetaAwareness,2020.1.2,Win32,60,3OWZNK3RYMSNEA43HGMJNGAF30OU23,A3V9FP3JACXUCH,31LM9EDVOMVDB0GWH2LRWLZQNVUNJ4,V9L19,V9L19,31LM9EDVOMVDB0GWH2LRWLZQNVUNJ4,31LM9EDVOMVDB0GWH2LRWLZQNVUNJ4,268159,268159,,,,,,,,,,
,,,,5,2.68455,0,21,21,29,1,a family feeding birds in front of all of them.,a family feeding birds that are in front of all of them except the young boy.,wolfe1,image-032,4,35,A3V9FP3JACXUCH,2021-01-09_15h58.45.174,MetaAwareness,2020.1.2,Win32,60,3OWZNK3RYMSNEA43HGMJNGAF30OU23,A3V9FP3JACXUCH,31LM9EDVOMVDB0GWH2LRWLZQNVUNJ4,V9L19,V9L19,31LM9EDVOMVDB0GWH2LRWLZQNVUNJ4,31LM9EDVOMVDB0GWH2LRWLZQNVUNJ4,268159,268159,,,,,,,,,,
,,,,4,3.06478,0,22,22,117,1,people walking on a boardwalk with a woman wearing a red shirt,people walking on a boardwalk with a woman wearing a blue shirt,wolfe1,image-134,3,35,A3V9FP3JACXUCH,2021-01-09_15h58.45.174,MetaAwareness,2020.1.2,Win32,60,3OWZNK3RYMSNEA43HGMJNGAF30OU23,A3V9FP3JACXUCH,31LM9EDVOMVDB0GWH2LRWLZQNVUNJ4,V9L19,V9L19,31LM9EDVOMVDB0GWH2LRWLZQNVUNJ4,31LM9EDVOMVDB0GWH2LRWLZQNVUNJ4,268159,268159,,,,,,,,,,
,,,,5,2.171295,0,23,23,37,1,a table with 6 food containers on it.,a table with 5 food containers on it.,wolfe1,image-037,4,35,A3V9FP3JACXUCH,2021-01-09_15h58.45.174,MetaAwareness,2020.1.2,Win32,60,3OWZNK3RYMSNEA43HGMJNGAF30OU23,A3V9FP3JACXUCH,31LM9EDVOMVDB0GWH2LRWLZQNVUNJ4,V9L19,V9L19,31LM9EDVOMVDB0GWH2LRWLZQNVUNJ4,31LM9EDVOMVDB0GWH2LRWLZQNVUNJ4,268159,268159,,,,,,,,,,
,,,,5,3.32081,0,24,24,30,1,a group of men playing basketball on a court next to a blue building and a crowd of people watching,a group of men playing basketball on a court next to no building and a crowd of people watching,wolfe1,image-033,2,35,A3V9FP3JACXUCH,2021-01-09_15h58.45.174,MetaAwareness,2020.1.2,Win32,60,3OWZNK3RYMSNEA43HGMJNGAF30OU23,A3V9FP3JACXUCH,31LM9EDVOMVDB0GWH2LRWLZQNVUNJ4,V9L19,V9L19,31LM9EDVOMVDB0GWH2LRWLZQNVUNJ4,31LM9EDVOMVDB0GWH2LRWLZQNVUNJ4,268159,268159,,,,,,,,,,
,,,,2,4.58889,0,25,25,54,1,coconut trees are placed in the beach and one coconut  leaves placed in the yellow box,coconut trees are placed in the beach and one coconut leaves with inflorescence is not  there in the yellow box,wolfe1,image-049,3,35,A3V9FP3JACXUCH,2021-01-09_15h58.45.174,MetaAwareness,2020.1.2,Win32,60,3OWZNK3RYMSNEA43HGMJNGAF30OU23,A3V9FP3JACXUCH,31LM9EDVOMVDB0GWH2LRWLZQNVUNJ4,V9L19,V9L19,31LM9EDVOMVDB0GWH2LRWLZQNVUNJ4,31LM9EDVOMVDB0GWH2LRWLZQNVUNJ4,268159,268159,,,,,,,,,,
,,,,5,2.49909,0,26,26,60,1,people outdoors with green umbrella,people outdoors with red umbrella,wolfe1,image-080,1,35,A3V9FP3JACXUCH,2021-01-09_15h58.45.174,MetaAwareness,2020.1.2,Win32,60,3OWZNK3RYMSNEA43HGMJNGAF30OU23,A3V9FP3JACXUCH,31LM9EDVOMVDB0GWH2LRWLZQNVUNJ4,V9L19,V9L19,31LM9EDVOMVDB0GWH2LRWLZQNVUNJ4,31LM9EDVOMVDB0GWH2LRWLZQNVUNJ4,268159,268159,,,,,,,,,,
,,,,4,4.321525,0,27,27,58,1,the inside of a large mall where people walk around shopping in different stores. one clothing store on the second floor has a red dress on display,the inside of a large mall where people walk around shopping in different stores.one clothing store on the second floor has a purple dress on display,wolfe1,image-079,3,35,A3V9FP3JACXUCH,2021-01-09_15h58.45.174,MetaAwareness,2020.1.2,Win32,60,3OWZNK3RYMSNEA43HGMJNGAF30OU23,A3V9FP3JACXUCH,31LM9EDVOMVDB0GWH2LRWLZQNVUNJ4,V9L19,V9L19,31LM9EDVOMVDB0GWH2LRWLZQNVUNJ4,31LM9EDVOMVDB0GWH2LRWLZQNVUNJ4,268159,268159,,,,,,,,,,
,,,,5,4.753375,0,28,28,66,1,hikers rest on the top of a mountain while a man gets something out of his red pack,hikers rest on the top of a mountain while a man gets something out of his gren pack,wolfe1,image-084,5,35,A3V9FP3JACXUCH,2021-01-09_15h58.45.174,MetaAwareness,2020.1.2,Win32,60,3OWZNK3RYMSNEA43HGMJNGAF30OU23,A3V9FP3JACXUCH,31LM9EDVOMVDB0GWH2LRWLZQNVUNJ4,V9L19,V9L19,31LM9EDVOMVDB0GWH2LRWLZQNVUNJ4,31LM9EDVOMVDB0GWH2LRWLZQNVUNJ4,268159,268159,,,,,,,,,,
,,,,5,1.641205,0,29,29,47,1,9 small barns are outside beneath a vibrant pink sky against a mountain backdrop.,8 small barns are outside beneath a vibrant pink sky against a mountain backdrop.,wolfe1,image-044,1,35,A3V9FP3JACXUCH,2021-01-09_15h58.45.174,MetaAwareness,2020.1.2,Win32,60,3OWZNK3RYMSNEA43HGMJNGAF30OU23,A3V9FP3JACXUCH,31LM9EDVOMVDB0GWH2LRWLZQNVUNJ4,V9L19,V9L19,31LM9EDVOMVDB0GWH2LRWLZQNVUNJ4,31LM9EDVOMVDB0GWH2LRWLZQNVUNJ4,268159,268159,,,,,,,,,,
,,,,,,,,,,,,,,,,35,A3V9FP3JACXUCH,2021-01-09_15h58.45.174,MetaAwareness,2020.1.2,Win32,60,3OWZNK3RYMSNEA43HGMJNGAF30OU23,A3V9FP3JACXUCH,31LM9EDVOMVDB0GWH2LRWLZQNVUNJ4,V9L19,V9L19,31LM9EDVOMVDB0GWH2LRWLZQNVUNJ4,31LM9EDVOMVDB0GWH2LRWLZQNVUNJ4,268159,268159,6,9.63388,someone laying underneath a blue beach umbrella on a crowded beach,someone laying underneath a blue beach umbrella on a crowded beach,same,1,4.95897,members of a marching band crossing a track that all have feather plumes at the front of their hats,a cluttered and rustic looking cafe with 10 hanging lights,different
