consent_response.keys,consent_response.rt,key_resp_2.keys,key_resp_2.rt,user_resp.keys,user_resp.rt,trials.thisRepN,trials.thisTrialN,trials.thisN,trials.thisIndex,trials.ran,image_1_text,image_2_text,database,image,number,age,worker_ID,date,expName,psychopyVersion,OS,frameRate,hitId,workerId,assignmentId,a,tp_a,b,tp_b,c,tp_c,catch_same_resp.keys,catch_same_resp.rt,image_1_text_catch_same,image_2_text_catch_same,image_catch_same,catch_different_resp.keys,catch_different_resp.rt,image_1_text_catch_different,image_2_text_catch_different,image_catch_different
space,7.888245,space,14.513045,4,11.387125,0,0,0,49,1,a group of farm animals is eating in front of a fence with a chicken just on the other side,a group of farm animals is eating in front of a fence,wolfe1,image-009,3,39,A2NBBQ3DKW5MV3,2021-01-07_08h15.31.536,MetaAwareness,2020.1.2,Win32,60,3FHTJGYT8O301Z4EZ98EFEHH50YPGE,A2NBBQ3DKW5MV3,3OB0CAO74ISBWTPK04RH1OHIDEQYHD,7CBO5,7CBO5,3OB0CAO74ISBWTPK04RH1OHIDEQYHD,3OB0CAO74ISBWTPK04RH1OHIDEQYHD,267715,267715,,,,,,,,,,
,,,,5,9.00789,0,1,1,633,1,beach area with caddy' surfboard and 4 blue umbrellas and 3 yellow umbrellas,beach area with caddy's surfboard and 3 blue umbrellas and 4 yellow umbrellas,wolfe1,image-137,4,39,A2NBBQ3DKW5MV3,2021-01-07_08h15.31.536,MetaAwareness,2020.1.2,Win32,60,3FHTJGYT8O301Z4EZ98EFEHH50YPGE,A2NBBQ3DKW5MV3,3OB0CAO74ISBWTPK04RH1OHIDEQYHD,7CBO5,7CBO5,3OB0CAO74ISBWTPK04RH1OHIDEQYHD,3OB0CAO74ISBWTPK04RH1OHIDEQYHD,267715,267715,,,,,,,,,,
,,,,5,6.692155,0,2,2,250,1,"a freshly mowed plain next to a vineyard, adorned with seven rolls of grass","a freshly mowed plain next to a vineyard, adorned with six rolls of grass",wolfe1,image-045,2,39,A2NBBQ3DKW5MV3,2021-01-07_08h15.31.536,MetaAwareness,2020.1.2,Win32,60,3FHTJGYT8O301Z4EZ98EFEHH50YPGE,A2NBBQ3DKW5MV3,3OB0CAO74ISBWTPK04RH1OHIDEQYHD,7CBO5,7CBO5,3OB0CAO74ISBWTPK04RH1OHIDEQYHD,3OB0CAO74ISBWTPK04RH1OHIDEQYHD,267715,267715,,,,,,,,,,
,,,,4,6.420375,0,3,3,116,1,people watch children in a park. one man has a pink beach bag.,people watch children in a park.,wolfe1,image-020,1,39,A2NBBQ3DKW5MV3,2021-01-07_08h15.31.536,MetaAwareness,2020.1.2,Win32,60,3FHTJGYT8O301Z4EZ98EFEHH50YPGE,A2NBBQ3DKW5MV3,3OB0CAO74ISBWTPK04RH1OHIDEQYHD,7CBO5,7CBO5,3OB0CAO74ISBWTPK04RH1OHIDEQYHD,3OB0CAO74ISBWTPK04RH1OHIDEQYHD,267715,267715,,,,,,,,,,
,,,,4,3.606025,0,4,4,4,1,"an outdoor dining area on the beach, the table towards the front has salt and pepper shakers in the middle",an outdoor dining area on the beach,wolfe1,image-001,5,39,A2NBBQ3DKW5MV3,2021-01-07_08h15.31.536,MetaAwareness,2020.1.2,Win32,60,3FHTJGYT8O301Z4EZ98EFEHH50YPGE,A2NBBQ3DKW5MV3,3OB0CAO74ISBWTPK04RH1OHIDEQYHD,7CBO5,7CBO5,3OB0CAO74ISBWTPK04RH1OHIDEQYHD,3OB0CAO74ISBWTPK04RH1OHIDEQYHD,267715,267715,,,,,,,,,,
,,,,3,5.111425,0,5,5,151,1,each bench in the park has a plaquard.,"each bench in the park has a plaquard, except one.",wolfe1,image-027,1,39,A2NBBQ3DKW5MV3,2021-01-07_08h15.31.536,MetaAwareness,2020.1.2,Win32,60,3FHTJGYT8O301Z4EZ98EFEHH50YPGE,A2NBBQ3DKW5MV3,3OB0CAO74ISBWTPK04RH1OHIDEQYHD,7CBO5,7CBO5,3OB0CAO74ISBWTPK04RH1OHIDEQYHD,3OB0CAO74ISBWTPK04RH1OHIDEQYHD,267715,267715,,,,,,,,,,
,,,,4,12.85961,0,6,6,59,1,a large room with table and a box plant and a chair off to the side.,a large room with table that doesn't have plant and has a chair and picture.,wolfe1,image-011,2,39,A2NBBQ3DKW5MV3,2021-01-07_08h15.31.536,MetaAwareness,2020.1.2,Win32,60,3FHTJGYT8O301Z4EZ98EFEHH50YPGE,A2NBBQ3DKW5MV3,3OB0CAO74ISBWTPK04RH1OHIDEQYHD,7CBO5,7CBO5,3OB0CAO74ISBWTPK04RH1OHIDEQYHD,3OB0CAO74ISBWTPK04RH1OHIDEQYHD,267715,267715,,,,,,,,,,
,,,,3,6.44263,0,7,7,558,1,a blue bag leaning against a sign post on a street,a yellow bag leaning against a post on a street,wolfe1,image-125,1,39,A2NBBQ3DKW5MV3,2021-01-07_08h15.31.536,MetaAwareness,2020.1.2,Win32,60,3FHTJGYT8O301Z4EZ98EFEHH50YPGE,A2NBBQ3DKW5MV3,3OB0CAO74ISBWTPK04RH1OHIDEQYHD,7CBO5,7CBO5,3OB0CAO74ISBWTPK04RH1OHIDEQYHD,3OB0CAO74ISBWTPK04RH1OHIDEQYHD,267715,267715,,,,,,,,,,
,,,,5,5.92814,0,8,8,506,1,some runners on a road with a baseball building in the distance,some runners on a road with a baseball building in the distance,wolfe1,image-116,1,39,A2NBBQ3DKW5MV3,2021-01-07_08h15.31.536,MetaAwareness,2020.1.2,Win32,60,3FHTJGYT8O301Z4EZ98EFEHH50YPGE,A2NBBQ3DKW5MV3,3OB0CAO74ISBWTPK04RH1OHIDEQYHD,7CBO5,7CBO5,3OB0CAO74ISBWTPK04RH1OHIDEQYHD,3OB0CAO74ISBWTPK04RH1OHIDEQYHD,267715,267715,,,,,,,,,,
,,,,3,5.750155,0,9,9,621,1,a girl with a green hat and sunglasses is riding on the back of a camel,a girl with a pink hat and sunglasses is riding on the back of a camel behind another girl,wolfe1,image-135,4,39,A2NBBQ3DKW5MV3,2021-01-07_08h15.31.536,MetaAwareness,2020.1.2,Win32,60,3FHTJGYT8O301Z4EZ98EFEHH50YPGE,A2NBBQ3DKW5MV3,3OB0CAO74ISBWTPK04RH1OHIDEQYHD,7CBO5,7CBO5,3OB0CAO74ISBWTPK04RH1OHIDEQYHD,3OB0CAO74ISBWTPK04RH1OHIDEQYHD,267715,267715,,,,,,,,,,
,,,,5,7.592825,0,10,10,17,1,a group of people engaged in a conversation in a room with a curtain on the wall.,a group of people sit in a circle while discussing something.,wolfe1,image-003,7,39,A2NBBQ3DKW5MV3,2021-01-07_08h15.31.536,MetaAwareness,2020.1.2,Win32,60,3FHTJGYT8O301Z4EZ98EFEHH50YPGE,A2NBBQ3DKW5MV3,3OB0CAO74ISBWTPK04RH1OHIDEQYHD,7CBO5,7CBO5,3OB0CAO74ISBWTPK04RH1OHIDEQYHD,3OB0CAO74ISBWTPK04RH1OHIDEQYHD,267715,267715,,,,,,,,,,
,,,,3,5.35268,0,11,11,586,1,a woman standing on the sidewalk wearing a pair of blue jeans.,a woman standing on the sidewalk wearing a pair of grey jeans.,wolfe1,image-129,10,39,A2NBBQ3DKW5MV3,2021-01-07_08h15.31.536,MetaAwareness,2020.1.2,Win32,60,3FHTJGYT8O301Z4EZ98EFEHH50YPGE,A2NBBQ3DKW5MV3,3OB0CAO74ISBWTPK04RH1OHIDEQYHD,7CBO5,7CBO5,3OB0CAO74ISBWTPK04RH1OHIDEQYHD,3OB0CAO74ISBWTPK04RH1OHIDEQYHD,267715,267715,,,,,,,,,,
,,,,2,7.92491,0,12,12,91,1,a black object sints on the ground in front of a woman in a brown skirt on a crowded playground,nothing sits on on the ground in front of a woman in a brown skirt on a crowded playground,wolfe1,image-016,2,39,A2NBBQ3DKW5MV3,2021-01-07_08h15.31.536,MetaAwareness,2020.1.2,Win32,60,3FHTJGYT8O301Z4EZ98EFEHH50YPGE,A2NBBQ3DKW5MV3,3OB0CAO74ISBWTPK04RH1OHIDEQYHD,7CBO5,7CBO5,3OB0CAO74ISBWTPK04RH1OHIDEQYHD,3OB0CAO74ISBWTPK04RH1OHIDEQYHD,267715,267715,,,,,,,,,,
,,,,5,8.20734,0,13,13,60,1,a room setting with objects on a low table. there is a small cactus next to a tall cactus.,a room setting with objects on the table. there is only one cactus present.,wolfe1,image-011,3,39,A2NBBQ3DKW5MV3,2021-01-07_08h15.31.536,MetaAwareness,2020.1.2,Win32,60,3FHTJGYT8O301Z4EZ98EFEHH50YPGE,A2NBBQ3DKW5MV3,3OB0CAO74ISBWTPK04RH1OHIDEQYHD,7CBO5,7CBO5,3OB0CAO74ISBWTPK04RH1OHIDEQYHD,3OB0CAO74ISBWTPK04RH1OHIDEQYHD,267715,267715,,,,,,,,,,
,,,,5,6.2044,0,14,14,72,1,a modern looking hammock house with a patch of grass enclosed in concrete in front of it.,a modern looking hammock house near some greenery,wolfe1,image-012,8,39,A2NBBQ3DKW5MV3,2021-01-07_08h15.31.536,MetaAwareness,2020.1.2,Win32,60,3FHTJGYT8O301Z4EZ98EFEHH50YPGE,A2NBBQ3DKW5MV3,3OB0CAO74ISBWTPK04RH1OHIDEQYHD,7CBO5,7CBO5,3OB0CAO74ISBWTPK04RH1OHIDEQYHD,3OB0CAO74ISBWTPK04RH1OHIDEQYHD,267715,267715,,,,,,,,,,
,,,,2,5.34857,0,15,15,377,1,a girl with pink pants exercises with other kids in a gymnasium,a girl with green pants exercises with other kids in a gymnasium ,wolfe1,image-093,4,39,A2NBBQ3DKW5MV3,2021-01-07_08h15.31.536,MetaAwareness,2020.1.2,Win32,60,3FHTJGYT8O301Z4EZ98EFEHH50YPGE,A2NBBQ3DKW5MV3,3OB0CAO74ISBWTPK04RH1OHIDEQYHD,7CBO5,7CBO5,3OB0CAO74ISBWTPK04RH1OHIDEQYHD,3OB0CAO74ISBWTPK04RH1OHIDEQYHD,267715,267715,,,,,,,,,,
,,,,5,7.09402,0,16,16,222,1,"boys play basketball at a house with a two car garage, one side has a light fixture over it",boys play basketball at a house with a two car garage with no lights,wolfe1,image-040,5,39,A2NBBQ3DKW5MV3,2021-01-07_08h15.31.536,MetaAwareness,2020.1.2,Win32,60,3FHTJGYT8O301Z4EZ98EFEHH50YPGE,A2NBBQ3DKW5MV3,3OB0CAO74ISBWTPK04RH1OHIDEQYHD,7CBO5,7CBO5,3OB0CAO74ISBWTPK04RH1OHIDEQYHD,3OB0CAO74ISBWTPK04RH1OHIDEQYHD,267715,267715,,,,,,,,,,
,,,,3,7.29826,0,17,17,248,1,"seven small barns adorn a grassy countryside that rests near a lake, rolling hills, and a large mountain","six small barns adorn a grassy countryside that rests near a lake, rolling hills, and a large mountain",wolfe1,image-044,4,39,A2NBBQ3DKW5MV3,2021-01-07_08h15.31.536,MetaAwareness,2020.1.2,Win32,60,3FHTJGYT8O301Z4EZ98EFEHH50YPGE,A2NBBQ3DKW5MV3,3OB0CAO74ISBWTPK04RH1OHIDEQYHD,7CBO5,7CBO5,3OB0CAO74ISBWTPK04RH1OHIDEQYHD,3OB0CAO74ISBWTPK04RH1OHIDEQYHD,267715,267715,,,,,,,,,,
,,,,3,7.242435,0,18,18,370,1,seniors exercising in a rec room with one lady wearing white shoes.,seniors exercising in a rec room with one lady wearing light purple shoes.,wolfe1,image-092,3,39,A2NBBQ3DKW5MV3,2021-01-07_08h15.31.536,MetaAwareness,2020.1.2,Win32,60,3FHTJGYT8O301Z4EZ98EFEHH50YPGE,A2NBBQ3DKW5MV3,3OB0CAO74ISBWTPK04RH1OHIDEQYHD,7CBO5,7CBO5,3OB0CAO74ISBWTPK04RH1OHIDEQYHD,3OB0CAO74ISBWTPK04RH1OHIDEQYHD,267715,267715,,,,,,,,,,
,,,,4,9.1495,0,19,19,35,1,"a luxurious and modern hotel room that features many appliances, such as a microwave, tv, refridgerator, and more","a luxurios and mdern hotel room that featuresa few appliances, such as a refridgerator, tv, and more",wolfe1,image-006,5,39,A2NBBQ3DKW5MV3,2021-01-07_08h15.31.536,MetaAwareness,2020.1.2,Win32,60,3FHTJGYT8O301Z4EZ98EFEHH50YPGE,A2NBBQ3DKW5MV3,3OB0CAO74ISBWTPK04RH1OHIDEQYHD,7CBO5,7CBO5,3OB0CAO74ISBWTPK04RH1OHIDEQYHD,3OB0CAO74ISBWTPK04RH1OHIDEQYHD,267715,267715,,,,,,,,,,
,,,,4,4.81944,0,20,20,572,1,rock climbing with a boy with blue on,rock climbing with a boy with green on,wolfe1,image-128,1,39,A2NBBQ3DKW5MV3,2021-01-07_08h15.31.536,MetaAwareness,2020.1.2,Win32,60,3FHTJGYT8O301Z4EZ98EFEHH50YPGE,A2NBBQ3DKW5MV3,3OB0CAO74ISBWTPK04RH1OHIDEQYHD,7CBO5,7CBO5,3OB0CAO74ISBWTPK04RH1OHIDEQYHD,3OB0CAO74ISBWTPK04RH1OHIDEQYHD,267715,267715,,,,,,,,,,
,,,,3,5.15575,0,21,21,162,1,bikes sit in front of a building with three front facing windows at the very top of the building,bikes sit in front of a building with two front facing windows at the very top of the building,wolfe1,image-029,2,39,A2NBBQ3DKW5MV3,2021-01-07_08h15.31.536,MetaAwareness,2020.1.2,Win32,60,3FHTJGYT8O301Z4EZ98EFEHH50YPGE,A2NBBQ3DKW5MV3,3OB0CAO74ISBWTPK04RH1OHIDEQYHD,7CBO5,7CBO5,3OB0CAO74ISBWTPK04RH1OHIDEQYHD,3OB0CAO74ISBWTPK04RH1OHIDEQYHD,267715,267715,,,,,,,,,,
,,,,4,7.01146,0,22,22,117,1,there is a group of people at an outside event. there is a man setting in the middle with a bag setting behind him.,there is a group of people at an outside event. there is a man setting watching but there is no bag setting next to him.,wolfe1,image-020,2,39,A2NBBQ3DKW5MV3,2021-01-07_08h15.31.536,MetaAwareness,2020.1.2,Win32,60,3FHTJGYT8O301Z4EZ98EFEHH50YPGE,A2NBBQ3DKW5MV3,3OB0CAO74ISBWTPK04RH1OHIDEQYHD,7CBO5,7CBO5,3OB0CAO74ISBWTPK04RH1OHIDEQYHD,3OB0CAO74ISBWTPK04RH1OHIDEQYHD,267715,267715,,,,,,,,,,
,,,,4,8.740115,0,23,23,19,1,a man sitting on the edge of the dock with a wooden addition chained to it.,"a man sitting on the edge of the dock with a wooden addition chained to it, but by only one chain.",wolfe1,image-004,2,39,A2NBBQ3DKW5MV3,2021-01-07_08h15.31.536,MetaAwareness,2020.1.2,Win32,60,3FHTJGYT8O301Z4EZ98EFEHH50YPGE,A2NBBQ3DKW5MV3,3OB0CAO74ISBWTPK04RH1OHIDEQYHD,7CBO5,7CBO5,3OB0CAO74ISBWTPK04RH1OHIDEQYHD,3OB0CAO74ISBWTPK04RH1OHIDEQYHD,267715,267715,,,,,,,,,,
,,,,3,9.81116,0,24,24,309,1,"a crowded outdoor cafe area, with people standing and sitting, and a green awning","a crowded outdoor cafe area, with people standing and sitting, and a red awning",wolfe1,image-080,2,39,A2NBBQ3DKW5MV3,2021-01-07_08h15.31.536,MetaAwareness,2020.1.2,Win32,60,3FHTJGYT8O301Z4EZ98EFEHH50YPGE,A2NBBQ3DKW5MV3,3OB0CAO74ISBWTPK04RH1OHIDEQYHD,7CBO5,7CBO5,3OB0CAO74ISBWTPK04RH1OHIDEQYHD,3OB0CAO74ISBWTPK04RH1OHIDEQYHD,267715,267715,,,,,,,,,,
,,,,4,5.593815,0,25,25,43,1,"a woman petting a deer in an outdoor setting, in the background is a man dressed in black clothing",a woman petting a deer in an outdoor setting,wolfe1,image-008,2,39,A2NBBQ3DKW5MV3,2021-01-07_08h15.31.536,MetaAwareness,2020.1.2,Win32,60,3FHTJGYT8O301Z4EZ98EFEHH50YPGE,A2NBBQ3DKW5MV3,3OB0CAO74ISBWTPK04RH1OHIDEQYHD,7CBO5,7CBO5,3OB0CAO74ISBWTPK04RH1OHIDEQYHD,3OB0CAO74ISBWTPK04RH1OHIDEQYHD,267715,267715,,,,,,,,,,
,,,,3,5.95992,0,26,26,493,1,a young man walking alone in front of a store with red colored hanging displays,a young man walking alone in front of a store with yellow colored hanging displays,wolfe1,image-113,4,39,A2NBBQ3DKW5MV3,2021-01-07_08h15.31.536,MetaAwareness,2020.1.2,Win32,60,3FHTJGYT8O301Z4EZ98EFEHH50YPGE,A2NBBQ3DKW5MV3,3OB0CAO74ISBWTPK04RH1OHIDEQYHD,7CBO5,7CBO5,3OB0CAO74ISBWTPK04RH1OHIDEQYHD,3OB0CAO74ISBWTPK04RH1OHIDEQYHD,267715,267715,,,,,,,,,,
,,,,3,5.826355,0,27,27,7,1,a yard sale in front of a brick house with clothing and a childs to and a blue dress,a yard sale in front of a brick house with clothing and a childs toy,wolfe1,image-002,2,39,A2NBBQ3DKW5MV3,2021-01-07_08h15.31.536,MetaAwareness,2020.1.2,Win32,60,3FHTJGYT8O301Z4EZ98EFEHH50YPGE,A2NBBQ3DKW5MV3,3OB0CAO74ISBWTPK04RH1OHIDEQYHD,7CBO5,7CBO5,3OB0CAO74ISBWTPK04RH1OHIDEQYHD,3OB0CAO74ISBWTPK04RH1OHIDEQYHD,267715,267715,,,,,,,,,,
,,,,3,7.48728,0,28,28,1,1,dining tables with place settings and a salt shaker and also chairs next to a blue ocean. ,dining tables with place mats and  silverware but lacking salt and pepper overlooking a blue ocean. ,wolfe1,image-001,2,39,A2NBBQ3DKW5MV3,2021-01-07_08h15.31.536,MetaAwareness,2020.1.2,Win32,60,3FHTJGYT8O301Z4EZ98EFEHH50YPGE,A2NBBQ3DKW5MV3,3OB0CAO74ISBWTPK04RH1OHIDEQYHD,7CBO5,7CBO5,3OB0CAO74ISBWTPK04RH1OHIDEQYHD,3OB0CAO74ISBWTPK04RH1OHIDEQYHD,267715,267715,,,,,,,,,,
,,,,3,9.24313,0,29,29,477,1,a group of stores connected together the one on the end has a red sign at the top of it. ,a group of stores connected together the one on the end has a blue sign at the top of it.,wolfe1,image-110,5,39,A2NBBQ3DKW5MV3,2021-01-07_08h15.31.536,MetaAwareness,2020.1.2,Win32,60,3FHTJGYT8O301Z4EZ98EFEHH50YPGE,A2NBBQ3DKW5MV3,3OB0CAO74ISBWTPK04RH1OHIDEQYHD,7CBO5,7CBO5,3OB0CAO74ISBWTPK04RH1OHIDEQYHD,3OB0CAO74ISBWTPK04RH1OHIDEQYHD,267715,267715,,,,,,,,,,
,,,,,,,,,,,,,,,,39,A2NBBQ3DKW5MV3,2021-01-07_08h15.31.536,MetaAwareness,2020.1.2,Win32,60,3FHTJGYT8O301Z4EZ98EFEHH50YPGE,A2NBBQ3DKW5MV3,3OB0CAO74ISBWTPK04RH1OHIDEQYHD,7CBO5,7CBO5,3OB0CAO74ISBWTPK04RH1OHIDEQYHD,3OB0CAO74ISBWTPK04RH1OHIDEQYHD,267715,267715,6,9.323505,someone laying underneath a blue beach umbrella on a crowded beach,someone laying underneath a blue beach umbrella on a crowded beach,same,3,4.90195,members of a marching band crossing a track that all have feather plumes at the front of their hats,a cluttered and rustic looking cafe with 10 hanging lights,different