consent_response.keys,consent_response.rt,key_resp_2.keys,key_resp_2.rt,user_resp.keys,user_resp.rt,trials.thisRepN,trials.thisTrialN,trials.thisN,trials.thisIndex,trials.ran,image_1_text,image_2_text,database,image,number,age,worker_ID,date,expName,psychopyVersion,OS,frameRate,hitId,workerId,assignmentId,a,tp_a,b,tp_b,c,tp_c,catch_same_resp.keys,catch_same_resp.rt,image_1_text_catch_same,image_2_text_catch_same,image_catch_same,catch_different_resp.keys,catch_different_resp.rt,image_1_text_catch_different,image_2_text_catch_different,image_catch_different
space,5.184045,space,19.65017,5,11.162405,0,0,0,273,1,a group of boys relax in the grass in front of a stone by a building,a group of boys relax in the grass by a building,wolfe1,image-048,4,29,AZEXDBAF8D8W7,2021-01-07_10h14.24.939,MetaAwareness,2020.1.2,Win32,60,336OE47KI3N935RA0QLV79SNLCSWV8,AZEXDBAF8D8W7,3TDXMTX3CCX994QY03EAI9Y4EHL6IN,3MDT5,3MDT5,3TDXMTX3CCX994QY03EAI9Y4EHL6IN,3TDXMTX3CCX994QY03EAI9Y4EHL6IN,267715,267715,,,,,,,,,,
,,,,4,4.634915,0,1,1,518,1,people are gathered at an outdoor market filled with various fruits and vegetables. one of the awnings covering the stalls is blue,people are gathered at an outdoor market filled with various fruits and vegetables. one of the awnings covering the stalls is red.,wolfe1,image-117,7,29,AZEXDBAF8D8W7,2021-01-07_10h14.24.939,MetaAwareness,2020.1.2,Win32,60,336OE47KI3N935RA0QLV79SNLCSWV8,AZEXDBAF8D8W7,3TDXMTX3CCX994QY03EAI9Y4EHL6IN,3MDT5,3MDT5,3TDXMTX3CCX994QY03EAI9Y4EHL6IN,3TDXMTX3CCX994QY03EAI9Y4EHL6IN,267715,267715,,,,,,,,,,
,,,,3,7.621085,0,2,2,108,1,crowds are being in the beach and something placed in the yellow box,crowds are being in the beach and no one placed in the yellow box,wolfe1,image-018,5,29,AZEXDBAF8D8W7,2021-01-07_10h14.24.939,MetaAwareness,2020.1.2,Win32,60,336OE47KI3N935RA0QLV79SNLCSWV8,AZEXDBAF8D8W7,3TDXMTX3CCX994QY03EAI9Y4EHL6IN,3MDT5,3MDT5,3TDXMTX3CCX994QY03EAI9Y4EHL6IN,3TDXMTX3CCX994QY03EAI9Y4EHL6IN,267715,267715,,,,,,,,,,
,,,,6,5.884775,0,3,3,536,1,there are some purple and black color cloths on the boat,there are some green and black color cloths on the boat ,wolfe1,image-121,4,29,AZEXDBAF8D8W7,2021-01-07_10h14.24.939,MetaAwareness,2020.1.2,Win32,60,336OE47KI3N935RA0QLV79SNLCSWV8,AZEXDBAF8D8W7,3TDXMTX3CCX994QY03EAI9Y4EHL6IN,3MDT5,3MDT5,3TDXMTX3CCX994QY03EAI9Y4EHL6IN,3TDXMTX3CCX994QY03EAI9Y4EHL6IN,267715,267715,,,,,,,,,,
,,,,6,8.817535,0,4,4,59,1,a large room with table and a box plant and a chair off to the side.,a large room with table that doesn't have plant and has a chair and picture.,wolfe1,image-011,2,29,AZEXDBAF8D8W7,2021-01-07_10h14.24.939,MetaAwareness,2020.1.2,Win32,60,336OE47KI3N935RA0QLV79SNLCSWV8,AZEXDBAF8D8W7,3TDXMTX3CCX994QY03EAI9Y4EHL6IN,3MDT5,3MDT5,3TDXMTX3CCX994QY03EAI9Y4EHL6IN,3TDXMTX3CCX994QY03EAI9Y4EHL6IN,267715,267715,,,,,,,,,,
,,,,3,3.569455,0,5,5,101,1,a group of men are watching a man hit a golf ball in the marked hole.,a group of men are watching a man hit a golf ball in an unmarked hole.,wolfe1,image-017,7,29,AZEXDBAF8D8W7,2021-01-07_10h14.24.939,MetaAwareness,2020.1.2,Win32,60,336OE47KI3N935RA0QLV79SNLCSWV8,AZEXDBAF8D8W7,3TDXMTX3CCX994QY03EAI9Y4EHL6IN,3MDT5,3MDT5,3TDXMTX3CCX994QY03EAI9Y4EHL6IN,3TDXMTX3CCX994QY03EAI9Y4EHL6IN,267715,267715,,,,,,,,,,
,,,,3,5.55134,0,6,6,570,1,"a group of people attempt to remove snow from a car, one of whom is holding a blue shovel","a group of people attempt to remove snow from a car, one of whom is holding a green shovel",wolfe1,image-127,4,29,AZEXDBAF8D8W7,2021-01-07_10h14.24.939,MetaAwareness,2020.1.2,Win32,60,336OE47KI3N935RA0QLV79SNLCSWV8,AZEXDBAF8D8W7,3TDXMTX3CCX994QY03EAI9Y4EHL6IN,3MDT5,3MDT5,3TDXMTX3CCX994QY03EAI9Y4EHL6IN,3TDXMTX3CCX994QY03EAI9Y4EHL6IN,267715,267715,,,,,,,,,,
,,,,6,6.189525,0,7,7,615,1, people walking on a boardwalk with a woman wearing a red shirt,people walking on a boardwalk with a woman wearing a blue shirt,wolfe1,image-134,3,29,AZEXDBAF8D8W7,2021-01-07_10h14.24.939,MetaAwareness,2020.1.2,Win32,60,336OE47KI3N935RA0QLV79SNLCSWV8,AZEXDBAF8D8W7,3TDXMTX3CCX994QY03EAI9Y4EHL6IN,3MDT5,3MDT5,3TDXMTX3CCX994QY03EAI9Y4EHL6IN,3TDXMTX3CCX994QY03EAI9Y4EHL6IN,267715,267715,,,,,,,,,,
,,,,6,8.45155,0,8,8,401,1,a man is leading a music class with a blue cooler bag underneath the table behind him,a man is leading a music class with a green cooler bag underneath the table behind him,wolfe1,image-096,5,29,AZEXDBAF8D8W7,2021-01-07_10h14.24.939,MetaAwareness,2020.1.2,Win32,60,336OE47KI3N935RA0QLV79SNLCSWV8,AZEXDBAF8D8W7,3TDXMTX3CCX994QY03EAI9Y4EHL6IN,3MDT5,3MDT5,3TDXMTX3CCX994QY03EAI9Y4EHL6IN,3TDXMTX3CCX994QY03EAI9Y4EHL6IN,267715,267715,,,,,,,,,,
,,,,6,9.25819,0,9,9,534,1,"a boat on a lake, with mountains visible in the background, with red devices on the side of the boat","a boat on a lake, with mountains visible in the background, with red and green devices on the side of the boat",wolfe1,image-121,2,29,AZEXDBAF8D8W7,2021-01-07_10h14.24.939,MetaAwareness,2020.1.2,Win32,60,336OE47KI3N935RA0QLV79SNLCSWV8,AZEXDBAF8D8W7,3TDXMTX3CCX994QY03EAI9Y4EHL6IN,3MDT5,3MDT5,3TDXMTX3CCX994QY03EAI9Y4EHL6IN,3TDXMTX3CCX994QY03EAI9Y4EHL6IN,267715,267715,,,,,,,,,,
,,,,6,4.36639,0,10,10,488,1,a man in a red shirt walks down a street with a crowd of many people.,a man in a blue shirt walks down a street with a crowd of many people.,wolfe1,image-112,3,29,AZEXDBAF8D8W7,2021-01-07_10h14.24.939,MetaAwareness,2020.1.2,Win32,60,336OE47KI3N935RA0QLV79SNLCSWV8,AZEXDBAF8D8W7,3TDXMTX3CCX994QY03EAI9Y4EHL6IN,3MDT5,3MDT5,3TDXMTX3CCX994QY03EAI9Y4EHL6IN,3TDXMTX3CCX994QY03EAI9Y4EHL6IN,267715,267715,,,,,,,,,,
,,,,4,5.79971,0,11,11,453,1,a yellow pillow sits next to many other multi-colored pillows on a tiered area of a room,a light green pillow sits next to many other colored pillows on a tiered area of a room,wolfe1,image-106,4,29,AZEXDBAF8D8W7,2021-01-07_10h14.24.939,MetaAwareness,2020.1.2,Win32,60,336OE47KI3N935RA0QLV79SNLCSWV8,AZEXDBAF8D8W7,3TDXMTX3CCX994QY03EAI9Y4EHL6IN,3MDT5,3MDT5,3TDXMTX3CCX994QY03EAI9Y4EHL6IN,3TDXMTX3CCX994QY03EAI9Y4EHL6IN,267715,267715,,,,,,,,,,
,,,,4,4.56861,0,12,12,538,1,a long boat with red fabrics along its side sits in a beautiful lake setting ready to be utilized,a long boat with red and green fabrics along its side sits in a beautiful lake setting ready to be utilized,wolfe1,image-121,6,29,AZEXDBAF8D8W7,2021-01-07_10h14.24.939,MetaAwareness,2020.1.2,Win32,60,336OE47KI3N935RA0QLV79SNLCSWV8,AZEXDBAF8D8W7,3TDXMTX3CCX994QY03EAI9Y4EHL6IN,3MDT5,3MDT5,3TDXMTX3CCX994QY03EAI9Y4EHL6IN,3TDXMTX3CCX994QY03EAI9Y4EHL6IN,267715,267715,,,,,,,,,,
,,,,5,5.961355,0,13,13,3,1,a table is set with salt in a seaside dining area  ,a table with no food on it is set in a seaside dining area,wolfe1,image-001,4,29,AZEXDBAF8D8W7,2021-01-07_10h14.24.939,MetaAwareness,2020.1.2,Win32,60,336OE47KI3N935RA0QLV79SNLCSWV8,AZEXDBAF8D8W7,3TDXMTX3CCX994QY03EAI9Y4EHL6IN,3MDT5,3MDT5,3TDXMTX3CCX994QY03EAI9Y4EHL6IN,3TDXMTX3CCX994QY03EAI9Y4EHL6IN,267715,267715,,,,,,,,,,
,,,,5,3.576985,0,14,14,145,1,a line up of vendors under tents with two trees behind them ,a line up of vendors under tents with one tree behind them,wolfe1,image-025,4,29,AZEXDBAF8D8W7,2021-01-07_10h14.24.939,MetaAwareness,2020.1.2,Win32,60,336OE47KI3N935RA0QLV79SNLCSWV8,AZEXDBAF8D8W7,3TDXMTX3CCX994QY03EAI9Y4EHL6IN,3MDT5,3MDT5,3TDXMTX3CCX994QY03EAI9Y4EHL6IN,3TDXMTX3CCX994QY03EAI9Y4EHL6IN,267715,267715,,,,,,,,,,
,,,,6,7.1829,0,15,15,160,1,there is an object behind the person sitting in the center of the photo,there is more grass behind the person sitting in the center of the photo,wolfe1,image-028,5,29,AZEXDBAF8D8W7,2021-01-07_10h14.24.939,MetaAwareness,2020.1.2,Win32,60,336OE47KI3N935RA0QLV79SNLCSWV8,AZEXDBAF8D8W7,3TDXMTX3CCX994QY03EAI9Y4EHL6IN,3MDT5,3MDT5,3TDXMTX3CCX994QY03EAI9Y4EHL6IN,3TDXMTX3CCX994QY03EAI9Y4EHL6IN,267715,267715,,,,,,,,,,
,,,,5,5.66676,0,16,16,438,1,a office meetins with a coworker on the left wearing a blue shirt ,a office meeting with a coworker on the right wearing a green shirt,wolfe1,image-104,3,29,AZEXDBAF8D8W7,2021-01-07_10h14.24.939,MetaAwareness,2020.1.2,Win32,60,336OE47KI3N935RA0QLV79SNLCSWV8,AZEXDBAF8D8W7,3TDXMTX3CCX994QY03EAI9Y4EHL6IN,3MDT5,3MDT5,3TDXMTX3CCX994QY03EAI9Y4EHL6IN,3TDXMTX3CCX994QY03EAI9Y4EHL6IN,267715,267715,,,,,,,,,,
,,,,6,2.651605,0,17,17,300,1,group of people and man in blue shirt,group of people and man in green shirt,wolfe1,image-078,4,29,AZEXDBAF8D8W7,2021-01-07_10h14.24.939,MetaAwareness,2020.1.2,Win32,60,336OE47KI3N935RA0QLV79SNLCSWV8,AZEXDBAF8D8W7,3TDXMTX3CCX994QY03EAI9Y4EHL6IN,3MDT5,3MDT5,3TDXMTX3CCX994QY03EAI9Y4EHL6IN,3TDXMTX3CCX994QY03EAI9Y4EHL6IN,267715,267715,,,,,,,,,,
,,,,6,4.908855,0,18,18,607,1,an outdoor lounge area with a brown surfboard leaning against the building,an outdoor lounge area with a green surfboard leaning against the building,wolfe1,image-133,3,29,AZEXDBAF8D8W7,2021-01-07_10h14.24.939,MetaAwareness,2020.1.2,Win32,60,336OE47KI3N935RA0QLV79SNLCSWV8,AZEXDBAF8D8W7,3TDXMTX3CCX994QY03EAI9Y4EHL6IN,3MDT5,3MDT5,3TDXMTX3CCX994QY03EAI9Y4EHL6IN,3TDXMTX3CCX994QY03EAI9Y4EHL6IN,267715,267715,,,,,,,,,,
,,,,5,3.40023,0,19,19,143,1,tree next to tents,people walking through tents,wolfe1,image-025,2,29,AZEXDBAF8D8W7,2021-01-07_10h14.24.939,MetaAwareness,2020.1.2,Win32,60,336OE47KI3N935RA0QLV79SNLCSWV8,AZEXDBAF8D8W7,3TDXMTX3CCX994QY03EAI9Y4EHL6IN,3MDT5,3MDT5,3TDXMTX3CCX994QY03EAI9Y4EHL6IN,3TDXMTX3CCX994QY03EAI9Y4EHL6IN,267715,267715,,,,,,,,,,
,,,,4,3.702905,0,20,20,176,1,people feeding a large group of pigeons while 3 stand by a young boy,people feeding a large group of pigeons,wolfe1,image-032,1,29,AZEXDBAF8D8W7,2021-01-07_10h14.24.939,MetaAwareness,2020.1.2,Win32,60,336OE47KI3N935RA0QLV79SNLCSWV8,AZEXDBAF8D8W7,3TDXMTX3CCX994QY03EAI9Y4EHL6IN,3MDT5,3MDT5,3TDXMTX3CCX994QY03EAI9Y4EHL6IN,3TDXMTX3CCX994QY03EAI9Y4EHL6IN,267715,267715,,,,,,,,,,
,,,,4,6.515265,0,21,21,194,1,the rock can help the path,there is a rock missing,wolfe1,image-034,5,29,AZEXDBAF8D8W7,2021-01-07_10h14.24.939,MetaAwareness,2020.1.2,Win32,60,336OE47KI3N935RA0QLV79SNLCSWV8,AZEXDBAF8D8W7,3TDXMTX3CCX994QY03EAI9Y4EHL6IN,3MDT5,3MDT5,3TDXMTX3CCX994QY03EAI9Y4EHL6IN,3TDXMTX3CCX994QY03EAI9Y4EHL6IN,267715,267715,,,,,,,,,,
,,,,4,0.58642,0,22,22,337,1,at an outdoor restaurant near the beach a man in a purple hat looks out towards the ocean. ,at an outdoor restaurant near the beach a man in a green hat looks out towards the ocean. ,wolfe1,image-085,2,29,AZEXDBAF8D8W7,2021-01-07_10h14.24.939,MetaAwareness,2020.1.2,Win32,60,336OE47KI3N935RA0QLV79SNLCSWV8,AZEXDBAF8D8W7,3TDXMTX3CCX994QY03EAI9Y4EHL6IN,3MDT5,3MDT5,3TDXMTX3CCX994QY03EAI9Y4EHL6IN,3TDXMTX3CCX994QY03EAI9Y4EHL6IN,267715,267715,,,,,,,,,,
,,,,3,3.070375,0,23,23,359,1,"there is an orange room with black seats. in the seats are 5 young men. one of the people in the photo is wearing a blue, grey, and white t-shirt","there is an orange room with black seats. in teh seats are 5 young men. one of men in the photo is wearing a purple, grey, and white t-shirt.",wolfe1,image-089,6,29,AZEXDBAF8D8W7,2021-01-07_10h14.24.939,MetaAwareness,2020.1.2,Win32,60,336OE47KI3N935RA0QLV79SNLCSWV8,AZEXDBAF8D8W7,3TDXMTX3CCX994QY03EAI9Y4EHL6IN,3MDT5,3MDT5,3TDXMTX3CCX994QY03EAI9Y4EHL6IN,3TDXMTX3CCX994QY03EAI9Y4EHL6IN,267715,267715,,,,,,,,,,
,,,,5,2.594975,0,24,24,499,1,three men pose for a picture with a blue wooden structure behind them,three men pose for a picture with a yellow wooden structure behind them,wolfe1,image-114,3,29,AZEXDBAF8D8W7,2021-01-07_10h14.24.939,MetaAwareness,2020.1.2,Win32,60,336OE47KI3N935RA0QLV79SNLCSWV8,AZEXDBAF8D8W7,3TDXMTX3CCX994QY03EAI9Y4EHL6IN,3MDT5,3MDT5,3TDXMTX3CCX994QY03EAI9Y4EHL6IN,3TDXMTX3CCX994QY03EAI9Y4EHL6IN,267715,267715,,,,,,,,,,
,,,,3,1.621325,0,25,25,479,1,"a downtown city street with shops and stores, one of which is under a red awning","a downtown city street with shops and stores, one of which is under a blue awning",wolfe1,image-110,7,29,AZEXDBAF8D8W7,2021-01-07_10h14.24.939,MetaAwareness,2020.1.2,Win32,60,336OE47KI3N935RA0QLV79SNLCSWV8,AZEXDBAF8D8W7,3TDXMTX3CCX994QY03EAI9Y4EHL6IN,3MDT5,3MDT5,3TDXMTX3CCX994QY03EAI9Y4EHL6IN,3TDXMTX3CCX994QY03EAI9Y4EHL6IN,267715,267715,,,,,,,,,,
,,,,6,3.78498,0,26,26,383,1,a man and a woman walking on a campus. the man is carrying a skateboard and a bottle of water. the woman is carrying a backpack with a blue logo,a man and a woman walking on a campus. the man is carrying a skateboard and a bottle of water. the woman is carrying a backpack with a green logo.,wolfe1,image-094,4,29,AZEXDBAF8D8W7,2021-01-07_10h14.24.939,MetaAwareness,2020.1.2,Win32,60,336OE47KI3N935RA0QLV79SNLCSWV8,AZEXDBAF8D8W7,3TDXMTX3CCX994QY03EAI9Y4EHL6IN,3MDT5,3MDT5,3TDXMTX3CCX994QY03EAI9Y4EHL6IN,3TDXMTX3CCX994QY03EAI9Y4EHL6IN,267715,267715,,,,,,,,,,
,,,,4,3.235255,0,27,27,379,1,several kids learning a dance in a school gym. a girl close to the front has on pink pants,several kids leanring a dance in a school gym. a girl close to the front has on green pants,wolfe1,image-093,6,29,AZEXDBAF8D8W7,2021-01-07_10h14.24.939,MetaAwareness,2020.1.2,Win32,60,336OE47KI3N935RA0QLV79SNLCSWV8,AZEXDBAF8D8W7,3TDXMTX3CCX994QY03EAI9Y4EHL6IN,3MDT5,3MDT5,3TDXMTX3CCX994QY03EAI9Y4EHL6IN,3TDXMTX3CCX994QY03EAI9Y4EHL6IN,267715,267715,,,,,,,,,,
,,,,5,4.239795,0,28,28,20,1,"a person is sitting on a dock, next to a chain, fishing.",a person is sitting on a dock fishing,wolfe1,image-004,3,29,AZEXDBAF8D8W7,2021-01-07_10h14.24.939,MetaAwareness,2020.1.2,Win32,60,336OE47KI3N935RA0QLV79SNLCSWV8,AZEXDBAF8D8W7,3TDXMTX3CCX994QY03EAI9Y4EHL6IN,3MDT5,3MDT5,3TDXMTX3CCX994QY03EAI9Y4EHL6IN,3TDXMTX3CCX994QY03EAI9Y4EHL6IN,267715,267715,,,,,,,,,,
,,,,5,6.448245,0,29,29,185,1,men playing basketball in front of a crowd with a blue awning in the top left corner. ,men playing basketball in front of a crowd with no awning visible.,wolfe1,image-033,3,29,AZEXDBAF8D8W7,2021-01-07_10h14.24.939,MetaAwareness,2020.1.2,Win32,60,336OE47KI3N935RA0QLV79SNLCSWV8,AZEXDBAF8D8W7,3TDXMTX3CCX994QY03EAI9Y4EHL6IN,3MDT5,3MDT5,3TDXMTX3CCX994QY03EAI9Y4EHL6IN,3TDXMTX3CCX994QY03EAI9Y4EHL6IN,267715,267715,,,,,,,,,,
,,,,,,,,,,,,,,,,29,AZEXDBAF8D8W7,2021-01-07_10h14.24.939,MetaAwareness,2020.1.2,Win32,60,336OE47KI3N935RA0QLV79SNLCSWV8,AZEXDBAF8D8W7,3TDXMTX3CCX994QY03EAI9Y4EHL6IN,3MDT5,3MDT5,3TDXMTX3CCX994QY03EAI9Y4EHL6IN,3TDXMTX3CCX994QY03EAI9Y4EHL6IN,267715,267715,6,7.83527,someone laying underneath a blue beach umbrella on a crowded beach,someone laying underneath a blue beach umbrella on a crowded beach,same,3,3.24326,members of a marching band crossing a track that all have feather plumes at the front of their hats,a cluttered and rustic looking cafe with 10 hanging lights,different