start_time,opening_start_time,opening_end_time,consent_start_time,consent_response_keys,consent_response_rt,consent_end_time,instructions_1_start_time,key_resp_2_keys,key_resp_2_rt,instructions_1_end_time,Example_1_start_time,Example_1_resp_keys,Example_1_response_keys,Example_1_response_rt,Example_1_end_time,Example_1_a_text,Example_1_b_text,Example_1_mouse_x,Example_1_mouse_y,Example_1_mouse_leftButton,Example_1_mouse_midButton,Example_1_mouse_rightButton,Example_2_start_time,Example_2_resp_keys,Example_2_response_keys,Example_2_response_rt,Example_2_end_time,Example_2_a_text,Example_2_b_text,Example_2_mouse_x,Example_2_mouse_y,Example_2_mouse_leftButton,Example_2_mouse_midButton,Example_2_mouse_rightButton,Example_3_start_time,Example_3_resp_keys,Example_3_response_keys,Example_3_response_rt,Example_3_end_time,Example_3_a_text,Example_3_b_text,Example_3_mouse_x,Example_3_mouse_y,Example_3_mouse_leftButton,Example_3_mouse_midButton,Example_3_mouse_rightButton,instructions_2_start_time,Start_resp_2_keys,Start_resp_2_rt,instructions_2_end_time,trial_start_time,user_resp_keys,trial_response_keys,trial_response_rt,trial_end_time,image_1_text,image_2_text,trial_mouse_x,trial_mouse_y,trial_mouse_leftButton,trial_mouse_midButton,trial_mouse_rightButton,trials.thisRepN,trials.thisTrialN,trials.thisN,trials.thisIndex,trials.ran,workerId,trial_num,image_a,image_b,age,worker_ID,date,expName,psychopyVersion,OS,frameRate,hitId,assignmentId,a,tp_a,b,tp_b,c,tp_c,Cow_start_time,Cow_resp_keys,Cow_response_keys,Cow_response_rt,Cow_end_time,Cow_a_text,Cow_b_text,Cow_mouse_x,Cow_mouse_y,Cow_mouse_leftButton,Cow_mouse_midButton,Cow_mouse_rightButton,Airplane_start_time,Airplane_resp_keys,Airplane_response_keys,Airplane_response_rt,Airplane_end_time,Airplane_a_text,Airplane_b_text,Airplane_mouse_x,Airplane_mouse_y,Airplane_mouse_leftButton,Airplane_mouse_midButton,Airplane_mouse_rightButton
14:17:51:64,14:18:1:308,14:18:16:226,14:18:16:230,space,13.415355,14:18:29:755,14:18:29:762,space,24.84361,14:18:54:632,14:18:55:648,,space,21.04837,14:19:16:743,members of a marching band crossing a track that all have feather plumes at the front of their hats,members of a marching band crossing a track with one player who has their feather plume at the back of their hat,-0.022135417,-0.3671875,0,0,0,14:19:17:759,,space,13.812595,14:19:31:606,a cluttered and rustic looking cafe with 10 hanging lights,a cluttered and rustic looking cafe with 9 hanging lights,-0.022135417,-0.3671875,0,0,0,14:19:32:621,,space,8.36626,14:19:41:19,someone laying underneath a blue beach umbrella on a crowded beach,someone laying underneath a purple beach umbrella on a crowded beach,-0.022135417,-0.3671875,0,0,0,14:19:42:39,return,6.59495,14:19:48:652,14:19:49:668,,return,72.65313,14:21:2:352,a cream colored couch being lit up by several can lights in a living room,"a cream colored couch being lit up by several can lights in a living room, there is a ceiling fan installed to help with air movement.",0.243489583,-0.2734375,0,0,0,0,0,0,3,1,A2XS49LRNX8PD4,77,wolfe_039_L_ventilator-a_w_outline.jpg,wolfe_039_L_ventilator-b_w_outline.jpg,31,A2XS49LRNX8PD4,2021-01-10_14h18.01.103,MetaAwareness,2020.1.2,Win32,60,3UXQ63NLABPEJXH5RVNTXMH0KGSBLE,37Q970SNZFB3WWSXZ9W7RFDAGEU1SK,N7Q76,N7Q76,37Q970SNZFB3WWSXZ9W7RFDAGEU1SK,37Q970SNZFB3WWSXZ9W7RFDAGEU1SK,268166,268166,,,,,,,,,,,,,,,,,,,,,,,,
,,,,,,,,,,,,,,,,,,,,,,,,,,,,,,,,,,,,,,,,,,,,,,,,,,,14:21:3:366,,return,33.391545,14:21:36:780,a tidy kitchen with a bowl that looks like it should be holding something,a tidy kitchen with a bowl of fruit on the counter,0.247395833,-0.244791667,0,0,0,0,1,1,4,1,A2XS49LRNX8PD4,81,wolfe_041_L_fruit-a_w_outline.jpg,wolfe_041_L_fruit-b_w_outline.jpg,31,A2XS49LRNX8PD4,2021-01-10_14h18.01.103,MetaAwareness,2020.1.2,Win32,60,3UXQ63NLABPEJXH5RVNTXMH0KGSBLE,37Q970SNZFB3WWSXZ9W7RFDAGEU1SK,N7Q76,N7Q76,37Q970SNZFB3WWSXZ9W7RFDAGEU1SK,37Q970SNZFB3WWSXZ9W7RFDAGEU1SK,268166,268166,,,,,,,,,,,,,,,,,,,,,,,,
,,,,,,,,,,,,,,,,,,,,,,,,,,,,,,,,,,,,,,,,,,,,,,,,,,,14:21:37:791,,return,70.41634,14:22:48:241,"a gorgeous open concept house that shows the kitchen flowing into the living room, their is a plant in front of the kitchen window","a gorgeous open concept house that shows the kitchen flowing into the living room, it appears that there is a perfect window for a plant in the kitchen",0.290364583,-0.307291667,0,0,0,0,2,2,9,1,A2XS49LRNX8PD4,229,wolfe_115_L_pot-a_w_outline.jpg,wolfe_115_L_pot-b_w_outline.jpg,31,A2XS49LRNX8PD4,2021-01-10_14h18.01.103,MetaAwareness,2020.1.2,Win32,60,3UXQ63NLABPEJXH5RVNTXMH0KGSBLE,37Q970SNZFB3WWSXZ9W7RFDAGEU1SK,N7Q76,N7Q76,37Q970SNZFB3WWSXZ9W7RFDAGEU1SK,37Q970SNZFB3WWSXZ9W7RFDAGEU1SK,268166,268166,,,,,,,,,,,,,,,,,,,,,,,,
,,,,,,,,,,,,,,,,,,,,,,,,,,,,,,,,,,,,,,,,,,,,,,,,,,,14:22:49:255,,return,39.441465,14:23:28:718,a very modern looking living room with a black accent wall,a very modern looking living room with a white vase set against a black accent wall,0.171875,-0.26953125,0,0,0,0,3,3,6,1,A2XS49LRNX8PD4,131,wolfe_066_L_vase-a_w_outline.jpg,wolfe_066_L_vase-b_w_outline.jpg,31,A2XS49LRNX8PD4,2021-01-10_14h18.01.103,MetaAwareness,2020.1.2,Win32,60,3UXQ63NLABPEJXH5RVNTXMH0KGSBLE,37Q970SNZFB3WWSXZ9W7RFDAGEU1SK,N7Q76,N7Q76,37Q970SNZFB3WWSXZ9W7RFDAGEU1SK,37Q970SNZFB3WWSXZ9W7RFDAGEU1SK,268166,268166,,,,,,,,,,,,,,,,,,,,,,,,
,,,,,,,,,,,,,,,,,,,,,,,,,,,,,,,,,,,,,,,,,,,,,,,,,,,14:23:29:729,,return,42.81936,14:24:12:573,a depicition of a home office with a yellow desk with very little on it,a picture of a home office with a keyboard on a yellow desk,0.287760417,-0.298177083,0,0,0,0,4,4,1,1,A2XS49LRNX8PD4,41,wolfe_021_L_keyboard-a_w_outline.jpg,wolfe_021_L_keyboard-b_w_outline.jpg,31,A2XS49LRNX8PD4,2021-01-10_14h18.01.103,MetaAwareness,2020.1.2,Win32,60,3UXQ63NLABPEJXH5RVNTXMH0KGSBLE,37Q970SNZFB3WWSXZ9W7RFDAGEU1SK,N7Q76,N7Q76,37Q970SNZFB3WWSXZ9W7RFDAGEU1SK,37Q970SNZFB3WWSXZ9W7RFDAGEU1SK,268166,268166,,,,,,,,,,,,,,,,,,,,,,,,
,,,,,,,,,,,,,,,,,,,,,,,,,,,,,,,,,,,,,,,,,,,,,,,,,,,14:24:13:584,,return,37.175955,14:24:50:791,a living room with a brown table with a bird looking figurine on the table,a living room with a brown wood table with books and vases on the table,0.40625,-0.279947917,0,0,0,0,5,5,8,1,A2XS49LRNX8PD4,227,wolfe_114_L_bird-a_w_outline.jpg,wolfe_114_L_bird-b_w_outline.jpg,31,A2XS49LRNX8PD4,2021-01-10_14h18.01.103,MetaAwareness,2020.1.2,Win32,60,3UXQ63NLABPEJXH5RVNTXMH0KGSBLE,37Q970SNZFB3WWSXZ9W7RFDAGEU1SK,N7Q76,N7Q76,37Q970SNZFB3WWSXZ9W7RFDAGEU1SK,37Q970SNZFB3WWSXZ9W7RFDAGEU1SK,268166,268166,,,,,,,,,,,,,,,,,,,,,,,,
,,,,,,,,,,,,,,,,,,,,,,,,,,,,,,,,,,,,,,,,,,,,,,,,,,,14:24:51:806,,return,21.771875,14:25:13:600,a childs room with a red shelf that has nothing on it,a childs room with a red shelf that has a white car on the shelf,0.315104167,-0.30078125,0,0,0,0,6,6,5,1,A2XS49LRNX8PD4,117,wolfe_059_L_car-a_w_outline.jpg,wolfe_059_L_car-b_w_outline.jpg,31,A2XS49LRNX8PD4,2021-01-10_14h18.01.103,MetaAwareness,2020.1.2,Win32,60,3UXQ63NLABPEJXH5RVNTXMH0KGSBLE,37Q970SNZFB3WWSXZ9W7RFDAGEU1SK,N7Q76,N7Q76,37Q970SNZFB3WWSXZ9W7RFDAGEU1SK,37Q970SNZFB3WWSXZ9W7RFDAGEU1SK,268166,268166,,,,,,,,,,,,,,,,,,,,,,,,
,,,,,,,,,,,,,,,,,,,,,,,,,,,,,,,,,,,,,,,,,,,,,,,,,,,14:25:14:617,,return,37.00617,14:25:51:658,a picture of a bedroom that has a white night stand with a lamp and car on it,a bedroom that has a white night stand with a lamp on it,0.282552083,-0.263020833,0,0,0,0,7,7,10,1,A2XS49LRNX8PD4,241,wolfe_121_L_car-a_w_outline.jpg,wolfe_121_L_car-b_w_outline.jpg,31,A2XS49LRNX8PD4,2021-01-10_14h18.01.103,MetaAwareness,2020.1.2,Win32,60,3UXQ63NLABPEJXH5RVNTXMH0KGSBLE,37Q970SNZFB3WWSXZ9W7RFDAGEU1SK,N7Q76,N7Q76,37Q970SNZFB3WWSXZ9W7RFDAGEU1SK,37Q970SNZFB3WWSXZ9W7RFDAGEU1SK,268166,268166,,,,,,,,,,,,,,,,,,,,,,,,
,,,,,,,,,,,,,,,,,,,,,,,,,,,,,,,,,,,,,,,,,,,,,,,,,,,14:25:52:674,,return,46.71455,14:26:39:413,a living room that has a fireplace looking thing that has candles on the shelf that are red,a living room that has a fireplace looking mantle that has white candles on the shelf,0.201822917,-0.274739583,0,0,0,0,8,8,7,1,A2XS49LRNX8PD4,189,wolfe_095_L_candle-a_w_outline.jpg,wolfe_095_L_candle-b_w_outline.jpg,31,A2XS49LRNX8PD4,2021-01-10_14h18.01.103,MetaAwareness,2020.1.2,Win32,60,3UXQ63NLABPEJXH5RVNTXMH0KGSBLE,37Q970SNZFB3WWSXZ9W7RFDAGEU1SK,N7Q76,N7Q76,37Q970SNZFB3WWSXZ9W7RFDAGEU1SK,37Q970SNZFB3WWSXZ9W7RFDAGEU1SK,268166,268166,,,,,,,,,,,,,,,,,,,,,,,,
,,,,,,,,,,,,,,,,,,,,,,,,,,,,,,,,,,,,,,,,,,,,,,,,,,,14:26:40:428,,return,36.8291,14:27:17:286,a bathroom that has a window with white blinds with what appears to be glass cleaner on the ledge,a bathroom that has a window with white blinds and there are 2 bottles on the window ledge,0.35546875,-0.2578125,0,0,0,0,9,9,0,1,A2XS49LRNX8PD4,15,wolfe_008_L_bottle-a_w_outline.jpg,wolfe_008_L_bottle-b_w_outline.jpg,31,A2XS49LRNX8PD4,2021-01-10_14h18.01.103,MetaAwareness,2020.1.2,Win32,60,3UXQ63NLABPEJXH5RVNTXMH0KGSBLE,37Q970SNZFB3WWSXZ9W7RFDAGEU1SK,N7Q76,N7Q76,37Q970SNZFB3WWSXZ9W7RFDAGEU1SK,37Q970SNZFB3WWSXZ9W7RFDAGEU1SK,268166,268166,,,,,,,,,,,,,,,,,,,,,,,,
,,,,,,,,,,,,,,,,,,,,,,,,,,,,,,,,,,,,,,,,,,,,,,,,,,,14:27:18:302,,return,42.510435,14:28:0:842,a hope office that has a white desk with a flower in a pot on the desk,a home office with a white desk with a printer and a laptop on it,0.201822917,-0.27734375,0,0,0,0,10,10,11,1,A2XS49LRNX8PD4,255,wolfe_128_L_pot-a_w_outline.jpg,wolfe_128_L_pot-b_w_outline.jpg,31,A2XS49LRNX8PD4,2021-01-10_14h18.01.103,MetaAwareness,2020.1.2,Win32,60,3UXQ63NLABPEJXH5RVNTXMH0KGSBLE,37Q970SNZFB3WWSXZ9W7RFDAGEU1SK,N7Q76,N7Q76,37Q970SNZFB3WWSXZ9W7RFDAGEU1SK,37Q970SNZFB3WWSXZ9W7RFDAGEU1SK,268166,268166,,,,,,,,,,,,,,,,,,,,,,,,
,,,,,,,,,,,,,,,,,,,,,,,,,,,,,,,,,,,,,,,,,,,,,,,,,,,14:28:1:857,,return,34.964695,14:28:36:848,a white bathroom with a brown shelf that has 5 rolled up towels,a white bathroom with a brown shelf that has 6 rolled up towels on it,0.22265625,-0.278645833,0,0,0,0,11,11,2,1,A2XS49LRNX8PD4,73,wolfe_037_L_towel-a_w_outline.jpg,wolfe_037_L_towel-b_w_outline.jpg,31,A2XS49LRNX8PD4,2021-01-10_14h18.01.103,MetaAwareness,2020.1.2,Win32,60,3UXQ63NLABPEJXH5RVNTXMH0KGSBLE,37Q970SNZFB3WWSXZ9W7RFDAGEU1SK,N7Q76,N7Q76,37Q970SNZFB3WWSXZ9W7RFDAGEU1SK,37Q970SNZFB3WWSXZ9W7RFDAGEU1SK,268166,268166,,,,,,,,,,,,,,,,,,,,,,,,
,,,,,,,,,,,,,,,,,,,,,,,,,,,,,,,,,,,,,,,,,,,,,,,,,,,,,,,,,,,,,,,,,,,,A2XS49LRNX8PD4,,,,31,A2XS49LRNX8PD4,2021-01-10_14h18.01.103,MetaAwareness,2020.1.2,Win32,60,3UXQ63NLABPEJXH5RVNTXMH0KGSBLE,37Q970SNZFB3WWSXZ9W7RFDAGEU1SK,N7Q76,N7Q76,37Q970SNZFB3WWSXZ9W7RFDAGEU1SK,37Q970SNZFB3WWSXZ9W7RFDAGEU1SK,268166,268166,14:28:37:864,,return,24.65159,14:29:2:545,a grass field with a cow eating grass,an empty grass green field,0.23828125,-0.265625,0,0,0,14:29:3:561,,return,18.932495,14:29:22:520,a sunset with a plane flying into it,a gorgeous sunset with just clouds and sky,0.2109375,-0.26953125,0,0,0
