"workerId","RT","image_1_text","image_2_text","database","image"
"AXXA481XH6FKE",33.893785,"a water fountain with a low volume of water at the top","a water fountain with a large volume of water at the top","rensink","Fountain"
"AXXA481XH6FKE",47.54122,"a big castle which has half of its front door hidden by a wall","a big castle which has most of its front door hidden by a wall","rensink","Castle"
"AXXA481XH6FKE",32.59685,"an ancient egypt structure with a big tree at the background","an ancient egypt structure with no tree at the background","rensink","Obelisk"
"AXXA481XH6FKE",61.242395,"a brown looking jeep with a lot of tree shadow behind it","a brown looking jeep with no tree shadow behind it","rensink","Army"
"AXXA481XH6FKE",25.66964,"a very green field with a cow standing in the middle of it","a very green field","rensink","cow"
"AXXA481XH6FKE",37.71884,"a sunrise looking sky with a plane flying through it","a sunrise looking sky with a cloud passing through it","rensink","airplane"
"AYOXZN5JZIHDT",46.652565,"a construction sight with a man holding a box in a dim green shirt","a construction site with a man holding a box with a bright green shirt","rensink","Farmer"
"AYOXZN5JZIHDT",22.602875,"a turtle on a beach with a man and the sky is blue","a turtle on a beach with a man and the sky is pink","rensink","Turtle"
"AYOXZN5JZIHDT",59.320745," a tropical beach with two men pushig a boat out in the calm water","a tropical beach with two men pushing a boat out on a big wave coming in","rensink","Water"
"AYOXZN5JZIHDT",39.25126,"3 people holding a fish on a boat over a yellow bag","3 people holding a fish on a boat","rensink","Marling"
"AYOXZN5JZIHDT",45.68555,"aa window display showing a scenic country backround wih a lantern and a vase on its side","a window display showing a scenic country backround with a lantern in the display","rensink","Window"
"AYOXZN5JZIHDT",53.384255,"a seal being photographed on a bank with a long walk  rockway","a seal being photographed on a bank wih a short rock walkwayw","rensink","Seal"
"AYOXZN5JZIHDT",32.549595,"a country farm with a red barn in the fall","a scenic country farm with a green barn in the fall","rensink","Barns"
"AYOXZN5JZIHDT",48.619785,"a white boat full of people about a foot away from a woman standing in the water","a white boat full of people in shallow water about a meter away from a woman standing in the water","rensink","Boat"
"AYOXZN5JZIHDT",48.140575,"3 people wearing native attire ","3 people wearing native attire and behind the woman on the right is a yellow flash","rensink","Description"
"AYOXZN5JZIHDT",100.60033,"a military plane that has a cord hanging down that looks attached to the truck driving in the grass below-  the shadow of the plane can be seen in the grass","a military plane that has a cord hanging down that looks attached to the truck driving in the grass but in this picture the shadow can only be seen of the truck","rensink","Chopper"
"AYOXZN5JZIHDT",38.85935,"underwater photo of a scuba diver ","underwater photo of a scuba diver with plants behind him","rensink","OtherDiver"
"AYOXZN5JZIHDT",44.41972," a scenic country road with a grass field in front of a white fence","a scenic country road with a dirt field in front of a white fence","rensink","BarnTrack"
"AYOXZN5JZIHDT",21.522525,"a grassy exspance with a cow eating grass","a grassy expanse","rensink","cow"
"AYOXZN5JZIHDT",33.280145,"a beautiful sunset or sunrise with a plane flying","a beautiful sunset or sunrise","rensink","airplane"
