consent_response.keys,consent_response.rt,key_resp_2.keys,key_resp_2.rt,user_resp.keys,user_resp.rt,trials.thisRepN,trials.thisTrialN,trials.thisN,trials.thisIndex,trials.ran,image_1_text,image_2_text,database,image,number,age,worker_ID,date,expName,psychopyVersion,OS,frameRate,hitId,workerId,assignmentId,a,tp_a,b,tp_b,c,tp_c,catch_same_resp.keys,catch_same_resp.rt,image_1_text_catch_same,image_2_text_catch_same,image_catch_same,catch_different_resp.keys,catch_different_resp.rt,image_1_text_catch_different,image_2_text_catch_different,image_catch_different
space,4.950075,space,17.51583,2,8.072165,0,0,0,530,1,a open spaced room with a potted plant,a open spaced room with an empty table,wolfe2,117_L_plant_sized,2,40,A1R5W4RQZTROD8,2021-02-17_20h37.20.741,MetaAwareness,2020.1.2,Win32,60,3H4IKZHALCL6869N6Y8H19LJ8J1NNG,A1R5W4RQZTROD8,36WLNQG780D3ZB570B5R8AM45MXBEB,7NW67,7NW67,36WLNQG780D3ZB570B5R8AM45MXBEB,36WLNQG780D3ZB570B5R8AM45MXBEB,276287,276287,,,,,,,,,,
,,,,4,4.022745,0,1,1,96,1,a large kitchen with two green items  hanging above the center,a large kitchen that has three green items hanging above the center,wolfe2,022_R_lamp,6,40,A1R5W4RQZTROD8,2021-02-17_20h37.20.741,MetaAwareness,2020.1.2,Win32,60,3H4IKZHALCL6869N6Y8H19LJ8J1NNG,A1R5W4RQZTROD8,36WLNQG780D3ZB570B5R8AM45MXBEB,7NW67,7NW67,36WLNQG780D3ZB570B5R8AM45MXBEB,36WLNQG780D3ZB570B5R8AM45MXBEB,276287,276287,,,,,,,,,,
,,,,5,13.90787,0,2,2,4,1,"a fancy bedroom with dark teal walls, a lacy bed spread, white curtains and a picture of a swan","a fancy bedroom with dark teal walls, a lacy bed spread, white curtains, a picture of a swan and a small mirror.",wolfe2,001_R_mirror,4,40,A1R5W4RQZTROD8,2021-02-17_20h37.20.741,MetaAwareness,2020.1.2,Win32,60,3H4IKZHALCL6869N6Y8H19LJ8J1NNG,A1R5W4RQZTROD8,36WLNQG780D3ZB570B5R8AM45MXBEB,7NW67,7NW67,36WLNQG780D3ZB570B5R8AM45MXBEB,36WLNQG780D3ZB570B5R8AM45MXBEB,276287,276287,,,,,,,,,,
,,,,2,9.56644,0,3,3,570,1,there is a mounted light on the wall in a large mansion full of brown furniture.,there are white walls in a lare house with a yellow dog and a swimming pool outside.,wolfe2,127_R_light,1,40,A1R5W4RQZTROD8,2021-02-17_20h37.20.741,MetaAwareness,2020.1.2,Win32,60,3H4IKZHALCL6869N6Y8H19LJ8J1NNG,A1R5W4RQZTROD8,36WLNQG780D3ZB570B5R8AM45MXBEB,7NW67,7NW67,36WLNQG780D3ZB570B5R8AM45MXBEB,36WLNQG780D3ZB570B5R8AM45MXBEB,276287,276287,,,,,,,,,,
,,,,3,6.539765,0,4,4,437,1,a bedroom with an object in front of the chair,a bedroom with nothing in front of the chair,wolfe2,098_L_slippers,3,40,A1R5W4RQZTROD8,2021-02-17_20h37.20.741,MetaAwareness,2020.1.2,Win32,60,3H4IKZHALCL6869N6Y8H19LJ8J1NNG,A1R5W4RQZTROD8,36WLNQG780D3ZB570B5R8AM45MXBEB,7NW67,7NW67,36WLNQG780D3ZB570B5R8AM45MXBEB,36WLNQG780D3ZB570B5R8AM45MXBEB,276287,276287,,,,,,,,,,
,,,,4,4.04308,0,5,5,133,1,a kitchen with a only three drawers for items,a kitchen with four different drawers,wolfe2,030_R_drawer,5,40,A1R5W4RQZTROD8,2021-02-17_20h37.20.741,MetaAwareness,2020.1.2,Win32,60,3H4IKZHALCL6869N6Y8H19LJ8J1NNG,A1R5W4RQZTROD8,36WLNQG780D3ZB570B5R8AM45MXBEB,7NW67,7NW67,36WLNQG780D3ZB570B5R8AM45MXBEB,36WLNQG780D3ZB570B5R8AM45MXBEB,276287,276287,,,,,,,,,,
,,,,6,7.236645,0,6,6,481,1,this is a gym shower or bathroo with a paper towel rack on the wall,this is a gym shower or bathroom without a paper towel rack on the wall,wolfe2,106_R_toweldispenser,6,40,A1R5W4RQZTROD8,2021-02-17_20h37.20.741,MetaAwareness,2020.1.2,Win32,60,3H4IKZHALCL6869N6Y8H19LJ8J1NNG,A1R5W4RQZTROD8,36WLNQG780D3ZB570B5R8AM45MXBEB,7NW67,7NW67,36WLNQG780D3ZB570B5R8AM45MXBEB,36WLNQG780D3ZB570B5R8AM45MXBEB,276287,276287,,,,,,,,,,
,,,,3,5.9016,0,7,7,155,1,a very luxurious bathroom designed for comfort and relationation.,a very relaxing room with plenty of storage space in the cabinets,wolfe2,037_R_towel,1,40,A1R5W4RQZTROD8,2021-02-17_20h37.20.741,MetaAwareness,2020.1.2,Win32,60,3H4IKZHALCL6869N6Y8H19LJ8J1NNG,A1R5W4RQZTROD8,36WLNQG780D3ZB570B5R8AM45MXBEB,7NW67,7NW67,36WLNQG780D3ZB570B5R8AM45MXBEB,36WLNQG780D3ZB570B5R8AM45MXBEB,276287,276287,,,,,,,,,,
,,,,4,8.88079,0,8,8,42,1,bedroom with pictures across the bed and one candle in a holder beside the bed on the right.,there are now two candles beside the bed on the right side.,wolfe2,010_R_candle,1,40,A1R5W4RQZTROD8,2021-02-17_20h37.20.741,MetaAwareness,2020.1.2,Win32,60,3H4IKZHALCL6869N6Y8H19LJ8J1NNG,A1R5W4RQZTROD8,36WLNQG780D3ZB570B5R8AM45MXBEB,7NW67,7NW67,36WLNQG780D3ZB570B5R8AM45MXBEB,36WLNQG780D3ZB570B5R8AM45MXBEB,276287,276287,,,,,,,,,,
,,,,5,6.594645,0,9,9,57,1,room with two tables and 3 lights on the wall,room with two tables and 4 lights on the wall,wolfe2,014_L_lamp,4,40,A1R5W4RQZTROD8,2021-02-17_20h37.20.741,MetaAwareness,2020.1.2,Win32,60,3H4IKZHALCL6869N6Y8H19LJ8J1NNG,A1R5W4RQZTROD8,36WLNQG780D3ZB570B5R8AM45MXBEB,7NW67,7NW67,36WLNQG780D3ZB570B5R8AM45MXBEB,36WLNQG780D3ZB570B5R8AM45MXBEB,276287,276287,,,,,,,,,,
,,,,5,5.653595,0,10,10,522,1,"a room with a small couch and coffee table that has some things on it, including two nicknacks","a room with a small couch and coffee table that has some things on it, including one nicknack",wolfe2,114_R_bird,5,40,A1R5W4RQZTROD8,2021-02-17_20h37.20.741,MetaAwareness,2020.1.2,Win32,60,3H4IKZHALCL6869N6Y8H19LJ8J1NNG,A1R5W4RQZTROD8,36WLNQG780D3ZB570B5R8AM45MXBEB,7NW67,7NW67,36WLNQG780D3ZB570B5R8AM45MXBEB,36WLNQG780D3ZB570B5R8AM45MXBEB,276287,276287,,,,,,,,,,
,,,,4,6.433155,0,11,11,259,1,a child's bedroom without a race car above the dresser,a child's bedroom with a racar on the dresser,wolfe2,059_R_car,2,40,A1R5W4RQZTROD8,2021-02-17_20h37.20.741,MetaAwareness,2020.1.2,Win32,60,3H4IKZHALCL6869N6Y8H19LJ8J1NNG,A1R5W4RQZTROD8,36WLNQG780D3ZB570B5R8AM45MXBEB,7NW67,7NW67,36WLNQG780D3ZB570B5R8AM45MXBEB,36WLNQG780D3ZB570B5R8AM45MXBEB,276287,276287,,,,,,,,,,
,,,,5,7.68996,0,12,12,500,1,an outdoor screened in living area with houseplants and an urn sitting beside one of the houseplants,an outdoor screened in living area with houseplants,wolfe2,111_L_pot,2,40,A1R5W4RQZTROD8,2021-02-17_20h37.20.741,MetaAwareness,2020.1.2,Win32,60,3H4IKZHALCL6869N6Y8H19LJ8J1NNG,A1R5W4RQZTROD8,36WLNQG780D3ZB570B5R8AM45MXBEB,7NW67,7NW67,36WLNQG780D3ZB570B5R8AM45MXBEB,36WLNQG780D3ZB570B5R8AM45MXBEB,276287,276287,,,,,,,,,,
,,,,3,5.17695,0,13,13,110,1,clean restroom without a storage shelf on the wall beneath the mirror,clean restroom with a storage shelf on the wall beneath the mirror,wolfe2,026_L_rack,3,40,A1R5W4RQZTROD8,2021-02-17_20h37.20.741,MetaAwareness,2020.1.2,Win32,60,3H4IKZHALCL6869N6Y8H19LJ8J1NNG,A1R5W4RQZTROD8,36WLNQG780D3ZB570B5R8AM45MXBEB,7NW67,7NW67,36WLNQG780D3ZB570B5R8AM45MXBEB,36WLNQG780D3ZB570B5R8AM45MXBEB,276287,276287,,,,,,,,,,
,,,,4,5.85062,0,14,14,559,1,an office space in a home with a vase on the floor,an office space in a home,wolfe2,124_R_vase,3,40,A1R5W4RQZTROD8,2021-02-17_20h37.20.741,MetaAwareness,2020.1.2,Win32,60,3H4IKZHALCL6869N6Y8H19LJ8J1NNG,A1R5W4RQZTROD8,36WLNQG780D3ZB570B5R8AM45MXBEB,7NW67,7NW67,36WLNQG780D3ZB570B5R8AM45MXBEB,36WLNQG780D3ZB570B5R8AM45MXBEB,276287,276287,,,,,,,,,,
,,,,3,4.87111,0,15,15,448,1,a modern dining room with a candal and holder on the wall,a modern dining room without a candal and holder on the wall,wolfe2,099_R_sconce,4,40,A1R5W4RQZTROD8,2021-02-17_20h37.20.741,MetaAwareness,2020.1.2,Win32,60,3H4IKZHALCL6869N6Y8H19LJ8J1NNG,A1R5W4RQZTROD8,36WLNQG780D3ZB570B5R8AM45MXBEB,7NW67,7NW67,36WLNQG780D3ZB570B5R8AM45MXBEB,36WLNQG780D3ZB570B5R8AM45MXBEB,276287,276287,,,,,,,,,,
,,,,4,5.347285,0,16,16,271,1,a high-class looking family room with a seat in front of the fireplace. the fireplace has nothing in it.,a high-class looking family room with a seat in front of the fireplace. the fireplace has a white object in it,wolfe2,062_R_flowers,1,40,A1R5W4RQZTROD8,2021-02-17_20h37.20.741,MetaAwareness,2020.1.2,Win32,60,3H4IKZHALCL6869N6Y8H19LJ8J1NNG,A1R5W4RQZTROD8,36WLNQG780D3ZB570B5R8AM45MXBEB,7NW67,7NW67,36WLNQG780D3ZB570B5R8AM45MXBEB,36WLNQG780D3ZB570B5R8AM45MXBEB,276287,276287,,,,,,,,,,
,,,,5,7.832185,0,17,17,204,1,"a dingy yellowish hotel room with sofa, chairs, three lamps and a glass coffee table.","a dingy yellowish hotel room with sofa, chairs, three lamps and a glass coffee table with a wine glass on top.",wolfe2,046_L_remote,1,40,A1R5W4RQZTROD8,2021-02-17_20h37.20.741,MetaAwareness,2020.1.2,Win32,60,3H4IKZHALCL6869N6Y8H19LJ8J1NNG,A1R5W4RQZTROD8,36WLNQG780D3ZB570B5R8AM45MXBEB,7NW67,7NW67,36WLNQG780D3ZB570B5R8AM45MXBEB,36WLNQG780D3ZB570B5R8AM45MXBEB,276287,276287,,,,,,,,,,
,,,,4,10.9982,0,18,18,221,1,very nice apartment with red as a theme. there is an empty bookshelf on the second row.,there are books on the second row of the bookshelf that was originally empty.,wolfe2,050_R_book,4,40,A1R5W4RQZTROD8,2021-02-17_20h37.20.741,MetaAwareness,2020.1.2,Win32,60,3H4IKZHALCL6869N6Y8H19LJ8J1NNG,A1R5W4RQZTROD8,36WLNQG780D3ZB570B5R8AM45MXBEB,7NW67,7NW67,36WLNQG780D3ZB570B5R8AM45MXBEB,36WLNQG780D3ZB570B5R8AM45MXBEB,276287,276287,,,,,,,,,,
,,,,2,6.482135,0,19,19,254,1,nothing upon the sofa,a purse is on the sofa,wolfe2,058_R_clutch,1,40,A1R5W4RQZTROD8,2021-02-17_20h37.20.741,MetaAwareness,2020.1.2,Win32,60,3H4IKZHALCL6869N6Y8H19LJ8J1NNG,A1R5W4RQZTROD8,36WLNQG780D3ZB570B5R8AM45MXBEB,7NW67,7NW67,36WLNQG780D3ZB570B5R8AM45MXBEB,36WLNQG780D3ZB570B5R8AM45MXBEB,276287,276287,,,,,,,,,,
,,,,3,4.90601,0,20,20,432,1,there is a white plastic container on the pink vanity.,there is nothing sitting on top of the pink vanity.,wolfe2,096_R_painting,2,40,A1R5W4RQZTROD8,2021-02-17_20h37.20.741,MetaAwareness,2020.1.2,Win32,60,3H4IKZHALCL6869N6Y8H19LJ8J1NNG,A1R5W4RQZTROD8,36WLNQG780D3ZB570B5R8AM45MXBEB,7NW67,7NW67,36WLNQG780D3ZB570B5R8AM45MXBEB,36WLNQG780D3ZB570B5R8AM45MXBEB,276287,276287,,,,,,,,,,
,,,,4,6.889455,0,21,21,545,1,a child's bedroom with a nightstand holding a lamp with a red shade and a black car at its base,a child's bedroom with a nightstand holding a lamp with a red shade,wolfe2,121_L_car,5,40,A1R5W4RQZTROD8,2021-02-17_20h37.20.741,MetaAwareness,2020.1.2,Win32,60,3H4IKZHALCL6869N6Y8H19LJ8J1NNG,A1R5W4RQZTROD8,36WLNQG780D3ZB570B5R8AM45MXBEB,7NW67,7NW67,36WLNQG780D3ZB570B5R8AM45MXBEB,36WLNQG780D3ZB570B5R8AM45MXBEB,276287,276287,,,,,,,,,,
,,,,4,7.2764,0,22,22,464,1,a darker colored bathroom with a very large sink and mirror,"a darker colored bathroom with a very large sink and mirror, but now there isn't a wall hanger at the top right of the mirror.",wolfe2,103_R_hook,5,40,A1R5W4RQZTROD8,2021-02-17_20h37.20.741,MetaAwareness,2020.1.2,Win32,60,3H4IKZHALCL6869N6Y8H19LJ8J1NNG,A1R5W4RQZTROD8,36WLNQG780D3ZB570B5R8AM45MXBEB,7NW67,7NW67,36WLNQG780D3ZB570B5R8AM45MXBEB,36WLNQG780D3ZB570B5R8AM45MXBEB,276287,276287,,,,,,,,,,
,,,,3,5.083425,0,23,23,573,1,"a home office, with access to a balcony, with a lily plant on the desk.","a home office, with access to a balcony, without any office plants.",wolfe2,128_L_pot,5,40,A1R5W4RQZTROD8,2021-02-17_20h37.20.741,MetaAwareness,2020.1.2,Win32,60,3H4IKZHALCL6869N6Y8H19LJ8J1NNG,A1R5W4RQZTROD8,36WLNQG780D3ZB570B5R8AM45MXBEB,7NW67,7NW67,36WLNQG780D3ZB570B5R8AM45MXBEB,36WLNQG780D3ZB570B5R8AM45MXBEB,276287,276287,,,,,,,,,,
,,,,5,10.109045,0,24,24,515,1,it seems to be a hangout area in a store with many plants and rustic scenic decorations and a lookout window to nature,"a hangout area in a store with one less plant by the large window, the area is still rustic with a nice lookout view to nature",wolfe2,113_R_plant,3,40,A1R5W4RQZTROD8,2021-02-17_20h37.20.741,MetaAwareness,2020.1.2,Win32,60,3H4IKZHALCL6869N6Y8H19LJ8J1NNG,A1R5W4RQZTROD8,36WLNQG780D3ZB570B5R8AM45MXBEB,7NW67,7NW67,36WLNQG780D3ZB570B5R8AM45MXBEB,36WLNQG780D3ZB570B5R8AM45MXBEB,276287,276287,,,,,,,,,,
,,,,5,15.653355,0,25,25,319,1,a spacious sitting room with a table that has two plants sitting in the middle of it.,a spacious sitting room with a table that has two plants and a book sitting in the middle of it.,wolfe2,074_L_book,1,40,A1R5W4RQZTROD8,2021-02-17_20h37.20.741,MetaAwareness,2020.1.2,Win32,60,3H4IKZHALCL6869N6Y8H19LJ8J1NNG,A1R5W4RQZTROD8,36WLNQG780D3ZB570B5R8AM45MXBEB,7NW67,7NW67,36WLNQG780D3ZB570B5R8AM45MXBEB,36WLNQG780D3ZB570B5R8AM45MXBEB,276287,276287,,,,,,,,,,
,,,,5,11.27202,0,26,26,321,1,a living room decorated in shabby chic with a wrought iron coffee table and nic nacks.,a living room decorated in shabby chic with a wrought iron coffee table holding a book and nic nacks.,wolfe2,074_L_book,3,40,A1R5W4RQZTROD8,2021-02-17_20h37.20.741,MetaAwareness,2020.1.2,Win32,60,3H4IKZHALCL6869N6Y8H19LJ8J1NNG,A1R5W4RQZTROD8,36WLNQG780D3ZB570B5R8AM45MXBEB,7NW67,7NW67,36WLNQG780D3ZB570B5R8AM45MXBEB,36WLNQG780D3ZB570B5R8AM45MXBEB,276287,276287,,,,,,,,,,
,,,,6,8.10081,0,27,27,400,1,"a hairdressers with no people in it, lots of empty black chairs, and a blue painting with something hanging above it on one of the walls","a hairdressers with no people in it, lots of empty black chairs, and a blue painting on one of the walls",wolfe2,088_R_clock,5,40,A1R5W4RQZTROD8,2021-02-17_20h37.20.741,MetaAwareness,2020.1.2,Win32,60,3H4IKZHALCL6869N6Y8H19LJ8J1NNG,A1R5W4RQZTROD8,36WLNQG780D3ZB570B5R8AM45MXBEB,7NW67,7NW67,36WLNQG780D3ZB570B5R8AM45MXBEB,36WLNQG780D3ZB570B5R8AM45MXBEB,276287,276287,,,,,,,,,,
,,,,4,3.465005,0,28,28,493,1,a living room with an orange pillow on the couch.,a living room with no pillow on the couch.,wolfe2,109_R_pillow,1,40,A1R5W4RQZTROD8,2021-02-17_20h37.20.741,MetaAwareness,2020.1.2,Win32,60,3H4IKZHALCL6869N6Y8H19LJ8J1NNG,A1R5W4RQZTROD8,36WLNQG780D3ZB570B5R8AM45MXBEB,7NW67,7NW67,36WLNQG780D3ZB570B5R8AM45MXBEB,36WLNQG780D3ZB570B5R8AM45MXBEB,276287,276287,,,,,,,,,,
,,,,3,6.57053,0,29,29,412,1,a fancy looking bathroom. there is a red chair near a mirror. there is a white rectangluar device reclected in the mirror above the red chair.,a fancy looking bathroom. there is a red chair near a mirror. there is nothing relected in the mirror above the red chair.,wolfe2,091_L_airfreshener,1,40,A1R5W4RQZTROD8,2021-02-17_20h37.20.741,MetaAwareness,2020.1.2,Win32,60,3H4IKZHALCL6869N6Y8H19LJ8J1NNG,A1R5W4RQZTROD8,36WLNQG780D3ZB570B5R8AM45MXBEB,7NW67,7NW67,36WLNQG780D3ZB570B5R8AM45MXBEB,36WLNQG780D3ZB570B5R8AM45MXBEB,276287,276287,,,,,,,,,,
,,,,,,,,,,,,,,,,40,A1R5W4RQZTROD8,2021-02-17_20h37.20.741,MetaAwareness,2020.1.2,Win32,60,3H4IKZHALCL6869N6Y8H19LJ8J1NNG,A1R5W4RQZTROD8,36WLNQG780D3ZB570B5R8AM45MXBEB,7NW67,7NW67,36WLNQG780D3ZB570B5R8AM45MXBEB,36WLNQG780D3ZB570B5R8AM45MXBEB,276287,276287,6,8.63212,someone laying underneath a blue beach umbrella on a crowded beach,someone laying underneath a blue beach umbrella on a crowded beach,same,1,6.143205,members of a marching band crossing a track that all have feather plumes at the front of their hats,a cluttered and rustic looking cafe with 10 hanging lights,different
