consent_response.keys,consent_response.rt,key_resp_2.keys,key_resp_2.rt,user_resp.keys,user_resp.rt,trials.thisRepN,trials.thisTrialN,trials.thisN,trials.thisIndex,trials.ran,image_1_text,image_2_text,database,image,number,age,worker_ID,date,expName,psychopyVersion,OS,frameRate,hitId,workerId,assignmentId,a,tp_a,b,tp_b,c,tp_c,catch_same_resp.keys,catch_same_resp.rt,image_1_text_catch_same,image_2_text_catch_same,image_catch_same,catch_different_resp.keys,catch_different_resp.rt,image_1_text_catch_different,image_2_text_catch_different,image_catch_different
space,61.255705,space,2.320285,5,4.855915,0,0,0,195,1,table with dinner set and white drink holder,table with dinner set and no white drink holder,wolfe1,image-037,5,36,A13T5R3LI8ANLN,2021-01-08_12h52.10.903,MetaAwareness,2020.1.2,Win32,60,3LN3BXKGC1YQL81FBVM978PDYZHWG0,A13T5R3LI8ANLN,3EJJQNKU9S82ZSDYM9ZNTSOLBXNHRJ,UQJE8,UQJE8,3EJJQNKU9S82ZSDYM9ZNTSOLBXNHRJ,3EJJQNKU9S82ZSDYM9ZNTSOLBXNHRJ,268048,268048,,,,,,,,,,
,,,,5,0.311365,0,1,1,15,1,a man sitting on the edge of the dock with a wooden addition chained to it.,"a man sitting on the edge of the dock with a wooden addition chained to it, but by only one chain.",wolfe1,image-004,2,36,A13T5R3LI8ANLN,2021-01-08_12h52.10.903,MetaAwareness,2020.1.2,Win32,60,3LN3BXKGC1YQL81FBVM978PDYZHWG0,A13T5R3LI8ANLN,3EJJQNKU9S82ZSDYM9ZNTSOLBXNHRJ,UQJE8,UQJE8,3EJJQNKU9S82ZSDYM9ZNTSOLBXNHRJ,3EJJQNKU9S82ZSDYM9ZNTSOLBXNHRJ,268048,268048,,,,,,,,,,
,,,,5,3.905885,0,2,2,352,1,a group of people on a basketball court with one person wearing a pair of pink pants,a group of people on a basketball court with one person wearing a pair of green pants,wolfe1,image-093,3,36,A13T5R3LI8ANLN,2021-01-08_12h52.10.903,MetaAwareness,2020.1.2,Win32,60,3LN3BXKGC1YQL81FBVM978PDYZHWG0,A13T5R3LI8ANLN,3EJJQNKU9S82ZSDYM9ZNTSOLBXNHRJ,UQJE8,UQJE8,3EJJQNKU9S82ZSDYM9ZNTSOLBXNHRJ,3EJJQNKU9S82ZSDYM9ZNTSOLBXNHRJ,268048,268048,,,,,,,,,,
,,,,6,3.06792,0,3,3,399,1,a man with a red tie poses with a group of men in suits,a man with a purple tie poses with a  group of men in suits,wolfe1,image-102,5,36,A13T5R3LI8ANLN,2021-01-08_12h52.10.903,MetaAwareness,2020.1.2,Win32,60,3LN3BXKGC1YQL81FBVM978PDYZHWG0,A13T5R3LI8ANLN,3EJJQNKU9S82ZSDYM9ZNTSOLBXNHRJ,UQJE8,UQJE8,3EJJQNKU9S82ZSDYM9ZNTSOLBXNHRJ,3EJJQNKU9S82ZSDYM9ZNTSOLBXNHRJ,268048,268048,,,,,,,,,,
,,,,5,4.36299,0,4,4,127,1,a mother and child walking in to a glass building thats a clinic with two bushes outside,a mother and child walking in to a glass building thats a clinic that has only 1 bush,wolfe1,image-023,1,36,A13T5R3LI8ANLN,2021-01-08_12h52.10.903,MetaAwareness,2020.1.2,Win32,60,3LN3BXKGC1YQL81FBVM978PDYZHWG0,A13T5R3LI8ANLN,3EJJQNKU9S82ZSDYM9ZNTSOLBXNHRJ,UQJE8,UQJE8,3EJJQNKU9S82ZSDYM9ZNTSOLBXNHRJ,3EJJQNKU9S82ZSDYM9ZNTSOLBXNHRJ,268048,268048,,,,,,,,,,
,,,,4,2.937555,0,5,5,115,1,"many people at park sitting on blankets, with a pink and white bag",many people at a park sitting on blankets,wolfe1,image-020,5,36,A13T5R3LI8ANLN,2021-01-08_12h52.10.903,MetaAwareness,2020.1.2,Win32,60,3LN3BXKGC1YQL81FBVM978PDYZHWG0,A13T5R3LI8ANLN,3EJJQNKU9S82ZSDYM9ZNTSOLBXNHRJ,UQJE8,UQJE8,3EJJQNKU9S82ZSDYM9ZNTSOLBXNHRJ,3EJJQNKU9S82ZSDYM9ZNTSOLBXNHRJ,268048,268048,,,,,,,,,,
,,,,5,2.34782,0,6,6,451,1,airplanes next to yellow truck,airplanes next to red truck,wolfe1,image-111,3,36,A13T5R3LI8ANLN,2021-01-08_12h52.10.903,MetaAwareness,2020.1.2,Win32,60,3LN3BXKGC1YQL81FBVM978PDYZHWG0,A13T5R3LI8ANLN,3EJJQNKU9S82ZSDYM9ZNTSOLBXNHRJ,UQJE8,UQJE8,3EJJQNKU9S82ZSDYM9ZNTSOLBXNHRJ,3EJJQNKU9S82ZSDYM9ZNTSOLBXNHRJ,268048,268048,,,,,,,,,,
,,,,3,4.60029,0,7,7,117,1,a pink and white striped bag sitting in a crowd,some grass in the middle of a crowd of people,wolfe1,image-020,7,36,A13T5R3LI8ANLN,2021-01-08_12h52.10.903,MetaAwareness,2020.1.2,Win32,60,3LN3BXKGC1YQL81FBVM978PDYZHWG0,A13T5R3LI8ANLN,3EJJQNKU9S82ZSDYM9ZNTSOLBXNHRJ,UQJE8,UQJE8,3EJJQNKU9S82ZSDYM9ZNTSOLBXNHRJ,3EJJQNKU9S82ZSDYM9ZNTSOLBXNHRJ,268048,268048,,,,,,,,,,
,,,,4,3.48511,0,8,8,318,1,a hiker on a grassy mountain reaching into their red bag.,a hiker on a grassy mountain reaching into their green bag.,wolfe1,image-084,7,36,A13T5R3LI8ANLN,2021-01-08_12h52.10.903,MetaAwareness,2020.1.2,Win32,60,3LN3BXKGC1YQL81FBVM978PDYZHWG0,A13T5R3LI8ANLN,3EJJQNKU9S82ZSDYM9ZNTSOLBXNHRJ,UQJE8,UQJE8,3EJJQNKU9S82ZSDYM9ZNTSOLBXNHRJ,3EJJQNKU9S82ZSDYM9ZNTSOLBXNHRJ,268048,268048,,,,,,,,,,
,,,,3,3.546655,0,9,9,338,1,"five boys sitting in a room and one boy's shirt has blue, tan, and white stripes","five boys sitting in a room and one boy's shirt has purple, tan, and white stripes",wolfe1,image-089,5,36,A13T5R3LI8ANLN,2021-01-08_12h52.10.903,MetaAwareness,2020.1.2,Win32,60,3LN3BXKGC1YQL81FBVM978PDYZHWG0,A13T5R3LI8ANLN,3EJJQNKU9S82ZSDYM9ZNTSOLBXNHRJ,UQJE8,UQJE8,3EJJQNKU9S82ZSDYM9ZNTSOLBXNHRJ,3EJJQNKU9S82ZSDYM9ZNTSOLBXNHRJ,268048,268048,,,,,,,,,,
,,,,4,2.62589,0,10,10,33,1,train station on milwaukie has building in the distance with a large window in the center.,train station on milwaukie has a building in the distance.,wolfe1,image-007,2,36,A13T5R3LI8ANLN,2021-01-08_12h52.10.903,MetaAwareness,2020.1.2,Win32,60,3LN3BXKGC1YQL81FBVM978PDYZHWG0,A13T5R3LI8ANLN,3EJJQNKU9S82ZSDYM9ZNTSOLBXNHRJ,UQJE8,UQJE8,3EJJQNKU9S82ZSDYM9ZNTSOLBXNHRJ,3EJJQNKU9S82ZSDYM9ZNTSOLBXNHRJ,268048,268048,,,,,,,,,,
,,,,5,3.42705,0,11,11,301,1,two women outside in white chairs with two pink notebooks on the table infront of them.,two women outside in white chairs with only on pink notebook in front of them.,wolfe1,image-081,4,36,A13T5R3LI8ANLN,2021-01-08_12h52.10.903,MetaAwareness,2020.1.2,Win32,60,3LN3BXKGC1YQL81FBVM978PDYZHWG0,A13T5R3LI8ANLN,3EJJQNKU9S82ZSDYM9ZNTSOLBXNHRJ,UQJE8,UQJE8,3EJJQNKU9S82ZSDYM9ZNTSOLBXNHRJ,3EJJQNKU9S82ZSDYM9ZNTSOLBXNHRJ,268048,268048,,,,,,,,,,
,,,,3,3.3181,0,12,12,343,1,"various people are seaed in outdoor tables, one of them is a woman in a pink jacket","various people are seated in outdoor tables, one of them is a woman in a purple jacket",wolfe1,image-091,1,36,A13T5R3LI8ANLN,2021-01-08_12h52.10.903,MetaAwareness,2020.1.2,Win32,60,3LN3BXKGC1YQL81FBVM978PDYZHWG0,A13T5R3LI8ANLN,3EJJQNKU9S82ZSDYM9ZNTSOLBXNHRJ,UQJE8,UQJE8,3EJJQNKU9S82ZSDYM9ZNTSOLBXNHRJ,3EJJQNKU9S82ZSDYM9ZNTSOLBXNHRJ,268048,268048,,,,,,,,,,
,,,,4,2.87899,0,13,13,146,1,people at an outdoor market in a park where some are sitting on concrete benches with small lights underneath.,people at an outdoor market in a park where some are sitting on concrete benches with small lights underneath but one is missing the light.,wolfe1,image-027,3,36,A13T5R3LI8ANLN,2021-01-08_12h52.10.903,MetaAwareness,2020.1.2,Win32,60,3LN3BXKGC1YQL81FBVM978PDYZHWG0,A13T5R3LI8ANLN,3EJJQNKU9S82ZSDYM9ZNTSOLBXNHRJ,UQJE8,UQJE8,3EJJQNKU9S82ZSDYM9ZNTSOLBXNHRJ,3EJJQNKU9S82ZSDYM9ZNTSOLBXNHRJ,268048,268048,,,,,,,,,,
,,,,4,3.91228,0,14,14,236,1,a large area of hilly farmland in front of a mountain range with 7 small bushes in the closest field.,a large area of hilly farmland in front of a mountain range with 6 small bushes in the closest field.,wolfe1,image-045,1,36,A13T5R3LI8ANLN,2021-01-08_12h52.10.903,MetaAwareness,2020.1.2,Win32,60,3LN3BXKGC1YQL81FBVM978PDYZHWG0,A13T5R3LI8ANLN,3EJJQNKU9S82ZSDYM9ZNTSOLBXNHRJ,UQJE8,UQJE8,3EJJQNKU9S82ZSDYM9ZNTSOLBXNHRJ,3EJJQNKU9S82ZSDYM9ZNTSOLBXNHRJ,268048,268048,,,,,,,,,,
,,,,4,2.61914,0,15,15,163,1,a parade of people are on the stree and the girl has a badge on her right chest,a parade of people are on the street and the girl has no badge on her right chest,wolfe1,image-031,4,36,A13T5R3LI8ANLN,2021-01-08_12h52.10.903,MetaAwareness,2020.1.2,Win32,60,3LN3BXKGC1YQL81FBVM978PDYZHWG0,A13T5R3LI8ANLN,3EJJQNKU9S82ZSDYM9ZNTSOLBXNHRJ,UQJE8,UQJE8,3EJJQNKU9S82ZSDYM9ZNTSOLBXNHRJ,3EJJQNKU9S82ZSDYM9ZNTSOLBXNHRJ,268048,268048,,,,,,,,,,
,,,,5,3.58515,0,16,16,577,1,"a group of five people walking together, one of the people in front have a red shirt on","a group of five people walking together, one of the people in front have a blue shirt on",wolfe1,image-134,4,36,A13T5R3LI8ANLN,2021-01-08_12h52.10.903,MetaAwareness,2020.1.2,Win32,60,3LN3BXKGC1YQL81FBVM978PDYZHWG0,A13T5R3LI8ANLN,3EJJQNKU9S82ZSDYM9ZNTSOLBXNHRJ,UQJE8,UQJE8,3EJJQNKU9S82ZSDYM9ZNTSOLBXNHRJ,3EJJQNKU9S82ZSDYM9ZNTSOLBXNHRJ,268048,268048,,,,,,,,,,
,,,,4,2.87534,0,17,17,110,1,people climbing the face of a short cliff with bags and gear on the ground and one man in a red shirt almost reaching the top.,people climbing the face of a short cliff with bags and gear on the ground.,wolfe1,image-019,4,36,A13T5R3LI8ANLN,2021-01-08_12h52.10.903,MetaAwareness,2020.1.2,Win32,60,3LN3BXKGC1YQL81FBVM978PDYZHWG0,A13T5R3LI8ANLN,3EJJQNKU9S82ZSDYM9ZNTSOLBXNHRJ,UQJE8,UQJE8,3EJJQNKU9S82ZSDYM9ZNTSOLBXNHRJ,3EJJQNKU9S82ZSDYM9ZNTSOLBXNHRJ,268048,268048,,,,,,,,,,
,,,,5,6.95487,0,18,18,12,1,people gathered in a circle in a classroom with a window and blinds on the wall with a speaker below,people gathered in a circle in a classroom with a blank wall and a speaker behind them,wolfe1,image-003,6,36,A13T5R3LI8ANLN,2021-01-08_12h52.10.903,MetaAwareness,2020.1.2,Win32,60,3LN3BXKGC1YQL81FBVM978PDYZHWG0,A13T5R3LI8ANLN,3EJJQNKU9S82ZSDYM9ZNTSOLBXNHRJ,UQJE8,UQJE8,3EJJQNKU9S82ZSDYM9ZNTSOLBXNHRJ,3EJJQNKU9S82ZSDYM9ZNTSOLBXNHRJ,268048,268048,,,,,,,,,,
,,,,4,2.297595,0,19,19,24,1,a 'jump for joy' graduation celebration of five graduates in front of a bench on the path,a 'jump for joy' graduation celebration of five graduates on an otherwise empty path,wolfe1,image-005,7,36,A13T5R3LI8ANLN,2021-01-08_12h52.10.903,MetaAwareness,2020.1.2,Win32,60,3LN3BXKGC1YQL81FBVM978PDYZHWG0,A13T5R3LI8ANLN,3EJJQNKU9S82ZSDYM9ZNTSOLBXNHRJ,UQJE8,UQJE8,3EJJQNKU9S82ZSDYM9ZNTSOLBXNHRJ,3EJJQNKU9S82ZSDYM9ZNTSOLBXNHRJ,268048,268048,,,,,,,,,,
,,,,5,5.051885,0,20,20,562,1,living room with red pillows,living room with green pillows,wolfe1,image-132,3,36,A13T5R3LI8ANLN,2021-01-08_12h52.10.903,MetaAwareness,2020.1.2,Win32,60,3LN3BXKGC1YQL81FBVM978PDYZHWG0,A13T5R3LI8ANLN,3EJJQNKU9S82ZSDYM9ZNTSOLBXNHRJ,UQJE8,UQJE8,3EJJQNKU9S82ZSDYM9ZNTSOLBXNHRJ,3EJJQNKU9S82ZSDYM9ZNTSOLBXNHRJ,268048,268048,,,,,,,,,,
,,,,4,5.08728,0,21,21,208,1,a group of young men playing basketball in front of garage doors that have overhanging lights,"a group of young men playing basketball in front of garage doors, of which one has an overhanging light",wolfe1,image-040,4,36,A13T5R3LI8ANLN,2021-01-08_12h52.10.903,MetaAwareness,2020.1.2,Win32,60,3LN3BXKGC1YQL81FBVM978PDYZHWG0,A13T5R3LI8ANLN,3EJJQNKU9S82ZSDYM9ZNTSOLBXNHRJ,UQJE8,UQJE8,3EJJQNKU9S82ZSDYM9ZNTSOLBXNHRJ,3EJJQNKU9S82ZSDYM9ZNTSOLBXNHRJ,268048,268048,,,,,,,,,,
,,,,5,2.645665,0,22,22,49,1,a person setting up camp in the snow with their supplies spread out and a yellow bucket laying on its side.,a person setting up camp in the snow with their supplies spread out.,wolfe1,image-010,3,36,A13T5R3LI8ANLN,2021-01-08_12h52.10.903,MetaAwareness,2020.1.2,Win32,60,3LN3BXKGC1YQL81FBVM978PDYZHWG0,A13T5R3LI8ANLN,3EJJQNKU9S82ZSDYM9ZNTSOLBXNHRJ,UQJE8,UQJE8,3EJJQNKU9S82ZSDYM9ZNTSOLBXNHRJ,3EJJQNKU9S82ZSDYM9ZNTSOLBXNHRJ,268048,268048,,,,,,,,,,
,,,,3,4.25934,0,23,23,13,1,a group of people engaged in a conversation in a room with a curtain on the wall.,a group of people sit in a circle while discussing something.,wolfe1,image-003,7,36,A13T5R3LI8ANLN,2021-01-08_12h52.10.903,MetaAwareness,2020.1.2,Win32,60,3LN3BXKGC1YQL81FBVM978PDYZHWG0,A13T5R3LI8ANLN,3EJJQNKU9S82ZSDYM9ZNTSOLBXNHRJ,UQJE8,UQJE8,3EJJQNKU9S82ZSDYM9ZNTSOLBXNHRJ,3EJJQNKU9S82ZSDYM9ZNTSOLBXNHRJ,268048,268048,,,,,,,,,,
,,,,4,4.90716,0,24,24,586,1,a rooftop lounge area overlooking a light blue building,a rooftop lounge area overlooking a pink building,wolfe1,image-136,4,36,A13T5R3LI8ANLN,2021-01-08_12h52.10.903,MetaAwareness,2020.1.2,Win32,60,3LN3BXKGC1YQL81FBVM978PDYZHWG0,A13T5R3LI8ANLN,3EJJQNKU9S82ZSDYM9ZNTSOLBXNHRJ,UQJE8,UQJE8,3EJJQNKU9S82ZSDYM9ZNTSOLBXNHRJ,3EJJQNKU9S82ZSDYM9ZNTSOLBXNHRJ,268048,268048,,,,,,,,,,
,,,,5,4.325255,0,25,25,504,1,a boat with red life vests hanging over the side of it,a boat with green life vests hanging over the side of it,wolfe1,image-121,5,36,A13T5R3LI8ANLN,2021-01-08_12h52.10.903,MetaAwareness,2020.1.2,Win32,60,3LN3BXKGC1YQL81FBVM978PDYZHWG0,A13T5R3LI8ANLN,3EJJQNKU9S82ZSDYM9ZNTSOLBXNHRJ,UQJE8,UQJE8,3EJJQNKU9S82ZSDYM9ZNTSOLBXNHRJ,3EJJQNKU9S82ZSDYM9ZNTSOLBXNHRJ,268048,268048,,,,,,,,,,
,,,,4,2.56373,0,26,26,52,1,a man in the snow with items including a yellow hat next to a red suitcase,a man in the snow with items including a red suitcase and a bucket with a blue garbage bag,wolfe1,image-010,6,36,A13T5R3LI8ANLN,2021-01-08_12h52.10.903,MetaAwareness,2020.1.2,Win32,60,3LN3BXKGC1YQL81FBVM978PDYZHWG0,A13T5R3LI8ANLN,3EJJQNKU9S82ZSDYM9ZNTSOLBXNHRJ,UQJE8,UQJE8,3EJJQNKU9S82ZSDYM9ZNTSOLBXNHRJ,3EJJQNKU9S82ZSDYM9ZNTSOLBXNHRJ,268048,268048,,,,,,,,,,
,,,,5,2.89867,0,27,27,274,1,bystanders including one wearing a yellow shirt observe a dirtbike race,bystanders including one wearing a green shirt observe a dirtbike race,wolfe1,image-076,5,36,A13T5R3LI8ANLN,2021-01-08_12h52.10.903,MetaAwareness,2020.1.2,Win32,60,3LN3BXKGC1YQL81FBVM978PDYZHWG0,A13T5R3LI8ANLN,3EJJQNKU9S82ZSDYM9ZNTSOLBXNHRJ,UQJE8,UQJE8,3EJJQNKU9S82ZSDYM9ZNTSOLBXNHRJ,3EJJQNKU9S82ZSDYM9ZNTSOLBXNHRJ,268048,268048,,,,,,,,,,
,,,,6,3.24342,0,28,28,77,1,people at an outdoor concert venue waiting for the show to start. there is one empty blanket off to the left.,people at an outdoor concert venue waiting for the show to start. there is not an empty blanket anywhere.,wolfe1,image-014,6,36,A13T5R3LI8ANLN,2021-01-08_12h52.10.903,MetaAwareness,2020.1.2,Win32,60,3LN3BXKGC1YQL81FBVM978PDYZHWG0,A13T5R3LI8ANLN,3EJJQNKU9S82ZSDYM9ZNTSOLBXNHRJ,UQJE8,UQJE8,3EJJQNKU9S82ZSDYM9ZNTSOLBXNHRJ,3EJJQNKU9S82ZSDYM9ZNTSOLBXNHRJ,268048,268048,,,,,,,,,,
,,,,4,3.09014,0,29,29,377,1,"a music classroom with a teacher, students, and a blue box under a stool.","a music classroom with a teacher, students, and a green box under a stool.",wolfe1,image-096,6,36,A13T5R3LI8ANLN,2021-01-08_12h52.10.903,MetaAwareness,2020.1.2,Win32,60,3LN3BXKGC1YQL81FBVM978PDYZHWG0,A13T5R3LI8ANLN,3EJJQNKU9S82ZSDYM9ZNTSOLBXNHRJ,UQJE8,UQJE8,3EJJQNKU9S82ZSDYM9ZNTSOLBXNHRJ,3EJJQNKU9S82ZSDYM9ZNTSOLBXNHRJ,268048,268048,,,,,,,,,,
,,,,,,,,,,,,,,,,36,A13T5R3LI8ANLN,2021-01-08_12h52.10.903,MetaAwareness,2020.1.2,Win32,60,3LN3BXKGC1YQL81FBVM978PDYZHWG0,A13T5R3LI8ANLN,3EJJQNKU9S82ZSDYM9ZNTSOLBXNHRJ,UQJE8,UQJE8,3EJJQNKU9S82ZSDYM9ZNTSOLBXNHRJ,3EJJQNKU9S82ZSDYM9ZNTSOLBXNHRJ,268048,268048,4,3.95407,someone laying underneath a blue beach umbrella on a crowded beach,someone laying underneath a blue beach umbrella on a crowded beach,same,5,3.56406,members of a marching band crossing a track that all have feather plumes at the front of their hats,a cluttered and rustic looking cafe with 10 hanging lights,different
